2017-11-17 06:53:00	FOXNEWSW	12	FOXNEWSW_20171117_060000_Hannity/start/3180	EW DEVELOPMENTS IN THE URANIUM ONE SCANDAL\nSARA CARTER. INVESTIGATIVE REPORTER\nCLINTON CORRUPTION
2017-11-17 06:53:00	MSNBCW	49	MSNBCW_20171117_060000_The_Last_Word_With_Lawrence_ODonnell/start/3180	WSJ: MUELLER ISSUES SUBPOENA FOR RUSSIA. DOCS FROM MORE THAN 12 CAMPAIGN OFFICIALS
2017-11-17 06:54:00	FOXNEWSW	20	FOXNEWSW_20171117_060000_Hannity/start/3240	CLINTON CORRUPTION\nSARA CARTER \u201c-. INVESTIGATIVE REPORTER J '
2017-11-17 06:56:00	CNNW	11	CNNW_20171117_060000_Anderson_Cooper_360/start/3360	HOUSE PASSES GOP TAX BILL; FATE IN SENATE UNCLEAR\nJake Tapper\n1-8OO-831-37OO mesobook.com. . Mesothelioma Book
2017-11-17 06:57:00	CNNW	59	CNNW_20171117_060000_Anderson_Cooper_360/start/3420	HOUSE PASSES GOP TAX BILL; FATE IN SENATE UNCLEAR
2017-11-17 06:58:00	CNNW	37	CNNW_20171117_060000_Anderson_Cooper_360/start/3480	HOUSE PASSES GOP TAX BILL; FATE IN SENATE UNCLEAR\nANALYSIS: SENATE BILL WOULD RAISE MIDDLE CLASS TAXES
2017-11-17 06:59:00	CNNW	62	CNNW_20171117_060000_Anderson_Cooper_360/start/3540	ANALYSIS: SENATE BILL WOULD RAISE MIDDLE CLASS TAXES
2017-11-17 06:59:00	FOXNEWSW	37	FOXNEWSW_20171117_060000_Hannity/start/3540	IN REPORT: TRUMP' S FACE FOUND IN A DOG' S EAR
2017-11-17 07:00:00	CNNW	39	CNNW_20171117_060000_Anderson_Cooper_360/start/3600	MORE AND MORE POWERFUL PEOPLE. BEING ACCUSED OF SEXUAL HARASSMENT\nANALYSIS: SENATE BILL WOULD RAISE MIDDLE CLASS TAXES
2017-11-17 07:00:00	MSNBCW	7	MSNBCW_20171117_060000_The_Last_Word_With_Lawrence_ODonnell/start/3600	NEWS ANCHOR: AL FRANKEN KISSED & GROPED. ME WITHOUT MY CONSENT ON 2OO6 USO TOUR
2017-11-17 07:01:00	CNNW	41	CNNW_20171117_070000_CNN_Tonight_With_Don_Lemon/start/60	THE WHITE HOUSE IS PAINTED INTO A CORNER. BY DONALD TRUMP'S OWN WORDS\nTHE PRESIDENT IS WILLING TO SPEAK OUT. WHEN THE PEOPLE ACCUSED ARE DEMOCRATS\nMORE AND MORE POWERFUL PEOPLE. BEING ACCUSED OF SEXUAL...
2017-11-17 07:01:00	MSNBCW	39	MSNBCW_20171117_070000_The_11th_Hour_With_Brian_Williams/start/60	NEWS ANCHOR: AL FRANKEN KISSED & GROPED. ME WITHOUT MY CONSENT ON 2OO6 USO TOUR\nNEWS ANCHOR: AL FRANKEN \"GROPED ME,. WITHOUT MY CONSENT. WHILE I WAS ASLEEP\
2017-11-17 07:02:00	CNNW	33	CNNW_20171117_070000_CNN_Tonight_With_Don_Lemon/start/120	WHICH ACCUSERS SHOULD YOU BELIEVE?\nTHE PRESIDENT IS WILLING TO SPEAK OUT. WHEN THE PEOPLE ACCUSED ARE DEMOCRATS
2017-11-17 07:02:00	FOXNEWSW	7	FOXNEWSW_20171117_070000_The_Ingraham_Angle/start/120	Judiciary. Co mittee
2017-11-17 07:03:00	CNNW	31	CNNW_20171117_070000_CNN_Tonight_With_Don_Lemon/start/180	WHICH ACCUSERS SHOULD YOU BELIEVE?\nCILLIZZA: THERE'S A MASSIVE MORAL VACUUM IN THE COUNTRY\n|F ROY MOORE'S ACCUSERS SHOULD BE BELIEVED,. WHAT ABOUT THE PRESIDENT'S...
2017-11-17 07:03:00	MSNBCW	14	MSNBCW_20171117_070000_The_11th_Hour_With_Brian_Williams/start/180	SEN. FRANKEN: \"I FEEL DISGUSTED WITH MYSELF\" & \"I'M SORRY\"\nNEW POLL: JONES LEADS MOORE |N AL SEN. RACE BY 8%\nMOORE VOWS TO STAY IN RACE DESPITE NEW ACCUSATIONS\nMOORE ACCUSER: HE GRABBED MY...
2017-11-17 07:04:00	CNNW	32	CNNW_20171117_070000_CNN_Tonight_With_Don_Lemon/start/240	TRUMP SILENT ON ROY MOORE ALLEGATIONS AS. CANDIDATE DOUBLES DOWN ON DENIALS\nCILLIZZA: THERE'S A MASSIVE MORAL VACUUM IN THE COUNTRY. . Margaret Hoover SiriusXM Host\nCILLIZZA: THERE'S A MASSIVE MORAL VACUUM IN...
2017-11-17 07:04:00	FOXNEWSW	18	FOXNEWSW_20171117_070000_The_Ingraham_Angle/start/240	ELANIE MORGAN. AL FRANKEN HARASSED ME I. . AAAAAAAAAAAAAAAAAA
2017-11-17 07:04:00	MSNBCW	27	MSNBCW_20171117_070000_The_11th_Hour_With_Brian_Williams/start/240	MOORE ACCUSER: HE GRABBED MY BEHIND\nMOORE CAMPAIGN: \"THESE ALLEGATIONS ARE A POLITICAL FARCE\
2017-11-17 07:05:00	CNNW	53	CNNW_20171117_070000_CNN_Tonight_With_Don_Lemon/start/300	CILLIZZA: THERE'S A MASSIVE MORAL VACUUM IN THE COUNTRY\nCILLIZZA: THERE'S A MASSIVE MORAL VACUUM IN THE COUNTRY. . Chris Cillizza OW Politics Reporter and Editor\u2014at\u2014Large
2017-11-17 07:06:00	CNNW	36	CNNW_20171117_070000_CNN_Tonight_With_Don_Lemon/start/360	WHERE IS PRES TRUMP'S MORAL LEADERSHIP?\nCILLIZZA: THERE'S A MASSIVE MORAL VACUUM IN THE COUNTRY\nWHERE IS PRES TRUMP'S MORAL LEADERSHIP?. . Roy Moore (R) Alabama Senate...
2017-11-17 07:06:00	MSNBCW	20	MSNBCW_20171117_070000_The_11th_Hour_With_Brian_Williams/start/360	TRUMP: FRANKEN \"PICTURE IS REALLY BAD, SPEAKS A THOUSAND. WORDS. WHERE DO HIS HANDS GO... WHILE SHE SLEEPS?\"\nNEWS ANCHOR: AL FRANKEN KISSED & GROPED. ME WITHOUT MY CONSENT ON 2OO6 USO TOUR
2017-11-17 07:07:00	CNNW	30	CNNW_20171117_070000_CNN_Tonight_With_Don_Lemon/start/420	ROY MOORE: ALLEGATIONS ARE UNTRUE, NO EVIDENCE\nROY MOORE: ALLEGATIONS ARE UNTRUE NO EVIDENCE. . Roy Moore (R) Alabama Senate Candidate\nROY MOORE: ALLEGATIONS ARE UNTRUE NO EVIDENCE....
2017-11-17 07:08:00	CNNW	43	CNNW_20171117_070000_CNN_Tonight_With_Don_Lemon/start/480	TRUMP SILENT ON ROY MOORE ALLEGATIONS AS. CANDIDATE DOUBLES DOWN ON DENIALS\nROY MOORE: ALLEGATIONS ARE UNTRUE, NO EVIDENCE\nROY MOORE: ALLEGATIONS ARE UNTRUE NO EVIDENCE. . Jack Kingston @JackKingston
2017-11-17 07:08:00	FOXNEWSW	8	FOXNEWSW_20171117_070000_The_Ingraham_Angle/start/480	ARASSMENT ALLEGATIONS SPARK SECOND-LOOK AT '. {ANKEN'S LONG-HISTORY OF INAPPROPRIATE JOKES. . '
2017-11-17 07:08:00	MSNBCW	36	MSNBCW_20171117_070000_The_11th_Hour_With_Brian_Williams/start/480	WH: PEOPLE OF ALABAMA SHOULD BE THE ONES TO. DECIDE WHETHER OR NOT TO SUPPORT ROY MOORE\nNEWS ANCHOR: AL FRANKEN \"GROPED ME,. WITHOUT MY CONSENT. WHILE I WAS ASLEEP\"\nTRUMP: FRANKEN \"PICTURE IS REALLY BAD, SPEAKS A THOUSAND....
2017-11-17 07:09:00	CNNW	41	CNNW_20171117_070000_CNN_Tonight_With_Don_Lemon/start/540	TRUMP SILENT ON ROY MOORE ALLEGATIONS AS. CANDIDATE DOUBLES DOWN ON DENIALS\nMaria Cardona | Democratic Strategist
2017-11-17 07:09:00	FOXNEWSW	58	FOXNEWSW_20171117_070000_The_Ingraham_Angle/start/540	ELANIE MORGAN. AL FRANKEN HARASSED ME. . AAAAAAAAAAAAAAAAAAAA
2017-11-17 07:09:00	MSNBCW	31	MSNBCW_20171117_070000_The_11th_Hour_With_Brian_Williams/start/540	NEWS ANCHOR: AL FRANKEN \"GROPED ME,. WITHOUT MY CONSENT. WHILE I WAS ASLEEP\"\nNEWS ANCHOR: AL FRANKEN \"RELENTLESSLY BADGERED\". ME INTO \"REHEARSING\" A KISS DURING USO TOUR\nEUGENE ROBINSON | g'gfgmgtm
2017-11-17 07:10:00	CNNW	53	CNNW_20171117_070000_CNN_Tonight_With_Don_Lemon/start/600	TRUMP SILENT ON ROY MOORE ALLEGATIONS AS. CANDIDATE DOUBLES DOWN ON DENIALS
2017-11-17 07:10:00	MSNBCW	25	MSNBCW_20171117_070000_The_11th_Hour_With_Brian_Williams/start/600	NEWS ANCHOR: AL FRANKEN \"RELENTLESSLY BADGERED\". ME INTO \"REHEARSING\" A KISS DURING USO TOUR\nTRUMP: FRANKEN \"PICTURE IS REALLY BAD, SPEAKS A THOUSAND. WORDS. WHERE DO HIS HANDS GO... WHILE SHE SLEEPS?\"\nMICHAEL CROWLEY l...
2017-11-17 07:11:00	CNNW	52	CNNW_20171117_070000_CNN_Tonight_With_Don_Lemon/start/660	TRUMP SILENT ON ROY MOORE ALLEGATIONS AS. CANDIDATE DOUBLES DOWN ON DENIALS\nIS FRANKEN'S CAREER OVER?
2017-11-17 07:11:00	FOXNEWSW	12	FOXNEWSW_20171117_070000_The_Ingraham_Angle/start/660	ELANIE MORGAN. AL FRANKEN HARASSED ME. . AAAAAAAAAAAAAAAAAAAA\nELANIE MORGAN: AL FRANKEN HARASSED ME \". . Th
2017-11-17 07:11:00	MSNBCW	48	MSNBCW_20171117_070000_The_11th_Hour_With_Brian_Williams/start/660	TRUMP: FRANKEN \"PICTURE IS REALLY BAD, SPEAKS A THOUSAND. WORDS. WHERE DO HIS HANDS GO... WHILE SHE SLEEPS?\"\nTRUMP CALLS SEN. FRANKEN \"AL FRANKENSTIEN\" (SIC)
2017-11-17 07:12:00	MSNBCW	21	MSNBCW_20171117_070000_The_11th_Hour_With_Brian_Williams/start/720	TRUMP CALLS SEN. FRANKEN \"AL FRANKENSTIEN\" (SIC)\nMOORE VOWS TO STAY IN RACE DESPITE NEW ACCUSATIONS\nEUGENE ROBINSON | g'gfgmgm
2017-11-17 07:13:00	MSNBCW	31	MSNBCW_20171117_070000_The_11th_Hour_With_Brian_Williams/start/780	WH: PEOPLE OF ALABAMA SHOULD BE THE ONES TO. DECIDE WHETHER OR NOT TO SUPPORT ROY MOORE\nMOORE VOWS TO STAY IN RACE DESPITE NEW ACCUSATIONS
2017-11-17 07:14:00	MSNBCW	47	MSNBCW_20171117_070000_The_11th_Hour_With_Brian_Williams/start/840	SENS. HATCH & BROWN GET IN SHOUTING MATCH OVER TAX BILL\nWH: PEOPLE OF ALABAMA SHOULD BE THE ONES TO. DECIDE WHETHER OR NOT TO SUPPORT ROY MOORE
2017-11-17 07:15:00	CNNW	44	CNNW_20171117_070000_CNN_Tonight_With_Don_Lemon/start/900	WOMAN SAYS FRANKEN GROPED, KISSED HER. WITHOUT CONSENT IN 2OO6\nTRUMP TWEETS: \u201cTHE AL FRANKENSTIEN (SIC) PICTURE IS REALLY BAD\
2017-11-17 07:15:00	FOXNEWSW	4	FOXNEWSW_20171117_070000_The_Ingraham_Angle/start/900	EXUAL HARASSMENT ON CAPITOL HILL I. . AAAAAAAAAAAAAAAAAAA
2017-11-17 07:15:00	MSNBCW	53	MSNBCW_20171117_070000_The_11th_Hour_With_Brian_Williams/start/900	SENS. HATCH & BROWN GET IN SHOUTING MATCH OVER TAX BILL
2017-11-17 07:16:00	CNNW	15	CNNW_20171117_070000_CNN_Tonight_With_Don_Lemon/start/960	TRUMP TWEETS: \"THE AL FRANKENSTIEN SIC PICTURE IS REALLY BAD\". . Jack Kingston Former Senior Adviser to the Trump Campaign\nTRUMP TWEETS: \u201cTHE AL FRANKENSTIEN (SIC) PICTURE IS REALLY BAD\"\nTRUMP TWEETS: \"THE AL FRANKENSTIEN SIC PICTURE IS REALLY BAD'I. ....
2017-11-17 07:17:00	CNNW	56	CNNW_20171117_070000_CNN_Tonight_With_Don_Lemon/start/1020	TRUMP TWEETS: \u201cTHE AL FRANKENSTIEN (SIC) PICTURE IS REALLY BAD\"\nTRUMP TWEETS: \"THE AL FRANKENSTIEN SIC PICTURE IS REALLY BAD'I. . Chris Cillizza OW Politics Reporter and Editor\u2014at\u2014Large
2017-11-17 07:17:00	FOXNEWSW	17	FOXNEWSW_20171117_070000_The_Ingraham_Angle/start/1020	FORMER FEMALE CONGRESSIONAL STAFFER. 'EAKS OUT ABOUT SEXUAL HARASSMENT ON THE HILL. . '\nREBECCA WEIR. . FORMER CONGRESSIONAL STAFFER ALLEGEDLY HARASSED. \u20141TI-.-V erLDALuuA ' AkleI : _
2017-11-17 07:17:00	MSNBCW	40	MSNBCW_20171117_070000_The_11th_Hour_With_Brian_Williams/start/1020	SENS. HATCH & BROWN GET IN SHOUTING MATCH OVER TAX BILL\nMICHAEL CROWLEY l Elng-gSEL SECURITY EDITOR\nEUGENE ROBINSON I POLI1S'IIEELCANALYST
2017-11-17 07:18:00	FOXNEWSW	29	FOXNEWSW_20171117_070000_The_Ingraham_Angle/start/1080	FORMER FEMALE CONGRESSIONAL STAFFER. 'EAKS OUT ABOUT SEXUAL HARASSMENT ON THE HILL. . \\
2017-11-17 07:18:00	MSNBCW	35	MSNBCW_20171117_070000_The_11th_Hour_With_Brian_Williams/start/1080	SENS. HATCH & BROWN GET IN SHOUTING MATCH OVER TAX BILL\nMICHAEL CROWLEY l {ISTLEJISEL SECURITY EDITOR
2017-11-17 07:19:00	FOXNEWSW	21	FOXNEWSW_20171117_070000_The_Ingraham_Angle/start/1140	FORMER FEMALE CONGRESSIONAL STAFFER. 'EAKS OUT ABOUT SEXUAL HARASSMENT ON THE HILL. . 1\nREBECCA WEIR. . FORMER CONGRESSIONAL STAFFER ALLEGEDLY HARASSED. \u2014TL- IMrLDALuuA ' Aklfll : _
2017-11-17 07:20:00	FOXNEWSW	33	FOXNEWSW_20171117_070000_The_Ingraham_Angle/start/1200	FORMER FEMALE CONGRESSIONAL STAFFER. 'EAKS OUT ABOUT SEXUAL HARASSMENT ON THE HILL. . \\
2017-11-17 07:20:00	MSNBCW	42	MSNBCW_20171117_070000_The_11th_Hour_With_Brian_Williams/start/1200	1-8O9-8491196O [Em | LIBEMI\n,1 1-8O9-844- 196O MI W
2017-11-17 07:21:00	MSNBCW	8	MSNBCW_20171117_070000_The_11th_Hour_With_Brian_Williams/start/1260	HI IVCORAVIN,COM
2017-11-17 07:22:00	CNNW	40	CNNW_20171117_070000_CNN_Tonight_With_Don_Lemon/start/1320	TRUMP TWEETS: \u201cTHE AL FRANKENSTIEN (SIC) PICTURE IS REALLY BAD\"\nHOUSE PASSES $1.5 TRILLION TAX CUT BILL;. SENATE WORKING ON ITS TAX PLAN
2017-11-17 07:22:00	FOXNEWSW	20	FOXNEWSW_20171117_070000_The_Ingraham_Angle/start/1320	EXUAL HARASSMENI ON CAPITOL HILL '\nFORMER FEMALE CONGRESSIONAL STAFFER. 'EAKS OUT ABOUT SEXUAL HARASSMENT ON THE HILL. . 1
2017-11-17 07:23:00	FOXNEWSW	10	FOXNEWSW_20171117_070000_The_Ingraham_Angle/start/1380	FORMER FEMALE CONGRESSIONAL STAFFER. 'EAKS OUT ABOUT SEXUAL HARASSMENT ON THE HILL. . \\ '\nFORMER FEMALE CONGRESSIONAL STAFFER. 'EAKS OUT ABOUT SEXUAL HARASSMENT ON THE HILL. . '
2017-11-17 07:24:00	MSNBCW	31	MSNBCW_20171117_070000_The_11th_Hour_With_Brian_Williams/start/1440	WSJ: SUBPOENA TO TRUMP CAMPAIGN REQUESTED. RUSSIA-RELATED DOCS FROM MORE THAN 12 OFFICIALS\nNBC NEWS: FEDS FLIPPED WITNESS. WHO MAY HAVE INFO ON MICHAEL FLYNN
2017-11-17 07:25:00	MSNBCW	40	MSNBCW_20171117_070000_The_11th_Hour_With_Brian_Williams/start/1500	NBC NEWS: FEDS FLIPPED WITNESS. WHO MAY HAVE INFO ON MICHAEL FLYNN\nNBC NEWS: EXPERTS SAY MUELLER MAY BE. SEEKING INFO ABOUT FLYNN'S TURKEY TIES
2017-11-17 07:26:00	CNNW	14	CNNW_20171117_070000_CNN_Tonight_With_Don_Lemon/start/1560	I BMWofSanRafael.com\n1 -8OO-NEW-BMWS\nxfinity.com/wwe
2017-11-17 07:26:00	MSNBCW	26	MSNBCW_20171117_070000_The_11th_Hour_With_Brian_Williams/start/1560	WSJ: SUBPOENA TO TRUMP CAMPAIGN REQUESTED. RUSSIA-RELATED DOCS FROM MORE THAN 12 OFFICIALS\nNBC NEWS: EXPERTS SAY MUELLER MAY BE. SEEKING INFO ABOUT FLYNN'S TURKEY TIES\nE Facebook.com/11thHour I\nPOLITICO. ANNIE KARNI I WHITE...
2017-11-17 07:27:00	CNNW	39	CNNW_20171117_070000_CNN_Tonight_With_Don_Lemon/start/1620	HOUSE PASSES $1.5 TRILLION TAX CUT BILL;. SENATE WORKING ON ITS TAX PLAN\nSATELLITE RADIO\nJason Miller | Former Trump Senior Communications Adviser
2017-11-17 07:27:00	MSNBCW	22	MSNBCW_20171117_070000_The_11th_Hour_With_Brian_Williams/start/1620	FMR. HOUSE INTELLIGENCE. M'EKE EOYANG COMMITTEE STAFFER\nWSJ: SUBPOENA TO TRUMP CAMPAIGN REQUESTED. RUSSIA-RELATED DOCS FROM MORE THAN 12 OFFICIALS\nPOLITICO. ANNIE KARNI I WHITE HOUSE...
2017-11-17 07:28:00	CNNW	28	CNNW_20171117_070000_CNN_Tonight_With_Don_Lemon/start/1680	HOUSE PASSES $1.5 TRILLION TAX CUT BILL;. SENATE WORKING ON ITS TAX PLAN\nHOUSE PASSES TAX CUT BILL WITH NO SUPPORT FROM DEMOCRATS\nJason Miller | @JasonMillerinDC
2017-11-17 07:28:00	MSNBCW	10	MSNBCW_20171117_070000_The_11th_Hour_With_Brian_Williams/start/1680	WSJ: SUBPOENA REQUESTED DOCS & EMAILS. THAT REFERENCE A SET OF RUSSIA-RELATED KEYWORDS
2017-11-17 07:29:00	CNNW	20	CNNW_20171117_070000_CNN_Tonight_With_Don_Lemon/start/1740	STUDY: TAX INCREASE WOULD HIT LOWER INCOME HOUSEHOLDS BY 2O21\nHOUSE PASSES $1.5 TRILLION TAX CUT BILL;. SENATE WORKING ON ITS TAX PLAN\nHOUSE PASSES TAX CUT BILL WITH NO SUPPORT FROM...
2017-11-17 07:29:00	FOXNEWSW	39	FOXNEWSW_20171117_070000_The_Ingraham_Angle/start/1740	LA. APPROVES MARIJUANA RULES I. FOR RECREATIONAL DISPENSARIES. . \u2014TL-'ADDITCD[\u2014
2017-11-17 07:30:00	CNNW	50	CNNW_20171117_070000_CNN_Tonight_With_Don_Lemon/start/1800	HOUSE PASSES $1.5 TRILLION TAX CUT BILL;. SENATE WORKING ON ITS TAX PLAN\nJason Miller | ON Political Commentator
2017-11-17 07:30:00	FOXNEWSW	7	FOXNEWSW_20171117_070000_The_Ingraham_Angle/start/1800	A. ON THE RISE TO MAJO MARIJUANA MARKET ,. . \\TLA\u2019ADDIT:D_\nLEO TERRELL F. CIVIL RIGHTS A1TORNEY. . . . TL\". A DDITED_
2017-11-17 07:31:00	CNNW	41	CNNW_20171117_070000_CNN_Tonight_With_Don_Lemon/start/1860	SENATORS HATCH AND BROWN IN TAX BILL SHOUTING MATCH\nHOUSE PASSES $1.5 TRILLION TAX CUT BILL;. SENATE WORKING ON ITS TAX PLAN
2017-11-17 07:31:00	FOXNEWSW	8	FOXNEWSW_20171117_070000_The_Ingraham_Angle/start/1860	A. ON THE RISE TO MAJO MARIJUANA MARKET F. . Tim! {rm r'rrn _
2017-11-17 07:31:00	MSNBCW	4	MSNBCW_20171117_070000_The_11th_Hour_With_Brian_Williams/start/1860	INVESTIGATORS: KUSHNER WITHHELD RUSSIA EMAILS
2017-11-17 07:32:00	CNNW	62	CNNW_20171117_070000_CNN_Tonight_With_Don_Lemon/start/1920	SENATORS HATCH AND BROWN IN TAX BILL SHOUTING MATCH
2017-11-17 07:32:00	FOXNEWSW	19	FOXNEWSW_20171117_070000_The_Ingraham_Angle/start/1920	)NSEQUENCES OF lEGALIZlNG RECREATIONAL POT
2017-11-17 07:33:00	CNNW	53	CNNW_20171117_070000_CNN_Tonight_With_Don_Lemon/start/1980	SENATORS HATCH AND BROWN IN TAX BILL SHOUTING MATCH\nSENATORS HATCH AND BROWN IN TAX BILL SHOUTING MATCH. . . . Bakari Sellers Host, \u201cViewPoint with Bakari\" Podcast
2017-11-17 07:33:00	FOXNEWSW	53	FOXNEWSW_20171117_070000_The_Ingraham_Angle/start/1980	DNSEQUENCES OF lEGALIZING RECREATIONAL POT. . \u2014T _
2017-11-17 07:34:00	CNNW	15	CNNW_20171117_070000_CNN_Tonight_With_Don_Lemon/start/2040	HOUSE PASSES $1.5 TRILLION TAX CUT BILL;. SENATE WORKING ON ITS TAX PLAN\nSENATORS HATCH AND BROWN IN TAX BILL SHOUTING MATCH\nTRUMP TO LIFI' BAN ON ELEPHANT TROPHIES
2017-11-17 07:34:00	FOXNEWSW	21	FOXNEWSW_20171117_070000_The_Ingraham_Angle/start/2040	DNSEQUENCES OF lEGALIZlNG RECREATIONAL POT\nLEO TERRELL. CIVIL RIGHTS A1TORNEY. . . . 1-\u00bb. A DDITED\u2014
2017-11-17 07:34:00	MSNBCW	44	MSNBCW_20171117_070000_The_11th_Hour_With_Brian_Williams/start/2040	POLITICO: PROSECUTORS PREPARING TO INTERVIEW HOPE HICKS\nPOLITICO. ANNIE KARNI I WHITE HOUSE REPORTER
2017-11-17 07:35:00	BBCNEWS	6	BBCNEWS_20171117_060000_Breakfast/start/5700	ANDV SWISS. Sports News Correspondent
2017-11-17 07:35:00	CNNW	3	CNNW_20171117_070000_CNN_Tonight_With_Don_Lemon/start/2100	All Items are prerowned and consigned to The Flea/Real. Trademarks are owned by their respective brand owners,
2017-11-17 07:35:00	FOXNEWSW	18	FOXNEWSW_20171117_070000_The_Ingraham_Angle/start/2100	)NSEQUENCES OF lEGALIZING RECREATIONAL POT. . _I'r _\nHORACE COOPER. PROJECT 21 CO-CHAIR. . Tl-uJA marmnT\u2014
2017-11-17 07:35:00	MSNBCW	26	MSNBCW_20171117_070000_The_11th_Hour_With_Brian_Williams/start/2100	POLITICO: HICKS PREPPED FOR MUELLER INTERVIEW FOR MONTHS\nPOLITICO: PROSECUTORS PREPARING TO INTERVIEW HOPE HICKS\nINVESTIGATORS: KUSHNER WITHHELD RUSSIA EMAILS\nPOLITICO. ANNIE KARNI I WHITE...
2017-11-17 07:36:00	MSNBCW	29	MSNBCW_20171117_070000_The_11th_Hour_With_Brian_Williams/start/2160	INVESTIGATORS: KUSHNER WITHHELD RUSSIA EMAILS\nSENATE LEADER: KUSHNER FAILED TO HAND. OVER DOCS RELATED TO WIKILEAKS & RUSSIA\n6hr .erlu \ufb02ork Gimrs. KEN VOGEL y POLITICAL REPORTER
2017-11-17 07:37:00	CNNW	9	CNNW_20171117_070000_CNN_Tonight_With_Don_Lemon/start/2220	stamps.con
2017-11-17 07:37:00	MSNBCW	43	MSNBCW_20171117_070000_The_11th_Hour_With_Brian_Williams/start/2220	SENATORS DEMAND KUSHNER\u2019S WIKILEAKS & RUSSIA EMAILS\nSENATE LEADER: KUSHNER FAILED TO HAND. OVER DOCS RELATED TO WIKILEAKS & RUSSIA\nFMR. HOUSE INTELLIGENCE. M'EKE EOYANG COMMITTEE STAFFER
2017-11-17 07:38:00	CNNW	9	CNNW_20171117_070000_CNN_Tonight_With_Don_Lemon/start/2280	U.S. TO LIFT BAN ON IMPORTS OF ELEPHANT. TROPHIES FROM ZIMBABWE AND ZAMBIA
2017-11-17 07:38:00	FOXNEWSW	6	FOXNEWSW_20171117_070000_The_Ingraham_Angle/start/2280	{S\ufb02nu [Maj E11O3\u201d
2017-11-17 07:38:00	MSNBCW	32	MSNBCW_20171117_070000_The_11th_Hour_With_Brian_Williams/start/2280	SENATORS DEMAND KUSHNER\u2019S WIKILEAKS & RUSSIA EMAILS
2017-11-17 07:40:00	FOXNEWSW	20	FOXNEWSW_20171117_070000_The_Ingraham_Angle/start/2400	E: 214 MS- 13 GANG MEMBERS ARRESTED IN SWEEP. . _ nnnnnnnnnnnnnnnnnn\n:P. BRAT INTRODUCES BILL ON IMMIGRATION I. . AAAAAAAAAAAAAAAAAA
2017-11-17 07:41:00	FOXNEWSW	10	FOXNEWSW_20171117_070000_The_Ingraham_Angle/start/2460	E: 214 MS-13 GANG MEMB\u00a7R\u00a7ARRESTED IN SWEEP \"\nE: 214 MS-13 GANG MEMBERS ARRESTED IN SWEEP \
2017-11-17 07:41:00	MSNBCW	6	MSNBCW_20171117_070000_The_11th_Hour_With_Brian_Williams/start/2460	TRUMP LIFI'S BAN ON IMPORTING HEADS OF HUNTED ELEPHANTS TO U.S.
2017-11-17 07:42:00	CNNW	39	CNNW_20171117_070000_CNN_Tonight_With_Don_Lemon/start/2520	U.S. TO LIFT BAN ON IMPORTS OF ELEPHANT. TROPHIES FROM ZIMBABWE AND ZAMBIA\nTRUMP TO LIFI' BAN ON ELEPHANT TROPHIES
2017-11-17 07:42:00	FOXNEWSW	16	FOXNEWSW_20171117_070000_The_Ingraham_Angle/start/2520	E: 214 MS-13 GANG MEMBERS ARRESTED IN SWEEP \
2017-11-17 07:43:00	MSNBCW	23	MSNBCW_20171117_070000_The_11th_Hour_With_Brian_Williams/start/2580	TRUMP ADMIN. TO LET HUNTERS IMPORT. ELEPHANT HEADS FROM ZIMBABWE & ZAMBIA\nJAROD MILLER | ZOOLOGIST\nTRUMP LIFI'S BAN ON IMPORTING HEADS OF HUNTED ELEPHANTS TO U.S.
2017-11-17 07:44:00	FOXNEWSW	20	FOXNEWSW_20171117_070000_The_Ingraham_Angle/start/2640	{ILL GOP CAVE OVER DACA COMPROMISE?. . AAAAAAAAAAAAAAAAAAAA
2017-11-17 07:44:00	MSNBCW	33	MSNBCW_20171117_070000_The_11th_Hour_With_Brian_Williams/start/2640	FISH & WILDLIFE SERVICE: \"LEGAL\" HUNTING PROGRAMS. IN ZIMBABWE. ZAMBIA WILL \"ENHANCE\" ELEPHANT SURVIVAL\nTRUMP LIFI'S BAN ON IMPORTING HEADS OF HUNTED ELEPHANTS TO U.S.\nJAROD MILLER | ZOOLOGIST
2017-11-17 07:45:00	MSNBCW	39	MSNBCW_20171117_070000_The_11th_Hour_With_Brian_Williams/start/2700	TRUMP LIFI'S BAN ON IMPORTING HEADS OF HUNTED ELEPHANTS TO U.S.\nJAROD MILLER | ZOOLOGIST\nFISH & WILDLIFE SERVICE: \"LEGAL\" HUNTING PROGRAMS. IN ZIMBABWE. ZAMBIA WILL \"ENHANCE\" ELEPHANT SURVIVAL
2017-11-17 07:46:00	CNNW	11	CNNW_20171117_070000_CNN_Tonight_With_Don_Lemon/start/2760	U.S. TO LIFT BAN ON IMPORTS OF ELEPHANT. TROPHIES FROM ZIMBABWE AND ZAMBIA
2017-11-17 07:46:00	MSNBCW	58	MSNBCW_20171117_070000_The_11th_Hour_With_Brian_Williams/start/2760	HUMANE SOCIETY CEO: CHANGE GIVES HUNTERS \"GREEN LIGHT\" TO KILL\nJAROD MILLER | ZOOLOGIST
2017-11-17 07:47:00	CNNW	51	CNNW_20171117_070000_CNN_Tonight_With_Don_Lemon/start/2820	U.S. TO LIFT BAN ON IMPORTS OF ELEPHANT. TROPHIES FROM ZIMBABWE AND ZAMBIA\n/. . Jeff Corwin I Wildlife expert
2017-11-17 07:47:00	FOXNEWSW	14	FOXNEWSW_20171117_070000_The_Ingraham_Angle/start/2820	Iww.superbeta.com RITE. . lAI-'Im-'ulu
2017-11-17 07:47:00	MSNBCW	11	MSNBCW_20171117_070000_The_11th_Hour_With_Brian_Williams/start/2820	Actual Quell' User\n8OO-243-597O buyquell.com
2017-11-17 07:48:00	CNNW	42	CNNW_20171117_070000_CNN_Tonight_With_Don_Lemon/start/2880	U.S. TO LIFT BAN ON IMPORTS OF ELEPHANT. TROPHIES FROM ZIMBABWE AND ZAMBIA\nJeff Corwin I Host, ABC's Ocean Treks
2017-11-17 07:50:00	CNNW	36	CNNW_20171117_070000_CNN_Tonight_With_Don_Lemon/start/3000	U.S. TO LIFT BAN ON IMPORTS OF ELEPHANT. TROPHIES FROM ZIMBABWE AND ZAMBIA\nTRUMP TO LIFI' BAN ON ELEPHANT TROPHIES
2017-11-17 07:50:00	FOXNEWSW	12	FOXNEWSW_20171117_070000_The_Ingraham_Angle/start/3000	November 13-15, 2O17. Likely Voters; +I- 3.5% Pts
2017-11-17 07:50:00	MSNBCW	14	MSNBCW_20171117_070000_The_11th_Hour_With_Brian_Williams/start/3000	JUDGE DECLARES MISTRIAL IN SEN. MENENDEZ BRIBERY TRIAL\nHOUSE PASSES $1.5 TRILLION TAX CUT BILL
2017-11-17 07:51:00	FOXNEWSW	17	FOXNEWSW_20171117_070000_The_Ingraham_Angle/start/3060	In! DALJAAA AM
2017-11-17 07:51:00	MSNBCW	33	MSNBCW_20171117_070000_The_11th_Hour_With_Brian_Williams/start/3060	JUDGE DECLARES MISTRIAL IN SEN. MENENDEZ BRIBERY TRIAL\nMENENDEZ JUROR: IO JURORS THINK MENENDEZ IS NOT GUILTY\nSEN. BOB MENENDEZ | (a) NEW JERSEY\nSEN. MENENDEZ: CORY BOOKER SUPPORTIVE FROM...
2017-11-17 07:52:00	CNNW	15	CNNW_20171117_070000_CNN_Tonight_With_Don_Lemon/start/3120	cancercenterLom/outsmart\ncancercenter.com/outsmart
2017-11-17 07:52:00	FOXNEWSW	39	FOXNEWSW_20171117_070000_The_Ingraham_Angle/start/3120	4C POLL: JONES lEADS MOORE BY 8 POINTS IN AL I\nL REPUBLICAN PARTY STANDING BEHIND MOORE. . \u2014 nnnnnnnnnnnnnnnnnn _
2017-11-17 07:52:00	MSNBCW	22	MSNBCW_20171117_070000_The_11th_Hour_With_Brian_Williams/start/3120	SEN. MENENDEZ: APPRECIATE POLITICAL CAPITAL. GOP SEN. GRAHAM USED TO TESTIFY ON MY BEHALF\nSEN. MENENDEZ: WON'T FORGET THOSE WHO WERE DIGGING MY POLITICAL GRAVE\nSENATE ETHICS COMMITTEE TO RESUME MENENDEZ INQUIRY\nSEN....
2017-11-17 07:53:00	FOXNEWSW	23	FOXNEWSW_20171117_070000_The_Ingraham_Angle/start/3180	WSJ: MUELLER SUBPOENAED TRUMP CAMPAIGN. . OFFICIALS FOR RUSSIA-RELATED DOCUMENTS\nL REPUBLICAN PARTY STANDING BEHIND MOORE I. . '\nL REPUBLICAN PARTY STANDING BEHIND MOORE. . \u2014T IM_D :\u2014
2017-11-17 07:53:00	MSNBCW	19	MSNBCW_20171117_070000_The_11th_Hour_With_Brian_Williams/start/3180	GOVT. WATCHDOG: INTERIOR SECY. ZINKE. FAILED TO PROPERLY DOCUMENT TRAVEL\nDEP. INTERIOR SECY.: INHERITED A MESS FROM LAST ADMINISTRATION
2017-11-17 07:54:00	CNNW	18	CNNW_20171117_070000_CNN_Tonight_With_Don_Lemon/start/3240	U.S. TO LIFT BAN ON IMPORTS OF ELEPHANT. TROPHIES FROM ZIMBABWE AND ZAMBIA
2017-11-17 07:54:00	FOXNEWSW	39	FOXNEWSW_20171117_070000_The_Ingraham_Angle/start/3240	WSJ: MUELLER SUBPOENAED TRUMP CAMPAIGN. . OFFICIALS FOR RUSSIA-RELATED DOCUMENTS
2017-11-17 07:55:00	CNNW	40	CNNW_20171117_070000_CNN_Tonight_With_Don_Lemon/start/3300	U.S. TO LIFT BAN ON IMPORTS OF ELEPHANT. TROPHIES FROM ZIMBABWE AND ZAMBIA\nAlice Stewart @alicetweet
2017-11-17 07:56:00	CNNW	26	CNNW_20171117_070000_CNN_Tonight_With_Don_Lemon/start/3360	U.S. TO LIFT BAN ON IMPORTS OF ELEPHANT. TROPHIES FROM ZIMBABWE AND ZAMBIA\nk '. Donald Trump Jr. l Donald Trump's Son
2017-11-17 07:57:00	CNNW	39	CNNW_20171117_070000_CNN_Tonight_With_Don_Lemon/start/3420	U.S. TO LIFT BAN ON IMPORTS OF ELEPHANT. TROPHIES FROM ZIMBABWE AND ZAMBIA\nCharles Blow CJ\\N Political Comentator
2017-11-17 07:57:00	FOXNEWSW	7	FOXNEWSW_20171117_070000_The_Ingraham_Angle/start/3420	\u00bb aderm'\
2017-11-17 07:57:00	MSNBCW	11	MSNBCW_20171117_070000_The_11th_Hour_With_Brian_Williams/start/3420	VOTER FOCUS GROUP SOUNDS OFF ON TRUMP
2017-11-17 07:58:00	CNNW	36	CNNW_20171117_070000_CNN_Tonight_With_Don_Lemon/start/3480	U.S. TO LIFT BAN ON IMPORTS OF ELEPHANT. TROPHIES FROM ZIMBABWE AND ZAMBIA\nBAN ON IMPORTS OF ELEPHANT TROPHIES PUT IN PLACE BY OBAMA
2017-11-17 07:58:00	MSNBCW	52	MSNBCW_20171117_070000_The_11th_Hour_With_Brian_Williams/start/3480	VOTER FOCUS GROUP SOUNDS OFF ON TRUMP
2017-11-17 07:59:00	CNNW	23	CNNW_20171117_070000_CNN_Tonight_With_Don_Lemon/start/3540	TRUMP TWEETS: \u201cTHE AL FRANKENSTIEN (SIC) PICTURE IS REALLY BAD\"\nBAN ON IMPORTS OF ELEPHANT TROPHIES PUT IN PLACE BY OBAMA\nBAN ON IMPORTS OF ELEPHANT TROPHIES PUT IN PLACE BY OBAMA. . Charles Blow...
2017-11-17 08:00:00	CNNW	48	CNNW_20171117_070000_CNN_Tonight_With_Don_Lemon/start/3600	CNN: SOURCE SAYS SPECIAL COUNSEL. SUBPOENAS TRUMP CAMPAIGN\nKUSHNER ACCUSED OF WITHHOLDING. CONTACTS ABOUT WIKILEAKS & RUSSIA
2017-11-17 08:01:00	CNNW	58	CNNW_20171117_080000_CNN_Tonight_With_Don_Lemon/start/60	KUSHNER ACCUSED OF WITHHOLDING. CONTACTS ABOUT WIKILEAKS & RUSSIA\nCNN: SOURCE SAYS SPECIAL COUNSEL. SUBPOENAS TRUMP CAMPAIGN
2017-11-17 08:01:00	FOXNEWSW	28	FOXNEWSW_20171117_080000_Fox_News__Night/start/60	NOT FUNNY. FRANKEN FACES SEXUAL HARASSMENT ALLEGATIONS. . _ [armour \u2014
2017-11-17 08:01:00	MSNBCW	10	MSNBCW_20171117_080000_All_In_With_Chris_Hayes/start/60	SARAH HUCKABEE SANDERS | WHITE HOUSE PRESS SECRETARY
2017-11-17 08:02:00	CNNW	57	CNNW_20171117_080000_CNN_Tonight_With_Don_Lemon/start/120	KUSHNER ACCUSED OF WITHHOLDING. CONTACTS ABOUT WIKILEAKS & RUSSIA\nSENATE JUDICIARY: KUSHNER HASN'T TURNED OVER. EMAIL ON WIKILEAKS, 'RUSSIAN BACKDOOR OVERTURE'
