2017-11-17 12:49:00	FOXNEWSW	28	FOXNEWSW_20171117_110000_FOX__Friends/start/6540	POLITICAL VENGEANCE\nANHUNT INTENSIFIES FOR BALTIMORE COP KILLER\nANHUNT INTENSIFIES FOR BALTIMORE COP KILLER I
2017-11-17 12:49:00	MSNBCW	38	MSNBCW_20171117_110000_Morning_Joe/start/6540	REP. DELANEY VOTED AGAINST GOP TAX BILL\nAlll | Enf'l IQ (\\M anon DDECIHEMTIAI RID
2017-11-17 12:50:00	BBCNEWS	11	BBCNEWS_20171117_110000_BBC_Newsroom_Live/start/6600	BAILLIE GIFFORD PRIZE 2O17. Book shows the move towards medical breakthrough\nBAILLIE GIFFORD PRIZE 2O17. David France wins Baillie-Gi\ufb02ovd Prize for Non-Fic'ion\nBAILLIE GIFFORD PRIZE 2O17. 'How to Survive a...
2017-11-17 12:50:00	CNNW	7	CNNW_20171117_120000_New_Day/start/3000	u. . libertymutual.com. . 1-844-592-2O89
2017-11-17 12:50:00	FOXNEWSW	12	FOXNEWSW_20171117_110000_FOX__Friends/start/6600	MEGA MORNING DEALS
2017-11-17 12:50:00	MSNBCW	53	MSNBCW_20171117_110000_Morning_Joe/start/6600	REP. DELANEY VOTED AGAINST GOP TAX BILL\nHOUSE TAX PLAN PASSES WITH NO VOTES FROM DEMOCRATS
2017-11-17 12:51:00	BBCNEWS	20	BBCNEWS_20171117_110000_BBC_Newsroom_Live/start/6660	BAILLIE GIFFORD PRIZE 2O17. 'How to Survive a Plague' chronicles AIDS epidemic\nBAILLIE GIFFORD PRIZE 2O17. David France wins Baillie-Gi\ufb02ord Prize for Non-Fic'ion\nBAILLIE GIFFORD PRIZE 2O17. Book covers yeavs...
2017-11-17 12:51:00	MSNBCW	53	MSNBCW_20171117_110000_Morning_Joe/start/6660	HOUSE TAX PLAN PASSES WITH NO VOTES FROM DEMOCRATS\nVOTERS GIVE TRUMP BLISTERING REVIEWS IN. NEW BATTLEGROUND STATE FOCUS GROUP
2017-11-17 12:52:00	BBCNEWS	15	BBCNEWS_20171117_110000_BBC_Newsroom_Live/start/6720	BAILLIE GIFFORD PRIZE 2O17. David France wins Baillie-Gifford Prize for Non-Fiction\nBAILLIE GIFFORD PRIZE 2O17. Book covers yeavs where there was no etfective treatment\nBAILLIE GIFFORD PRIZE 2O17. Book shows the move...
2017-11-17 12:52:00	CNNW	13	CNNW_20171117_120000_New_Day/start/3120	Larry Summers Former Treasury Secretary
2017-11-17 12:52:00	MSNBCW	57	MSNBCW_20171117_110000_Morning_Joe/start/6720	VOTERS GIVE TRUMP BLISTERING REVIEWS IN. NEW BA1TLEGROUND STATE FOCUS GROUP\nREP- JOHN DELANEY | (Fm\ufb01\u00e9f\ufb01f's'\u00e9\u2019fv'icgscma
2017-11-17 12:53:00	BBCNEWS	12	BBCNEWS_20171117_110000_BBC_Newsroom_Live/start/6780	BAILLIE GiFFORD PRIZE 2O17. 'How to Survive a Plague' chronicies AIDS epidemic
2017-11-17 12:53:00	CNNW	8	CNNW_20171117_120000_New_Day/start/3180	Larry ngmers Former Treasury Secretary\nSUMMtHSI UUI\" II-UK PLAN MAKE WIIUULI: GLASS PUUHtH. . RIGHT NOW MIAMI (' 68\u00b0 ORLANDO ( 59\u00b0 TAMPA\nI'UH IHtASUHY StUHtIAHYI UUI\"...
2017-11-17 12:54:00	BBCNEWS	6	BBCNEWS_20171117_110000_BBC_Newsroom_Live/start/6840	JEREMY COLLINGWOOD. Frame owner
2017-11-17 12:54:00	CNNW	18	CNNW_20171117_120000_New_Day/start/3240	Larry Summers Former Treasury Secretary\nSUMMtHSl MNUUI'IIN CLAIM PLAN PAYS NH \u201d5th l5 \"NUN5tN5t\". . RIGHT NOW CHICAGO q 36\" DETROIT L\\ 34\u00b0 HOUSTON\nSUMMtHSI UUI\" II-UK PLAN...
2017-11-17 12:54:00	MSNBCW	9	MSNBCW_20171117_110000_Morning_Joe/start/6840	COMING up
2017-11-17 12:55:00	BBCNEWS	7	BBCNEWS_20171117_110000_BBC_Newsroom_Live/start/6900	JEFF JAMES. Chief Executive, The Na\ufb01onal Archives\nROWENA HILLEL. Archivist\nGEORGE HAY. Archivist
2017-11-17 12:55:00	CNNW	14	CNNW_20171117_120000_New_Day/start/3300	Jamie Gangel On Twitter. @jamiegangel\n5UMMtH5: \"I UUN'I KNUW HUW...||'||:5I: PtUPLI: I'AUI: IHtIH UHILUHtN\". . TODAY BOSTON Illll|343\ufb02 NEW YORK . 5O\u00b0...
2017-11-17 12:55:00	MSNBCW	17	MSNBCW_20171117_110000_Morning_Joe/start/6900	@ Lively Mobile 25%OFFand \ufb01rstmomhFREEatz G %
2017-11-17 12:56:00	CNNW	7	CNNW_20171117_120000_New_Day/start/3360	PHESIUENI IHUIVIP MUM UN IVIUUHI:. . TODAY MIAMI ' 79\u00b0 ORLANDO ' 78\u00b0 TAMPA\nPHI:5IUI:NI IHUIVIP MUM UN IVIUUHI:. . RIGHT NOW BOSTON (' 39\u00b0 NEWYORKC .4Ou PHILADELPHIA\nSUMMtHSI UUI\" IAX PLAN MAKt5 WIIUULI: GLASS...
2017-11-17 12:56:00	MSNBCW	25	MSNBCW_20171117_110000_Morning_Joe/start/6960	m9 Lively Mobile 25%OFFand \ufb01rstmomhFREEatz Q E\nLearn more at greatcamom
2017-11-17 12:57:00	BBCNEWS	32	BBCNEWS_20171117_125700_	SATURDAY OO:OO
2017-11-17 12:59:00	CNNW	10	CNNW_20171117_120000_New_Day/start/3540	WW. Suzanne Malveaux CI\\N National Correspondent\nIHUMI\" IAKtS UN I'HANKtN, \ufb01ll-\"5 SILtNI UN MUUHI:. . TODAY DALLAS ' 82\u00b0 LOSANGELES $72\u00b0 PHOENIX\n,__ -. Camerota Berman. TODAY...
2017-11-17 12:59:00	MSNBCW	4	MSNBCW_20171117_110000_Morning_Joe/start/7140	WH: TRUMP LEAVES MOORE DECISION UP TO ALABAMA VOTERS
2017-11-17 13:00:00	CNNW	5	CNNW_20171117_120000_New_Day/start/3600	IHUMI\" IAKtb UN I'HI-\\Nl\\l:N, bII-\\Y5 bILtNI UN MUUHI:. . TODAY ATLANTA ( 65\u00b0 CHARLOTTEC ,\u201c6O WASHINGTON
2017-11-17 13:00:00	FOXNEWSW	55	FOXNEWSW_20171117_110000_FOX__Friends/start/7200	November 17, 2O17
2017-11-17 13:01:00	CNNW	7	CNNW_20171117_130000_New_Day/start/60	Sarah Sanders White House Press Secretary\nIHUMI\u2019 \ufb01ll-\u201c5 5|L|:N| UN HUY MUUHI: 5M ABUSI: ALLEUAI IUNS. . RIGHT NOW BOSTON V 39\u00b0 NEWYORKC .4O\ufb02 PHILADELPHIA
2017-11-17 13:01:00	MSNBCW	42	MSNBCW_20171117_110000_Morning_Joe/start/7260	WH: TRUMP LEAVES MOORE DECISION UP TO ALABAMA VOTERS\nSARAH HUCKABEE SANDERS ' WHITE HOUSE PRESS SECRETARY
2017-11-17 13:02:00	CNNW	15	CNNW_20171117_130000_New_Day/start/120	Leeann Tweeden Accused Sen. Franken of Sexual Harassment
2017-11-17 13:02:00	FOXNEWSW	29	FOXNEWSW_20171117_110000_FOX__Friends/start/7320	3N. AL FRANKEN ACCUSED OF SEXUAL MISCONDUCT I\niN. AL FRANKEN ACCUSED OF SEXUAL MISCONDUCT i\nGRIFF JENKINS
2017-11-17 13:02:00	MSNBCW	38	MSNBCW_20171117_110000_Morning_Joe/start/7320	WH: TRUMP LEAVES MOORE DECISION UP TO ALABAMA VOTERS\nPOLL SHOWS DEMOCRAT DOUG JONES WITH LEAD IN ALABAMA\nAMONG 823 LIKELY VOTERS, NOVEMBER 13-15; +/- 3.5PTS
2017-11-17 13:03:00	CNNW	5	CNNW_20171117_130000_New_Day/start/180	5|:N. I'HANKtN APULUUILt5 I'UH UHUI\u2019INU WUMAN IN ZUUb. . TODAY CHICAGO w 48\u00b0 DETROIT J 42\" HOUSTON
2017-11-17 13:03:00	FOXNEWSW	22	FOXNEWSW_20171117_110000_FOX__Friends/start/7380	3N. AL FRANKEN ACCUSED OF SEXUAL MISCONDUCT I
2017-11-17 13:03:00	MSNBCW	62	MSNBCW_20171117_110000_Morning_Joe/start/7380	WH: TRUMP LEAVES MOORE DECISION UP TO ALABAMA VOTERS
2017-11-17 13:04:00	CNNW	9	CNNW_20171117_130000_New_Day/start/240	Maggie Haberman White House Correspondent In NY New York Times\nIHUMI\" IAKtS UN I'HANKtN, \ufb01ll-\"5 5|L|:N| UN MUUHI:. . TODAY MIAMI ' 79\ufb02 ORLANDO ' .78\u00b0 TAMPA
2017-11-17 13:04:00	MSNBCW	35	MSNBCW_20171117_110000_Morning_Joe/start/7440	ALABAMA REPUBLICAN PARTY STANDS BY SUPPORT FOR MOORE\nWH: TRUMP LEAVES MOORE DECISION UP TO ALABAMA VOTERS
2017-11-17 13:05:00	CNNW	9	CNNW_20171117_130000_New_Day/start/300	Maggie Haberman White House Correspondent New York Times
2017-11-17 13:05:00	MSNBCW	62	MSNBCW_20171117_110000_Morning_Joe/start/7500	ALABAMA REPUBLICAN PARTY STANDS BY SUPPORT FOR MOORE
2017-11-17 13:06:00	CNNW	7	CNNW_20171117_130000_New_Day/start/360	IHUMI\" |I-\\KI:5 UN I'HANKtN, \ufb01ll-\"5 SILtNI UN MUUHI:. . TODAY DALLAS ' 82\u00b0 LOSANGELES {\u201d72a PHOENIX\nIHUMI\" |I-\\KI:5 UN I'HANKtN, \ufb01ll-IVS SILtNI UN MUUHI:. . RIGHT NOW CINCINNATI .' 31\u00b0 CLEVELAND L' 39\u00b0 COLUMBUS
2017-11-17 13:06:00	FOXNEWSW	34	FOXNEWSW_20171117_110000_FOX__Friends/start/7560	ISTRIAL DECLARED MENENDEZ BRIBERY CASE I\nENENDEZ VOWS VENGEANCE AFTER HUNG JURY I\n'HAT IS NEXT IN MENENDEZ INVESTIGATION? I
2017-11-17 13:07:00	CNNW	9	CNNW_20171117_130000_New_Day/start/420	Maggie Haberman White House Correspondent New York Times\nIHUMI\" IAKtS UN I'HANKtN, \ufb01ll-\"5 SILtNI UN MUUHI:. . RIGHT NOW CHICAGO g 36\u00b0 DETROIT L' 34\u00b0 HOUSTON
2017-11-17 13:07:00	FOXNEWSW	34	FOXNEWSW_20171117_110000_FOX__Friends/start/7620	ENENDEZ VOWS VENGEANCE AFTER HUNG JURY i\nISTRIAL DECLARED |N MENENDEZ BRIBERY CASE i
2017-11-17 13:07:00	MSNBCW	59	MSNBCW_20171117_110000_Morning_Joe/start/7620	ALABAMA REPUBLICAN PARTY STANDS BY SUPPORT FOR MOORE\nSUSAN DEL PERCIO ' REPUBLICAN STRATEGIST
2017-11-17 13:08:00	FOXNEWSW	58	FOXNEWSW_20171117_110000_FOX__Friends/start/7680	ISTRIAL DECLARED |N MENENDEZ BRIBERY CASE i
2017-11-17 13:08:00	MSNBCW	30	MSNBCW_20171117_110000_Morning_Joe/start/7680	ALABAMA REPUBLICAN PARTY STANDS BY SUPPORT FOR MOORE\nCOMING up\nWH: TRUMP LEAVES MOORE DECISION UP TO ALABAMA VOTERS
2017-11-17 13:09:00	CNNW	10	CNNW_20171117_130000_New_Day/start/540	Maggie Haberman OW Political Analyst\nVoice of: Sen. Kirsten Gillibrand (D) New York\nUILLIBHANU IU NYII ULINIUN SHUULU'VI: HtSIUNtU UVtH LtWINSKY SCANDAL. . RIGHT NOW...
2017-11-17 13:09:00	FOXNEWSW	52	FOXNEWSW_20171117_110000_FOX__Friends/start/7740	DNGRESSIONAL HISPANIC CAUCUS SNUBS GOP i
2017-11-17 13:09:00	MSNBCW	20	MSNBCW_20171117_110000_Morning_Joe/start/7740	I. .. {e experlan.com/scan
2017-11-17 13:10:00	FOXNEWSW	23	FOXNEWSW_20171117_110000_FOX__Friends/start/7800	ASSIVE FIRE TEARS THROUGH SENIOR COMMUNITY I\nDNGRESSIONAL HISPANIC CAUCUS SNUBS GOP i\nARNING: HOLIDAY TERROR THREAT IN EUROPE
2017-11-17 13:10:00	MSNBCW	17	MSNBCW_20171117_110000_Morning_Joe/start/7800	See our ad in Redbook.\nEnbrel.com\nSymptoms of an infection include fever, sweats, chills, or cough. E
2017-11-17 13:11:00	FOXNEWSW	21	FOXNEWSW_20171117_110000_FOX__Friends/start/7860	(UMP TO HOST NCAA CHAMPS AT WH i\nARNING: HOLIDAY TERROR THREAT IN EUROPE\nRECORD STOCK SURGE
2017-11-17 13:12:00	BBCNEWS	4	BBCNEWS_20171117_130000_BBC_News_at_One/start/720	Detective Superintendent PAUL KESSLER. Dorset Police
2017-11-17 13:12:00	FOXNEWSW	13	FOXNEWSW_20171117_110000_FOX__Friends/start/7920	SMOOTH CRIMINAL
2017-11-17 13:13:00	CNNW	16	CNNW_20171117_130000_New_Day/start/780	Individual results may vary.\nLYRICA is not an antidepressant. or an opioid.
2017-11-17 13:13:00	MSNBCW	14	MSNBCW_20171117_110000_Morning_Joe/start/7980	SENATOR AL FRANKEN ACCUSED OF SEXUAL MISCONDUCT\n= TAQUERIA = eltorotaq
2017-11-17 13:14:00	MSNBCW	8	MSNBCW_20171117_110000_Morning_Joe/start/8040	SENATOR AL FRANKEN ACCUSED OF SEXUAL MISCONDUCT\nkenb' '. \u2014 audwm'm...om-s Inmotho man; mmmm-omwn. . Middle Eas' before he was elected (R )and \ufb01enalo Mumnn' IA\u2019\u00e9ld'
2017-11-17 13:15:00	CNNW	4	CNNW_20171117_130000_New_Day/start/900	Sen. Orrin Hatch (R) Utah
2017-11-17 13:15:00	MSNBCW	28	MSNBCW_20171117_110000_Morning_Joe/start/8100	[ll-ll\" MIIIIIIIITY lEIIlEII\nSENATOR AL FRANKEN ACCUSED OF SEXUAL MISCONDUCT
2017-11-17 13:16:00	FOXNEWSW	40	FOXNEWSW_20171117_110000_FOX__Friends/start/8160	TOCKS RISE AS HOUSE PASSES TAX BILL I
2017-11-17 13:16:00	MSNBCW	11	MSNBCW_20171117_110000_Morning_Joe/start/8160	FRANKEN CALLS FOR ETHICS INVESTIGATION OF HIMSELF\nSENATORS CALL FOR ETHICS INVESTIGATION. INTO SEN. FRANKEN GROPING ALLEGATION
2017-11-17 13:17:00	CNNW	7	CNNW_20171117_130000_New_Day/start/1020	Sen. Orrin Hatch (R) Utah\n5tNA|UH\u00a7 I'll-\\IUI'I & BHUWN INVULVtU IN SHUUIINU MAIUI'I UVtH IAK blLL. . RIGHT NOW ATLANTA ' 41\u00b0 CHARLOTTEC ,412\u201c WASHINGTON
2017-11-17 13:17:00	FOXNEWSW	38	FOXNEWSW_20171117_110000_FOX__Friends/start/8220	TOCKS RISE AS HOUSE PASSES TAX BILL I\nr=- STUART VARNEY 'l HOST, \"VARNEY & CO.\" ON FBN. . . . TOCKS RISE AS HOUSE PASSES TAX BILL\nECORD STOCK SURGES AFTER TAX BILL PASSES I
2017-11-17 13:17:00	MSNBCW	28	MSNBCW_20171117_110000_Morning_Joe/start/8220	FRANKEN CALLS FOR ETHICS INVESTIGATION OF HIMSELF\nTRUMP DENOUNCES FRANKEN BUT. REMAINS SILENT ON ROY MOORE\n'edding guest who 15 being mum-med by Km\u201c. Nenlon. plnnug the wedding...
2017-11-17 13:18:00	CNNW	18	CNNW_20171117_130000_New_Day/start/1080	Rep. Charlie Dent (R) Appropriations Committee\nRep. Charlie Dent (R) Pennsylvania
2017-11-17 13:18:00	FOXNEWSW	20	FOXNEWSW_20171117_110000_FOX__Friends/start/8280	WHAT'S NEXT FOR TAX REFORM? I\nany - Manda\nECORD STOCK SURGES AFTER TAX BILL PASSES I
2017-11-17 13:18:00	MSNBCW	47	MSNBCW_20171117_110000_Morning_Joe/start/8280	SENATORS CALL FOR ETHICS INVESTIGATION. INTO SEN. FRANKEN GROPING ALLEGATION\nFRANKEN CALLS FOR ETHICS INVESTIGATION OF HIMSELF
2017-11-17 13:19:00	BBCNEWS	4	BBCNEWS_20171117_130000_BBC_News_at_One/start/1140	berary pictures
2017-11-17 13:19:00	CNNW	24	CNNW_20171117_130000_New_Day/start/1140	Rep. Charlie Dent (R) Pennsylvania\nRep. Charlie Dent (R) Former Chair, Ethics Committee
2017-11-17 13:19:00	MSNBCW	41	MSNBCW_20171117_110000_Morning_Joe/start/8340	TRUMP DENOUNCES FRANKEN BUT. REMAINS SILENT ON ROY MOORE\nSENATORS CALL FOR ETHICS INVESTIGATION. INTO SEN. FRANKEN GROPING ALLEGATION
2017-11-17 13:20:00	CNNW	35	CNNW_20171117_130000_New_Day/start/1200	Rep. Charlie Dent (R) Pennsylvania\nHUUSI: PASStS UUI\u201c II-UK BILL; l'I-\\| I: IN 5|:NAI I: UNULtAH. . TODAY ATLANTA . 65\u00b0 CHARLOTTE ' ,6\u201c\u201c WASHINGTON
2017-11-17 13:20:00	FOXNEWSW	15	FOXNEWSW_20171117_110000_FOX__Friends/start/8400	CAN YOUR PLANE BE HACKED?
2017-11-17 13:20:00	MSNBCW	20	MSNBCW_20171117_110000_Morning_Joe/start/8400	ROGER STONE APPEARED TO KNOW. FRANKEN ALLEGATION WAS COMING\nTRUMP DENOUNCES FRANKEN BUT. REMAINS SILENT ON ROY MOORE
2017-11-17 13:21:00	CNNW	30	CNNW_20171117_130000_New_Day/start/1260	Rep. Charlie Dent (R) Pennsylvania\nRep. Charlie Dent (R) Former Chair, Ethics Committee\nHUUSI: PASStS UUI\" II-UK BILL; l'I-\\| I: IN 5|:NAI I: UNULEAH. . TODAY ATLANTA ....
2017-11-17 13:21:00	MSNBCW	54	MSNBCW_20171117_110000_Morning_Joe/start/8460	ROGER STONE APPEARED TO KNOW. FRANKEN ALLEGATION WAS COMING\nDONNY DEUTSCH \\ BRANDING & MARKETING EXPERT
2017-11-17 13:22:00	CNNW	29	CNNW_20171117_130000_New_Day/start/1320	Rep. Charlie Dent (R) Former Chair, Ethics Committee\nV V V V _ V _ V V. Rep. Charlie Dent (R) Pennsylvania\nRep. Charlie Dent (R) Appropriations Committee
2017-11-17 13:22:00	MSNBCW	62	MSNBCW_20171117_110000_Morning_Joe/start/8520	ROGER STONE APPEARED TO KNOW. FRANKEN ALLEGATION WAS COMING
2017-11-17 13:23:00	FOXNEWSW	8	FOXNEWSW_20171117_110000_FOX__Friends/start/8580	>MOOTH CRIMINAL' ARRESTED BY POLICE I
2017-11-17 13:23:00	MSNBCW	36	MSNBCW_20171117_110000_Morning_Joe/start/8580	ROGER STONE APPEARED TO KNOW. FRANKEN ALLEGATION WAS COMING\nFRANKEN ISSUES APOLOGY AFI'ER GROPING ALLEGATION
2017-11-17 13:24:00	FOXNEWSW	41	FOXNEWSW_20171117_110000_FOX__Friends/start/8640	:HOOL NIXES 'FAKE NEWS' CNN T-SHIRT I\n>MOOTH CRIMINAL' ARRESTED BY POLICE I
2017-11-17 13:25:00	FOXNEWSW	27	FOXNEWSW_20171117_110000_FOX__Friends/start/8700	LINTON VS POTENTIAL SPECIAL COUNSEL I\nLINTON VS POTENTIAL SPECIAL COUNSEL i\n13' PETER SCHWEIZER | AUTHOR, \"CLINTON CASH\". . . . LINTON VS POTENTIAL SPECIAL COUNSEL
2017-11-17 13:26:00	FOXNEWSW	15	FOXNEWSW_20171117_110000_FOX__Friends/start/8760	IGGING INTO THE URANIUM ONE DEAL i\nEv PETER SCHWEIZER | AUTHOR, \"CLINTON CASH\". . . . LINTON VS POTENTIAL SPECIAL COUNSEL\nF' PETER SCHWEIZER | AUTHOR, \"CLINTON CASH\". ....
2017-11-17 13:27:00	FOXNEWSW	40	FOXNEWSW_20171117_110000_FOX__Friends/start/8820	IGGING INTO THE URANIUM ONE DEAL i\nF: PETER SCHWEIZER | AUTHOR, \"CLINTON CASH\". . . . IGGING INTO THE URANIUM ONE DEAL
2017-11-17 13:27:00	MSNBCW	3	MSNBCW_20171117_110000_Morning_Joe/start/8820	SUSAN DEL PERCIO ' REPUBLICAN STRATEGIST
2017-11-17 13:28:00	FOXNEWSW	36	FOXNEWSW_20171117_110000_FOX__Friends/start/8880	IGGING INTO THE URANIUM ONE DEAL i
2017-11-17 13:28:00	MSNBCW	57	MSNBCW_20171117_110000_Morning_Joe/start/8880	SEXUAL HARASSMENT AND MODERN DAY POLITICS
2017-11-17 13:30:00	CNNW	15	CNNW_20171117_130000_New_Day/start/1800	Rep. Jim Himes (D) Connecticut\n5PtUIAL WUN\ufb01tL 5UbPUtNH5 IHUMP CAMPAIGN I'UH MUHI: UUUUMtN|5. . TODAY ATLANTA ( , 65u CHARLOTTE (\" 61\u00b0 WASHINGTON
2017-11-17 13:31:00	CNNW	24	CNNW_20171117_130000_New_Day/start/1860	Rep. Jim Himes (D) Intelligence Committee\nRep. Jim Himes (D) Chair, New Democrat Coalition
2017-11-17 13:31:00	FOXNEWSW	7	FOXNEWSW_20171117_110000_FOX__Friends/start/9060	Works w'th your smartphone
2017-11-17 13:32:00	FOXNEWSW	12	FOXNEWSW_20171117_110000_FOX__Friends/start/9120	Available at. . amazon\nWorks wnh your smartphone
2017-11-17 13:33:00	CNNW	17	CNNW_20171117_130000_New_Day/start/1980	Rep. Jim Himes (D) Chair, New Democrat Coalition\nRep. Jim Himes (D) Connecticut
2017-11-17 13:33:00	FOXNEWSW	50	FOXNEWSW_20171117_110000_FOX__Friends/start/9180	llS GROWING FOR ETHICS PROBE INTO FRANKEN\n. \\llS GROWING FOR ETHICS PROBE INTO FRANKEN I
2017-11-17 13:33:00	MSNBCW	11	MSNBCW_20171117_110000_Morning_Joe/start/9180	TrySoFi.c1
2017-11-17 13:34:00	CNNW	14	CNNW_20171117_130000_New_Day/start/2040	Rep. Jim Himes (D) Connecticut\nRep. Jim Himes (D) Intelligence Committee
2017-11-17 13:34:00	FOXNEWSW	23	FOXNEWSW_20171117_110000_FOX__Friends/start/9240	'1: OBAMA ADMIN RARELY TOOK ACTION ON GUNS i\nllS GROWING FOR ETHICS PROBE INTO FRANKEN i\n'T: OBAMA ADMIN RARELY TOOK ACTION ON GUNS
2017-11-17 13:35:00	CNNW	15	CNNW_20171117_130000_New_Day/start/2100	Rep. Jim Himes (D) Chair, New Democrat Coalition\nRep. Jim Himes (D) Connecticut
2017-11-17 13:35:00	FOXNEWSW	36	FOXNEWSW_20171117_110000_FOX__Friends/start/9300	BAMA ADMIN RARELY TRIED ILLEGAL GUN BUYERS i\n'T: OBAMA ADMIN RARELY TOOK ACTION ON GUNS\nEFT TALKS TOUGH ON GUNS, LITTLE ACTION i
2017-11-17 13:36:00	CNNW	4	CNNW_20171117_130000_New_Day/start/2160	UILLIBHANU IU NYI' ULINIUN DHUULU' VI: thlletU UVtH LtWINSKY SCANDAL. . RIGHT NOW CHICAGO ( 36\u00b0 DETROIT L' 36\u00b0 HOUSTON r
2017-11-17 13:36:00	FOXNEWSW	26	FOXNEWSW_20171117_110000_FOX__Friends/start/9360	BIPARTISAN DEAL ON GUN CONTROL? i\nBIPARTISAN DEAL ON GUN CONTROL? I\nEFT TALKS TOUGH ON GUNS, LITTLE ACTION i
2017-11-17 13:36:00	MSNBCW	18	MSNBCW_20171117_110000_Morning_Joe/start/9360	1:\u00bb Jitterbug Smart Get 25% OFF at: . \ufb02
2017-11-17 13:37:00	FOXNEWSW	37	FOXNEWSW_20171117_110000_FOX__Friends/start/9420	BIPARTISAN DEAL ON GUN CONTROL? I\n. BIPARTISAN DEAL ON GUN CONTROL? I
2017-11-17 13:38:00	BBCNEWS	10	BBCNEWS_20171117_133000_BBC_News/start/480	BREXIT NEGOTIATIONS. EU says negotiations cannot move until issues resolved\nBREXIT NEGOTIATIONS '. Davis: EU countries do want to move on in negotiations L\nDAVID DAVIS MP. Brexit Secretary
2017-11-17 13:38:00	MSNBCW	15	MSNBCW_20171117_110000_Morning_Joe/start/9480	WSJ: MUELLER ISSUED SUBPOENA FOR TRUMP. CAMPAIGN'S RUSSIA-RELATED DOCUMENTS IN OCTOBER\nWSJ: MUELLER ISSUED SUBPOENA FOR TRUMP
2017-11-17 13:39:00	BBCNEWS	11	BBCNEWS_20171117_133000_BBC_News/start/540	BREXIT NEGOTIATIONS. Brexit Sec: Concessions made on EU citizens rights'\nBREXIT NEGOTIATIONS. David Davis: 'Nothing comes ior nothing' in negotiation;\nBREXIT NEGOTIATIONS. Brexit Secretary gave a speech in...
2017-11-17 13:39:00	CNNW	11	CNNW_20171117_130000_New_Day/start/2340	BuyLeesa.com
2017-11-17 13:39:00	FOXNEWSW	24	FOXNEWSW_20171117_110000_FOX__Friends/start/9540	E AGENTS UNION BLASTS OBAMA-ERA HOLDOVERS i\nHS HACKS AIRPLANE IN SUCCESSFUL TEST i\n'OMAN WITH ANTI-TRUMP DECAL ARRESTED i\nDAVID WARD. FORMER ICE AGENT
2017-11-17 13:39:00	MSNBCW	55	MSNBCW_20171117_110000_Morning_Joe/start/9540	WSJ: MUELLER ISSUED SUBPOENA FOR TRUMP. CAMPAIGN\u2019S RUSSIA-RELATED DOCUMENTS IN OCTOBER\nMA-ITHEW MILLER l JUSTICSEIXEl\ufb01ECURITY ANALYST
2017-11-17 13:40:00	BBCNEWS	11	BBCNEWS_20171117_133000_BBC_News/start/600	BREXIT NEGOTIATIONS. Davis: EU countries do want to move on in negotiations\nBREXIT NEGOTIATIONS. EU says negotiations cannot move until issues resolved\nBORIS JOHNSON MP. Foreign Secretary
2017-11-17 13:40:00	FOXNEWSW	28	FOXNEWSW_20171117_110000_FOX__Friends/start/9600	'OMAN WITH ANTI-TRUMP DECAL ARRESTED I. . . a
2017-11-17 13:40:00	MSNBCW	21	MSNBCW_20171117_110000_Morning_Joe/start/9600	WSJ: MUELLER ISSUED SUBPOENA FOR TRUMP. CAMPAIGN\u2019S RUSSIA-RELATED DOCUMENTS IN OCTOBER\nSENATE JUDICIARY: KUSHNER FORWARD EMAILS. ABOUT A \"RUSSIAN BACKDOOR OVERTURE\
2017-11-17 13:41:00	BBCNEWS	10	BBCNEWS_20171117_133000_BBC_News/start/660	BREXIT NEGOTIATIONS. Foreign Sec: Work 1O be done to solve Irish border issue\nBREXIT NEGOTIATIONS. Foreign Sec: No interesi in hard border with Ireland\nBREXIT NEGOTIATIONS. Foreign Sec: No interest in hard border...
2017-11-17 13:41:00	MSNBCW	21	MSNBCW_20171117_110000_Morning_Joe/start/9660	POLITICO: SENATORS PRESS KUSHNER FOR. MISSING DOCS RELATED TO RUSSIA INVESTIGATION\nSENATE JUDICIARY: KUSHNER FORWARD EMAILS. ABOUT A \"RUSSIAN BACKDOOR OVERTURE\"\nJARED KUSHNER\u2019S DISCLOSURE PROBLEM
2017-11-17 13:42:00	BBCNEWS	17	BBCNEWS_20171117_133000_BBC_News/start/720	BREXIT NEGOTIATIONS. Report finds deadline would create 'significant dimcukies'
2017-11-17 13:42:00	MSNBCW	59	MSNBCW_20171117_110000_Morning_Joe/start/9720	JARED KUSHNER\u2019S DISCLOSURE PROBLEM
2017-11-17 13:43:00	BBCNEWS	5	BBCNEWS_20171117_133000_BBC_News/start/780	BREXIT NEGOTIATIONS '. Report iinds deadline would create 'significant diiiiculiies' , L
2017-11-17 13:43:00	CNNW	6	CNNW_20171117_130000_New_Day/start/2580	Eli! IVIUHI: I-\\I bLtAUHtHHtPUHI.UUWI. . RIGHT NOW CHICAGO ' 36\u00b0 DETROIT L' 36\u00b0 HOUSTON
2017-11-17 13:43:00	MSNBCW	47	MSNBCW_20171117_110000_Morning_Joe/start/9780	THE STATE OF THE MUELLER INVESTIGATION\nJARED KUSHNER AND MUELLER\u2019S RUSSIA PROBE\nNATASHA BERTRAND \\ ESE'T'TCEEEC'ESLDEE'SONDENT
2017-11-17 13:44:00	CNNW	4	CNNW_20171117_130000_New_Day/start/2640	NPFinder.com
2017-11-17 13:44:00	MSNBCW	29	MSNBCW_20171117_110000_Morning_Joe/start/9840	NBC NEWS: NEW WITNESS COOPERATING WITH FEDS. MAY HAVE INFO RELATING TO MICHAEL FLYNN\nTHE STATE OF THE MUELLER INVESTIGATION
2017-11-17 13:45:00	FOXNEWSW	7	FOXNEWSW_20171117_110000_FOX__Friends/start/9900	m Shriners Hospitals. for Children
2017-11-17 13:45:00	MSNBCW	43	MSNBCW_20171117_110000_Morning_Joe/start/9900	NBC NEWS: NEW WITNESS COOPERATING WITH FEDS. MAY HAVE INFO RELATING TO MICHAEL FLYNN
2017-11-17 13:46:00	BBCNEWS	18	BBCNEWS_20171117_133000_BBC_News/start/960	ZIMBABWE TAKEOVER\nMICHAEL BUTLER. Care home activity coordinator
2017-11-17 13:46:00	FOXNEWSW	32	FOXNEWSW_20171117_110000_FOX__Friends/start/9960	>EMOCRATS TURNING ON CLINTONS i\n>EMOCRATS TURNING ON CLINTONS
2017-11-17 13:47:00	BBCNEWS	45	BBCNEWS_20171117_133000_BBC_News/start/1020	CREDIT CARD LIMITS
2017-11-17 13:47:00	MSNBCW	3	MSNBCW_20171117_110000_Morning_Joe/start/10020	= COMING up
2017-11-17 13:48:00	BBCNEWS	18	BBCNEWS_20171117_133000_BBC_News/start/1080	NEW TOWNS REPORT. Report launched on making new towns more productive\nNEW TOWNS REPORT. National lnhastructure Commission publishes new report\nLord ADONIS. Chairman, National Infrastructure Commission
2017-11-17 13:48:00	CNNW	38	CNNW_20171117_130000_New_Day/start/2880	Leeann Tweeden Anchor who accused Franken of groping
2017-11-17 13:48:00	FOXNEWSW	20	FOXNEWSW_20171117_110000_FOX__Friends/start/10080	EM LAWMAKER LAMENTS LEWINSKY SCANDAL i
2017-11-17 13:49:00	BBCNEWS	11	BBCNEWS_20171117_133000_BBC_News/start/1140	NEW TOWNS REPORT. Report: \u2019Chronic' under-supply of homes hinders growth\nNEW TOWNS REPORT. National lnhastructure Commission publishes new report\nNEW TOWNS REPORT. Report: 1m homes and jobs could be created...
2017-11-17 13:49:00	CNNW	4	CNNW_20171117_130000_New_Day/start/2940	I'HANKtN AUGUStH.\u2019 \u201dIVI: bttN ANUHY ABUUI || .. fUH UVtH 1U YtAHS\". . RIGHT NOW ATLANTA ( 41\u00b0 CHARLOTTEC\u2014 .412\u201c WASHINGTON
2017-11-17 13:49:00	FOXNEWSW	19	FOXNEWSW_20171117_110000_FOX__Friends/start/10140	ADOPTION AWARENESS
2017-11-17 13:50:00	CNNW	10	CNNW_20171117_130000_New_Day/start/3000	iAreva Martin CJ\\N Legal Analyst\nRuth Marcus | Deputy Editorial Page Editor and Columnist Washington Post. TODAY MIAMI i 79\" ORLANDO i 78\u00b0 TAMPA\nIIIIIII II--\u2014v Iv...
2017-11-17 13:50:00	FOXNEWSW	8	FOXNEWSW_20171117_110000_FOX__Friends/start/10200	www.3OckSlider.com\nA. . www.8OckSlider.com
2017-11-17 13:50:00	MSNBCW	3	MSNBCW_20171117_110000_Morning_Joe/start/10200	AMERICA'S TAX CODE: COMPLEX & OU'
2017-11-17 13:51:00	BBCNEWS	4	BBCNEWS_20171117_133000_BBC_News/start/1260	MIKE ISHERWOOD. Managing Director, APD Communications
2017-11-17 13:51:00	CNNW	7	CNNW_20171117_130000_New_Day/start/3060	W. Areva Martin Attorney & Legal Affairs Commentator
2017-11-17 13:51:00	FOXNEWSW	7	FOXNEWSW_20171117_110000_FOX__Friends/start/10260	www.porschemarin.com
2017-11-17 13:51:00	MSNBCW	24	MSNBCW_20171117_110000_Morning_Joe/start/10260	TO BE SENT TO TRUMP BY CHRISTMAS
2017-11-17 13:52:00	BBCNEWS	11	BBCNEWS_20171117_133000_BBC_News/start/1320	BUSINESS IN BRIEF. Reports: Comcast and Verizon eye up 21st Century Fox\nMARTIN BRYANT. Tech Nation\nKISHAW TAILOR. Chief Executive, Humber LEP
2017-11-17 13:52:00	CNNW	8	CNNW_20171117_130000_New_Day/start/3120	DETROIT 43\" HOUSTON
2017-11-17 13:53:00	CNNW	7	CNNW_20171117_130000_New_Day/start/3180	Ruth Marcus | Deputy Editorial Page Editor and Columnist Washington Post. RIGHT NOW MIAMI l 7O\" ORLANDO ( 61\u00b0 TAMPA
2017-11-17 13:53:00	FOXNEWSW	18	FOXNEWSW_20171117_110000_FOX__Friends/start/10380	NGER & AUTHOR'S INSPIRATIONAL JOURNEY I
2017-11-17 13:53:00	MSNBCW	17	MSNBCW_20171117_110000_Morning_Joe/start/10380	ABOUT BUYING MAJOR ASSETS
2017-11-17 13:54:00	BBCNEWS	21	BBCNEWS_20171117_133000_BBC_News/start/1440	MILITARY DOG BRAVEHV AWARD. Mali helped save the lives of troops in Aighanistan
2017-11-17 13:54:00	CNNW	17	CNNW_20171117_130000_New_Day/start/3240	V V V V V _ V _ V V. Areva Martin Civil Rights Attorney\nWV V V ' W. Areva Martin Attorney & Legal Affairs Commentator\nV V V _ V _ V _ V V. Areva Martin Civil Rights Attorney
2017-11-17 13:54:00	FOXNEWSW	42	FOXNEWSW_20171117_110000_FOX__Friends/start/10440	NGER & AUTHOR'S INSPIRATIONAL JOURNEY I\nNGER & AUTHOR'S INSPIRATIONAL JOURNEY
2017-11-17 13:54:00	MSNBCW	8	MSNBCW_20171117_110000_Morning_Joe/start/10440	Enbrel.com l 1-888-4ENBREL\nVISIT JAG UARUSA.COM
2017-11-17 13:55:00	CNNW	12	CNNW_20171117_130000_New_Day/start/3300	WW. Ruth Marcus Deputy Editorial Page Editor and Columnist Washington Post\nDETROIT -l 43\" HOUSTON\nRuth Marcus | Deputy Editorial Page Editor and Columnist Washington Post. RIGHT NOW DALLAS ( 71D LOSANGELES ,...
2017-11-17 13:55:00	MSNBCW	11	MSNBCW_20171117_110000_Morning_Joe/start/10500	See our ad in Redbook.
