2017-11-17 18:27:00	MSNBCW	9	MSNBCW_20171117_180000_MSNBC_Live_With_Craig_Melvin/start/1620	SENATE JUDICIARY: KUSHNER EMAILED. ABOUT WIKILEAKS. RUSSIA DURING CAMPAIGN
2017-11-17 18:29:00	CNNW	11	CNNW_20171117_180000_Wolf/start/1740	1.844.ENTYV|O
2017-11-17 18:29:00	FOXNEWSW	21	FOXNEWSW_20171117_180000_Outnumbered_Overtime_With_Harris_Faulkner/start/1740	OMAN WHO ACCUSED FRANKEN OF KISSING HER. _ I I L L A _ A ' _ A ' I I
2017-11-17 18:30:00	BBCNEWS	21	BBCNEWS_20171117_180000_BBC_News_at_Six/start/1800	ZIMBABWE TAKEOVER\nMID-AIR COLLISION
2017-11-17 18:30:00	CNNW	17	CNNW_20171117_180000_Wolf/start/1800	1-8OO-754-9595 MRP' \u201cWWW. . AARPMedicareSupplementmm mm\u201c amp\u201d\n1 -8OO-754-9595 Call now for Free Guide. . TTY:711\n1 -8OO-754-9595 mp: \u201cWWW. . AARPMedicareSupplementmm mm\u201c cm?\u201d
2017-11-17 18:30:00	FOXNEWSW	27	FOXNEWSW_20171117_180000_Outnumbered_Overtime_With_Harris_Faulkner/start/1800	W ALLEGATIONS: RADIO HOST SAYS FRANKEN HARASSED
2017-11-17 18:30:00	MSNBCW	10	MSNBCW_20171117_180000_MSNBC_Live_With_Craig_Melvin/start/1800	. call 1-8OO-33O-51OO\n. or call 1-8OO-33O-51OO.
2017-11-17 18:31:00	CNNW	11	CNNW_20171117_180000_Wolf/start/1860	1 -8OO-754-9595 Call now for Free Guide. . AARPMedicareSupplement.com\n1-8OO-754-9595 ~AARP' \u201cWWW. . TTY:71 1 1mm Company\n1-8OO-754-9595 ~AARP' \u201cWWW. . Toll-free 1mm.\u201c comp\u201d,
2017-11-17 18:31:00	FOXNEWSW	14	FOXNEWSW_20171117_180000_Outnumbered_Overtime_With_Harris_Faulkner/start/1860	It was a remarkable slatement from a senator who enthusiastically. backed Hillary Clinton\u2019s presidential bid last year but has been. deeply involved in eflorts to curb sexual abuse and harassment.. . imimes com
2017-11-17 18:31:00	MSNBCW	33	MSNBCW_20171117_180000_MSNBC_Live_With_Craig_Melvin/start/1860	SEN. GILLIBRAND TO NYT: BILL CLINTON SHOULD. HAVE RESIGNED OVER LEWINSKY SCANDAL
2017-11-17 18:32:00	FOXNEWSW	9	FOXNEWSW_20171117_180000_Outnumbered_Overtime_With_Harris_Faulkner/start/1920	ATOR GILLIBRAND SUGESTS BILL CLINTON SHOULD HAVE. A I I ' I A . A A ' A A |A A ' A\nATOR GILLIBRAND SUGGESTS BILL CLINTON SHOULD HAVE
2017-11-17 18:32:00	MSNBCW	54	MSNBCW_20171117_180000_MSNBC_Live_With_Craig_Melvin/start/1920	SEN. GILLIBRAND TO NYT: \"SHOULD HAVE A VERY DIFFERENT. CONVERSATION\" ABOUT TRUMP IN LIGHT OF HARASSMENT SCANDALS\nFMR. DIRECTOR OF PROGRESSIVE MEDIA. ZERLINA MAXWELL I CLINTON CAMPAIGN
2017-11-17 18:33:00	CNNW	48	CNNW_20171117_180000_Wolf/start/1980	SENATORS: KUSHNER FAILED TO HAND OVER SOME RUSSIA DOCS\nSENATORS: KUSHNER FAILED TO HAND OVER SOME RUSSIA DOCS. . . . Laura Coates cm Legal Analyst
2017-11-17 18:33:00	FOXNEWSW	25	FOXNEWSW_20171117_180000_Outnumbered_Overtime_With_Harris_Faulkner/start/1980	ATOR GILLIBRAND SUGGESTS BILL CLINTON SHOULD HAVE
2017-11-17 18:34:00	CNNW	37	CNNW_20171117_180000_Wolf/start/2040	SENATORS: KUSHNER FAILED TO HAND OVER SOME RUSSIA DOCS. . . . Looking for WikiLeaks emails & \"Russian backdoor overture & dinner invite\"\nSENATORS: KUSHNER FAILED TO HAND OVER SOME RUSSIA DOCS. . . . Laura Coates Former Federal Prosecutor
2017-11-17 18:34:00	MSNBCW	39	MSNBCW_20171117_180000_MSNBC_Live_With_Craig_Melvin/start/2040	SEN. GILLIBRAND TO NYT: STEPPING DOWN WOULD HAVE. BEEN \"APPROPRIATE RESPONSE\" BY BILL CLINTON\nSEN. GILLIBRAND TO NYT: \"SHOULD HAVE A VERY DIFFERENT. CONVERSATION\" ABOUT TRUMP IN LIGHT OF HARASSMENT SCANDALS\n' 'HOST 8c EXECUTIVE...
2017-11-17 18:35:00	FOXNEWSW	4	FOXNEWSW_20171117_180000_Outnumbered_Overtime_With_Harris_Faulkner/start/2100	WHETHER GILLIBRAND'S COMMENTS INDICATE A. cult-r IM TI-ll: I :Iz'rlc \\IIFW m: nlll ('I IM'rnM
2017-11-17 18:35:00	MSNBCW	37	MSNBCW_20171117_180000_MSNBC_Live_With_Craig_Melvin/start/2100	SEN. GILLIBRAND TO NYT: \"SHOULD HAVE A VERY DIFFERENT. CONVERSATION\" ABOUT TRUMP IN LIGHT OF HARASSMENT SCANDALS
2017-11-17 18:36:00	CNNW	39	CNNW_20171117_180000_Wolf/start/2160	SENATORS: KUSHNER FAILED TO HAND OVER SOME RUSSIA DOCS. . . . David Gregory (M Political Analyst\nSENATORS: KUSHNER FAILED TO HAND OVER SOME RUSSIA DOCS. . . . Looking for WikiLeaks emails & \"Russian backdoor overture & dinner...
2017-11-17 18:37:00	CNNW	27	CNNW_20171117_180000_Wolf/start/2220	SENATORS: KUSHNER FAILED TO HAND OVER SOME RUSSIA DOCS. . . . Ana Navarro CJ\\N Political Commentator\nSENATORS: KUSHNER FAILED TO HAND OVER SOME RUSSIA DOCS. . . . Looking for WikiLeaks emails & \"Russian backdoor overture & dinner...
2017-11-17 18:38:00	BBCNEWS	19	BBCNEWS_20171117_183000_Sportsday/start/480	v. . RSPOHTSDAV\nGEORGE GRAHAM. Tottenham Manager 1998-2OO1
2017-11-17 18:38:00	CNNW	38	CNNW_20171117_180000_Wolf/start/2280	LAWYER: TRUMP PAYING HIS OWN LEGAL FEES IN RUSSIA PROBE\nLAWYER: TRUMP PAYING HIS OWN LEGAL FEES IN RUSSIA PROBE. . Rick Santorum cw Senior Political Commentator
2017-11-17 18:38:00	FOXNEWSW	7	FOXNEWSW_20171117_180000_Outnumbered_Overtime_With_Harris_Faulkner/start/2280	Iln rnn nu nrrrn n nrrrnnnu rmmnmnn
2017-11-17 18:38:00	MSNBCW	54	MSNBCW_20171117_180000_MSNBC_Live_With_Craig_Melvin/start/2280	POWERFUL MEN IN SPOTLIGHT OVER ALLEGED SEXUAL MISCONDUCT\nJESSICA CONTRERA | 2%?ng .....
2017-11-17 18:39:00	MSNBCW	34	MSNBCW_20171117_180000_MSNBC_Live_With_Craig_Melvin/start/2340	GROWING SCANDALS SHEDDING NEW LIGHT ON #METOO MOVEMENT\nPOWERFUL MEN IN SPOTLIGHT OVER ALLEGED SEXUAL MISCONDUCT
2017-11-17 18:40:00	BBCNEWS	20	BBCNEWS_20171117_183000_Sportsday/start/600	| /. . SPORTSDAV
2017-11-17 18:40:00	CNNW	23	CNNW_20171117_180000_Wolf/start/2400	\"BULLCRAP\": SHOUTING MATCH ERUPTS OVER GOP'S TAX BILL\nLAWYER: TRUMP PAYING HIS OWN LEGAL FEES IN RUSSIA PROBE
2017-11-17 18:40:00	MSNBCW	34	MSNBCW_20171117_180000_MSNBC_Live_With_Craig_Melvin/start/2400	GROWING SCANDALS SHEDDING NEW LIGHT ON #METOO MOVEMENT\nSENATE JUDICIARY: KUSHNER EMAILED. ABOUT WIKILEAKS. RUSSIA DURING CAMPAIGN\nEX-PROSECUTOR: PANAMA BUILDING BEARING. TRUMP'S NAME WAS A...
2017-11-17 18:42:00	CNNW	7	CNNW_20171117_180000_Wolf/start/2520	1.8OO.551.8963 preventcruelty.org
2017-11-17 18:42:00	FOXNEWSW	21	FOXNEWSW_20171117_180000_Outnumbered_Overtime_With_Harris_Faulkner/start/2520	SENATORS HATCH (R-UT) & BROWN (D-OH). k I _ I A AA A _ I ' L A A '\nSENATORS HATCH (R-UT) & BROWN (D-OH). ' L _ D L |A A _ I ' x A A '\nSENATORS HATCH (R-UT) & BROWN (D-OH)
2017-11-17 18:44:00	BBCNEWS	21	BBCNEWS_20171117_183000_Sportsday/start/840	SPORTSDAV\nSARAH HUNTER. England Captain\nsvonrsmv'u.
2017-11-17 18:44:00	CNNW	27	CNNW_20171117_180000_Wolf/start/2640	1.8OO.551.8963 preventcruelty.org\n\"BULLCRAP\": SHOUTING MATCH ERUPTS OVER GOP'S TAX BILL\n1-8OO-831-37OO mesobook.com. . Mesothelioma Book
2017-11-17 18:44:00	FOXNEWSW	14	FOXNEWSW_20171117_180000_Outnumbered_Overtime_With_Harris_Faulkner/start/2640	5 _ __. CAPRI CAFARO. . A I'EDIf'AKI I Ikll'lEDCI'I'V crunnl :nn DI \u201cII If' AEEAIBC\nSENATORS HATCH (R-UT) & BROWN (D-OH). . :FT IMTn CI-lnl ITIMI': MATf'I-l ('\u201cIFD CFMATF TAY DI AM
2017-11-17 18:44:00	MSNBCW	9	MSNBCW_20171117_180000_MSNBC_Live_With_Craig_Melvin/start/2640	Available by prescription only. See our ad in Popular Science.\nSOURCE: SPECIAL COUNSEL SUBPOENAS. TRUMP CAMPAIGN FOR MORE DOCUMENTS
2017-11-17 18:45:00	BBCNEWS	18	BBCNEWS_20171117_183000_Sportsday/start/900	PORTSDAV -
2017-11-17 18:45:00	CNNW	41	CNNW_20171117_180000_Wolf/start/2700	\"BULLCRAP\": SHOUTING MATCH ERUPTS OVER GOP'S TAX BILL\n\"BULLCRAP\": SHOUTING MATCH ERUPTS OVER GOP'S TAX BILL. . . . Sen Sherrod Brown (D) Finance Committee\n\"BULLCRAP\": SHOUTING MATCH ERUPTS...
2017-11-17 18:45:00	MSNBCW	39	MSNBCW_20171117_180000_MSNBC_Live_With_Craig_Melvin/start/2700	SOURCE: SPECIAL COUNSEL SUBPOENAS. TRUMP CAMPAIGN FOR MORE DOCUMENTS\nThe Journal reported that the Trump campaign had been caught by surprise b:. the subpoena.
2017-11-17 18:46:00	FOXNEWSW	10	FOXNEWSW_20171117_180000_Outnumbered_Overtime_With_Harris_Faulkner/start/2760	SENATORS HATCH (R-UT) & BROWN (D-OH)
2017-11-17 18:46:00	MSNBCW	42	MSNBCW_20171117_180000_MSNBC_Live_With_Craig_Melvin/start/2760	SENATE JUDICIARY: KUSHNER EMAILED. ABOUT WIKILEAKS. RUSSIA DURING CAMPAIGN\nSOURCE: SPECIAL COUNSEL SUBPOENAS. TRUMP CAMPAIGN FOR MORE DOCUMENTS
2017-11-17 18:48:00	CNNW	49	CNNW_20171117_180000_Wolf/start/2880	FACT-CHECKING SHOUTING MATCH OVER GOP'S TAX BILL\n\"BULLCRAP\": SHOUTING MATCH ERUPTS OVER GOP'S TAX BILL. . Lauren FOX OW Congressional Reporter\n\"BULLCRAP\": SHOUTING MATCH ERUPTS OVER...
2017-11-17 18:48:00	FOXNEWSW	4	FOXNEWSW_20171117_180000_Outnumbered_Overtime_With_Harris_Faulkner/start/2880	\ufb02. CAD A' In nclJe'PCBll AcTeIF'AIfR'QTV I E A \u201cCD
2017-11-17 18:48:00	MSNBCW	24	MSNBCW_20171117_180000_MSNBC_Live_With_Craig_Melvin/start/2880	SENATE JUDICIARY: KUSHNER RECEIVED EMAIL ABOUT. \"RUSSIAN BACKDOOR OVERTURE AND DINNER INVITE\" IN 2O16\nEX-PROSECUTOR: PANAMA BUILDING BEARING. TRUMP'S NAME WAS A MAGNET FOR DIRTY MONEY\nSENATE JUDICIARY: KUSHNER FORWARDED EMAILS. ON...
2017-11-17 18:49:00	CNNW	10	CNNW_20171117_180000_Wolf/start/2940	WATCHDOG: INTERIOR SECY FAILED TO PROPERLY DOCUMENT TRAVEL\n*Use as directed. Results may vary. Among leading OTC TENS brands.\nFACT-CHECKING SHOUTING MATCH OVER GOP'S TAX BILL
2017-11-17 18:49:00	FOXNEWSW	15	FOXNEWSW_20171117_180000_Outnumbered_Overtime_With_Harris_Faulkner/start/2940	866-GET-CARE O MyRightAtHome.com
2017-11-17 18:50:00	BBCNEWS	3	BBCNEWS_20171117_183000_Sportsday/start/1200	CARL FRAMPTON. Former Two-Weight World Champion
2017-11-17 18:50:00	CNNW	7	CNNW_20171117_180000_Wolf/start/3000	[ 1-8OO-552-1854
2017-11-17 18:51:00	BBCNEWS	16	BBCNEWS_20171117_183000_Sportsday/start/1260	K SPORTSDAV
2017-11-17 18:51:00	CNNW	4	CNNW_20171117_180000_Wolf/start/3060	Comparison based on minimum labeled dosing.
2017-11-17 18:52:00	MSNBCW	22	MSNBCW_20171117_180000_MSNBC_Live_With_Craig_Melvin/start/3120	EX-PROSECUTOR: PANAMA BUILDING BEARING. TRUMP'S NAME WAS A MAGNET FOR DIRTY MONEY
2017-11-17 18:53:00	FOXNEWSW	10	FOXNEWSW_20171117_180000_Outnumbered_Overtime_With_Harris_Faulkner/start/3180	OI' call 1-8OO-33O-51OO.\nKEYSTONE PIPELINE LEAKS 21O,OOO\nYou mav be eliqible for a free specialized phone.
2017-11-17 18:54:00	CNNW	35	CNNW_20171117_180000_Wolf/start/3240	WATCHDOG: INTERIOR SECY FAILED TO PROPERLY DOCUMENT TRAVEL\nINTERIOR SECY UNDER SCRUTINY FOR TRAVEL EXPENSES. . Ryan Zinke Interior Secretary\nWATCHDOG: INTERIOR SECY FAILED TO PROPERLY DOCUMENT...
2017-11-17 18:54:00	FOXNEWSW	12	FOXNEWSW_20171117_180000_Outnumbered_Overtime_With_Harris_Faulkner/start/3240	TRANSGANADA STATEMENT. THURSDAY .\nKEYSTONE PIPELINE LEAKS 21O,OOO\nKEYSTONE PIPELINE LEAKS 21O,OOO. (:AIInMC n: nu IN cnl ITI-l hAlInTA __
2017-11-17 18:54:00	MSNBCW	45	MSNBCW_20171117_180000_MSNBC_Live_With_Craig_Melvin/start/3240	EX-PROSECUTOR: RUSSIAN GANGSTERS, LAUNDERERS. HID MONEY IN PANAMA'S TRUMP OCEAN CLUB\nDOCUMENTS: SEVERAL UNITS IN PANAMA\u2019S TRUMP. OCEAN CLUB BOUGHT THROUGH SHELL COMPANIES
2017-11-17 18:55:00	CNNW	62	CNNW_20171117_180000_Wolf/start/3300	WATCHDOG: INTERIOR SECY FAILED TO PROPERLY DOCUMENT TRAVEL
2017-11-17 18:55:00	FOXNEWSW	18	FOXNEWSW_20171117_180000_Outnumbered_Overtime_With_Harris_Faulkner/start/3300	KEYSTONE PIPELINE LEAKS 21O,OOO .. (:AIInMc n: nu IN cnl ITI-l hAlInTA\nTHURSDAY. . AA\n> JONATHAN HUNT
2017-11-17 18:55:00	MSNBCW	43	MSNBCW_20171117_180000_MSNBC_Live_With_Craig_Melvin/start/3300	TRUMP ORGANIZATION: WE WERE NOT \"THE OWNER,. DEVELOPER OR SELLER\" OF TRUMP OCEAN CLUB PANAMA\nDOCUMENTS: SEVERAL UNITS IN PANAMA\u2019S TRUMP. OCEAN CLUB BOUGHT THROUGH SHELL COMPANIES
2017-11-17 18:56:00	CNNW	15	CNNW_20171117_180000_Wolf/start/3360	TRUMP SLAMS FRANKEN ON SCANDAL, STAYS MUM ON MOORE
2017-11-17 18:56:00	FOXNEWSW	7	FOXNEWSW_20171117_180000_Outnumbered_Overtime_With_Harris_Faulkner/start/3360	b JONATHAN HUNT
2017-11-17 18:56:00	MSNBCW	15	MSNBCW_20171117_180000_MSNBC_Live_With_Craig_Melvin/start/3360	TRUMP ORGANIZATION: WE WERE NOT \"THE OWNER,. DEVELOPER OR SELLER\" OF TRUMP OCEAN CLUB PANAMA
2017-11-17 18:57:00	CNNW	7	CNNW_20171117_180000_Wolf/start/3420	'v\u2014v I II I I'n-II'UIVVI
2017-11-17 19:00:00	CNNW	30	CNNW_20171117_180000_Wolf/start/3600	SOON: WHITE HOUSE BRIEFING AS TRUMP SLAMS FRANKEN\nTRUMP BLASTS AL FRANKEN AS HE STAYS MUM ON ROY MOORE
2017-11-17 19:00:00	FOXNEWSW	14	FOXNEWSW_20171117_180000_Outnumbered_Overtime_With_Harris_Faulkner/start/3600	DORE REFUSES TO DROP OUT OF Al SENATE RACE\n> DOUG MCKELWAY
2017-11-17 19:00:00	MSNBCW	14	MSNBCW_20171117_180000_MSNBC_Live_With_Craig_Melvin/start/3600	KAYLA MOORE: MY HUSBAND \"WILL NOT STEP DOWN\"\nMOORE REMAINS DEFIANT AS NEW ACCUSERS TELL THEIR STORIES\nSEN. FRANKEN APOLOGIZES AFTER NEWS. ANCHOR SAYS HE KISSED. GROPED HER IN...
2017-11-17 19:01:00	CNNW	62	CNNW_20171117_190000_CNN_Newsroom_With_Brooke_Baldwin/start/60	TRUMP BLASTS AL FRANKEN AS HE STAYS MUM ON ROY MOORE
2017-11-17 19:01:00	FOXNEWSW	22	FOXNEWSW_20171117_190000_The_Daily_Briefing_With_Dana_Perino/start/60	IPARTISAN CALLS FOR ETHICS PROBE INTO SENATOR. ' A A . A A ' A AA I A I A A I A\nGORE REFUSES TO DROP OUT OF Al SENATE RACE
2017-11-17 19:01:00	MSNBCW	19	MSNBCW_20171117_190000_MSNBC_Live_With_Katy_Tur/start/60	LEEANN TWEEDEN | FRANKEN ACCUSSER\nTINA JOHNSON I MOORE ACCUSSER\nSEN. FRANKEN APOLOGIZES AFTER NEWS. ANCHOR SAYS HE KISSED. GROPED HER IN 2OO6\nLesley Stahl tape?
2017-11-17 19:02:00	BBCNEWS	11	BBCNEWS_20171117_190000_BBC_News/start/120	BUCKINGHAMSHIRE AIR COLLISION. . Mid ail-collision between aircra\ufb02 a. helicopter near Aylesbury\nBUCKINGHAMSHIRE AIR COLLISION. 'Number of casualties' reported at the scene
2017-11-17 19:02:00	CNNW	51	CNNW_20171117_190000_CNN_Newsroom_With_Brooke_Baldwin/start/120	TRUMP BLASTS AL FRANKEN AS HE STAYS MUM ON ROY MOORE\nTRUMP BLASTS AL FRANKEN AS HE STAYS MUM ON ROY MOORE. . . . Abby Phillip G\\\\J White House Correspondent
2017-11-17 19:02:00	FOXNEWSW	14	FOXNEWSW_20171117_190000_The_Daily_Briefing_With_Dana_Perino/start/120	IPARTISAN CALLS FOR ETHICS PROBE INTO SENATOR. ' A A . A A ' A AA I A I A A I A
2017-11-17 19:02:00	MSNBCW	53	MSNBCW_20171117_190000_MSNBC_Live_With_Katy_Tur/start/120	TRUMP BLASTS FRANKEN, STAYS QUIET ON ROY MOORE
2017-11-17 19:03:00	CNNW	27	CNNW_20171117_190000_CNN_Newsroom_With_Brooke_Baldwin/start/180	MCCONNELL PREPPING MEMO FOR TRUMP ON MOORE OPTIONS\nTRUMP BLASTS AL FRANKEN AS HE STAYS MUM ON ROY MOORE\nTRUMP BLASTS AL FRANKEN AS HE STAYS MUM ON ROY MOORE. . . . Abby Phillip G\\\\J...
2017-11-17 19:03:00	FOXNEWSW	10	FOXNEWSW_20171117_190000_The_Daily_Briefing_With_Dana_Perino/start/180	LABAMA WOMEN VOICE SUPPORT FOR MOORE\nIPARTISAN CALLS FOR ETHICS PROBE INTO SENATOR. ' A A . A A ' A AA I A I A A C A
2017-11-17 19:03:00	MSNBCW	37	MSNBCW_20171117_190000_MSNBC_Live_With_Katy_Tur/start/180	TRUMP BLASTS FRANKEN, STAYS QUIET ON ROY MOORE\nROY MOORE STAYING IN SENATE RACE DESPITE GROWING CALLS TO EXIT
2017-11-17 19:04:00	CNNW	33	CNNW_20171117_190000_CNN_Newsroom_With_Brooke_Baldwin/start/240	TWEET PUTS PAST ACCUSATIONS AGAINST TRUMP IN SPOTLIGHT\nTWEET PUTS PAST ACCUSATIONS AGAINST TRUMP IN SPOTLIGHT. . . . Carrie Sheffield Conservative Commentator\nMCCONNELL PREPPING MEMO FOR...
2017-11-17 19:04:00	FOXNEWSW	28	FOXNEWSW_20171117_190000_The_Daily_Briefing_With_Dana_Perino/start/240	. LABAMA WOMEN VOICE SUPPORT FOR MOORE\nNovember 13-15. MOE = 5%
2017-11-17 19:04:00	MSNBCW	20	MSNBCW_20171117_190000_MSNBC_Live_With_Katy_Tur/start/240	KAYLA MOORE: MY HUSBAND \"WILL NOT STEP DOWN\"\nTRUMP BLASTS FRANKEN, STAYS QUIET ON ROY MOORE\nWH CALLS MOORE ALLEGATIONS \"EXTREMELY. TROUBLING.\" TRUMP YET TO ADDRESS HIMSELF\nROY...
2017-11-17 19:05:00	BBCNEWS	7	BBCNEWS_20171117_190000_BBC_News/start/300	BUCKINGHAMSHIRE AIR COLLISION. Police expected to hold news briefing\nBUCKINGHAMSHIRE AIR COLLISION. 'Number of casualties' reported at the scene
2017-11-17 19:05:00	CNNW	21	CNNW_20171117_190000_CNN_Newsroom_With_Brooke_Baldwin/start/300	TRUMP SLAMS FRANKEN ON SCANDAL, STAYS MUM ON MOORE\nTWEET PUTS PAST ACCUSATIONS AGAINST TRUMP IN SPOTLIGHT\nTRUMP SLAMS FRANKEN ON SCANDAL, STAYS MUM ON MOORE. . Sara Azari Criminal...
2017-11-17 19:05:00	FOXNEWSW	25	FOXNEWSW_20171117_190000_The_Daily_Briefing_With_Dana_Perino/start/300	HICS COMMITTEE TO INVESTIGATE FRANKEN\nO ORE REFUSES TO QUIT ALABAMA SENATE RACE
2017-11-17 19:05:00	MSNBCW	29	MSNBCW_20171117_190000_MSNBC_Live_With_Katy_Tur/start/300	KAYLA MOORE: WE \"ARE IN A BATTLE\" IN SENATE RACE\nKAYLA MOORE | WIFE OF ROY MOORE\nKAYLA MOORE: MY HUSBAND \"WILL NOT STEP DOWN\
2017-11-17 19:06:00	CNNW	21	CNNW_20171117_190000_CNN_Newsroom_With_Brooke_Baldwin/start/360	TRUMP SLAMS FRANKEN ON SCANDAL, STAYS MUM ON MOORE. . Sara Azari Criminal Defense Attorney\nTRUMP SLAMS FRANKEN ON SCANDAL, STAYS MUM ON MOORE\nTRUMP SLAMS FRANKEN ON SCANDAL, STAYS MUM ON MOORE. . Zerlina Maxwell Former...
2017-11-17 19:06:00	FOXNEWSW	37	FOXNEWSW_20171117_190000_The_Daily_Briefing_With_Dana_Perino/start/360	UMP CRITICIZES FRANKEN SILENT ON MOORE\n' A NKEN ACCUSEDOF SEXUAL ASSAULT
2017-11-17 19:06:00	MSNBCW	42	MSNBCW_20171117_190000_MSNBC_Live_With_Katy_Tur/start/360	NEW POLL: MOORE NOW TRAILING DEM. CHALLENGER BY 8-POINTS\nAmong 823 likely voters, Nov. 13-15; +/- 3.5%
2017-11-17 19:07:00	CNNW	23	CNNW_20171117_190000_CNN_Newsroom_With_Brooke_Baldwin/start/420	TRUMP SLAMS FRANKEN ON SCANDAL, STAYS MUM ON MOORE. . Zerlina Maxwell Former Director of Progressive Media, Clinton Campaign\nTRUMP SLAMS FRANKEN ON SCANDAL, STAYS MUM ON MOORE\nTRUMP SLAMS FRANKEN ON SCANDAL, STAYS MUM ON MOORE. . Sara Azari Criminal Defense...
2017-11-17 19:07:00	FOXNEWSW	35	FOXNEWSW_20171117_190000_The_Daily_Briefing_With_Dana_Perino/start/420	UMP CRITICIZES FRANKEN SILENT ON MOORE\nSENATOR KIRSTEN GILLIBRAND (\nRASSMENT DEBATE REVIVES CLINTON QUESTIONS
2017-11-17 19:07:00	MSNBCW	31	MSNBCW_20171117_190000_MSNBC_Live_With_Katy_Tur/start/420	NEWS ANCHOR: \"I FELT DISGUSTED AND VIOLATED\". BY AL FRANKEN'S KISS ON 2OO6 USO TOUR\nLEEANN TWEEDEN | FRANKEN ACCUSER\nSENATE LAUNCHING ETHICS INVESTIGATION. INTO AL FRANKEN OVER SEXUAL MISCONDUCT\nNEW POLL: MOORE NOW...
2017-11-17 19:08:00	CNNW	30	CNNW_20171117_190000_CNN_Newsroom_With_Brooke_Baldwin/start/480	TWEET PUTS PAST ACCUSATIONS AGAINST TRUMP IN SPOTLIGHT\nTRUMP SLAMS FRANKEN ON SCANDAL, STAYS MUM ON MOORE\nTRUMP SLAMS FRANKEN ON SCANDAL, STAYS MUM ON MOORE. . Jamie Gangel CW Special...
2017-11-17 19:08:00	FOXNEWSW	9	FOXNEWSW_20171117_190000_The_Daily_Briefing_With_Dana_Perino/start/480	RASSMENT DEBATE REVIVES CLINTON QUESTIONS\nMS BEGIN TO TURN ON BILL CLINTON\nENATOR GILLIBRAND: PRESIDENT CLINTON SHOULD. _ A ' n I I ' It I L A A L . A A '
2017-11-17 19:08:00	MSNBCW	22	MSNBCW_20171117_190000_MSNBC_Live_With_Katy_Tur/start/480	SEN. FRANKEN: \"NO EXCUSE\" FOR WHAT I DID. IN PICTURE. \"I FEEL DISGUSTED WITH MYSELF\"\nSENATE LAUNCHING ETHICS INVESTIGATION. INTO AL FRANKEN OVER SEXUAL MISCONDUCT\nSEN. FRANKEN: I\u2019LL \"GLADLY\" COOPERATE WITH ETHICS...
2017-11-17 19:09:00	CNNW	46	CNNW_20171117_190000_CNN_Newsroom_With_Brooke_Baldwin/start/540	GILLIBRAND: BILL CLINTON SHOULD'VE RESIGNED OVER LEWINSKY\nGILLIBRAND: BILL CLINTON SHOULD'VE RESIGNED OVER LEWINSKY. . Voice of Sen. Kirsten Gillibrand (D) New York
2017-11-17 19:09:00	FOXNEWSW	42	FOXNEWSW_20171117_190000_The_Daily_Briefing_With_Dana_Perino/start/540	RASSMENT DEBATE REVIVES CLINTON QUESTIONS\nLlIBRAND SLAMS CLINTON OVER lEWINSKY\nb ED HENRY | CHIEF NATIONAL CORRESPONDENT
2017-11-17 19:09:00	MSNBCW	37	MSNBCW_20171117_190000_MSNBC_Live_With_Katy_Tur/start/540	TRUMP BLASTS FRANKEN, STAYS QUIET ON ROY MOORE\nSENATE LAUNCHING ETHICS INVESTIGATION. INTO AL FRANKEN OVER SEXUAL MISCONDUCT
2017-11-17 19:10:00	FOXNEWSW	33	FOXNEWSW_20171117_190000_The_Daily_Briefing_With_Dana_Perino/start/600	RASSMENT DEBATE REVIVES CLINTON QUESTIONS\nARI FLEISCHER. FORMER GWB PRESS SECRETARY
2017-11-17 19:10:00	MSNBCW	31	MSNBCW_20171117_190000_MSNBC_Live_With_Katy_Tur/start/600	TRUMP BLASTS FRANKEN, STAYS QUIET ON ROY MOORE\nSEN. FRANKEN APOLOGIZES AFTER NEWS. ANCHOR SAYS HE KISSED. GROPED HER IN 2OO6\nROY MOORE STAYING IN SENATE RACE DESPITE GROWING CALLS...
2017-11-17 19:11:00	CNNW	29	CNNW_20171117_190000_CNN_Newsroom_With_Brooke_Baldwin/start/660	GILLIBRAND: BILL CLINTON SHOULD'VE RESIGNED OVER LEWINSKY. . Sara Azari Criminal Defense Attorney\nGILLIBRAND: BILL CLINTON SHOULD'VE RESIGNED OVER LEWINSKY\nGILLIBRAND: BILL CLINTON SHOULD'VE RESIGNED OVER LEWINSKY. . Zerlina Maxwell...
2017-11-17 19:11:00	MSNBCW	54	MSNBCW_20171117_190000_MSNBC_Live_With_Katy_Tur/start/660	TRUMP BLASTS FRANKEN, STAYS QUIET ON ROY MOORE
2017-11-17 19:12:00	CNNW	28	CNNW_20171117_190000_CNN_Newsroom_With_Brooke_Baldwin/start/720	GILLIBRAND: BILL CLINTON SHOULD'VE RESIGNED OVER LEWINSKY. . Jamie Gangel CW Special Correspondent\nGILLIBRAND: BILL CLINTON SHOULD'VE RESIGNED OVER LEWINSKY\nGILLIBRAND: BILL CLINTON SHOULD'VE RESIGNED OVER LEWINSKY. . Sara Azari...
2017-11-17 19:12:00	MSNBCW	31	MSNBCW_20171117_190000_MSNBC_Live_With_Katy_Tur/start/720	TRUMP BLASTS FRANKEN, STAYS QUIET ON ROY MOORE\n1. . Among 823 likely voters, Nov. 13-15; +/\u2014 3.5%\nBOSTON GLOBE. ANNIE LINSKEY ' NATL. POLITICAL REPORTER
2017-11-17 19:13:00	BBCNEWS	3	BBCNEWS_20171117_190000_BBC_News/start/780	CHRIS MUTSVANGWA. Leader, War Veterans
2017-11-17 19:13:00	CNNW	36	CNNW_20171117_190000_CNN_Newsroom_With_Brooke_Baldwin/start/780	GILLIBRAND: BILL CLINTON SHOULD'VE RESIGNED OVER LEWINSKY\nGILLIBRAND: BILL CLINTON SHOULD'VE RESIGNED OVER LEWINSKY. . Carrie Sheffield Conservative Commentator\nGILLIBRAND: BILL CLINTON...
2017-11-17 19:13:00	FOXNEWSW	11	FOXNEWSW_20171117_190000_The_Daily_Briefing_With_Dana_Perino/start/780	)ayUSA.com 1 -844-647-671 2
2017-11-17 19:13:00	MSNBCW	54	MSNBCW_20171117_190000_MSNBC_Live_With_Katy_Tur/start/780	NEW POLL: MOORE NOW TRAILING DEM. CHALLENGER BY 8-POINTS
2017-11-17 19:14:00	BBCNEWS	11	BBCNEWS_20171117_190000_BBC_News/start/840	ZIMBABWE TAKEOVER. Mugabe appeared at university graduation ceremony\nZIMBABWE TAKEOVER. . Mugabe makes \ufb01rst public appearance since detained by army\nBEN BROWN. News Correspondent
2017-11-17 19:14:00	CNNW	32	CNNW_20171117_190000_CNN_Newsroom_With_Brooke_Baldwin/start/840	SOON: WHITE HOUSE BRIEFING AS TRUMP SLAMS FRANKEN\nREP DINGELL: MOVEMENT IS NOT \"WATERSHED\" MOMENT. Rep. Debbie Dingell (D) Michigan\nGILLIBRAND: BILL CLINTON SHOULD'VE RESIGNED OVER...
2017-11-17 19:14:00	FOXNEWSW	27	FOXNEWSW_20171117_190000_The_Daily_Briefing_With_Dana_Perino/start/840	. UMP ADMIN REVERSES BAN ON ELEPHANT TROPHIES\nUMP ADMIN REVERSES BAN ON ELEPHANT TROPHIES
2017-11-17 19:14:00	MSNBCW	20	MSNBCW_20171117_190000_MSNBC_Live_With_Katy_Tur/start/840	NEW POLL: MOORE NOW TRAILING DEM. CHALLENGER BY 8-POINTS\nSOURCES: PUBLICIST WHO HELPED ARRANGE TRUMP JR.,. RUSSIAN LAWYER MEETING READY TO MEET WITH MUELLER\nROY MOORE: \"I LOOK FORWARD TO...
2017-11-17 19:15:00	BBCNEWS	10	BBCNEWS_20171117_190000_BBC_News/start/900	ZIMBABWE TAKEOVER. Military says it's 'engaging' with Robert Mugabe\nZIMBABWE TAKEOVER. Crisis talks continuing beiween Mugabe and military\nZIMBABWE TAKEOVER. Mugabe under house arrest since...
2017-11-17 19:15:00	CNNW	19	CNNW_20171117_190000_CNN_Newsroom_With_Brooke_Baldwin/start/900	REP DINGELL: MOVEMENT IS NOT \"WATERSHED\" MOMENT\nREP DINGELL: MOVEMENT IS NOT \"WATERSHED\" MOMENT. . Jamie Gangel CW Special Correspondent\nREP DINGELL: MOVEMENT IS NOT \"WATERSHED\"...
2017-11-17 19:15:00	FOXNEWSW	18	FOXNEWSW_20171117_190000_The_Daily_Briefing_With_Dana_Perino/start/900	> ANDREW BEATTY I AFP WHITE HOUSE CORRESPONDENT\n. POLITICAL TURMOIL IN ZIMBABWE\nUMP ADMIN REVERSES BAN ON ELEPHANT TROPHIES
2017-11-17 19:15:00	MSNBCW	9	MSNBCW_20171117_190000_MSNBC_Live_With_Katy_Tur/start/900	SOURCES: PUBLICIST WHO HELPED ARRANGE TRUMP JR.,. RUSSIAN LAWYER MEETING READY TO MEET WITH MUELLER\n945 Retweets 1.3O3 Likes
2017-11-17 19:16:00	BBCNEWS	12	BBCNEWS_20171117_190000_BBC_News/start/960	ZIMBABWE TAKEOVER. Mutsvangwa: I am issuing a 'slark warning' m Mr Mugabe\nZIMBABWE TAKEOVER. . Mugabe makes (Irsl publlc appealance since detained by army\nZIMBABWE TAKEOVER. Mugabe appeared at university...
2017-11-17 19:16:00	CNNW	16	CNNW_20171117_190000_CNN_Newsroom_With_Brooke_Baldwin/start/960	SENATORS: KUSHNER FAILED TO HAND OVER SOME RUSSIA DOCS\nROY MOORE'S WIFE: HE WILL NOT STEP DOWN\nREP DINGELL: MOVEMENT IS NOT \"WATERSHED\" MOMENT\nMorgan & Morgan, PA
2017-11-17 19:16:00	FOXNEWSW	14	FOXNEWSW_20171117_190000_The_Daily_Briefing_With_Dana_Perino/start/960	> ANDREW BEATTY l AFP WHITE HOUSE CORRESPONDENT\nE? ANDREW BEATI'Y | AFP WHITE HOUSE CORRESPONDENT\nlPORTS NOW ALLOWED FROM ZAMBIA & ZIMBABWE
2017-11-17 19:17:00	BBCNEWS	20	BBCNEWS_20171117_190000_BBC_News/start/1020	ZIMBABWE TAKEOVER. Crisis talks continuing between Mugabe and military\nZIMBABWE TAKEOVER. Mutsvangwa: I am issuing a \u2019slark warning' to Mr Mugabe\nZIMBABWE TAKEOVER. Military says it's 'engaging' with...
2017-11-17 19:17:00	CNNW	11	CNNW_20171117_190000_CNN_Newsroom_With_Brooke_Baldwin/start/1020	classAmon.ccm \\ Inmrmanon. Protectionjusnce.\nav-sg12lb peeorwek n|. . nutrisystem.com/holiday 877- 7O6- Sh
2017-11-17 19:17:00	FOXNEWSW	37	FOXNEWSW_20171117_190000_The_Daily_Briefing_With_Dana_Perino/start/1020	lPORTS NOW ALLOWED FROM ZAMBIA & ZIMBABWE
2017-11-17 19:18:00	BBCNEWS	10	BBCNEWS_20171117_190000_BBC_News/start/1080	ZIMBABWE TAKEOVER. Mugabe reportedly refusing to step down\nZIMBABWE TAKEOVER. Military says it's arrested 'criminals' around president\nZIMBABWE TAKEOVER. Opposition MDC's Morgan Tsvangirai back...
2017-11-17 19:18:00	CNNW	4	CNNW_20171117_190000_CNN_Newsroom_With_Brooke_Baldwin/start/1080	deliver ybu\u2019re\u2019ce\u2019ive 'a'discount 5\" me r'e'gular bri\u00e9-ume\u2019rafteIFaud chi-ug\u00e9d'z\u2019nd 'smpped eveiy 4 Wee'ks'unless'ybu'ca\ufb01cei. Re\ufb01t. . nutrisystem.com/holiday 877-7O6-5']
2017-11-17 19:18:00	FOXNEWSW	26	FOXNEWSW_20171117_190000_The_Daily_Briefing_With_Dana_Perino/start/1080	F ANDREW BEATI'Y I AFP WHITE HOUSE CORRESPONDENT
