2017-11-22 07:46:00	FOXNEWSW	4	FOXNEWSW_20171122_070000_The_Ingraham_Angle/start/2760	HOWARD KURTZ. . HOST, \"MEDIA BUZZ\". \u20141n.,. mm: ....... m :
2017-11-22 07:46:00	MSNBCW	54	MSNBCW_20171122_070000_The_11th_Hour_With_Brian_Williams/start/2760	TRUMP: ROY MOORE \"DENIES IT, THAT'S ALL I CAN SAY\"\nMIKE MURPHY [ REPUBLICAN STRATEGIST
2017-11-22 07:47:00	CNNW	26	CNNW_20171122_070000_CNN_Newsroom_Live/start/2820	CBS PBS FIRE VETERAN JOURNALIST CHARLIE ROSE. . Areva Martin Civil Rights Attorney\nCBS PBS FIRE VETERAN JOURNALIST CHARLIE ROSE. . Areva Martin Attorney & Legal Affairs Commentator\nCBS PBS FIRE VETERAN JOURNALIST...
2017-11-22 07:47:00	MSNBCW	44	MSNBCW_20171122_070000_The_11th_Hour_With_Brian_Williams/start/2820	DEM. DOUG JONES HIGHLIGHTS GOP CRITICS. OF ROY MOORE IN NEW CAMPAIGN AD\nTRUMP: ROY MOORE \"DENIES IT, THAT'S ALL I CAN SAY\"\nTRUMP: \"DON\u2019T NEED A LIBERAL\" IN ALABAMA SENATE SEAT
2017-11-22 07:48:00	CNNW	62	CNNW_20171122_070000_CNN_Newsroom_Live/start/2880	CBS PBS FIRE VETERAN JOURNALIST CHARLIE ROSE. . Jenn Mann Licensed Psychotherapist
2017-11-22 07:48:00	MSNBCW	15	MSNBCW_20171122_070000_The_11th_Hour_With_Brian_Williams/start/2880	TRUMP: \"DON\u2019T NEED A LIBERAL\" IN ALABAMA SENATE SEAT\nTAMARA KEITH I {RI/$5 HOUSE CORRESPONDENT\nHodgkin's Lymphoma Lancer H
2017-11-22 07:49:00	CNNW	42	CNNW_20171122_070000_CNN_Newsroom_Live/start/2940	CBS, PBS FIRE VETERAN JOURNALIST CHARLIE ROSE\nFORMER BOSNIAN SERB GENERAL AWAITS WAR CRIMES VERDICT\nCBS PBS FIRE VETERAN JOURNALIST CHARLIE ROSE. . Jenn Mann Licensed...
2017-11-22 07:50:00	CNNW	4	CNNW_20171122_070000_CNN_Newsroom_Live/start/3000	FORMER BOSNIAN SERB GENERAL AWAITS WAR CRIMES VERDICT
2017-11-22 07:51:00	MSNBCW	24	MSNBCW_20171122_070000_The_11th_Hour_With_Brian_Williams/start/3060	TRUMP: AT&T DEAL IS NOT GOOD FOR THE COUNTRY
2017-11-22 07:52:00	FOXNEWSW	25	FOXNEWSW_20171122_070000_The_Ingraham_Angle/start/3120	SNBC HOSTS CALL TRUMP'S \"UNGRATEFUL\" TWEETS. TO LAVAR BALL i'RACIST\" AND A \"DOG WHISTLE\
2017-11-22 07:52:00	MSNBCW	33	MSNBCW_20171122_070000_The_11th_Hour_With_Brian_Williams/start/3120	DOJ FILES LAWSUIT TO BLOCK AT&T-TIME WARNER MERGER\nTRUMP: AT&T DEAL IS NOT GOOD FOR THE COUNTRY\nRANDALL STEPHENSON | AT&T CEo
2017-11-22 07:53:00	CNNW	9	CNNW_20171122_070000_CNN_Newsroom_Live/start/3180	vinon.mm. 1733373967O241. . . . \\liCTOZA\n\"BUTCHER OF BOSNIA\" AWAITS WAR CRIMES VERDICT\nSymptoms may include pain in the right or middle upper stomach area, fever,. mmm nausea...
2017-11-22 07:53:00	MSNBCW	19	MSNBCW_20171122_070000_The_11th_Hour_With_Brian_Williams/start/3180	TRUMP PLANS REPEAL OBAMA-ERA NET NEUTRALITY RULES\nAT&T CEO: I DON'T KNOW WHETHER THIS IS ALL ABOUT CNN\nRANDALL STEPHENSON | AT&T CEo
2017-11-22 07:54:00	CNNW	27	CNNW_20171122_070000_CNN_Newsroom_Live/start/3240	\"BUTCHER OF BOSNIA\" AWAITS WAR CRIMES VERDICT\nMLADIC FACES CHARGES OF GENOCIDE & OTHER WAR CRIMES\nMLADIC FACES CHARGES OF GENOCIDE & OTHER WAR CRIMES. . Melissa Bell cw...
2017-11-22 07:54:00	FOXNEWSW	43	FOXNEWSW_20171122_070000_The_Ingraham_Angle/start/3240	LAVAR BALL VS. PRESIDENT TRUMP I
2017-11-22 07:54:00	MSNBCW	37	MSNBCW_20171122_070000_The_11th_Hour_With_Brian_Williams/start/3240	TRUMP PLANS REPEAL OBAMA-ERA NET NEUTRALITY RULES
2017-11-22 07:55:00	CNNW	27	CNNW_20171122_070000_CNN_Newsroom_Live/start/3300	MLADIC FACES CHARGES OF GENOCIDE & OTHER WAR CRIMES\n\"BUTCHER OF BOSNIAll AWAITS WAR CRIMES VERDICT. . Melissa Bell U\\l\\l Correspondent\n\"BUTCHER OF BOSNIA\" AWAITS WAR CRIMES VERDICT
2017-11-22 07:55:00	MSNBCW	38	MSNBCW_20171122_070000_The_11th_Hour_With_Brian_Williams/start/3300	1-8O9-8491196O WI 1
2017-11-22 07:56:00	CNNW	31	CNNW_20171122_070000_CNN_Newsroom_Live/start/3360	\"BUTCHER OF BOSNIAll AWAITS WAR CRIMES VERDICT. . Melissa Bell U\\l\\l Correspondent\n\"BUTCHER OF BOSNIA\" AWAITS WAR CRIMES VERDICT. . Melissa Bell Cl\\l\\l Correspondent
2017-11-22 07:57:00	FOXNEWSW	4	FOXNEWSW_20171122_070000_The_Ingraham_Angle/start/3420	1 '8OO-928-6857
2017-11-22 07:58:00	MSNBCW	20	MSNBCW_20171122_070000_The_11th_Hour_With_Brian_Williams/start/3480	JFK\u2019S LAST FULL DAY AS PRESIDENT WAS NOV. 21, 1963\nREMEMBERING JOHN F. KENNEDY
2017-11-22 07:59:00	CNNW	6	CNNW_20171122_070000_CNN_Newsroom_Live/start/3540	stamps.con
2017-11-22 07:59:00	MSNBCW	53	MSNBCW_20171122_070000_The_11th_Hour_With_Brian_Williams/start/3540	JFK\u2019S LAST FULL DAY AS PRESIDENT WAS NOV. 21, 1963
2017-11-22 08:00:00	CNNW	23	CNNW_20171122_070000_CNN_Newsroom_Live/start/3600	TRUMP ALL BUT ENDORSES MOORE
2017-11-22 08:01:00	CNNW	13	CNNW_20171122_080000_CNN_Newsroom_Live/start/60	TRUMP BREAKS SILENCE, DEFENDS ROY MOORE\nACTOR-SINGER, DAVID CASSIDY DEAD AT 67\nWEEKS OF ACCUSATIONS AGAINST PROMINENT MEN\nTRUMP, PUTIN DISCUSS ISIS & SYRIA\nIsha Sesay....
2017-11-22 08:01:00	MSNBCW	13	MSNBCW_20171122_080000_All_In_With_Chris_Hayes/start/60	TRUMP BACWCUSED CHILD MOLESTER OVER DEMOCRAT\nTRUMP BACKS ACCUSED CHILD MOLESTER OVER DEMOCRAT
2017-11-22 08:02:00	CNNW	61	CNNW_20171122_080000_CNN_Newsroom_Live/start/120	TRUMP BREAKS SILENCE, DEFENDS ROY MOORE
2017-11-22 08:03:00	CNNW	45	CNNW_20171122_080000_CNN_Newsroom_Live/start/180	TRUMP BREAKS SILENCE, DEFENDS ROY MOORE\nDOUG JONES AD QUOTES REPUBLICANS CRITICIZING MOORE
2017-11-22 08:04:00	CNNW	31	CNNW_20171122_080000_CNN_Newsroom_Live/start/240	ETHICS COMMI'ITEE INVESTIGATING CONYERS ALLEGATIONS\nTRUMP BREAKS SILENCE, DEFENDS ROY MOORE\nTRUMP BREAKS SILENCE DEFENDS ROY MOORE. . Jeff Zelenv CJ\\N Senior White House Correspondent
2017-11-22 08:05:00	CNNW	62	CNNW_20171122_080000_CNN_Newsroom_Live/start/300	ETHICS COMMI'ITEE INVESTIGATING CONYERS ALLEGATIONS
2017-11-22 08:05:00	MSNBCW	27	MSNBCW_20171122_080000_All_In_With_Chris_Hayes/start/300	TRUMP ON MOORE ALLEGATIONS: \"HE TOTALLY DENIES IT\"\nTRUMP ON MERE ALLEGATIONS: \"HE TOTALLY DENIES IT\
2017-11-22 08:06:00	CNNW	30	CNNW_20171122_080000_CNN_Newsroom_Live/start/360	ETHICS COMMI'ITEE INVESTIGATING CONYERS ALLEGATIONS\nETHICS COMMITTEE INVESTIGATING CONYERS ALLEGATIONS\nTRUMP BREAKS SILENCE, DEFENDS ROY MOORE\nETHICS COMMI'ITEE INVESTIGATING CONYERS...
2017-11-22 08:07:00	CNNW	44	CNNW_20171122_080000_CNN_Newsroom_Live/start/420	TRUMP BREAKS SILENCE, DEFENDS ROY MOORE\nTRUMP BREAKS SILENCE, DEFENDS ROY MOORE. . Michael Genovese Pres', Global Policy Inst, Loyola Marvmount University\nTRUMP BREAKS...
2017-11-22 08:07:00	FOXNEWSW	4	FOXNEWSW_20171122_080000_Fox_News__Night/start/420	TRUMP BACKS MOORE I. . ll Inn: nEklIEC Al I :CATIARIC lkl kll\ufb02AI IKITED\\IIE\\AI TnkllnuT
2017-11-22 08:07:00	MSNBCW	25	MSNBCW_20171122_080000_All_In_With_Chris_Hayes/start/420	TRUMP ON RECKONING OVER SEXUAL. MISCONDUCT: \"IT'S A VERY SPECIAL TIME\"\nTRUMP BACKS ACCUSED CHILD MOLESTER OVER DEMOCRAT\nTRUMP ON MOORE ALLEGATIONS: \"HE TOTALLY DENIES IT\
2017-11-22 08:08:00	MSNBCW	46	MSNBCW_20171122_080000_All_In_With_Chris_Hayes/start/480	TRUMP BACKS ACCUSED CHILD MOLESTER OVER DEMOCRAT
2017-11-22 08:09:00	CNNW	33	CNNW_20171122_080000_CNN_Newsroom_Live/start/540	POLITICAL IMPACT OF TRUMP'S SUPPORT OF MOORE\nPOLITICAL IMPACT OF TRUMP'S SUPPORT OF MOORE. . Michael Genovese Political Analyst\nELECTION COMES AS TRUMP PUSHES FOR TAX...
2017-11-22 08:09:00	FOXNEWSW	19	FOXNEWSW_20171122_080000_Fox_News__Night/start/540	iOULD GOP KEEP ITS DISTANCE FROM ROY MOORE? I
2017-11-22 08:10:00	CNNW	34	CNNW_20171122_080000_CNN_Newsroom_Live/start/600	DEMOCRAT CONYERS FACES ALLEGATIONS OF HARASSMENT\nDEMOCRAT FRANKEN ACCUSED OF INAPPROPRIATE TOUCHING\nDEMOCRAT CONYERS FACES ALLEGATIONS OF HARASSMENT. . Michael Genovese Pres, Global...
2017-11-22 08:11:00	CNNW	24	CNNW_20171122_080000_CNN_Newsroom_Live/start/660	WEEKS OF ACCUSATIONS AGAINST PROMINENT MEN. . Michael Genovese Political Analyst\nDEMOCRAT FRANKEN ACCUSED OF INAPPROPRIATE TOUCHING\nWEEKS OF ACCUSATIONS AGAINST PROMINENT MEN
2017-11-22 08:11:00	FOXNEWSW	8	FOXNEWSW_20171122_080000_Fox_News__Night/start/660	MOORE THAN THEY BARGAINED FOR. CONGRESSIONAL REPUBLICANS KI'E'EPJNETHEIR DISTANCE ~ -\nTqESDAY STATEMENT
2017-11-22 08:12:00	CNNW	24	CNNW_20171122_080000_CNN_Newsroom_Live/start/720	CONGRESSIONAL ETHICS INVESTIGATIONS OPENED\nWEEKS OF ACCUSATIONS AGAINST PROMINENT MEN\nWEEKS OF ACCUSATIONS AGAINST PROMINENT MEN. . Michael Genovese Pres', Global Policy Inst,...
2017-11-22 08:12:00	FOXNEWSW	26	FOXNEWSW_20171122_080000_Fox_News__Night/start/720	TqESDAY STATEMENT
2017-11-22 08:13:00	CNNW	25	CNNW_20171122_080000_CNN_Newsroom_Live/start/780	CONGRESSIONAL ETHICS INVESTIGATIONS OPENED. . Michael Genovese Political Analyst\nCONGRESSIONAL ETHICS INVESTIGATIONS OPENED\nCBS, PBS FIRE VETERAN JOURNALIST CHARLIE ROSE\nCONGRESSIONAL ETHICS INVESTIGATIONS OPENED. ....
2017-11-22 08:13:00	FOXNEWSW	9	FOXNEWSW_20171122_080000_Fox_News__Night/start/780	.. CAPITOL HILL SEX HARASSMENT SCANDAL _. . ccrnun Af'f'l ICED (TEDC :nnumnn nu BED rnuvnm- DDT\nCAPITOL HILL SEX HARASSMENT SCANDAL I. SECOND ACCUSER STEPS FORWARD ON REP. CONYERS- RPT\n.. CAPITOL HILL SEX HARASSMENT SCANDAL -. ....
2017-11-22 08:14:00	CNNW	38	CNNW_20171122_080000_CNN_Newsroom_Live/start/840	CBS, PBS FIRE VETERAN JOURNALIST CHARLIE ROSE\nGAYLE KING ON CHARLIE ROSE ALLEGATIONS. . Gayle King Co-Host, \"CBS This Morning\"\nGAYLE KING ON CHARLIE ROSE ALLEGATIONS
2017-11-22 08:15:00	CNNW	6	CNNW_20171122_080000_CNN_Newsroom_Live/start/900	CBS, PBS FIRE VETERAN JOURNALIST CHARLIE ROSE
2017-11-22 08:17:00	FOXNEWSW	11	FOXNEWSW_20171122_080000_Fox_News__Night/start/1020	SEXUAL HARASSMENT ON CAPITOL HILL F. CAN CONGRESS KEEP mg DAM FROM BREAKING?
2017-11-22 08:19:00	CNNW	22	CNNW_20171122_080000_CNN_Newsroom_Live/start/1140	TRUMP: \"GREAT CALL\" WITH PUTIN ON SYRIA, UKRAINE 8: N. KOREA\nPOWER BROKERS TURKEY, IRAN & RUSSIA TO MEET ON SYRIA\nTRUMP APPEARS TO CEDE POST-WAR SYRIA PLANNING TO PUTIN\nPUTIN &TRUMP DISCUSS SYRIA...
2017-11-22 08:20:00	CNNW	44	CNNW_20171122_080000_CNN_Newsroom_Live/start/1200	TRUMP: \"GREAT CALL\" WITH PUTIN ON SYRIA, UKRAINE 8: N. KOREA\nTRUMP APPEARS TO CEDE POST-WAR SYRIA PLANNING TO PUTIN. . Matthew Chance <J\\N Seniorlnternational Correspondent\nTRUMP APPEARS TO CEDE...
2017-11-22 08:20:00	FOXNEWSW	14	FOXNEWSW_20171122_080000_Fox_News__Night/start/1200	KLPUKI INU ILLEGAL)\nSEXUAL HARASSMENT ON CAPITOL HILL F. CAN CONGRESS KEEP we DAM FROM BREAKING? ,
2017-11-22 08:21:00	CNNW	28	CNNW_20171122_080000_CNN_Newsroom_Live/start/1260	TRUMP: \"GREAT CALL\" WITH PUTIN ON SYRIA, UKRAINE 8: N. KOREA\nPOWER BROKERS TURKEY, IRAN & RUSSIA TO MEET ON SYRIA\nPOWER BROKERS TURKEY IRAN & RUSSIA TO MEET ON SYRIA. . Matthew Chance (J\\I\\I...
2017-11-22 08:22:00	CNNW	57	CNNW_20171122_080000_CNN_Newsroom_Live/start/1320	POWER BROKERS TURKEY, IRAN & RUSSIA TO MEET ON SYRIA\nPOWER BROKERS TURKEY IRAN & RUSSIA TO MEET ON SYRIA. . Matthew Chance (_N\\I Seniorlnternational Correspondent
2017-11-22 08:22:00	MSNBCW	9	MSNBCW_20171122_080000_All_In_With_Chris_Hayes/start/1320	(D-CO) RANKING MEMBER. REP' DIANA DEGETrE I OVERSIGHT&INVESTIGATIONSSUBCOMMITTEE
2017-11-22 08:23:00	CNNW	26	CNNW_20171122_080000_CNN_Newsroom_Live/start/1380	U.S. NAW AIRCRAFI' CRASHES OFF OKINAWA 11 ON BOARD. . Ivan Watson OW Seniorlntemational Correspondent\nU.S. NAW AIRCRAFT CRASHES OFF OKINAWA, 11 ON BOARD\nPOWER BROKERS TURKEY, IRAN & RUSSIA TO MEET ON SYRIA
2017-11-22 08:23:00	FOXNEWSW	15	FOXNEWSW_20171122_080000_Fox_News__Night/start/1380	ROO-GRR-17OR
2017-11-22 08:24:00	CNNW	32	CNNW_20171122_080000_CNN_Newsroom_Live/start/1440	U.S. NAW AIRCRAFT CRASHES OFF OKINAWA, 11 ON BOARD\nU.S. NAW AIRCRAFI' CRASHES OFF OKINAWA 11 ON BOARD. . Ivan Watson CJ\\N Seniorlnternational Correspondent
2017-11-22 08:25:00	BBCNEWS	6	BBCNEWS_20171122_060000_Breakfast/start/8700	STEWART LITTLE. Former Royal Navy Submariner
2017-11-22 08:25:00	CNNW	42	CNNW_20171122_080000_CNN_Newsroom_Live/start/1500	U.N. COMMAND: NORTH KOREA VIOLATED ARMISTICE\nU.S. NAW AIRCRAFT CRASHES OFF OKINAWA, 11 ON BOARD
2017-11-22 08:26:00	CNNW	43	CNNW_20171122_080000_CNN_Newsroom_Live/start/1560	U.N. COMMAND: N. KOREAN SOLDIER CROSSED DEMARCATION LINE\nU.N. COMMAND: NORTH KOREA VIOLATED ARMISTICE. . Anna Coren CI\\N Correspondent
2017-11-22 08:26:00	FOXNEWSW	13	FOXNEWSW_20171122_080000_Fox_News__Night/start/1560	SERIOUS ALLEGATIONS I. NASHINGTON POST REPORTER ON ROSE BOMBSHELL REPORT. . _ mun/2m\nSERIOUS ALLEGATIONS I. AORE THAN 8 WOMEN ACCUSE ROSE OF UNWANTED ADVANCES. . mun/2m\nSERIOUS ALLEGATIONS I. AORE THAN 8 WOMEN ACCUSE...
2017-11-22 08:27:00	FOXNEWSW	13	FOXNEWSW_20171122_080000_Fox_News__Night/start/1620	SERIOUS ALLEGATIONS I. NASHINGTON POST REPORTER ON ROSE BOMBSHELL REPORT. . _ mkllDL\ufb02'\nSERIOUS ALLEGATIONS I. NASHINGTON POST REPORTER ON ROSE BOMBSHELL REPORT. . _ mun/N.\u201d\nSERIOUS ALLEGATIONS I. NASHINGTON POST...
2017-11-22 08:27:00	MSNBCW	6	MSNBCW_20171122_080000_All_In_With_Chris_Hayes/start/1620	'Valid November 215: through November 27th
2017-11-22 08:28:00	BBCNEWS	8	BBCNEWS_20171122_060000_Breakfast/start/8880	\"5. ' WEDNESDAY 15:OO
2017-11-22 08:28:00	CNNW	28	CNNW_20171122_080000_CNN_Newsroom_Live/start/1680	U.N. COMMAND: N. KOREAN SOLDIER CROSSED DEMARCATION LINE\nU.N. COMMAND: NORTH KOREA VIOLATED ARMISTICE\nHOSPITAL: N. KOREAN SOLDIER WAS SHOT UP TO FIVE TIMES\nU.N. COMMAND: NORTH KOREA VIOLATED...
2017-11-22 08:28:00	MSNBCW	8	MSNBCW_20171122_080000_All_In_With_Chris_Hayes/start/1680	, Imumz\u00e9. Tl-ll: puccmuc
2017-11-22 08:29:00	CNNW	47	CNNW_20171122_080000_CNN_Newsroom_Live/start/1740	ZIMBABWE REJOICES FOLLOWING APPARENT COUP\nU.N. COMMAND: NORTH KOREA VIOLATED ARMISTICE
2017-11-22 08:29:00	FOXNEWSW	13	FOXNEWSW_20171122_080000_Fox_News__Night/start/1740	Uthl'IUWI IL UN MUI:LLI:K
2017-11-22 08:30:00	CNNW	7	CNNW_20171122_080000_CNN_Newsroom_Live/start/1800	ZIMBABWE REJOICES FOLLOWING APPARENT COUP
2017-11-22 08:30:00	FOXNEWSW	17	FOXNEWSW_20171122_080000_Fox_News__Night/start/1800	1-8OO-3O5-9745 Call now for free guide
2017-11-22 08:31:00	BBCNEWS	18	BBCNEWS_20171122_083000_BBC_Business_Live/start/60	JOIN THE DEBATE. How do you take your cuppa? #BBCBizLive
2017-11-22 08:31:00	MSNBCW	30	MSNBCW_20171122_080000_All_In_With_Chris_Hayes/start/1860	Hnnltharknfc rnm (32O!\u201c 797-1 1\nI-Innl'l'hMArlln'l': rnm (5mm 7527-1 1
2017-11-22 08:32:00	MSNBCW	10	MSNBCW_20171122_080000_All_In_With_Chris_Hayes/start/1920	HnaltharIm-lrc rnm mnm 797-1 '1'
2017-11-22 08:33:00	BBCNEWS	17	BBCNEWS_20171122_083000_BBC_Business_Live/start/180	KAMAL AHMED. Economics Editor\nUK BUDGET DAV. UK budget expected to go big on productivity\nUK BUDGET DAV. UK Chancellor to deliver his Autumn Budget\nUK BUDGET DAV -...
2017-11-22 08:33:00	CNNW	23	CNNW_20171122_080000_CNN_Newsroom_Live/start/1980	MUGABE RESIGNS, MNANGAGWA TO BE SWORN IN\nMUGABE RESIGNATION PROMPTS JUBILANT CELEBRATIONS
2017-11-22 08:33:00	FOXNEWSW	9	FOXNEWSW_20171122_080000_Fox_News__Night/start/1980	1-8OO-594-8441. . aaaaaaaaaaaaaaaaaaaaaaaaaaaaaaaaa
2017-11-22 08:34:00	BBCNEWS	15	BBCNEWS_20171122_083000_BBC_Business_Live/start/240	UK BUDGET DAV. Join the debate using #BBCBizLive\nUK BUDGET DAV. UK budget expected to go big on productivity\nUK BUDGET DAV. UK Chancellor to deliver his Autumn Budget\nUK BUDGET DAV ....
2017-11-22 08:34:00	MSNBCW	25	MSNBCW_20171122_080000_All_In_With_Chris_Hayes/start/2040	1 mum: .~. Tl-ll: puccmuc\nMICHAEL MCFAUL I FMR. u.s. AMBASSADOR TO RUSSIA\n, mum: .~. Tl-ll: puccmuc
2017-11-22 08:35:00	BBCNEWS	11	BBCNEWS_20171122_083000_BBC_Business_Live/start/300	UK BUDGET DAY. UK budget expected to go big on productivity\nUK BUDGET DAV .. More money for teacher training in England expected \u201can\nUK BUDGET DAV. UK Chancellor to deliver his Autumn...
2017-11-22 08:35:00	CNNW	31	CNNW_20171122_080000_CNN_Newsroom_Live/start/2100	MUGABE RESIGNS MNANGAGWA TO BE SWORN IN. . Farai Sevenzo cm Correspondent\nMUGABE RESIGNS, MNANGAGWA TO BE SWORN IN\nFORMER VP MNANGAGWA TO BE SWORN IN BY THURSDAY
2017-11-22 08:35:00	FOXNEWSW	51	FOXNEWSW_20171122_080000_Fox_News__Night/start/2100	THANKSGIVING TRADITIONS I. FIRST FAMILY TRAVELS TO FLORIDA FOR HOLIDAY. . mkur'm\nTHANKSGIVING TRADITIONS I. FIRST FAMILY TRAVELS TO FLORIDA FOR HOLIDAY. . \ufb01hkllf'u'l'
2017-11-22 08:35:00	MSNBCW	16	MSNBCW_20171122_080000_All_In_With_Chris_Hayes/start/2100	MICHAEL MCFAUL I FMR. u.s. AMBASSADOR TO RUSSIA\nMICHAEL MCFAUL I FMR. us. AMBASSADOR TO RUSSIA
2017-11-22 08:36:00	BBCNEWS	16	BBCNEWS_20171122_083000_BBC_Business_Live/start/360	END OF AN ERA. Meg Whitman steps down lrom CEO post at HPE\nSKYPE CHINA APP BLOCK. Skype removed from China Apple & Android app stores. . .1:
2017-11-22 08:36:00	CNNW	34	CNNW_20171122_080000_CNN_Newsroom_Live/start/2160	MUGABE RESIGNATION PROMPTS JUBILANT CELEBRATIONS\nFORMER VP MNANGAGWA TO BE SWORN IN BY THURSDAY
2017-11-22 08:36:00	FOXNEWSW	23	FOXNEWSW_20171122_080000_Fox_News__Night/start/2160	THANKSGIVING TRADITIONS E. FIRST FAMILY TRAVELS TO FLORIDA FOR HOLIDAY. . _mmMInuT\nPROTECTING THEIR STATUS. DEMONSTRATORS PROTEST OUTSIDE MAR- A- LAGO. . mun/2m _
2017-11-22 08:36:00	MSNBCW	44	MSNBCW_20171122_080000_All_In_With_Chris_Hayes/start/2160	1 mum: .~. Tl-ll: puccmuc\nMICHAEL MCFAUL I FMR. u.s. AMBASSADOR TO RUSSIA
2017-11-22 08:37:00	BBCNEWS	17	BBCNEWS_20171122_083000_BBC_Business_Live/start/420	H8O HACK CHARGES . '9, \". Iranian charged with Game of Thrones hack & leak $3M
2017-11-22 08:37:00	FOXNEWSW	11	FOXNEWSW_20171122_080000_Fox_News__Night/start/2220	JUUILIAL ALIIVIDM '
2017-11-22 08:37:00	MSNBCW	37	MSNBCW_20171122_080000_All_In_With_Chris_Hayes/start/2220	. Imumz\u00e9. Tu: puccmuc\n1 mum: .~. Tl-ll: puccmuc\nMICHAEL MCFAUL I FMR. u.s. AMBASSADOR TO RUSSIA
2017-11-22 08:38:00	BBCNEWS	11	BBCNEWS_20171122_083000_BBC_Business_Live/start/480	EMILY ORTON. Cyber securny analysL Darktrace\nUBER HACK CONCEALED. Hackers tound 57m names, email addresses & numbers. . . . .'u.. . x\nUBEH HACK CONCEALED . 1. Firm paid hackers...
2017-11-22 08:38:00	CNNW	39	CNNW_20171122_080000_CNN_Newsroom_Live/start/2280	FORMER VP MNANGAGWA TO BE SWORN IN BY THURSDAY. . Farai Sevenzo cm Correspondent\nFORMER VP MNANGAGWA TO BE SWORN IN BY THURSDAY\nFORMER VP MNANGAGWA TO BE SWORN IN BY THURSDAY. . Farai Sevenzo (M Correspondent
2017-11-22 08:38:00	FOXNEWSW	12	FOXNEWSW_20171122_080000_Fox_News__Night/start/2280	N. . W?. . \\ \\. . Libe. Mutgl.
2017-11-22 08:38:00	MSNBCW	14	MSNBCW_20171122_080000_All_In_With_Chris_Hayes/start/2280	1 mum! .~. m: puccmuc\nMICHAEL MCFAUL I FMR. u.s. AMBASSADOR TO RUSSIA
2017-11-22 08:39:00	CNNW	33	CNNW_20171122_080000_CNN_Newsroom_Live/start/2340	FORMER VP MNANGAGWA TO BE SWORN IN BY THURSDAY\nMUGABE RESIGNATION PROMPTS JUBILANT CELEBRATIONS\nFORMER VP MNANGAGWA TO BE SWORN IN BY THURSDAY. . Farai Sevenzo aw Correspondent
2017-11-22 08:40:00	BBCNEWS	9	BBCNEWS_20171122_083000_BBC_Business_Live/start/600	BUSINESS LIVE A . A
2017-11-22 08:40:00	CNNW	31	CNNW_20171122_080000_CNN_Newsroom_Live/start/2400	FORMER VP MNANGAGWA TO BE SWORN IN BY THURSDAY\nFORMER VP MNANGAGWA TO BE SWORN IN BY THURSDAY. . Geoff Hill Author, \"What Happens After Mugabe?\"\nFORMER VP MNANGAGWA TO BE SWORN IN...
2017-11-22 08:41:00	BBCNEWS	11	BBCNEWS_20171122_083000_BBC_Business_Live/start/660	VIEW FROM THE US . '- , '. Fed releases minutes of latest meeting Wednesday \"EM\nVIEW FROM THE US 3', \". Deere & Company to release earnings on Wednesday EM\nRICHARD DUNBAR. Aberdeen Standard Investments
2017-11-22 08:41:00	CNNW	44	CNNW_20171122_080000_CNN_Newsroom_Live/start/2460	FORMER VP MNANGAGWA TO BE SWORN IN BY THURSDAY\nRULING PARTY: MNANGAGWA RETURNING TO ZIMBABWE WEDNESDAY\nFORMER VP MNANGAGWA TO BE SWORN IN BY THURSDAY. . Geoff Hill Africa...
2017-11-22 08:42:00	BBCNEWS	39	BBCNEWS_20171122_083000_BBC_Business_Live/start/720	VIEW FROM THE US . i \". Deere & Company to release earnings on Wednesday \"EM\nFTSE 1OO DAX CAO. 743O19 A 18,85 13T75,73 A 8.19 5369'91 A816
2017-11-22 08:42:00	CNNW	42	CNNW_20171122_080000_CNN_Newsroom_Live/start/2520	FORMER VP MNANGAGWA TO BE SWORN IN BY THURSDAY. . Geoff Hill Author, \"What Happens After Mugabe?\
2017-11-22 08:42:00	FOXNEWSW	12	FOXNEWSW_20171122_080000_Fox_News__Night/start/2520	WILLIAM H. ORRICK. .'. UNITED STATES DISTRICT COURT JUDGE .. NOV. 2O \u00ab I.. . mif\u2014
2017-11-22 08:43:00	BBCNEWS	14	BBCNEWS_20171122_083000_BBC_Business_Live/start/780	BRENT CRUDE LIGHT CRUDE GOLD. 6&15'O56 57.88 A 1.O5 128O.O'12.35\n$:EURO $:YEN \u00a3:$. (185O1 112O4 1.3244\nFTSE 1OO NIKKEI 225 HANG SENG. 7428.74 A 17,4 22523.15 A 1.O7 3OOO3.49 A 185.42
2017-11-22 08:43:00	FOXNEWSW	8	FOXNEWSW_20171122_080000_Fox_News__Night/start/2580	DEPUTY PRE\u00a7S SECRETARY HOGAN GIDLEY
2017-11-22 08:43:00	MSNBCW	26	MSNBCW_20171122_080000_All_In_With_Chris_Hayes/start/2580	1-8O9-844- 196O WI WW\n1-8O9-8491196O [Em | LIBEMI
2017-11-22 08:44:00	BBCNEWS	15	BBCNEWS_20171122_083000_BBC_Business_Live/start/840	GIG ECONOMY\nTHOMAS COOK RESULTS . ' u'. Underlying earnings was around $437.6m \"MM\nSIMON CALDER. Travel editor, The Independent
2017-11-22 08:44:00	FOXNEWSW	18	FOXNEWSW_20171122_080000_Fox_News__Night/start/2640	SANCTUARY CITY RULING. JUDGE PERMANENTLY BLOCKS TRUMP ORDER ON FUNDING. . _ manual.\u201d _\nSANCTUARY CITY RULING. JUDGE PERMANENTLY BLOCKS TRUMP ORDER ON FUNDING. . _ manunm _
2017-11-22 08:44:00	MSNBCW	6	MSNBCW_20171122_080000_All_In_With_Chris_Hayes/start/2640	1-8O9-8491196O mm | mm
2017-11-22 08:45:00	BBCNEWS	11	BBCNEWS_20171122_083000_BBC_Business_Live/start/900	THOMAS COOK RESULTS . , .'. Firm sees strong demand for Turkey and Egypt -\ufb02\ufb02:\u00a7m\nTHOMAS COOK RESULTS v s;. Travel firm posted 8% rise in 1ull year earnings MM\nTHOMAS COOK RESULTS . ' u'. Underlying earnings was...
2017-11-22 08:45:00	FOXNEWSW	24	FOXNEWSW_20171122_080000_Fox_News__Night/start/2700	SANCTUARY CITY RULING '-. JUDGE PERMANENTLY BLOCKS TRUMP ORDER ON FUNDING I. . \u2014 Wanton.\u201d
2017-11-22 08:45:00	MSNBCW	16	MSNBCW_20171122_080000_All_In_With_Chris_Hayes/start/2700	HI IVCORAVIN,COM\nKAREN FONSECA \\ TEXAS DRIVER WITH ANTI-TRUMPDECAL
2017-11-22 08:46:00	CNNW	56	CNNW_20171122_080000_CNN_Newsroom_Live/start/2760	\"PARTRIDGE FAMILY\" STAR DAVID CASSIDY DIES AT 67
2017-11-22 08:47:00	CNNW	62	CNNW_20171122_080000_CNN_Newsroom_Live/start/2820	\"PARTRIDGE FAMILY\" STAR DAVID CASSIDY DIES AT 67
2017-11-22 08:47:00	MSNBCW	23	MSNBCW_20171122_080000_All_In_With_Chris_Hayes/start/2820	\"I WILLDI
2017-11-22 08:48:00	BBCNEWS	11	BBCNEWS_20171122_083000_BBC_Business_Live/start/1080	THE INSIDE TRACK \u00e9 \". Ainasker is an Australian labour-sharing platlorm 3m\nTHE INSIDE TRACK v s\" \". Airtasker enables users to outsource everyday tasks \u00ab7\nTIM FUNG. Founder and CEO, Airtasker\nTHE INSIDE TRACK...
2017-11-22 08:48:00	MSNBCW	13	MSNBCW_20171122_080000_All_In_With_Chris_Hayes/start/2880	Ynl ID ('I-lAMDInM\u201d\n\"I WILL DI
2017-11-22 08:49:00	BBCNEWS	10	BBCNEWS_20171122_083000_BBC_Business_Live/start/1140	THE INSIDE TRACK. Join the debate using #BBCBizLive\nTHE INSIDE TRACK . 3',. Ainasker is an Australian labour-sharing platlorm ~.m\nTHE INSIDE TRACK v 3',. Ainasker is Sydney-based with...
2017-11-22 08:49:00	CNNW	42	CNNW_20171122_080000_CNN_Newsroom_Live/start/2940	\"PARTRIDGE FAMILY\" STAR DAVID CASSIDY DIES AT 67\nU.S. NAW AIRCRAFT CRASHES OFF OKINAWA, 11 ON BOARD
2017-11-22 08:50:00	CNNW	11	CNNW_20171122_080000_CNN_Newsroom_Live/start/3000	Text: NI:VV To:DD'I-UU
2017-11-22 08:51:00	BBCNEWS	11	BBCNEWS_20171122_083000_BBC_Business_Live/start/1260	THE INSIDE TRACK. Join the debate using #BBCBizLive\nTHE INSIDE TRACK. Tim Fung is Co-Founder and CEO of Ainasker\nTHE INSIDE TRACK \u2019.. Ainasker is Sydney-based with 12O employees...
2017-11-22 08:51:00	CNNW	17	CNNW_20171122_080000_CNN_Newsroom_Live/start/3060	1-8OO-381-9139 Call now for free guide. . TTY:711\nText: NEW To: 554OO\nText: NI:VV To:DD'I-UU. . Message and data rates may apply.
2017-11-22 08:51:00	FOXNEWSW	52	FOXNEWSW_20171122_080000_Fox_News__Night/start/3060	IESIDENT TRUMP'S CONSTITUTIONAL AUTHORITY\nCOUNSELING CAUTION I. ZONCERNS SPECIAL PROSECUIOR OVERSTEPPING HIS AUTHORITY. . rmuurm
2017-11-22 08:52:00	BBCNEWS	10	BBCNEWS_20171122_083000_BBC_Business_Live/start/1320	BUSINESS LIVE\nTHE INSIDE TRACK . 3\u2019,. Ainasker is an Australian labour-sharing platlorm ~.m\nTIM FUNG. Founder and CEO, Ainasker\nTHE INSIDE TRACK....
2017-11-22 08:52:00	CNNW	15	CNNW_20171122_080000_CNN_Newsroom_Live/start/3120	1-8OO-381-9139 Call now for free guide. . AARPMedicareSupplement.com
2017-11-22 08:52:00	FOXNEWSW	44	FOXNEWSW_20171122_080000_Fox_News__Night/start/3120	COUNSELING CAUTION I. ZONCERNS SPECIAL PROSECUTOR OVERSTEPPING HIS AUTHORITY. . mun/N.\u201d\nCOUNSELING CAUTION I. ZONCERNS SPECIAL PROSECUTOR OVERSTEPPING HIS AUTHORITY. . munrm
2017-11-22 08:53:00	MSNBCW	21	MSNBCW_20171122_080000_All_In_With_Chris_Hayes/start/3180	F} THIS MOMENT
2017-11-22 08:54:00	BBCNEWS	14	BBCNEWS_20171122_083000_BBC_Business_Live/start/1440	BUSINESS LIVE I
2017-11-22 08:54:00	CNNW	51	CNNW_20171122_080000_CNN_Newsroom_Live/start/3240	U.S. NAW AIRCRAFI' CRASHES OFF OKINAWA 11 ON BOARD. . Ivan Watson CJ\\N Seniorlnternational Correspondent\nU.S. NAW AIRCRAFT CRASHES OFF OKINAWA, 11 ON BOARD
2017-11-22 08:55:00	BBCNEWS	5	BBCNEWS_20171122_083000_BBC_Business_Live/start/1500	RICHARD DUNBAR. Aberdeen Standard Investments
2017-11-22 08:55:00	CNNW	62	CNNW_20171122_080000_CNN_Newsroom_Live/start/3300	U.S. NAW AIRCRAFT CRASHES OFF OKINAWA, 11 ON BOARD
2017-11-22 08:55:00	FOXNEWSW	33	FOXNEWSW_20171122_080000_Fox_News__Night/start/3300	BROADENING INVESTIGATION I. iPECIAI. COUNSEL SET TO INTERVIEW WHITE HOUSE OFFICIALS. . n'\ufb01KIII'LIT
2017-11-22 08:55:00	MSNBCW	18	MSNBCW_20171122_080000_All_In_With_Chris_Hayes/start/3300	Cl]? wasnmgton 1JO51. IRIN CARMON l BROKE CHARLIE ROSE STORY\nCl]? wasnmgton 1.1O51. IRIN CARMON l BROKE CHARLIE ROSE STORY
2017-11-22 08:56:00	CNNW	37	CNNW_20171122_080000_CNN_Newsroom_Live/start/3360	U.S. NAW AIRCRAFT CRASHES OFF OKINAWA, 11 ON BOARD\nU.S. NAW AIRCRAFI' CRASHES OFF OKINAWA 11 ON BOARD. . Ivan Watson OW Seniorlntemational Correspondent
2017-11-22 08:56:00	FOXNEWSW	19	FOXNEWSW_20171122_080000_Fox_News__Night/start/3360	O, 1 -8OO-8O_6_-2 1 89
