2017-12-03 00:00:00	BBCNEWS	15	BBCNEWS_20171202_234500_The_Film_Review/start/900	TRUMP ON FLYNN\nTIRED MOUNTAIN SYNDROME
2017-12-03 14:44:00	MSNBCW	9	MSNBCW_20171203_140000_MSNBC_Live_With_Alex_Witt/start/2640	SEN. SANDERS: TAX BILL IS \"BIGGEST ACT OF. THIEVERY\" IN MODERN U.S. HISTORY\nMCCONNELL: CONFIDENT THIS IS A REVENUE NEUTRAL BILL
2017-12-03 14:45:00	CNNW	40	CNNW_20171203_140000_State_of_the_Union_With_Jake_Tapper/start/2700	BIG WIN FOR TRUMP AS SENATE PASSES GOP TAX BILL\nBIG WIN FOR TRUMP AS SENATE PASSES GOP TAX BILL. . Jennifer Granholm (D) Former Michigan Governor\nBIG WIN FOR TRUMP AS SENATE PASSES...
2017-12-03 14:45:00	FOXNEWSW	19	FOXNEWSW_20171203_110000_Fox_and_Friends_Sunday/start/13500	www.8OckSlider.com\nI'ILUII'
2017-12-03 14:46:00	CNNW	56	CNNW_20171203_140000_State_of_the_Union_With_Jake_Tapper/start/2760	BIG WIN FOR TRUMP AS SENATE PASSES GOP TAX BILL\nBIG WIN FOR TRUMP AS SENATE PASSES GOP TAX BILL. . Mike Rogers CI\\N National Security Commentator
2017-12-03 14:46:00	FOXNEWSW	21	FOXNEWSW_20171203_110000_Fox_and_Friends_Sunday/start/13560	DW WILL MARKETS RESPOND TO TAX REFORM VOTE? I
2017-12-03 14:47:00	CNNW	43	CNNW_20171203_140000_State_of_the_Union_With_Jake_Tapper/start/2820	SENATE PASSES TAX BILL AFTER LATE CHANGES, LATE VOTE\nSENATE PASSES TAX BILL AFTER LATE CHANGES LATE VOTE. . Karine Jean-Pierre Senior Adviser, MoveOn.org\nBIG WIN FOR TRUMP AS SENATE...
2017-12-03 14:48:00	CNNW	57	CNNW_20171203_140000_State_of_the_Union_With_Jake_Tapper/start/2880	TRUMP: THIS IS LARGEST TAX DECREASE IN HISTORY, BY FAR\nSENATE PASSES TAX BILL AFTER LATE CHANGES, LATE VOTE
2017-12-03 14:48:00	FOXNEWSW	43	FOXNEWSW_20171203_110000_Fox_and_Friends_Sunday/start/13680	RTIROMO: TAX PLAN EXPECTED TO RAISE S&P 8% I\nDW WILL MARKETS RESPOND TO TAX REFORM VOTE? I
2017-12-03 14:48:00	MSNBCW	6	MSNBCW_20171203_140000_MSNBC_Live_With_Alex_Witt/start/2880	TRUMP LASHES OUT AT MEDIA IN WAKE OF FLYNN PLEA DEAL\nNEW DOCUMENTARY ON JOURNALISM ICON BEN BRADLEE
2017-12-03 14:49:00	BBCNEWS	7	BBCNEWS_20171203_143000_The_Week_in_Parliament/start/1140	KENNETH CLARKE. __Con Rushcliffe\nPETER GRANT. SNP Europe spokesman\nHILARY BENN
2017-12-03 14:49:00	CNNW	57	CNNW_20171203_140000_State_of_the_Union_With_Jake_Tapper/start/2940	SENATE PASSES TAX BILL AFTER LATE CHANGES, LATE VOTE
2017-12-03 14:49:00	FOXNEWSW	15	FOXNEWSW_20171203_110000_Fox_and_Friends_Sunday/start/13740	RTIROMO: TAX PLAN EXPECTED TO RAISE S&P 8% I\n'OCK MARKET SURGED UNDER TRUMP, IN 2O17 I\n>OKING AHEAD TO \"SUNDAY MORNING FUTURES\" I\nCHRISTMAS COOKIE CHALLENGE\nDAVID PERDUE [R3....
2017-12-03 14:49:00	MSNBCW	29	MSNBCW_20171203_140000_MSNBC_Live_With_Alex_Witt/start/2940	NEW DOCUMENTARY ON JOURNALISM ICON BEN BRADLEE\nTRUMP LASHES OUT AT MEDIA IN WAKE OF FLYNN PLEA DEAL\nPREVIOUSLY UNSEEN FOOTAGE. EXPLORES BEN BRADLEE\u2019S LEGACY
2017-12-03 14:50:00	FOXNEWSW	10	FOXNEWSW_20171203_110000_Fox_and_Friends_Sunday/start/13800	cash back for our holida sho- -in-.\nlay shipping\u201c BuyNortonCoreLom 1-8OO-336-O756 (\"O'1O\
2017-12-03 14:50:00	MSNBCW	38	MSNBCW_20171203_140000_MSNBC_Live_With_Alex_Witt/start/3000	TRUMP LASHES OUT AT MEDIA IN WAKE OF FLYNN PLEA DEAL\nJOURNALISM IN THE AGE OF TRUMP VS NIXON
2017-12-03 14:51:00	MSNBCW	58	MSNBCW_20171203_140000_MSNBC_Live_With_Alex_Witt/start/3060	JOURNALISM IN THE AGE OF TRUMP VS NIXON
2017-12-03 14:53:00	BBCNEWS	10	BBCNEWS_20171203_143000_The_Week_in_Parliament/start/1380	LEE WATERS. _La.b9',\"v\u00a3a\"\u00b0\u201ci
2017-12-03 14:53:00	FOXNEWSW	38	FOXNEWSW_20171203_110000_Fox_and_Friends_Sunday/start/13980	\"CHRISTMAS COOKIE CHALLENGE\" I
2017-12-03 14:53:00	MSNBCW	31	MSNBCW_20171203_140000_MSNBC_Live_With_Alex_Witt/start/3180	NEW DOCUMENTARY ON JOURNALISM ICON BEN BRADLEE\nJOURNALISM IN THE AGE OF TRUMP VS NIXON\nNEW FILM ON BEN BRADLEE USES. PREVIOUSLY UNSEEN FOOTAGE
2017-12-03 14:54:00	MSNBCW	60	MSNBCW_20171203_140000_MSNBC_Live_With_Alex_Witt/start/3240	NEW FILM ON BEN BRADLEE USES. PREVIOUSLY UNSEEN FOOTAGE
2017-12-03 14:55:00	MSNBCW	58	MSNBCW_20171203_140000_MSNBC_Live_With_Alex_Witt/start/3300	FILM HIGHLIGHTS BRADLEE'S ROLE AT HELM OF WASHINGTON POST\nNEW FILM ON BEN BRADLEE USES. PREVIOUSLY UNSEEN FOOTAGE
2017-12-03 14:56:00	MSNBCW	9	MSNBCW_20171203_140000_MSNBC_Live_With_Alex_Witt/start/3360	NEW BEN BRADLEE DOCUMENTARY PREMIERES TONIGHT ON HBO
2017-12-03 14:57:00	BBCNEWS	15	BBCNEWS_20171203_143000_The_Week_in_Parliament/start/1620	A- ' MONDAY 15:OO-
2017-12-03 14:58:00	CNNW	5	CNNW_20171203_140000_State_of_the_Union_With_Jake_Tapper/start/3480	Results may vary. Use as directed.. Offer valid through 12/31/17.
2017-12-03 14:59:00	CNNW	4	CNNW_20171203_140000_State_of_the_Union_With_Jake_Tapper/start/3540	of San Francisco
2017-12-03 15:00:00	BBCNEWS	38	BBCNEWS_20171203_143000_The_Week_in_Parliament/start/1800	SOCIAL MOBILITY BOARD QUIT\nHEART TRANSPLANT 5Oth ANNIVERSARY
2017-12-03 15:00:00	FOXNEWSW	15	FOXNEWSW_20171203_110000_Fox_and_Friends_Sunday/start/14400	TAX CUT TIMELINE. . \\l 'I'HLIIIII' EII'I'I Incc\nTIME FOR \"KATE' S LAW\"?. . '1 'I'HLIIKII' EII'I'I Incc
2017-12-03 15:01:00	BBCNEWS	23	BBCNEWS_20171203_150000_BBC_News/start/60	15:3O CLICK
2017-12-03 15:01:00	FOXNEWSW	18	FOXNEWSW_20171203_150000_Sunday_Morning_Futures_With_Maria_Bartiromo/start/60	GOP TAX REFORM BILL HEADS TO CONFERENCE I. COMMITTEE AFTER SENATE PASSES ITS VERSION. . El I'I'I Incc\nNORTH KOREAN THREAT. . \\l 'l'nklllll' EII'I'I Incc\nTIME FOR \"KATE' S LAW\"?. . '1 ll'nLIILIA EII'I'I Incc
2017-12-03 15:01:00	MSNBCW	13	MSNBCW_20171203_150000_AM_Joy/start/60	llulllp lull) UUIIIE] It; rlyllll I. hope you can let this go\"\nTRUMP UNLEASHES TWEETSTORM AFTER FLYNN PLEA DEAL
2017-12-03 15:02:00	BBCNEWS	4	BBCNEWS_20171203_150000_BBC_News/start/120	ALAN MILBURN. Chair, Social Mobility Commission 2O12-17
2017-12-03 15:02:00	CNNW	33	CNNW_20171203_150000_Fareed_Zakaria_GPS/start/120	FAREED'S TAKE\nFAREED'S TAKE. . . . Non artisan anal sis finds tax Ian will be a boon to the rich, not the\nFAREED'S TAKE. . . . Non artisan anal sis...
2017-12-03 15:02:00	MSNBCW	39	MSNBCW_20171203_150000_AM_Joy/start/120	TRUMP UNLEASHES TWEETSTORM AFTER FLYNN PLEA DEAL\nTRUMP TWEET: \"I HAD TO FIRE GENERAL FLYNN. BECAUSE HE LIED TO THE VICE PRESIDENT AND THE FBI\
2017-12-03 15:03:00	BBCNEWS	5	BBCNEWS_20171203_150000_BBC_News/start/180	JUSTINE GREENING MP. Education Secretary
2017-12-03 15:03:00	CNNW	33	CNNW_20171203_150000_Fareed_Zakaria_GPS/start/180	FAREED'S TAKE. . . . How is it that Reoublicans an oeal tO the ooeole but reward the rich?\nFAREED'S TAKE. A redistribution of wealth to the wealth , via the tax code\nFAREED'S TAKE. . . . Are liberals rio ht that the GOP is...
2017-12-03 15:03:00	MSNBCW	44	MSNBCW_20171203_150000_AM_Joy/start/180	TRUMP TWEET: \"I HAD TO FIRE GENERAL FLYNN. BECAUSE HE LIED TO THE VICE PRESIDENT AND THE FBI\"\nIlulllp um: UUIIIE] I5. rlyllll I. hope you can let this go\
2017-12-03 15:04:00	CNNW	28	CNNW_20171203_150000_Fareed_Zakaria_GPS/start/240	FAREED'S TAKE. . . . What if Trum's base cares more about cultural issues than economics?\nFAREED'S TAKE. . . . Are liberals ri- ht that the GOP is hoodwinkin- its su o coders?\nFAREED'S TAKE. . . . What Euro ean oooulist...
2017-12-03 15:04:00	FOXNEWSW	32	FOXNEWSW_20171203_150000_Sunday_Morning_Futures_With_Maria_Bartiromo/start/240	GOP TAX REFORM BILL HEADS TO CONFERENCE I. COMMITTEE AFTER SENATE PASSES ITS VERSION. . CI I'I'I Incc
2017-12-03 15:04:00	MSNBCW	39	MSNBCW_20171203_150000_AM_Joy/start/240	TWEET RAISES QUESTIONS OF OBSTRUCT ION OF JUSTICE
2017-12-03 15:05:00	BBCNEWS	13	BBCNEWS_20171203_150000_BBC_News/start/300	SOCIAL MOBILITY BOARD QUIT. All four board members of the commission resign\nSOCIAL MOBILITY BOARD QUIT. Chair Alan Milburn: Govt focussing on Brexit\nSOCIAL MOBILITV BOARD QUIT. Milburn: PM 1ai|ing over pledge...
2017-12-03 15:05:00	CNNW	37	CNNW_20171203_150000_Fareed_Zakaria_GPS/start/300	FAREED'S TAKE. . . . Ma be Trumo knows his base better than we do\nFAREED'S TAKE. . . . What Euro ean oooulist voters and Trumo voters have in common
2017-12-03 15:05:00	FOXNEWSW	28	FOXNEWSW_20171203_150000_Sunday_Morning_Futures_With_Maria_Bartiromo/start/300	HOUSE AND SENATE REPUBLICANS PASS I. SEPARATE TAX BILLS WITH KEY DIFFERENCES. . El I'I'I InCC
2017-12-03 15:05:00	MSNBCW	38	MSNBCW_20171203_150000_AM_Joy/start/300	TWEET RAISES QUESTIONS OF OBSTRUCT ION OF JUSTICE\nPAUL BUTLER [ FORMER FEDERAL PROSECUTOR
2017-12-03 15:06:00	BBCNEWS	11	BBCNEWS_20171203_150000_BBC_News/start/360	SOCIAL MOBILITY BOARD QUIT. Education Sec delends govt record on social mobility\nSOCIAL MOBILITV BOARD QUIT. Education Sec: Time for {rash blood in the Commission\nSOCIAL MOBILITY BOARD QUIT. All four board members...
2017-12-03 15:06:00	CNNW	13	CNNW_20171203_150000_Fareed_Zakaria_GPS/start/360	FORMER NATIONAL SECURITY ADVISER FLYNN PLEADS GUILTY
2017-12-03 15:07:00	BBCNEWS	10	BBCNEWS_20171203_150000_BBC_News/start/420	SOCIAL MOBILITY BOARD QUIT. Chair Alan Milburn: Govt focussing on Brexit\nSOCIAL MOBILITY BOARD QUIT. Milbum: PM 1ailing over pledge to build a fairer Britain\nSOCIAL MOBILITY BOARD QUIT. Milbum: May doing...
2017-12-03 15:07:00	CNNW	29	CNNW_20171203_150000_Fareed_Zakaria_GPS/start/420	FORMER NATIONAL SECURITY ADVISER FLYNN PLEADS GUILTY\nFORMER NATIONAL SECURITY ADVISER FLYNN PLEADS GUILTY. . David Sanger National Security Correspondent, New York Times\nFORMER NATIONAL...
2017-12-03 15:07:00	FOXNEWSW	21	FOXNEWSW_20171203_150000_Sunday_Morning_Futures_With_Maria_Bartiromo/start/420	HOUSE AND SENATE REPUBLICANS PASS I. SEPARATE TAX BILLS WITH KEY DIFFERENCES. . CI ITI InCC\nIIN THE DISCUSSION ON TWITTER @SUNDAYFUTURES I. . \\l 'nrnlnu' EII'I'I Incc\n19 DAVID PERDUE R-GA l SENATE BUDGET COMMITTEE I. . HOUSE...
2017-12-03 15:07:00	MSNBCW	28	MSNBCW_20171203_150000_AM_Joy/start/420	TWEET RAISES QUESTIONS OF OBSTRUCTION OF JUSTICE\nTWEET RAISES QUESTIONS OF OBSTRUCT ION OF JUSTICE\nFMR. SENIOR AIDE. RON KLAIN \u2019 TO PRESIDENT OBAMA
2017-12-03 15:08:00	BBCNEWS	11	BBCNEWS_20171203_150000_BBC_News/start/480	SOCIAL MOBILITY BOARD QUIT. All four board members of the commission resign\nSOCIAL MOBILITY BOARD QUIT. Labour: Social mobility has stalled under Conservatives\nSOCIAL MOBILITY BOARD QUIT. Education Sec: Time...
2017-12-03 15:08:00	FOXNEWSW	17	FOXNEWSW_20171203_150000_Sunday_Morning_Futures_With_Maria_Bartiromo/start/480	HOUSE AND SENATE REPUBLICANS PASS I. SEPARATE TAX BILLS WITH KEY DIFFERENCES. . El I'I'I InCC\nGOP TAX REFORM BILL HEADS TO CONFERENCE I. COMMITTEE AFTER SENATE PASSES ITS VERSION. . El I'I'I InEC
2017-12-03 15:08:00	MSNBCW	12	MSNBCW_20171203_150000_AM_Joy/start/480	TWEET RAISES QUESTIONS OF OBSTRUCT ION OF JUSTICE\nFMR. CHIEF OF STAFF TO. RON KLAIN \u2019 VICE PRESIDENT JOE BIDEN
2017-12-03 15:09:00	CNNW	40	CNNW_20171203_150000_Fareed_Zakaria_GPS/start/540	FORMER NATIONAL SECURITY ADVISER FLYNN PLEADS GUILTY. . Julia loffe Staff Writer. The Atlantic\nFORMER NATIONAL SECURITY ADVISER FLYNN PLEADS GUILTY
2017-12-03 15:09:00	FOXNEWSW	62	FOXNEWSW_20171203_150000_Sunday_Morning_Futures_With_Maria_Bartiromo/start/540	HOUSE AND SENATE REPUBLICANS PASS. SEPARATE TAX BILLS WITH KEY DIFFERENCES. . El I'I'I InCC
2017-12-03 15:09:00	MSNBCW	38	MSNBCW_20171203_150000_AM_Joy/start/540	TWEET RAISES QUESTIONS OF OBSTRUCT ION OF JUSTICE
2017-12-03 15:10:00	BBCNEWS	11	BBCNEWS_20171203_150000_BBC_News/start/600	BREXIT NEGOTIATIONS. Irish cabinet 1O hold emergency meeting tomorrow\nBREXIT NEGOTIATIONS. Simon Coveney asks for 'credib'e answers' on border issue\nLOUISE CULLEN. News Correspondent
2017-12-03 15:10:00	CNNW	29	CNNW_20171203_150000_Fareed_Zakaria_GPS/start/600	FORMER NATIONAL SECURITY ADVISER FLYNN PLEADS GUILTY\nFORMER NATIONAL SECURITY ADVISER FLYNN PLEADS GUILTY. . Julia loffe Staff Writer. The Atlantic\nFORMER NATIONAL SECURITY ADVISER FLYNN...
2017-12-03 15:10:00	FOXNEWSW	41	FOXNEWSW_20171203_150000_Sunday_Morning_Futures_With_Maria_Bartiromo/start/600	HOUSE AND SENATE REPUBLICANS PASS I. SEPARATE TAX BILLS WITH KEY DIFFERENCES. . El I'I'I Incc\nHOUSE AND SENATE REPUBLICANS PASS. SEPARATE TAX BILLS WITH KEY DIFFERENCES. . El I'I'I Incc
2017-12-03 15:11:00	BBCNEWS	22	BBCNEWS_20171203_150000_BBC_News/start/660	BREXIT NEGOTIATIONS. Theresa May meeting EU's Jean CIaude-Juncker tomorrow\nBREXIT NEGOTIATIONS. Simon Coveney asks for 'cvedib'e answers' on border issue\nBREXIT NEGOTIATIONS. Irish cabinet 1O hold emergency...
2017-12-03 15:11:00	CNNW	32	CNNW_20171203_150000_Fareed_Zakaria_GPS/start/660	FORMER NATIONAL SECURITY ADVISER FLYNN PLEADS GUILTY. . Ian Bremmer President, Eurasia Group\nFORMER NATIONAL SECURITY ADVISER FLYNN PLEADS GUILTY\nFORMER NATIONAL SECURITY ADVISER FLYNN PLEADS GUILTY. . Ian Bremmer Author,...
2017-12-03 15:12:00	MSNBCW	41	MSNBCW_20171203_150000_AM_Joy/start/720	TWEET RAISES QUESTIONS OF OBSTRUCT ION OF JUSTICE\nTWEET RAISES QUESTIONS OF OBSTRUCTION OF JUSTICE\nPROFESSOR OF LAW. PAUL BUTLER ' GEORGETOWN LAW SCHOOL
2017-12-03 15:13:00	BBCNEWS	6	BBCNEWS_20171203_150000_BBC_News/start/780	JEREMY HUNT MP. Health Secretary
2017-12-03 15:13:00	MSNBCW	58	MSNBCW_20171203_150000_AM_Joy/start/780	TWEET RAISES QUESTIONS OF OBSTRUCT ION OF JUSTICE
2017-12-03 15:14:00	BBCNEWS	11	BBCNEWS_20171203_150000_BBC_News/start/840	RAIL DELAYS. All lines out of London Euston station closed this morning\nLISA HAMPELE. News Correspondent
2017-12-03 15:15:00	BBCNEWS	12	BBCNEWS_20171203_150000_BBC_News/start/900	RAIL DELAYS. Passengers wamed of delays for the rest of Sunday\nRAIL DELAYS. Emergency work took place to repair power cables\nRAIL DELAYS. 5OOm of overhead power cables damaged on Friday\nRAIL...
2017-12-03 15:15:00	CNNW	20	CNNW_20171203_150000_Fareed_Zakaria_GPS/start/900	@SimpliSafe ' GetSimpliSafe.com\n6 Simpli \\ GetSimpliSafe.com
2017-12-03 15:15:00	FOXNEWSW	36	FOXNEWSW_20171203_150000_Sunday_Morning_Futures_With_Maria_Bartiromo/start/900	STICE DEPARTMENT CONSIDERING FEDERAL CHARGES AGAINST. ILLEGAL IMMIGRANT FOUND NOT GUILTY IN STEINLE KILLING. . El I'I'I Incc\n.YNN PLEADS GUILTY TO LYING TO THE FBI I. . 'nrnlnu' El I'I'I Incc
2017-12-03 15:16:00	BBCNEWS	25	BBCNEWS_20171203_150000_BBC_News/start/960	SOCIAL MOBILITY BOARD QUIT
2017-12-03 15:16:00	CNNW	10	CNNW_20171203_150000_Fareed_Zakaria_GPS/start/960	6 Simpli \\ GetSimpliSafe.com\n1-8OO-831-37OO mesobook.com. . Mesothelioma Book
2017-12-03 15:16:00	FOXNEWSW	14	FOXNEWSW_20171203_150000_Sunday_Morning_Futures_With_Maria_Bartiromo/start/960	\ufb01. .YNN PLEADS GUILTY TO LYING TO THE FBI E\nTRUMP: NOT CONCERNED ABOUT FLYNN' S I. PLEA DEAL, \"THERE' S NO COLLUSION\". . CIILIl-uul l'nrnlult- El I'I'I Incc\nTRUMP: NOT CONCERNED...
2017-12-03 15:17:00	CNNW	33	CNNW_20171203_150000_Fareed_Zakaria_GPS/start/1020	NORTH KOREA SAYS NEW MISSILE CAN HIT ANYWHERE IN U.S.\nNORTH KOREA SAYS NEW MISSILE CAN HIT ANYWHERE IN U.S.. . David Sanger National Security Correspondent, New York Times\nNORTH KOREA SAYS...
2017-12-03 15:17:00	FOXNEWSW	7	FOXNEWSW_20171203_150000_Sunday_Morning_Futures_With_Maria_Bartiromo/start/1020	TRUMP: NOT CONCERNED ABOUT FLYNN' S I. PLEA DEAL, \"THERE' S NO COLLUSION\". . cIILIHA\\l I'I'nkllkll' El I'I'I In\ufb02c
2017-12-03 15:18:00	CNNW	37	CNNW_20171203_150000_Fareed_Zakaria_GPS/start/1080	NORTH KOREA SAYS NEW MISSILE CAN HIT ANYWHERE IN U.S.. . David Sanger National Security Correspondent, New York Times\nNORTH KOREA SAYS NEW MISSILE CAN HIT ANYWHERE IN U.S.. . David Sanger Q\\l\\l Political and National Security Analyst\nNORTH KOREA SAYS...
2017-12-03 15:18:00	FOXNEWSW	17	FOXNEWSW_20171203_150000_Sunday_Morning_Futures_With_Maria_Bartiromo/start/1080	STICE DEPARTMENT CONSIDERING FEDERAL CHARGES AGAINST. ILLEGAL IMMIGRANT FOUND NOT GUILTY IN STEINLE KILLING. . El I'I'I InEC\n.YNN PLEADS GUILTY TO LYING TO THE FBI I. . 'l'nklllll' El I'I'I Incc
2017-12-03 15:19:00	BBCNEWS	12	BBCNEWS_20171203_150000_BBC_News/start/1140	HEART TRANSPLANT 5OTH ANNIVERSARY. First hean transplant took place on 3 December 1967\nHEART TRANSPLANT 5OTH ANNIVERSARY. First operation took place in South Africa
2017-12-03 15:19:00	CNNW	22	CNNW_20171203_150000_Fareed_Zakaria_GPS/start/1140	SEC'Y OF STATE TILLERSON: WILL HE STAY OR WILL HE GO?\nNORTH KOREA SAYS NEW MISSILE CAN HIT ANYWHERE IN U.S.\nNORTH KOREA SAYS NEW MISSILE CAN HIT ANYWHERE IN U.S.. . David Sanger OW...
2017-12-03 15:19:00	FOXNEWSW	17	FOXNEWSW_20171203_150000_Sunday_Morning_Futures_With_Maria_Bartiromo/start/1140	;\u2014. \\RATE COULD BE CHARGED WITH FELONY RE- ENTRYE\n> MICHAEL MCCAUL R-TX | HOUSE HOMELAND SECURITY CMTE CHAIR. . STICE DEPARTMENT CONSIDERING FEDERAL CHARGES AGAINST. mmm IMMIGRANT mlwn...
2017-12-03 15:20:00	BBCNEWS	10	BBCNEWS_20171203_150000_BBC_News/start/1200	HEART TRANSPLANT 5OTH ANNIVERSARY. Patients waiting for Transplant has risen 162% in a decade\nHEART TRANSPLANT 5OTH ANNIVERSARY. Around 2OO transplants a year take place in the UK\nHEART TRANSPLANT 5OTH ANNIVERSARY. First hean...
2017-12-03 15:20:00	CNNW	18	CNNW_20171203_150000_Fareed_Zakaria_GPS/start/1200	TURMOIL AT THE U.S. STATE DEPARTMENT\nSEC'Y OF STATE TILLERSON: WILL HE STAY OR WILL HE GO?. . . . Julia loffe Staff Writer. The Atlantic\nSEC'Y OF STATE TILLERSON: WILL HE...
2017-12-03 15:20:00	FOXNEWSW	17	FOXNEWSW_20171203_150000_Sunday_Morning_Futures_With_Maria_Bartiromo/start/1200	\"KATE' S LAW\" PASSED THE HOUSE,. THE SENATE HAS YET TO ACT ON IT. . cIILIHA\\l l'nrnluu' El I'I'I Incc\n\"KATE' S LAW\" PASSED THE HOUSE,. THE SENATE HAS YET TO ACT ON IT. . CIILIl-uul llnnnluu' El I'I'I Incc
2017-12-03 15:20:00	MSNBCW	12	MSNBCW_20171203_150000_AM_Joy/start/1200	SEN. MARCO RUBIO [ (R) FLORIDA
2017-12-03 15:21:00	BBCNEWS	11	BBCNEWS_20171203_150000_BBC_News/start/1260	HEART TRANSPLANT 5OTH ANNIVERSARV. First operation took place in Souih Africa\nHEART TRANSPLANT 5OTH ANNIVERSARY. First heart transplant patient died 18 days later\nHEART TRANSPLANT 5OTH ANNIVERSARY. Around 2OO...
2017-12-03 15:21:00	CNNW	36	CNNW_20171203_150000_Fareed_Zakaria_GPS/start/1260	NORTH KOREA SAYS NEW MISSILE CAN HIT ANYWHERE IN U.S.. . Ian Bremmer President, Eurasia Group\nSEC'Y OF STATE TILLERSON: WILL HE STAY OR WILL HE GO?. . . . Ian Bremmer President, Eurasia Group\nNORTH KOREA SAYS NEW MISSILE CAN HIT...
2017-12-03 15:21:00	FOXNEWSW	4	FOXNEWSW_20171203_150000_Sunday_Morning_Futures_With_Maria_Bartiromo/start/1260	\"KATE' S LAW\" PASSED THE HOUSE;. THE SENATE HAS YET TO ACT ON IT. . cIILIHA\\l l'nrulnu' El I'I'I Incc
2017-12-03 15:21:00	MSNBCW	27	MSNBCW_20171203_150000_AM_Joy/start/1260	WHAT'S NEXT FOR GOP TAX BILLS\nKATON DAWSON I NATIONAL REPUBLICAN CONSULTANT
2017-12-03 15:22:00	BBCNEWS	10	BBCNEWS_20171203_150000_BBC_News/start/1320	HEART TRANSPLANT 5OTH ANNIVERSARY. First heart transplant patient died 18 days later\nHEART TRANSPLANT 5OTH ANNIVERSARY. First operation took place in South Africa\nHEART TRANSPLANT 5OTH ANNIVERSARY. First heart...
2017-12-03 15:22:00	CNNW	19	CNNW_20171203_150000_Fareed_Zakaria_GPS/start/1320	TRUMP EXPECTED TO RECOGNIZE JERUSALEM AS ISRAELI CAPITAL\nNORTH KOREA SAYS NEW MISSILE CAN HIT ANYWHERE IN U.S.\nTRUMP EXPECTED TO RECOGNIZE JERUSALEM AS ISRAELI CAPITAL. . David Sanger...
2017-12-03 15:22:00	MSNBCW	57	MSNBCW_20171203_150000_AM_Joy/start/1320	NYTIMES: GOP SETS ITS SIGHTS ON. CUTI'ING SOCIAL SECURITY. MEDICARE
2017-12-03 15:23:00	CNNW	13	CNNW_20171203_150000_Fareed_Zakaria_GPS/start/1380	TRUMP EXPECTED TO RECOGNIZE JERUSALEM AS ISRAELI CAPITAL\nthe Tax Reconciliation Act /
2017-12-03 15:24:00	BBCNEWS	4	BBCNEWS_20171203_150000_BBC_News/start/1440	HR McMaster. National Security Advisor
2017-12-03 15:24:00	FOXNEWSW	15	FOXNEWSW_20171203_150000_Sunday_Morning_Futures_With_Maria_Bartiromo/start/1440	ICMASTER: N KOREA IS GREATEST IMMEDIATE THREAT. TO THE U. 5.; WE ARE IN A RACE TO SOLVE THE ISSUE. . CI I'I'I InCC\nICMASTER: N KOREA IS GREATEST IMMEDIATE THREAT. TO THE U.S.; WE ARE IN A RACE TO SOLVE THE ISSUE. . El I'I'I InEC
2017-12-03 15:24:00	MSNBCW	52	MSNBCW_20171203_150000_AM_Joy/start/1440	NYTIMES: GOP SETS ITS SIGHTS ON. CUTI'ING SOCIAL SECURITY. MEDICARE\nJAMAL SIMMONS | DEMOCRATIC STRATEGIST
2017-12-03 15:25:00	FOXNEWSW	9	FOXNEWSW_20171203_150000_Sunday_Morning_Futures_With_Maria_Bartiromo/start/1500	> BILL RICHARDSON D | FORMER NEW MEXICO GOVERNOR. . chASTER: N KOREA IS GREATEST IMMEDIATE THREAT. rn 11-\": II c - w: ADF IN A pArI: Tn cnnn: 11-\": Ice\u201d:
2017-12-03 15:25:00	MSNBCW	24	MSNBCW_20171203_150000_AM_Joy/start/1500	NYTIMES: GOP SETS ITS SIGHTS ON. CUTI'ING SOCIAL SECURITY. MEDICARE
2017-12-03 15:26:00	FOXNEWSW	19	FOXNEWSW_20171203_150000_Sunday_Morning_Futures_With_Maria_Bartiromo/start/1560	.CMASTER: N KOREA IS GREATEST IMMEDIATE THREAT. TO THE U. 5.; WE ARE IN A RACE TO SOLVE THE ISSUE. . El I'I'I InEC
2017-12-03 15:26:00	MSNBCW	29	MSNBCW_20171203_150000_AM_Joy/start/1560	NYTIMES: GOP SETS ITS SIGHTS ON. CUTI'ING SOCIAL SECURITY. MEDICARE\nKATON DAWSON I NATIONAL REPUBLICAN CONSULTANT
2017-12-03 15:27:00	MSNBCW	51	MSNBCW_20171203_150000_AM_Joy/start/1620	NYTIMES: GOP SETS ITS SIGHTS ON. CUTI'ING SOCIAL SECURITY. MEDICARE
2017-12-03 15:28:00	CNNW	48	CNNW_20171203_150000_Fareed_Zakaria_GPS/start/1680	WHAT IN THE WORLD
2017-12-03 15:28:00	FOXNEWSW	19	FOXNEWSW_20171203_150000_Sunday_Morning_Futures_With_Maria_Bartiromo/start/1680	IIN THE DISCUSSION ON TWITTER @SUNDAYFUTURES I. . \\l 'nrnlnu' EII'I'I Incc\n> BILL RICHARDSON D | FORMER NEW MEXICO GOVERNOR. . VICMASTER SAYS THREAT OF WAR WITH N KOREA IS. apnwwr: AFTFD DFGIMF'Q I ATFCT Mlccn...
2017-12-03 15:28:00	MSNBCW	49	MSNBCW_20171203_150000_AM_Joy/start/1680	NYTIMES: GOP SETS ITS SIGHTS ON. CUTI'ING SOCIAL SECURITY. MEDICARE\nJAMAL SIMMONS | DEMOCRATIC STRATEGIST
2017-12-03 15:29:00	BBCNEWS	3	BBCNEWS_20171203_150000_BBC_News/start/1740	ALEX FRASER. British Red Cross
2017-12-03 15:29:00	CNNW	29	CNNW_20171203_150000_Fareed_Zakaria_GPS/start/1740	WHAT IN THE WORLD\nWHAT IN THE WORLD. . . . countries, doin taxes takes most uteole a matter of minutes\nWHAT IN THE WORLD. . . . countries, doin taxes...
2017-12-03 15:29:00	FOXNEWSW	13	FOXNEWSW_20171203_150000_Sunday_Morning_Futures_With_Maria_Bartiromo/start/1740	ICMASTER: N KOREA IS GREATEST IMMEDIATE THREAT :. TO THE U.S.; WE ARE IN A RACE TO SOLVE THE ISSUE '. . :IITIIncc L\nICMASTER: N KOREA IS GREATEST IMMEDIATE THREAT :. TO THE U.S.; WE ARE IN A RACE TO SOLVE THE ISSUE '. . :II'rIIncc L\n.CMASTER: N KOREA...
2017-12-03 15:29:00	MSNBCW	10	MSNBCW_20171203_150000_AM_Joy/start/1740	NYTIMES: GOP SETS ITS SIGHTS ON. CUTI'ING SOCIAL SECURITY. MEDICARE
2017-12-03 15:30:00	BBCNEWS	9	BBCNEWS_20171203_150000_BBC_News/start/1800	O' - MONDAY 15:OO-\nSOCIAL MOBILITY BOARD QUIT
2017-12-03 15:30:00	CNNW	24	CNNW_20171203_150000_Fareed_Zakaria_GPS/start/1800	WHAT IN THE WORLD. . . . Reid: Tax aents in man countries are loud and oroud of their work\nWHAT IN THE WORLD. . . . Reid: A hit Jaoanese film deoicted the exoloits of a tax auditor\nLR. Reid is a reporter, author,_ and...
2017-12-03 15:30:00	FOXNEWSW	9	FOXNEWSW_20171203_150000_Sunday_Morning_Futures_With_Maria_Bartiromo/start/1800	EXPENSES
2017-12-03 15:30:00	MSNBCW	4	MSNBCW_20171203_150000_AM_Joy/start/1800	Nick Boltor
2017-12-03 15:31:00	CNNW	36	CNNW_20171203_150000_Fareed_Zakaria_GPS/start/1860	WHAT IN THE WORLD\nWHAT IN THE WORLD. . . . Reid: In other countries the don't O ive out tax breaks left and rioht\nWHAT IN THE WORLD. . . . Reid: A hit...
2017-12-03 15:32:00	CNNW	27	CNNW_20171203_150000_Fareed_Zakaria_GPS/start/1920	WHAT IN THE WORLD\nWHAT IN THE WORLD. . . . Reid: Lowerin rates leads to more taxoa ers, fewer law ers & accountants\nWHAT IN THE WORLD. Reid:When ou...
2017-12-03 15:32:00	FOXNEWSW	12	FOXNEWSW_20171203_150000_Sunday_Morning_Futures_With_Maria_Bartiromo/start/1920	Lilelime Guaranlee (Less PEN) lAllow 2-4 weeks tor delivery \u201c\u2014
2017-12-03 15:33:00	CNNW	21	CNNW_20171203_150000_Fareed_Zakaria_GPS/start/1980	WHAT IN THE WORLD. . . . Reid: Reoublicans do want to oet rid of some reall stuoid tax breaks\nWHAT IN THE WORLD. . . . Reid: GOPtax clan has some ood ideas, like doublino the standard deduction\nWHAT IN THE WORLD. . . ....
2017-12-03 15:33:00	FOXNEWSW	10	FOXNEWSW_20171203_150000_Sunday_Morning_Futures_With_Maria_Bartiromo/start/1980	RPT: TX LAWMAKER USED TAXPAYER FUNDS I. TO SETTLE SEXUAL HARASSMENT CLAIMS. . El I'I'I InEC
2017-12-03 15:34:00	CNNW	9	CNNW_20171203_150000_Fareed_Zakaria_GPS/start/2040	WHAT IN THE WORLD. . . . Reid: Donald Trumo ' o-oin to make out oreat on this bill\nWHAT IN THE WORLD. . . . Reid: GOPtax clan has some ood ideas, like doublino the standard deduction
2017-12-03 15:34:00	MSNBCW	3	MSNBCW_20171203_150000_AM_Joy/start/2040	HCCOFOIng IO \u201c151$\" OO1O AU I O. . These statements Eve been evaluated byrthe FDA.W. . Tkie min/d: \u201d<5 :r nAV inbnn/JAA \ufb01m<k A. urn Ar Am .An} an: . Amnm\u2014A
2017-12-03 15:35:00	FOXNEWSW	9	FOXNEWSW_20171203_150000_Sunday_Morning_Futures_With_Maria_Bartiromo/start/2100	)V 29: HOUSE PASSED RESOLUTION TO REQUIRE ANNUAL. X:UAL HARASSMENT TRAINING FOR ALL MEMBERS, STAFF. . El I'I'I InCC\nLULTIPLE DEM LAWMAKERS, INCLUDING PELOSI (D- CA) AND. YBURN (D- SC), HAVE CALLED ON CONYERS (D- Ml) TO RESIGN. . El I'I'I InEC\nIOV 27:...
2017-12-03 15:36:00	FOXNEWSW	18	FOXNEWSW_20171203_150000_Sunday_Morning_Futures_With_Maria_Bartiromo/start/2160	RPT: TX LAWMAKER USED TAXPAYER FUNDS. TO SETTLE SEXUAL HARASSMENT CLAIMS. . El I'I'I InEC\nIDAY: FARENTHOLD (R-TX) REVEALED TO BE LAWMAKER WHO. ADE $84K HARASSMENT SETTLEMENT W/ COMMS DIRECTOR. . CI I'I'I InCC\nT: MEMBERS OF...
2017-12-03 15:37:00	FOXNEWSW	12	FOXNEWSW_20171203_150000_Sunday_Morning_Futures_With_Maria_Bartiromo/start/2220	RPT: TX LAWMAKER USED TAXPAYER FUNDS. TO SE'I'I'LE SEXUAL HARASSMENT CLAIMS. . El I'I'I InEC\nRPT: TX LAWMAKER USED TAXPAYER FUNDS I. TO SE'I'I'LE SEXUAL HARASSMENT CLAIMS. . El I'I'I Incc
2017-12-03 15:37:00	MSNBCW	13	MSNBCW_20171203_150000_AM_Joy/start/2220	LATEST NORTH KOREA MISSILE LAUNCH. STOKES HEIGHTENED TENSIONS WITH US.
2017-12-03 15:38:00	CNNW	33	CNNW_20171203_150000_Fareed_Zakaria_GPS/start/2280	THE TRUMP EFFECT IN TEHRAN\nTHE TRUMP EFFECT IN IRAN
