2017-11-28 00:00:00	CNNW	13	CNNW_20171127_230000_Situation_Room_With_Wolf_Blitzer/start/3600	TRUMP CALLS SEN. WARREN \"POCAHONTAS\" AS HE HONORS NATIVE. AMERICANS; NAVAJO NATION RESPONDS SAYING \u201cPREJUDICE\u201d EXISTS
2017-11-28 00:00:00	FOXNEWSW	11	FOXNEWSW_20171127_230000_Special_Report_With_Bret_Baier/start/3600	ENATOR WARREN LASHES OUT OVER TRUMP'S PICK. FOR CONSUMER FINANCIAL PROTECTION BUREAU\nIADERSHIP SHOWDOWN AT FEDERAL AGENCY I\nIADERSHIP SHOWDOWN AT FEDERAL AGENCY
2017-11-28 00:00:00	MSNBCW	7	MSNBCW_20171127_230000_The_Beat_With_Ari_Melber/start/3600	WATCH THANKSGIVING SPECIAL. AT THERFATWITHADLCOM\nRUSSIA ON TRIAL: THE COLLUSION DEBATE
2017-11-28 00:01:00	BBCNEWS	31	BBCNEWS_20171128_000000_Newsday/start/60	BALI VOLCANO THREAT. Alert at highest level over fears of maior eruption\nWHO IS MEGHAN MABKLE?
2017-11-28 00:01:00	FOXNEWSW	18	FOXNEWSW_20171128_000000_The_Story_With_Martha_MacCallum/start/60	ADERSHIP SHOWDOWN AT FEDERAL AGENCY\nIADERSHIP SHOWDOWN AT FEDERAL AGENCY
2017-11-28 00:01:00	MSNBCW	8	MSNBCW_20171128_000000_Hardball_With_Chris_Matthews/start/60	TRUMP APOLOGIZES FOR \"ACCESS HOLLYWOOD\" TAPE
2017-11-28 00:02:00	FOXNEWSW	25	FOXNEWSW_20171128_000000_The_Story_With_Martha_MacCallum/start/120	)WER STRUGGLE BATTLE BREAKS OUT AT CFPB I\ntUELING \"ACTING DIRECTORS\" SHOW UP FOR WORK. AT CONSUMER FINANCIAL PROTECTION BUREAU\nnun/l lllllll: TnllllIZUT
2017-11-28 00:02:00	MSNBCW	9	MSNBCW_20171128_000000_Hardball_With_Chris_Matthews/start/120	SANDERS: HARASSMENT ACCUSATIONS AGAINST. TDUMD WFDF \"I ITIGATFD\" RY THF Fl FCTION\nTRUMP APOLOGIZES FOR \"ACCESS HOLLYWOOD\" TAPE\nSANDERS: HARASSMENT ACCUSATIONS AGAINST. TpuMD WFDF \"I ITIGATFD\" RY THF Fl FCTION\nSARAH...
2017-11-28 00:03:00	BBCNEWS	16	BBCNEWS_20171128_000000_Newsday/start/180	BALI VOLCANO THREAT. Alert at highest level over fears of major eruption\nBALI VOLCANO THREAT. Rain created destructive 'Iahavs' or cold lava \ufb02ows
2017-11-28 00:03:00	FOXNEWSW	24	FOXNEWSW_20171128_000000_The_Story_With_Martha_MacCallum/start/180	ASHBACK: ELIZABETH WARREN ESTABLISHED CFPB I\nAWSUIT FILED OVER CFPB LEADERSHIP I\n'UELING \"ACTING DIRECTORS\" SHOW UP FOR WORK. AT CONSUMER FINANCIAL PROTECTION BUREAU
2017-11-28 00:03:00	MSNBCW	36	MSNBCW_20171128_000000_Hardball_With_Chris_Matthews/start/180	WHITE HOUSE: TRUMP WON\u2019T CAMPAIGN FOR MOORE
2017-11-28 00:04:00	BBCNEWS	11	BBCNEWS_20171128_000000_Newsday/start/240	BALI VOLCANO THREAT. Dark smoke 8. ash seen up to 3,4OOm above summit\nBALI VOLCANO THREAT. About 1OO,OOO people urged to move to safety\nBALI VOLCANO THREAT. Island's only airpon Ngurah Rai has been...
2017-11-28 00:04:00	FOXNEWSW	30	FOXNEWSW_20171128_000000_The_Story_With_Martha_MacCallum/start/240	DWER STRUGGLE BREAKS OUT AT CFPB I\nGAL CLASH OVER WHO IS IN CHARGE OF CFPB I\nAWSUIT FILED OVER CFPB LEADERSHIP
2017-11-28 00:04:00	MSNBCW	35	MSNBCW_20171128_000000_Hardball_With_Chris_Matthews/start/240	NYT: ONE YEAR AFFER APOLOGIZING, TRUMP NOW. SUGGFSTING \"ACCFSS HOI I vwonn\" TADF MAY RF A FAKF\nWHITE HOUSE: TRUMP WON'T CAMPAIGN FOR MOORE\nWHITE HOUSE: TRUMP WON\u2019T CAMPAIGN FOR MOORE
2017-11-28 00:05:00	MSNBCW	33	MSNBCW_20171128_000000_Hardball_With_Chris_Matthews/start/300	SANDERS: HARASSMENT ACCUSATIONS AGAINST. TDUMD WFDF \"I ITIGATFD\" RY THF Fl FCTION\nNYT: ONE YEAR AFFER APOLOGIZING, TRUMP NOW. SUGGFSTING \"ACCFSS HOI I vwonn\" TADF MAY RF A FAKF\nANNIE LINSKEY I THE BOSTON GLOBE
2017-11-28 00:06:00	BBCNEWS	11	BBCNEWS_20171128_000000_Newsday/start/360	LT '. \"mom I\nNEWSDAV
2017-11-28 00:07:00	FOXNEWSW	33	FOXNEWSW_20171128_000000_The_Story_With_Martha_MacCallum/start/420	JUDGE NAPOLITANO ON LEGAL BA'ITLE AT. CONSUMER FINANCIAL PROTECTION BUREAU\nIi\u201c m1!) LIN \ufb01rm Ig;\\N';L|d~H. . GAL CLASH OVER IIIIHO IS IH CHARGE OF CFPB
2017-11-28 00:07:00	MSNBCW	51	MSNBCW_20171128_000000_Hardball_With_Chris_Matthews/start/420	TRUMP SLAMS ACCUSERS AS \"HORRIBLE WOMEN\"\nNYT: ONE YEAR AFFER APOLOGIZING, TRUMP NOW. SUGGFSTING \"ACCFSS HOI I vwonn\" TADF MAY RF A FAKF
2017-11-28 00:08:00	BBCNEWS	16	BBCNEWS_20171128_000000_Newsday/start/480	SVRIAN GOVERNMENT FORCES HIT REBEL STRONGHOLD. Dozens of people killed in Eastern Ghouta\nEU SETTLES DISPUTE OVER MAJOR WEEDKILLER. Despite concerns glyphosate could cause cancer
2017-11-28 00:08:00	CNNW	20	CNNW_20171128_000000_Erin_Burnett_OutFront/start/480	TRUMP MAKES \"POCAHONTAS\" REMARK AS HE HONORS NATIVE AMERICANS. . Van Jones Former Special Adviser to President Obama\nTRUMP MAKES \"POCAHONTAS\" REMARK AS HE HONORS NATIVE AMERICANS. . Jack Kingston Former Senior Adviser, 2O16 Trump Campaign\nTRUMP CALLS...
2017-11-28 00:08:00	MSNBCW	39	MSNBCW_20171128_000000_Hardball_With_Chris_Matthews/start/480	NYT: ONE YEAR AFFER APOLOGIZING, TRUMP NOW. SUGGFSTING \"ACCFSS HOI I vwnnn\" TADF MAY RF A FAKF\nTRUMP APOLOGIZES FOR \"ACCESS HOLLYWOOD\" TAPE\nTRUMP SLAMS ACCUSERS AS \"HORRIBLE WOMEN\
2017-11-28 00:09:00	BBCNEWS	19	BBCNEWS_20171128_000000_Newsday/start/540	US FINANCIAL WATCHDOG ROW. Row involving Consumer Financial Protection Bureau\nEU SETTLES DISPUTE OVER MAJOR WEEDKILLEH. Despite concerns glyphosate could cause cancer
2017-11-28 00:09:00	CNNW	58	CNNW_20171128_000000_Erin_Burnett_OutFront/start/540	TRUMP CALLS SEN. WARREN \"POCAHONTAS\" AS HE HONORS NATIVE. AMERICANS; NAVAJO NATION RESPONDS SAYING \u201cPREJUDICE\u201d EXISTS\nTRUMP MAKES \"POCAHONTAS\" REMARK AS HE HONORS NATIVE AMERICANS. . Jack Kingston Former Senior Adviser, 2O16 Trump Campaign
2017-11-28 00:09:00	FOXNEWSW	15	FOXNEWSW_20171128_000000_The_Story_With_Martha_MacCallum/start/540	tUELING \"ACTING DIRECTORS\" SHOW UP FOR WORK. AT CONSUMER FINANCIAL PROTECTION BUREAU. . m 1:;\nDWER STRUGGLE BREAKS OUT AT CFPB\nWHITE HOUSE SAYS PRESIDENT TRUMP HAS. LEGAL RIGHT TO APPOINT ACTING CFPB DIRECTOR\n'UELING \"ACTING...
2017-11-28 00:10:00	BBCNEWS	15	BBCNEWS_20171128_000000_Newsday/start/600	COMING UP\nNEWSDAV
2017-11-28 00:10:00	FOXNEWSW	16	FOXNEWSW_20171128_000000_The_Story_With_Martha_MacCallum/start/600	WHITE HOUSE SAYS PRESIDENT TRUMP HAS. LEGAL RIGHT TO APPOINT ACTING CFPB DIRECTOR
2017-11-28 00:10:00	MSNBCW	26	MSNBCW_20171128_000000_Hardball_With_Chris_Matthews/start/600	WHITE HOUSE: TRUMP WON'T CAMPAIGN FOR MOORE\nNYT: ONE YEAR AFFER APOLOGIZING, TRUMP NOW. SUGGFSTING \"ACCFSS HOI I vwonn\" TADF MAY RF A FAKF\nTRUMP BLASTS MOORE OPPONENT DOUG JONES
2017-11-28 00:11:00	MSNBCW	62	MSNBCW_20171128_000000_Hardball_With_Chris_Matthews/start/660	WHITE HOUSE: TRUMP WON'T CAMPAIGN FOR MOORE
2017-11-28 00:12:00	MSNBCW	37	MSNBCW_20171128_000000_Hardball_With_Chris_Matthews/start/720	GOP SENATORS CALL ON MOORE TO STEP ASIDE\nWHITE HOUSE: TRUMP WON'T CAMPAIGN FOR MOORE
2017-11-28 00:13:00	FOXNEWSW	9	FOXNEWSW_20171128_000000_The_Story_With_Martha_MacCallum/start/780	)O-CASH coshgg\ufb02fJ
2017-11-28 00:14:00	MSNBCW	14	MSNBCW_20171128_000000_Hardball_With_Chris_Matthews/start/840	WHITE HOUSE: TRUMP WON\u2019T CAMPAIGN FOR MOORE
2017-11-28 00:15:00	BBCNEWS	7	BBCNEWS_20171128_000000_Newsday/start/900	NEWSDAV Auckland\nBAWK SAN. Kachin student
2017-11-28 00:15:00	CNNW	7	CNNW_20171128_000000_Erin_Burnett_OutFront/start/900	By prescription only HUMIRAW. . adalimumab\nHUMIRA is taken by injection HUMIRA\". adalimumab
2017-11-28 00:16:00	BBCNEWS	3	BBCNEWS_20171128_000000_Newsday/start/960	NEWSDAY
2017-11-28 00:16:00	CNNW	12	CNNW_20171128_000000_Erin_Burnett_OutFront/start/960	AWAITING JUDGE'S DECISION ON DUELING CONSUMER WATCHDOG HEADS
2017-11-28 00:16:00	FOXNEWSW	19	FOXNEWSW_20171128_000000_The_Story_With_Martha_MacCallum/start/960	lUMP OPTIMISTIC TAX REFORM HAS ENOUGH VOTES I\nENATORS CLOSE TO VOTE ON TAX REFORM BILL
2017-11-28 00:16:00	MSNBCW	29	MSNBCW_20171128_000000_Hardball_With_Chris_Matthews/start/960	NEW MOORE POLITICAL AD: \"NOT A HINT OF SCANDAL\
2017-11-28 00:17:00	BBCNEWS	4	BBCNEWS_20171128_000000_Newsday/start/1020	U AYE LWIN. Religions for Peace, Myanmar
2017-11-28 00:17:00	FOXNEWSW	32	FOXNEWSW_20171128_000000_The_Story_With_Martha_MacCallum/start/1020	ENATORS CLOSE TO VOTE ON TAX REFORM BILL
2017-11-28 00:18:00	BBCNEWS	11	BBCNEWS_20171128_000000_Newsday/start/1080	THE POPE IN MYANMAR. Pope to meet Myanmar's de tacto leader Aung San Suu Kyi\nTHE POPE IN MYANMAR. Pope Francis is visiting Myanmar\nTHE POPE IN MYANMAR. Not clear i1 Pope will mention plight of Rohingyas\nOLIVER...
2017-11-28 00:18:00	CNNW	40	CNNW_20171128_000000_Erin_Burnett_OutFront/start/1080	AWAITING JUDGE'S DECISION ON DUELING CONSUMER WATCHDOG HEADS. . Richard Cordrav Former Director, Consumer Financial Protection Bureau\nAWAITING JUDGE'S DECISION ON DUELING CONSUMER WATCHDOG HEADS
2017-11-28 00:18:00	FOXNEWSW	3	FOXNEWSW_20171128_000000_The_Story_With_Martha_MacCallum/start/1080	w\u201c, 'J'JONSCOMMI'I'I'EE. . N LANKE6R6 6N WHY HE s N6T'sou') ON TAX BILL _;
2017-11-28 00:19:00	BBCNEWS	10	BBCNEWS_20171128_000000_Newsday/start/1140	THE POPE IN MYANMAR. Pope has met the head of Myanmar's military\nTHE POPE IN MYANMAR. Army chief: No religious discrimination in Myanmar\nTHE POPE IN MYANMAR. The Pope will travel on to Bangladesh\nTHE...
2017-11-28 00:19:00	MSNBCW	6	MSNBCW_20171128_000000_Hardball_With_Chris_Matthews/start/1140	MAJOR DEVELOPMENTS IN RUSSIA INVESTIGATION
2017-11-28 00:20:00	BBCNEWS	16	BBCNEWS_20171128_000000_Newsday/start/1200	BALI VOLCANO THREAT. Alert at highest level over fears of major eruption\nBALI VOLCANO THREAT. Rain created destructive 'Iahavs' or cold lava flows\nBALI VOLCANO THREAT. Dark smoke & ash seen up to 3,4OOm...
2017-11-28 00:20:00	CNNW	32	CNNW_20171128_000000_Erin_Burnett_OutFront/start/1200	AWAITING JUDGE'S DECISION ON DUELING CONSUMER WATCHDOG HEADS\nAWAITING JUDGE'S DECISION ON DUELING CONSUMER WATCHDOG HEADS. . Richard Cordrav Former Director, Consumer Financial Protection...
2017-11-28 00:20:00	FOXNEWSW	4	FOXNEWSW_20171128_000000_The_Story_With_Martha_MacCallum/start/1200	> SENATOR J E '4\". ' I:. . N LANKFORD ON WHY NE' S NOT SOLD ON TAX BILL
2017-11-28 00:20:00	MSNBCW	25	MSNBCW_20171128_000000_Hardball_With_Chris_Matthews/start/1200	MICHAEL FLYNN\u2019S LAWYERS SPLIT FROM TRUMP\nSPLIT WITH WHITE HOUSE MAY MEAN FLYNN. DI ANS ON COODFDATING WITH MllFl I Fp\nMAJOR DEVELOPMENTS IN RUSSIA INVESTIGATION
2017-11-28 00:21:00	BBCNEWS	11	BBCNEWS_20171128_000000_Newsday/start/1260	BALI VOLCANO THREAT. Island's only airpon Ngurah Rai has been closed\nBALI VOLCANO THREAT. Authorities preparing to lorcibly evict residents\nBALI VOLCANO THREAT. Volcano's 1963 eruption killed about 1,6OO...
2017-11-28 00:21:00	CNNW	50	CNNW_20171128_000000_Erin_Burnett_OutFront/start/1260	AWAITING JUDGE'S DECISION ON DUELING CONSUMER WATCHDOG HEADS. . Richard Cordrav Former Director, Consumer Financial Protection Bureau\nAWAITING JUDGE'S DECISION ON DUELING CONSUMER WATCHDOG HEADS
2017-11-28 00:21:00	FOXNEWSW	14	FOXNEWSW_20171128_000000_The_Story_With_Martha_MacCallum/start/1260	ENATE COULD VOTE THIS WEEK ON TAX REFORM\nEN LANKFORD ON NEW ANNUAL WASTE REPORT\n:N LANKFORD ON NEW ANNUAL WASTE REPORT __;\n:N LANKFDRD DN NEW ANNUAL WASTE REPORT __;
2017-11-28 00:22:00	BBCNEWS	10	BBCNEWS_20171128_000000_Newsday/start/1320	BALI VOLCANO THREAT. About 1OO,OOO people urged to move to safety\nBALI VOLCANO THREAT. Dark smoke & ash seen up to 3,4OOm above summit\nBALI VOLCANO THREAT. Island's only airport Ngurah Rai has been...
2017-11-28 00:22:00	CNNW	27	CNNW_20171128_000000_Erin_Burnett_OutFront/start/1320	AWAITING JUDGE'S DECISION ON DUELING CONSUMER WATCHDOG HEADS\nAWAITING JUDGE'S DECISION ON DUELING CONSUMER WATCHDOG HEADS. . Richard Cordrav Former Director, Consumer Financial Protection...
2017-11-28 00:23:00	CNNW	30	CNNW_20171128_000000_Erin_Burnett_OutFront/start/1380	SHOWDOWN OVER TOP POST AT CONSUMER WATCHDOG AGENCY. . Richard Cordrav Former Director. Consumer Financial Protection Bureau
2017-11-28 00:23:00	FOXNEWSW	18	FOXNEWSW_20171128_000000_The_Story_With_Martha_MacCallum/start/1380	D.RL ROVE ON FUTURE OF SENATE GOP TAX BILL\nDVE: GOP WILL GET ACROSS THE FINISH LINE _;
2017-11-28 00:23:00	MSNBCW	62	MSNBCW_20171128_000000_Hardball_With_Chris_Matthews/start/1380	SPLIT WITH WHITE HOUSE MAY MEAN FLYNN. DI ANS ON COODFDATING WITH MllFl I Fp
2017-11-28 00:24:00	BBCNEWS	16	BBCNEWS_20171128_000000_Newsday/start/1440	news'nu-\nNEWSDAV
2017-11-28 00:24:00	FOXNEWSW	29	FOXNEWSW_20171128_000000_The_Story_With_Martha_MacCallum/start/1440	\ufb02\ufb02cll \u201dIII: T\ufb02\ufb02l'cuf\nD.RL ROVE ON FUTURE OF SENATE GOP TAX BILL
2017-11-28 00:25:00	BBCNEWS	4	BBCNEWS_20171128_000000_Newsday/start/1500	ELIZABETH NVAMAYARO. Senior Adviser. UN Women
2017-11-28 00:25:00	FOXNEWSW	18	FOXNEWSW_20171128_000000_The_Story_With_Martha_MacCallum/start/1500	D.RL ROVE ON FUTURE OF SENATE GOP TAX BILL
2017-11-28 00:25:00	MSNBCW	47	MSNBCW_20171128_000000_Hardball_With_Chris_Matthews/start/1500	SPLIT WITH WHITE HOUSE MAY MEAN FLYNN. DI ANS ON COODFDATING WITH MllFl I Fp\nBARBARA MCQUADE I FORMER U.S. ATTORNEY
2017-11-28 00:26:00	BBCNEWS	9	BBCNEWS_20171128_000000_Newsday/start/1560	TUESDAV O8:OO
2017-11-28 00:26:00	MSNBCW	29	MSNBCW_20171128_000000_Hardball_With_Chris_Matthews/start/1560	MICHAEL FLYNN\u2019S LAWYERS SPLIT FROM TRUMP\nSPLIT WITH WHITE HOUSE MAY MEAN FLYNN. DI ANS ON COODFDATING WITH MllFl I Fp\nMA'I-r APUZZO I EllcgN\ufb02u\ufb02orkEimrs\nBARBARA MCQUADE I...
2017-11-28 00:27:00	CNNW	15	CNNW_20171128_000000_Erin_Burnett_OutFront/start/1620	NYT: TRUMP SUGGESTS TAPE OF HIM SAYING \"GRAB THEM BY THE P****\u201c. IS FAKE. (THE SAME TAPE HE ACKNOWLEDGED & APOLOGIZED FOR)
2017-11-28 00:27:00	MSNBCW	49	MSNBCW_20171128_000000_Hardball_With_Chris_Matthews/start/1620	SPLIT WITH WHITE HOUSE MAY MEAN FLYNN. DI ANS ON COODFDATING WITH MllFl I Fp
2017-11-28 00:28:00	FOXNEWSW	4	FOXNEWSW_20171128_000000_The_Story_With_Martha_MacCallum/start/1680	I Tel! your doctor if yqu are pr'egnang, plgn
2017-11-28 00:29:00	MSNBCW	13	MSNBCW_20171128_000000_Hardball_With_Chris_Matthews/start/1740	GetSodaStream.com
2017-11-28 00:30:00	FOXNEWSW	26	FOXNEWSW_20171128_000000_The_Story_With_Martha_MacCallum/start/1800	ANKEN: NO MAGIC WORDS I CAN SAY TO REGAIN YOUR. TRUST, AND I KNOW THAT'S GOING TO TAKE TIME
2017-11-28 00:30:00	MSNBCW	6	MSNBCW_20171128_000000_Hardball_With_Chris_Matthews/start/1800	. Real Ebates members tell their stories.
2017-11-28 00:31:00	FOXNEWSW	12	FOXNEWSW_20171128_000000_The_Story_With_Martha_MacCallum/start/1860	PELOSI: I DON'T THINK YOU CAN EQUATE. SENATOR FRANKEN WITH ROY MOORE\n:I.OS|: CONYERg IS AN \"ICON IN OUR COUNTRY\";\nELOSI: CONYERS IS AN \"ICON IN OUR COUNTRY\" h
2017-11-28 00:31:00	MSNBCW	8	MSNBCW_20171128_000000_Hardball_With_Chris_Matthews/start/1860	GOP SEN. JOHNSON MAY VOTE AGAINST TAX BILL\nBALI CANCELS FLIGHTS FOR SECOND DAY. AS vnl CANO FOPCFS FVACUATIONS
2017-11-28 00:32:00	FOXNEWSW	16	FOXNEWSW_20171128_000000_The_Story_With_Martha_MacCallum/start/1920	PELOSI: I DON'T THINK YOU CAN EQUATE. SENATOR FRANKEN WITH ROY MOORE\nmomma]: 3'7
2017-11-28 00:32:00	MSNBCW	8	MSNBCW_20171128_000000_Hardball_With_Chris_Matthews/start/1920	PRINCE HARRY AND MEGHAN MARKLE ENGAGED
2017-11-28 00:33:00	CNNW	31	CNNW_20171128_000000_Erin_Burnett_OutFront/start/1980	NYT: TRUMP QUESTIONS AUTHENTICITY OF \"ACCESS HOLLYWOOD\" TAPE. . Mark Preston Cl\\l\\I Senior Political Analyst\nNYT: TRUMP SUGGESTS TAPE OF HIM SAYING \"GRAB THEM BY THE P****\u201c. IS FAKE (THE SAME TAPE HE ACKNOWLEDGED & APOLOGIZED FOR)
2017-11-28 00:33:00	FOXNEWSW	7	FOXNEWSW_20171128_000000_The_Story_With_Martha_MacCallum/start/1980	NOWHERE a7
2017-11-28 00:33:00	MSNBCW	20	MSNBCW_20171128_000000_Hardball_With_Chris_Matthews/start/1980	PELOSI ON CONYERS ACCUSERS: \"I DON'T KNOW WHO THEY ARE\"\nREP. CONYERS STEPS DOWN FROM JUDICIARY CMTE.. WHII F DFNYING HADASSMFNT ACCIISATIONS
2017-11-28 00:34:00	CNNW	32	CNNW_20171128_000000_Erin_Burnett_OutFront/start/2040	NYT: TRUMP SUGGESTS TAPE OF HIM SAYING \"GRAB THEM BY THE P****\u201c. IS FAKE (THE SAME TAPE HE ACKNOWLEDGED & APOLOGIZED FOR)\nNYT: TRUMP QUESTIONS AUTHENTICITY OF \"ACCESS HOLLYWOOD\" TAPE. . Alex Burns National Political Reporter, The New York Times\nNYT: TRUMP...
2017-11-28 00:34:00	FOXNEWSW	35	FOXNEWSW_20171128_000000_The_Story_With_Martha_MacCallum/start/2040	ASHBACK: PELOSI ON CLINTON ALLEGATIONS\n:|.OS| NOW SAYS SHE BELIEVES CONYERS ACCUSER __;
2017-11-28 00:34:00	MSNBCW	61	MSNBCW_20171128_000000_Hardball_With_Chris_Matthews/start/2040	PELOSI ON CONYERS ACCUSERS: \"I DON'T KNOW WHO THEY ARE\
2017-11-28 00:35:00	FOXNEWSW	38	FOXNEWSW_20171128_000000_The_Story_With_Martha_MacCallum/start/2100	NEW QUESTIONS SURROUNDING FUTURE OF DEM. WMAKERS FACING SEXUAL MISCONDUCT ALLEGATIONS\nGROWING CALLS FOR CONGRESS TO STEP UP. RESPONSE TO SEXUAL HARASSMENT ALLEGATIONS
2017-11-28 00:36:00	FOXNEWSW	16	FOXNEWSW_20171128_000000_The_Story_With_Martha_MacCallum/start/2160	GROWING CALLSFOR CONGRESS TO STEP UP. DFQDONCF Tn (FYIIAI HAnAchFNT Al I FnATInmc .\u2014\nGROWING CALLS'FOR CONGRESS TO STEP UP. DFCDONCF Tn (FYIIAI HADAQQMFNT Al I FnATIrwc __#\nGROWING CALLS FOR CONGRESS TO STEP UP....
2017-11-28 00:36:00	MSNBCW	45	MSNBCW_20171128_000000_Hardball_With_Chris_Matthews/start/2160	FRANKEN \"EMBARRASSED AND ASHAMED\" OF PAST CONDUCT\nREP. PELOSI FACING BACKLASH FOR. COMMFNTS ON CONYFDS Accuans\nKASIE HUNT I swam NEWS\nFRANKEN APOLOGIZES AFI'ER GROPING ACCUSATIONS
2017-11-28 00:37:00	MSNBCW	32	MSNBCW_20171128_000000_Hardball_With_Chris_Matthews/start/2220	FRANKEN: WILL COOPERATE \"COMPLETELY\" WITH ETHICS CMTE.\nSEN. FRANKEN: \"I'VE LET A LOT OF PEOPLE DOWN\"\nFRANKEN APOLOGIZES AFI'ER GROPING ACCUSATIONS
2017-11-28 00:38:00	FOXNEWSW	10	FOXNEWSW_20171128_000000_The_Story_With_Martha_MacCallum/start/2280	Available at mend at basspro.com
2017-11-28 00:38:00	MSNBCW	43	MSNBCW_20171128_000000_Hardball_With_Chris_Matthews/start/2280	SEN. FRANKEN: \"I'VE LET A LOT OF PEOPLE DOWN\"\nREP. PELOSI: I HAVE ASKED FOR. Fri-Hrs INVFSTIGATION INTO CONYFDS
2017-11-28 00:39:00	FOXNEWSW	7	FOXNEWSW_20171128_000000_The_Story_With_Martha_MacCallum/start/2340	BUY NOW AT RING.COM
2017-11-28 00:40:00	CNNW	8	CNNW_20171128_000000_Erin_Burnett_OutFront/start/2400	ROY MOORE HOLDING ALABAMA RALLY; DENIES. ALLEGATIONS OF CHILD MOLESTATION, SEXUAL ABUSE
2017-11-28 00:41:00	FOXNEWSW	13	FOXNEWSW_20171128_000000_The_Story_With_Martha_MacCallum/start/2460	NEW QUESTIONS SURROUNDING. WITNESS IN URANIUM ONE CASE
2017-11-28 00:42:00	MSNBCW	29	MSNBCW_20171128_000000_Hardball_With_Chris_Matthews/start/2520	TRUMP CALLS WARREN \"POCAHONTAS\". AT FVFNT HONODING NATIVF AMFDICANS
2017-11-28 00:43:00	CNNW	22	CNNW_20171128_000000_Erin_Burnett_OutFront/start/2580	ROY MOORE HOLDS RALLY; DENIES ALLEGATIONS. BUT REFUSES TO TAKE QUESTIONS\nROY MOORE HOLDING ALABAMA RALLY; DENIES. ALLEGATIONS OF CHILD MOLESTATION, SEXUAL ABUSE\nROY MOORE HOLDING RALLY IN ALABAMA. . Bill...
2017-11-28 00:43:00	FOXNEWSW	9	FOXNEWSW_20171128_000000_The_Story_With_Martha_MacCallum/start/2580	k VICTORIA TOENSING l FBI INFORMANT'S A'ITORNEY. . RPT: FED OFFICIALS HAVE SERIOUS QUESTIONS. Apnl wn rpanu [TV on: law wmumc T;\nb VICTORIA TOENSING I FBI INFORMANT'S ATTORNEY. . RPT: FED OFFICIALS HAVE SERIOUS QUESTIONS. Apnl an rppnmu [TV or law wmumc T;
2017-11-28 00:43:00	MSNBCW	40	MSNBCW_20171128_000000_Hardball_With_Chris_Matthews/start/2580	TRUMP CALLS WARREN \"POCAHONTAS\". AT FVFNT HONODING NATIVF AMFDICANS\nDAVID CATANESE I U.S. NEWS & WORLD REPORT\nSEN ELIZABETH WARREN I (D) MASSACHUSETTS
2017-11-28 00:44:00	CNNW	31	CNNW_20171128_000000_Erin_Burnett_OutFront/start/2640	ROY MOORE HOLDS RALLY; DENIES ALLEGATIONS. BUT REFUSES TO TAKE QUESTIONS\nROY MOORE SPEAKS AT FIRST PUBLIC APPEARANCE IN DAYS. . Bill Kristol Former Chief of Staff to Vice President Dan Quayle\nROY MOORE...
2017-11-28 00:44:00	FOXNEWSW	23	FOXNEWSW_20171128_000000_The_Story_With_Martha_MacCallum/start/2640	HORNEY FOR FBI INFORMANT REBUFFS REPORT 7;\ni\u00bb VICTORIA TOENSING l FBI INFORMANT'S A'ITORNEY. . RPT: FED OFFICIALS HAVE SERIOUS QUESTIONS. Apnl wn rpanu [TV on: law wmumc T;
2017-11-28 00:44:00	MSNBCW	59	MSNBCW_20171128_000000_Hardball_With_Chris_Matthews/start/2640	TRUMP CALLS WARREN \"POCAHONTAS\". AT FVFNT HONODING NATIVF AMFDICANS
2017-11-28 00:45:00	CNNW	47	CNNW_20171128_000000_Erin_Burnett_OutFront/start/2700	ROY MOORE SPEAKS AT FIRST PUBLIC APPEARANCE IN DAYS. . Bill Kristol The Weekly Standard Editor-at-Larqe\nROY MOORE SPEAKS AT FIRST PUBLIC APPEARANCE IN DAYS
2017-11-28 00:45:00	MSNBCW	19	MSNBCW_20171128_000000_Hardball_With_Chris_Matthews/start/2700	SEN. WARREN: \"TRUMP DOES THIS OVER AND. OVFD,\" HF IS NOT \"GOING To SHUT MF up WITH IT\"\nTRUMP CALLS WARREN \"POCAHONTAS\". AT FVFNT HONODING NATIVF AMFDICANS\nTRUMP TO NATIVE AMERICAN WAR HEROES:. Om: MFMRFR O|: CONGRFSS CAI...
2017-11-28 00:46:00	MSNBCW	25	MSNBCW_20171128_000000_Hardball_With_Chris_Matthews/start/2760	TRUMP CALLS WARREN \"POCAHONTAS\". AT FVFNT HONODING NATIVF AMFDICANS\nSEN. WARREN: TRUMP CAN'T EVEN MAKE IT THROUGH. A CFpFMan WITHOUT HAVING TO us: A \"PACIAI SI up\"\nWARREN: TRUMP\u2019S \"POCAHONTAS\" COMMENT...
2017-11-28 00:47:00	MSNBCW	20	MSNBCW_20171128_000000_Hardball_With_Chris_Matthews/start/2820	WH: RIDICULOUS To CALL TRUMP'S USE OF \"POCAHONTAS\". AT NATIVF AMFDICAN WAD HFDOFS FVFNT A \"DACIAI SI up\"\nTRUMP CALLS WARREN \"POCAHONTAS\". AT FVFNT HONODING NATIVF AMFDICANS\nWH: \"NOT THE PRESIDENT'S INTENT\" TO USE RACIAL SLUR\nWARREN:...
2017-11-28 00:48:00	CNNW	4	CNNW_20171128_000000_Erin_Burnett_OutFront/start/2880	Diabetic heart disease\u201d refers to heart disease that develops in people who have diabei
2017-11-28 00:48:00	FOXNEWSW	11	FOXNEWSW_20171128_000000_The_Story_With_Martha_MacCallum/start/2880	SEA/Ml! PM\u201d SUNDAYS 1O/9c [m
2017-11-28 00:48:00	MSNBCW	36	MSNBCW_20171128_000000_Hardball_With_Chris_Matthews/start/2880	WH: SEN. WARREN \"LYING ABOUT HER HERITAGE\". mom: OFFFNSIVF THAN TDUMD'S COMMFNTS\nANITA KUMAR I MCCLATCHY NEWSPAPERS\nWH: RIDICULOUS To CALL TRUMP'S USE OF \"POCAHONTAS\". AT NATIVF AMFDICAN WAD HFDOFS FVFNT A \"DACIAI...
2017-11-28 00:49:00	FOXNEWSW	16	FOXNEWSW_20171128_000000_The_Story_With_Martha_MacCallum/start/2940	Mercedes-Benz '. of San Francisco
2017-11-28 00:49:00	MSNBCW	7	MSNBCW_20171128_000000_Hardball_With_Chris_Matthews/start/2940	WH: RIDICULOUS To CALL TRUMP'S USE OF \"POCAHONTAS\". AT NATIVF AMFDICAN WAD HFDOFS FVFNT A \"DACIAI SI up\"\nWH: \"NOT THE PRESIDENT'S INTENT\" TO USE RACIAL SLUR
2017-11-28 00:50:00	CNNW	44	CNNW_20171128_000000_Erin_Burnett_OutFront/start/3000	SPECULATION GROWS THAT FLYNN MAY BE COOPERATING WITH MUELLER
2017-11-28 00:52:00	FOXNEWSW	27	FOXNEWSW_20171128_000000_The_Story_With_Martha_MacCallum/start/3120	COL SHAFFER ON NEW CLINTON BOMBSHELLS Jnmu
2017-11-28 00:53:00	MSNBCW	36	MSNBCW_20171128_000000_Hardball_With_Chris_Matthews/start/3180	ANITA KUMAR I MCCLATCHY NEWSPAPERS
2017-11-28 00:54:00	FOXNEWSW	4	FOXNEWSW_20171128_000000_The_Story_With_Martha_MacCallum/start/3240	COL TONY SHAFEER RET | IONDON CENTER FOR POLICY RESEARCH '7 W m n. . um I. . DRMER FEDERAL WATCH DOG: IF CLINTON EMAILS. FMFn IT wnl II n'vr HAPMFn NATIONAI crmmw .Lmuu;__,
2017-11-28 00:54:00	MSNBCW	14	MSNBCW_20171128_000000_Hardball_With_Chris_Matthews/start/3240	TELL ME SQMETHJNG ' A ' '\nDAVID CATANESE I U.S. NEWS & WORLD REPORT
2017-11-28 00:55:00	FOXNEWSW	10	FOXNEWSW_20171128_000000_The_Story_With_Martha_MacCallum/start/3300	Q'. HomeAdvisoncom\n\ufb01Home/Advisomom
2017-11-28 00:56:00	FOXNEWSW	5	FOXNEWSW_20171128_000000_The_Story_With_Martha_MacCallum/start/3360	o: I 'OIH'LIV:. www.visitingangels.com
2017-11-28 00:56:00	MSNBCW	36	MSNBCW_20171128_000000_Hardball_With_Chris_Matthews/start/3360	1:\u00bb Lively Mobile 25% OFF and \ufb01rst month FREE at: C E?
2017-11-28 00:57:00	CNNW	26	CNNW_20171128_000000_Erin_Burnett_OutFront/start/3420	TRUMP A'ITACKS PRESS AS HE PUSHES CONSPIRACY WEBSITE\nTRUMP A'ITACKS PRESS, ENDORSES RIGHT-WING CONSPIRACY BLOG
2017-11-28 00:58:00	CNNW	56	CNNW_20171128_000000_Erin_Burnett_OutFront/start/3480	TRUMP A'ITACKS PRESS, ENDORSES RIGHT-WING CONSPIRACY BLOG\nTRUMP ATI'ACKS PRESS ENDORSES RIGHT-WING CONSPIRACY BLOG. . Claire Ward Executive Director, First Draft
2017-11-28 00:59:00	CNNW	60	CNNW_20171128_000000_Erin_Burnett_OutFront/start/3540	TRUMP A'ITACKS PRESS, ENDORSES RIGHT-WING CONSPIRACY BLOG
2017-11-28 01:00:00	CNNW	41	CNNW_20171128_000000_Erin_Burnett_OutFront/start/3600	DID I SAY THAT?\nTRUMP ATI'ACKS PRESS ENDORSES RIGHT-WING CONSPIRACY BLOG. . Brian Stelter cw Senior Media Correspondent\nTRUMP ATI'ACKS PRESS ENDORSES...
2017-11-28 01:01:00	CNNW	62	CNNW_20171128_010000_Anderson_Cooper_360/start/60	DID I SAY THAT?
2017-11-28 01:01:00	MSNBCW	20	MSNBCW_20171128_010000_All_In_With_Chris_Hayes/start/60	IKUMI\" 6:
2017-11-28 01:02:00	FOXNEWSW	6	FOXNEWSW_20171128_010000_Tucker_Carlson_Tonight/start/120	CKER TELLS HIS STORY OF BEING FALSELY ACCUSED
2017-11-28 01:02:00	MSNBCW	11	MSNBCW_20171128_010000_All_In_With_Chris_Hayes/start/120	MICHAEL FLYNN | FMR.NATIONALSECURITYADVISOR\nIKUMI\" 6\
2017-11-28 01:04:00	CNNW	54	CNNW_20171128_010000_Anderson_Cooper_360/start/240	DID I SAY THAT?\nDID I SAY THAT?. Sarah Sanders White House Press Secretar
2017-11-28 01:04:00	MSNBCW	16	MSNBCW_20171128_010000_All_In_With_Chris_Hayes/start/240	JAMES COMEY | FMR. FBI DIRECTOR
2017-11-28 01:05:00	BBCNEWS	11	BBCNEWS_20171128_010000_Newsday/start/300	BALI VOLCANO THREAT. Rain created destructive 'Iahavs' or cold lava flows\nBALI VOLCANO THREAT. Alert at highest level over fears of major eruption
2017-11-28 01:05:00	CNNW	62	CNNW_20171128_010000_Anderson_Cooper_360/start/300	DID I SAY THAT?
2017-11-28 01:05:00	MSNBCW	10	MSNBCW_20171128_010000_All_In_With_Chris_Hayes/start/300	IKUMI\" 6\"\nEhc New \ufb02urk Eimcs. MICHAEL SCHMIDT I WASHINGTON COPPFSDONDFNT\nIKUMI\" 6':
2017-11-28 01:06:00	BBCNEWS	11	BBCNEWS_20171128_010000_Newsday/start/360	BALI VOLCANO THREAT. Dark smoke & ash seen up to 3,4OOm above summit\nBALI VOLCANO THREAT. About 1OO,OOO people urged 1O move 1O safety\nBALI VOLCANO THREAT. Island's only airpon Ngurah Rai has been...
