2017-11-22 14:01:00	FOXNEWSW	42	FOXNEWSW_20171122_140000_Americas_Newsroom_With_Bill_Hemmer_and_Sandra_Smith/start/60	ISSING AFTER NAW PLANE CRASHES IN PACIFIC\nMISSING AFTER NAW PLANE CRASHES IN PACIFIC i\n> LUCAS fbMLINSON
2017-11-22 14:01:00	MSNBCW	46	MSNBCW_20171122_140000_MSNBC_Live_With_Stephanie_Ruhle/start/60	TRUMP BACKS MOORE IN ALABAMA SENATE RACE, POINTS TO DENIALS\nUBER: HACKERS STOLE PERSONAL INFO ON 57 MILLION RIDERS AND DRIVERS
2017-11-22 14:02:00	BBCNEWS	7	BBCNEWS_20171122_113000_The_Budget/start/9120	.cash lonhe NHS. ll.
2017-11-22 14:02:00	CNNW	32	CNNW_20171122_140000_CNN_Newsroom_With_John_Berman_and_Poppy_Harlow/start/120	TRUMP: FREED PLAYER'S DAD AN \"UNGRATEFUL FOOL\"\n8 RESCUED, 3 MISSING AFI'ER NAW PLANE CRASHES OFF JAPAN. . Barbara Starr CJ\\N Pentagon Correspondent\nTRUMP STICKS WITH MOORE: \"HE...
2017-11-22 14:02:00	FOXNEWSW	37	FOXNEWSW_20171122_140000_Americas_Newsroom_With_Bill_Hemmer_and_Sandra_Smith/start/120	ISSING AFTER NAW PLANE CRASHES IN PACIFIC\nb LUCAS TOMLINSON
2017-11-22 14:02:00	MSNBCW	20	MSNBCW_20171122_140000_MSNBC_Live_With_Stephanie_Ruhle/start/120	TRUMP: MOORE \"TOTALLY DENIES IT\" AND \"YOU HAVE TO LISTEN TO HIM\"\nTRUMP: \"WE DON'T NEED A LIBERAL\" IN ALABAMA SENATE SEAT\nTRUMP BACKS MOORE IN ALABAMA SENATE RACE, POINTS TO DENIALS
2017-11-22 14:03:00	CNNW	22	CNNW_20171122_140000_CNN_Newsroom_With_John_Berman_and_Poppy_Harlow/start/180	TRUMP: FREED PLAYER'S DAD AN \"UNGRATEFUL FOOL\". . . . Joe Johns CJ\\N Senior Washington Correspondent\nTRUMP: FREED PLAYER'S DAD AN \"UNGRATEFUL FOOL\"\nTRUMP STICKS WITH MOORE: \"HE TOTALLY DENIES IT\
2017-11-22 14:03:00	FOXNEWSW	41	FOXNEWSW_20171122_140000_Americas_Newsroom_With_Bill_Hemmer_and_Sandra_Smith/start/180	ESIDENT TRUMP RESPONDS TO NAW CRASH\n> LUCASHTOMLINSON
2017-11-22 14:03:00	MSNBCW	18	MSNBCW_20171122_140000_MSNBC_Live_With_Stephanie_Ruhle/start/180	TRUMP: ROY MOORE \"DENIES IT, THAT'S ALL I CAN SAY\"\nTRUMP CALLS MOORE'S OPPONENT \"TERRIBLE ON CRIME\". (EX-PROSECUTOR CONVICTED KLANSMEN IN CIVIL-RIGHTS ERA BOMBING)\naccuseu nlm OT...
2017-11-22 14:04:00	FOXNEWSW	37	FOXNEWSW_20171122_140000_Americas_Newsroom_With_Bill_Hemmer_and_Sandra_Smith/start/240	ESIDENT TRUMP RESPONDS TO NAVY CRASH\nUMP COMMENTS ON ROY MOORE ALLEGATIONS
2017-11-22 14:04:00	MSNBCW	19	MSNBCW_20171122_140000_MSNBC_Live_With_Stephanie_Ruhle/start/240	TRUMP ON MOORE'S ACCUSERS: \"4O YEARS IS A LONG TIME\"\nTRUMP BACKS MOORE IN ALABAMA SENATE RACE, POINTS TO DENIALS\nMOORE CONSIDERING LEGAL ACTION AGAINST HIS ACCUSERS\nTRUMP CALLS MOORE'S...
2017-11-22 14:05:00	CNNW	53	CNNW_20171122_140000_CNN_Newsroom_With_John_Berman_and_Poppy_Harlow/start/300	TRUMP STICKS WITH MOORE: \"HE TOTALLY DENIES IT\
2017-11-22 14:05:00	FOXNEWSW	53	FOXNEWSW_20171122_140000_Americas_Newsroom_With_Bill_Hemmer_and_Sandra_Smith/start/300	UMP COMMENTS ON ROY MOORE ALLEGATIONS\n> KEVIN CORKE
2017-11-22 14:05:00	MSNBCW	32	MSNBCW_20171122_140000_MSNBC_Live_With_Stephanie_Ruhle/start/300	MOORE CONSIDERING LEGAL ACTION AGAINST HIS ACCUSERS\nMOORE: \"WE'RE GETTING PROOF\" AGAINST ACCUSERS
2017-11-22 14:06:00	FOXNEWSW	30	FOXNEWSW_20171122_140000_Americas_Newsroom_With_Bill_Hemmer_and_Sandra_Smith/start/360	COND WOMAN COMES FOWARD ACCUSING CONYERS I\nUMP COMMENTS N ROY MOORE ALLEGATIONS '\n, . '. UMP COMMENTS ON ROY MOORE ALLEGATIONS
2017-11-22 14:06:00	MSNBCW	22	MSNBCW_20171122_140000_MSNBC_Live_With_Stephanie_Ruhle/start/360	MOORE ATTY.: GOP, DEMS, MEDIA IN \"3-FRONT WAR\" AGAINST HIM\nMOORE: \"WE'RE GE1T|NG PROOF\" AGAINST ACCUSERS\nMOORE: \"WE'RE GETI'ING PROOF\" AGAINST ACCUSERS
2017-11-22 14:07:00	CNNW	32	CNNW_20171122_140000_CNN_Newsroom_With_John_Berman_and_Poppy_Harlow/start/420	MOORE: \"I WANT TO GET BACK TO THE CAMPAIGN\"\nTRUMP STICKS WITH MOORE: \"HE TOTALLY DENIES IT\
2017-11-22 14:07:00	FOXNEWSW	12	FOXNEWSW_20171122_140000_Americas_Newsroom_With_Bill_Hemmer_and_Sandra_Smith/start/420	> CHARLIE HURT I WASHINGTON TIMES OPINION EDITOR\n{UMP COMMENTS ON ROY MOORE ALLEGATIONS W
2017-11-22 14:07:00	MSNBCW	31	MSNBCW_20171122_140000_MSNBC_Live_With_Stephanie_Ruhle/start/420	MOORE CAMPAIGN: OPPONENTS TRYING TO STOP HIM \"AT ANY COST\"\nMOORE ATTY.: GOP, DEMS, MEDIA IN \"3-FRONT WAR\" AGAINST HIM\nTRUMP BACKS MOORE IN ALABAMA SENATE RACE, POINTS TO DENIALS\nDOUG JONES I...
2017-11-22 14:08:00	FOXNEWSW	43	FOXNEWSW_20171122_140000_Americas_Newsroom_With_Bill_Hemmer_and_Sandra_Smith/start/480	UMP COMMENTS ON ROY MOORE ALLEGATIONS
2017-11-22 14:08:00	MSNBCW	52	MSNBCW_20171122_140000_MSNBC_Live_With_Stephanie_Ruhle/start/480	TRUMP BACKS MOORE IN ALABAMA SENATE RACE, POINTS TO DENIALS\nTRUMP: MOORE \"TOTALLY DENIES IT\" AND \"YOU HAVE TO LISTEN TO HIM\
2017-11-22 14:09:00	CNNW	23	CNNW_20171122_140000_CNN_Newsroom_With_John_Berman_and_Poppy_Harlow/start/540	TRUMP: FREED PLAYER'S DAD AN \"UNGRATEFUL FOOL\"\nTRUMP: LAVAR BALL \"A POOR MAN'S VERSION OF DON KING\". . Christina Bellantoni Asst Managing Editor, Los Angeles Times\nTRUMP: FREED...
2017-11-22 14:09:00	FOXNEWSW	35	FOXNEWSW_20171122_140000_Americas_Newsroom_With_Bill_Hemmer_and_Sandra_Smith/start/540	OND WOMAN COMES FOWARD ACCUSING CONYERS\nr55: _ \\\u2014. {UMP COMMENTS ON ROY MOORE ALLEGATIONS
2017-11-22 14:09:00	MSNBCW	37	MSNBCW_20171122_140000_MSNBC_Live_With_Stephanie_Ruhle/start/540	TRUMP: MOORE \"TOTALLY DENIES IT\" AND \"YOU HAVE TO LISTEN TO HIM\"\nTRUMP: \"WE DON'T NEED A LIBERAL\" |N ALABAMA SENATE SEAT\nMOORE CONSIDERING LEGAL ACTION AGAINST HIS ACCUSERS
2017-11-22 14:10:00	BBCNEWS	4	BBCNEWS_20171122_113000_The_Budget/start/9600	Iluuunal Illwnm ml: yum. . and than tall
2017-11-22 14:10:00	CNNW	42	CNNW_20171122_140000_CNN_Newsroom_With_John_Berman_and_Poppy_Harlow/start/600	TRUMP: FREED PLAYER'S DAD AN \"UNGRATEFUL FOOL\". . Christina Bellantoni Asst Managing Editor, Los Angeles Times\nTRUMP: FREED PLAYER'S DAD AN \"UNGRATEFUL FOOL\"\nTRUMP: LAVAR BALL \"A POOR MAN'S VERSION OF DON KING\". . Christina Bellantoni Asst...
2017-11-22 14:10:00	FOXNEWSW	24	FOXNEWSW_20171122_140000_Americas_Newsroom_With_Bill_Hemmer_and_Sandra_Smith/start/600	COND WOMAN COMES FOWARD ACCUSING CONYERS I\n. {UMP CONTINUES TWIITER RANT ON LAVAR BALL\n> CHARLIE HURT I WASHINGTON TIMES OPINION EDITOR\n> CHARLIE HURT l WASHINGTON TIMES OPINION...
2017-11-22 14:10:00	MSNBCW	32	MSNBCW_20171122_140000_MSNBC_Live_With_Stephanie_Ruhle/start/600	TRUMP: MOORE \"TOTALLY DENIES IT\" AND \"YOU HAVE TO LISTEN TO HIM\"\nTRUMP: ROY MOORE \"DENIES IT, THAT'S ALL I CAN SAY\"\nTRUMP BACKS MOORE IN ALABAMA SENATE RACE, POINTS TO DENIALS
2017-11-22 14:11:00	CNNW	31	CNNW_20171122_140000_CNN_Newsroom_With_John_Berman_and_Poppy_Harlow/start/660	TRUMP STICKS WITH MOORE: \"HE TOTALLY DENIES IT\". . Patrick Healy Deputy Culture Editor, New York Times\nTRUMP STICKS WITH MOORE: \"HE TOTALLY DENIES IT\"\nTRUMP: FREED PLAYER'S DAD AN \"UNGRATEFUL FOOL\
2017-11-22 14:11:00	FOXNEWSW	41	FOXNEWSW_20171122_140000_Americas_Newsroom_With_Bill_Hemmer_and_Sandra_Smith/start/660	. {UMP CONTINUES TWIITER RANT ON LAVAR BALL
2017-11-22 14:11:00	MSNBCW	17	MSNBCW_20171122_140000_MSNBC_Live_With_Stephanie_Ruhle/start/660	TRUMP CALLS MOORE'S OPPONENT \"TERRIBLE ON CRIME\". (EX-PROSECUTOR CONVICTED KLANSMEN IN CIVIL-RIGHTS ERA BOMBING)\nTRUMP: MOORE \"TOTALLY DENIES IT\" AND \"YOU HAVE TO LISTEN TO HIM\"\nTRUMP BACKS MOORE IN ALABAMA SENATE RACE, POINTS TO DENIALS\nELISE...
2017-11-22 14:12:00	CNNW	39	CNNW_20171122_140000_CNN_Newsroom_With_John_Berman_and_Poppy_Harlow/start/720	TRUMP STICKS WITH MOORE: \"HE TOTALLY DENIES IT\"\nTRUMP STICKS WITH MOORE: \"HE TOTALLY DENIES IT\". . David Gergen CJ\\N Senior Political Analyst
2017-11-22 14:12:00	FOXNEWSW	15	FOXNEWSW_20171122_140000_Americas_Newsroom_With_Bill_Hemmer_and_Sandra_Smith/start/720	RON DESANTIS (R). FLORIDA CONGRESSMAN
2017-11-22 14:12:00	MSNBCW	48	MSNBCW_20171122_140000_MSNBC_Live_With_Stephanie_Ruhle/start/720	CBS, PBS, BLOOMBERG CUT TIES WITH CHARLIE ROSE\nCBS: THREE CBS EMPLOYEES COME FORWARD. WITH ALLEGATIONS AGAINST CHARLIE ROSE
2017-11-22 14:13:00	CNNW	40	CNNW_20171122_140000_CNN_Newsroom_With_John_Berman_and_Poppy_Harlow/start/780	TRUMP: \"IT'S A VERY SPECIAL TIME\" FOR WOMEN, SOCIETY\nTRUMP STICKS WITH MOORE: \"HE TOTALLY DENIES IT\". . David Gergen CJ\\N Senior Political Analyst\nTRUMP STICKS WITH MOORE: \"HE TOTALLY...
2017-11-22 14:13:00	MSNBCW	36	MSNBCW_20171122_140000_MSNBC_Live_With_Stephanie_Ruhle/start/780	CBS: THREE CBS EMPLOYEES COME FORWARD. WITH ALLEGATIONS AGAINST CHARLIE ROSE\nFORMER INTERN: CHARLIE ROSE SHOWED ME GRAPHIC. SEX SCENE FROM A MOVIE. BUT DID NOT TOUCH ME
2017-11-22 14:14:00	BBCNEWS	9	BBCNEWS_20171122_113000_The_Budget/start/9840	KAMAL AHMED. @bbckamal
2017-11-22 14:14:00	CNNW	56	CNNW_20171122_140000_CNN_Newsroom_With_John_Berman_and_Poppy_Harlow/start/840	TRUMP: \"IT'S A VERY SPECIAL TIME\u201c FOR WOMEN, SOCIETY. . Christina Bellantoni Asst Managing Editor, Los Angeles Times\nTRUMP: \"IT'S A VERY SPECIAL TIME\" FOR WOMEN, SOCIETY
2017-11-22 14:14:00	MSNBCW	34	MSNBCW_20171122_140000_MSNBC_Live_With_Stephanie_Ruhle/start/840	FORMER INTERN: CHARLIE ROSE SHOWED ME GRAPHIC. SEX SCENE FROM A MOVIE. BUT DID NOT TOUCH ME\nCBS, PBS, BLOOMBERG CUT TIES WITH CHARLIE ROSE\nCHARLIE ROSE: ALLEGATIONS AGAINST ME \"NOT WRONGDOINGS\
2017-11-22 14:15:00	MSNBCW	44	MSNBCW_20171122_140000_MSNBC_Live_With_Stephanie_Ruhle/start/900	CBS: THREE CBS EMPLOYEES COME FORWARD. WITH ALLEGATIONS AGAINST CHARLIE ROSE\nFORMER INTERN: CHARLIE ROSE SHOWED ME GRAPHIC. SEX SCENE FROM A MOVIE. BUT DID NOT TOUCH ME\nNEW YORK DAILY NEWS. MIKE LUPICA | COLUMNST
2017-11-22 14:16:00	CNNW	39	CNNW_20171122_140000_CNN_Newsroom_With_John_Berman_and_Poppy_Harlow/start/960	TRUMP STICKS WITH MOORE: \"HE TOTALLY DENIES IT\". . Patrick Healy Deputy Culture Editor, New York Times\nTRUMP STICKS WITH MOORE: \"HE TOTALLY DENIES IT\"\nTRUMP STICKS WITH MOORE: \"HE TOTALLY DENIES IT\". . . . Patrick Healy OW Political...
2017-11-22 14:16:00	FOXNEWSW	11	FOXNEWSW_20171122_140000_Americas_Newsroom_With_Bill_Hemmer_and_Sandra_Smith/start/960	b VICTOR M VELAZQUEZ l CUSTOMS & BORDER PATROL AGENT\nI: \"POTENTIAL ASSAULT\" KILLED BORDER AGENT
2017-11-22 14:16:00	MSNBCW	20	MSNBCW_20171122_140000_MSNBC_Live_With_Stephanie_Ruhle/start/960	HOUSE ETHICS PANEL LAUNCHING PROBE INTO REP. CONYERS\nCBS: THREE CBS EMPLOYEES COME FORWARD. WITH ALLEGATIONS AGAINST CHARLIE ROSE\nCBS, PBS, BLOOMBERG CUT TIES WITH CHARLIE ROSE\nEX-CO...
2017-11-22 14:17:00	CNNW	12	CNNW_20171122_140000_CNN_Newsroom_With_John_Berman_and_Poppy_Harlow/start/1020	DAVID CASSIDY DIES AT AGE 67\nDRAMATIC VIDEO SHOWS NORTH KOREAN SOLDIER'S ESCAPE\nUBER PAYS HACKERS $1OOK AFTER MAJOR DATA BREACH
2017-11-22 14:17:00	FOXNEWSW	28	FOXNEWSW_20171122_140000_Americas_Newsroom_With_Bill_Hemmer_and_Sandra_Smith/start/1020	I: \"POTENTIAL ASSAULT\" KILLED BORDER AGENT\nl'. LI: \"POTENTIAL ASSAULT\" KILLED BORDER AGENT H\n> KEN PAXTON I TEXAS ATTORNEY GENERAL
2017-11-22 14:17:00	MSNBCW	40	MSNBCW_20171122_140000_MSNBC_Live_With_Stephanie_Ruhle/start/1020	REPORT: NEW ACCUSER ALLEGED SHE WAS SEXUALLY. HARASSED BY REP. CONYERS IN COURT FILINGS THIS YEAR\nHOUSE ETHICS PANEL LAUNCHING PROBE INTO REP. CONYERS
2017-11-22 14:18:00	FOXNEWSW	50	FOXNEWSW_20171122_140000_Americas_Newsroom_With_Bill_Hemmer_and_Sandra_Smith/start/1080	LI: \"POTENTIAL ASSAULT\" KILLED BORDER AGENT I. . \"HINDI!!!\"\nI: \"POTENTIAL ASSAULT\" KILLED BORDER AGENT\n> KEN PAXTON I TEXAS ATTORNEY GENERAL
2017-11-22 14:18:00	MSNBCW	26	MSNBCW_20171122_140000_MSNBC_Live_With_Stephanie_Ruhle/start/1080	REPORT: NEW ACCUSER ALLEGED IN LAWSUIT SHE \"REPEATEDLY. AND DAILY\" DEALT WITH UNWANTED TOUCHING BY REP. CONYERS\nREP. CONYERS SPOKESMAN: NEW ACCUSER. \"VOLUNTARILY DECIDED TO DROP HER CASE\"\nREP. CONYERS ACKNOWLEDGES SE'I'I'LING CLAIM BY. EX-STAFFER...
2017-11-22 14:19:00	FOXNEWSW	52	FOXNEWSW_20171122_140000_Americas_Newsroom_With_Bill_Hemmer_and_Sandra_Smith/start/1140	I: \"POTENTIAL ASSAULT\" KILLED BORDER AGENT
2017-11-22 14:19:00	MSNBCW	29	MSNBCW_20171122_140000_MSNBC_Live_With_Stephanie_Ruhle/start/1140	'7OS TEEN IDOL DAVID CASSIDY DIES AT 67
2017-11-22 14:20:00	FOXNEWSW	21	FOXNEWSW_20171122_140000_Americas_Newsroom_With_Bill_Hemmer_and_Sandra_Smith/start/1200	I: \"POTENTIAL ASSAULT\" KILLED BORDER AGENT\n> KEN PAXTON I TEXAS ATTORNEY GENERAL
2017-11-22 14:21:00	CNNW	18	CNNW_20171122_140000_CNN_Newsroom_With_John_Berman_and_Poppy_Harlow/start/1260	N KOREAN SOLDIER, UNDER FIRE, DASHES ACROSS BORDER
2017-11-22 14:22:00	MSNBCW	10	MSNBCW_20171122_140000_MSNBC_Live_With_Stephanie_Ruhle/start/1320	NAW: 8 RESCUED, 3 STILL MISSING AFI'ER PLANE CRASH NEAR JAPAN
2017-11-22 14:23:00	CNNW	47	CNNW_20171122_140000_CNN_Newsroom_With_John_Berman_and_Poppy_Harlow/start/1380	N KOREAN SOLDIER, UNDER FIRE, DASHES ACROSS BORDER\nN KOREAN SOLDIER, UNDER FIRE, DASHES ACROSS BORDER. . Chase and gunfire over border violated ceasefire
2017-11-22 14:23:00	FOXNEWSW	19	FOXNEWSW_20171122_140000_Americas_Newsroom_With_Bill_Hemmer_and_Sandra_Smith/start/1380	l\u2014\u00a755-2 88-417O Humana.
2017-11-22 14:23:00	MSNBCW	35	MSNBCW_20171122_140000_MSNBC_Live_With_Stephanie_Ruhle/start/1380	NAW: 8 RESCUED, 3 STILL MISSING AFI'ER PLANE CRASH NEAR JAPAN\nTRUMP: \"MONITORING\" NAW CRASH, \"PRAYERS FOR ALL INVOLVED\
2017-11-22 14:24:00	CNNW	51	CNNW_20171122_140000_CNN_Newsroom_With_John_Berman_and_Poppy_Harlow/start/1440	N KOREAN SOLDIER, UNDER FIRE, DASHES ACROSS BORDER. . Chase and gunfire over border violated ceasefire\nN KOREAN SOLDIER, UNDER FIRE, DASHES ACROSS BORDER. . David Rohde Online News Director, The New Yorker
2017-11-22 14:24:00	MSNBCW	50	MSNBCW_20171122_140000_MSNBC_Live_With_Stephanie_Ruhle/start/1440	NAW: 8 RESCUED, 3 STILL MISSING AFI'ER PLANE CRASH NEAR JAPAN\nCLINTON: \"HISTORICAL HEADWIND\" AGAINST ME IN PRESIDENTIAL RUN
2017-11-22 14:25:00	CNNW	32	CNNW_20171122_140000_CNN_Newsroom_With_John_Berman_and_Poppy_Harlow/start/1500	N KOREAN SOLDIER, UNDER FIRE, DASHES ACROSS BORDER\nN KOREAN SOLDIER, UNDER FIRE, DASHES ACROSS BORDER. . Chase and gunfire over border violated ceasefire
2017-11-22 14:25:00	FOXNEWSW	24	FOXNEWSW_20171122_140000_Americas_Newsroom_With_Bill_Hemmer_and_Sandra_Smith/start/1500	YC TERROR SUSPECT INDICTED ON 22 COUNTS m
2017-11-22 14:25:00	MSNBCW	25	MSNBCW_20171122_140000_MSNBC_Live_With_Stephanie_Ruhle/start/1500	JIMMY FALLON TAKES ON TRUMP\u2019S TURKEY PARDONS
2017-11-22 14:26:00	CNNW	15	CNNW_20171122_140000_CNN_Newsroom_With_John_Berman_and_Poppy_Harlow/start/1560	CONYERS' HOMETOWN PAPER CALLS FOR HIS RESIGNATION
2017-11-22 14:26:00	FOXNEWSW	27	FOXNEWSW_20171122_140000_Americas_Newsroom_With_Bill_Hemmer_and_Sandra_Smith/start/1560	YC TERROR SUSPECT INDICTED ON 22 COUNTS m\nIPOV TO APPEAR IN FEDERAL COURT ON NOV 28 V\n> BUCK SEXTON | FORMER CIA OFFICER
2017-11-22 14:27:00	FOXNEWSW	16	FOXNEWSW_20171122_140000_Americas_Newsroom_With_Bill_Hemmer_and_Sandra_Smith/start/1620	YC TERROR SUSPECT INDICTED ON 22 COUNTS .-\n. YC TERROR SUSPECT INDICTED ON 22 COUNTS
2017-11-22 14:27:00	MSNBCW	17	MSNBCW_20171122_140000_MSNBC_Live_With_Stephanie_Ruhle/start/1620	NewDiUSA com
2017-11-22 14:29:00	CNNW	11	CNNW_20171122_140000_CNN_Newsroom_With_John_Berman_and_Poppy_Harlow/start/1740	[E FREMONT BAN K fremontbank.comlnomystery 877-711-7
2017-11-22 14:29:00	MSNBCW	18	MSNBCW_20171122_140000_MSNBC_Live_With_Stephanie_Ruhle/start/1740	LAS VEGAS SHOOTING VICTIMS FILE SUITS. AGAINST HOTEL. CONCERT ORGANIZERS\nN. KOREAN DEFECTOR SHOT AT LEAST 5 TIMES IN DRAMATIC ESCAPE\nWH MILITARY PERSONNEL \"REASSIGNED\" OVER ALLEGED. CONTACT WITH WOMEN DURING...
2017-11-22 14:30:00	CNNW	23	CNNW_20171122_140000_CNN_Newsroom_With_John_Berman_and_Poppy_Harlow/start/1800	TWO WOMEN ACCUSE CONYERS OF INAPPROPRIATE ADVANCES
2017-11-22 14:30:00	MSNBCW	13	MSNBCW_20171122_140000_MSNBC_Live_With_Stephanie_Ruhle/start/1800	MEG WHITMAN STEPPING DOWN AS HEAD OF HP ENTERPRISE\nI mmar\u2014'n am am aanm
2017-11-22 14:31:00	CNNW	36	CNNW_20171122_140000_CNN_Newsroom_With_John_Berman_and_Poppy_Harlow/start/1860	TWO WOMEN ACCUSE CONYERS OF INAPPROPRIATE ADVANCES. . Rep Gregory Meeks (D) Congressional Black Caucus\nTWO WOMEN ACCUSE CONYERS OF INAPPROPRIATE ADVANCES
2017-11-22 14:31:00	FOXNEWSW	7	FOXNEWSW_20171122_140000_Americas_Newsroom_With_Bill_Hemmer_and_Sandra_Smith/start/1860	TTY: 71 1. . \u201c 8OO-347-1 6OO. . CALL THE
2017-11-22 14:31:00	MSNBCW	17	MSNBCW_20171122_140000_MSNBC_Live_With_Stephanie_Ruhle/start/1860	CLINTON: FOLLOWING OBAMA MADE IT. HARD TO RUN AS AN \"AGENT OF CHANGE\"\nCLINTON: \"HISTORICAL HEADWIND\" AGAINST ME IN PRESIDENTIAL RUN\nHUGH HEWITT ' 333%??? ANALYST\nCLINTON: FOLLOWING OBANA MADE |T HARD TO...
2017-11-22 14:32:00	CNNW	23	CNNW_20171122_140000_CNN_Newsroom_With_John_Berman_and_Poppy_Harlow/start/1920	HOUSE ETHICS COMMITTEE OPENS CONYERS INVESTIGATION\nHOUSE ETHICS COMMITTEE OPENS CONYERS INVESTIGATION. . Rep Gregory Meeks (D) Foreign Affairs Committee\nTWO WOMEN ACCUSE CONYERS OF...
2017-11-22 14:32:00	MSNBCW	25	MSNBCW_20171122_140000_MSNBC_Live_With_Stephanie_Ruhle/start/1920	CLINTON: \"HARD TO BREAK THROUGH\" DURING 2O16 CAMPAIGN\nCLINTON: \"I HAVE HIGH REGARD FOR THE CAMPAIGN THAT WE PUT TOGETHER\"\nCLINTON: \"HISTORICAL HEADWIND\" AGAINST ME IN PRESIDENTIAL...
2017-11-22 14:33:00	CNNW	30	CNNW_20171122_140000_CNN_Newsroom_With_John_Berman_and_Poppy_Harlow/start/1980	CONYERS' HOMETOWN PAPER CALLS FOR HIS RESIGNATION. . Detroit Free Press: \"It's a tragic end to his public career\"\nHOUSE ETHICS COMMITTEE OPENS CONYERS INVESTIGATION. . Rep Gregory Meeks (D) Foreign Affairs Committee\nCONYERS' HOMETOWN PAPER CALLS...
2017-11-22 14:33:00	FOXNEWSW	18	FOXNEWSW_20171122_140000_Americas_Newsroom_With_Bill_Hemmer_and_Sandra_Smith/start/1980	MISSING AFTER NAW PLANE CRASHES OFF JAPA\ufb02
2017-11-22 14:33:00	MSNBCW	24	MSNBCW_20171122_140000_MSNBC_Live_With_Stephanie_Ruhle/start/1980	CLINTON BLAMES CAMPAIGN \"ENVIRONMENT\". FOR HAMPERING HER ABILITY TO \"BREAK THROUGH\"\nCLINTON ON CAMPAIGN FAILURES: \"MAYBE SOME OF THAT IS ON MY SHOULDERS\"\nCLINTON: A \"SHORTCOMING OF THE CAMPAIGN\" THAT. MY RECORD....
2017-11-22 14:34:00	CNNW	42	CNNW_20171122_140000_CNN_Newsroom_With_John_Berman_and_Poppy_Harlow/start/2040	TRUMP DEFENDS ROY MOORE, DOUBTS HIS ACCUSERS\nCONYERS' HOMETOWN PAPER CALLS FOR HIS RESIGNATION. . Detroit Free Press: \"It's a tragic end to his public career\"\nCONYERS' HOMETOWN...
2017-11-22 14:34:00	FOXNEWSW	17	FOXNEWSW_20171122_140000_Americas_Newsroom_With_Bill_Hemmer_and_Sandra_Smith/start/2040	ISSING AFTER NAVY PLANE CRASHES OFF JAPAN\n. JD WOMAN ACCUSES REP CONYERS OF HARASSMENT\n> RON DESANTIS R-FL | HOUSE JUDICIARY COMMITTEE\n> RON DESANTIS R | FLORIDA CONGRESSMAN
2017-11-22 14:34:00	MSNBCW	22	MSNBCW_20171122_140000_MSNBC_Live_With_Stephanie_Ruhle/start/2040	CLINTON: A \"SHORTCOMING OF THE CAMPAIGN\" THAT. MY RECORD. \"PASSION\" DIDN'T \"BREAK THROUGH\"\nCLINTON ON CAMPAIGN FAILURES: \"MAYBE. SOME OF THAT IS ON MY SHOULDERS\u201d
2017-11-22 14:35:00	CNNW	22	CNNW_20171122_140000_CNN_Newsroom_With_John_Berman_and_Poppy_Harlow/start/2100	TRUMP DEFENDS ROY MOORE, DOUBTS HIS ACCUSERS\nTRUMP, PUTIN TALK SYRIA, N KOREA IN LENGTHY CALL\nTRUMP DEFENDS ROY MOORE, DOUBTS HIS ACCUSERS. . Rep Gregory Meeks (D) Congressional...
2017-11-22 14:35:00	FOXNEWSW	31	FOXNEWSW_20171122_140000_Americas_Newsroom_With_Bill_Hemmer_and_Sandra_Smith/start/2100	JD WOMAN ACCUSES REP CONYERS OF HARASSMENTI'. . \"HINDI!!!\"\nm \u2014. HICS CMTE INVESTIGATING CONYERS ALLEGATIONS
2017-11-22 14:36:00	CNNW	30	CNNW_20171122_140000_CNN_Newsroom_With_John_Berman_and_Poppy_Harlow/start/2160	TRUMP, PUTIN TALK SYRIA, N KOREA IN LENGTHY CALL. . Rep Gregory Meeks (D) Foreign Affairs Committee\nTRUMP, PUTIN TALK SYRIA, N KOREA IN LENGTHY CALL\nUBER HACKED; COMPANY PAYS HACKERS TO STAY QUIET
2017-11-22 14:36:00	FOXNEWSW	35	FOXNEWSW_20171122_140000_Americas_Newsroom_With_Bill_Hemmer_and_Sandra_Smith/start/2160	HICS CMTE INVESTIGATING CONYERS ALLEGATIONS\n> RON DESANTIS R | FLORIDA CONGRESSMAN\nm _. HICS CMTE INVESTIGATING CONYERS ALLEGATIONS
2017-11-22 14:36:00	MSNBCW	35	MSNBCW_20171122_140000_MSNBC_Live_With_Stephanie_Ruhle/start/2160	CLINTON: \"HISTORICAL HEADWIND\" AGAINST ME IN PRESIDENTIAL RUN\nCLINTON: \"HARD TO BREAK THROUGH\" DURING 2O16 CAMPAIGN\nCLINTON: A \"SHORTCOMING OF THE CAMPAIGN\" THAT. MY RECORD. \"PASSION\" DIDN'T...
2017-11-22 14:37:00	CNNW	9	CNNW_20171122_140000_CNN_Newsroom_With_John_Berman_and_Poppy_Harlow/start/2220	888.391.PALM SouthBeachDiet.c<\nUBER HACKED; COMPANY PAYS HACKERS TO STAY QUIET
2017-11-22 14:37:00	MSNBCW	21	MSNBCW_20171122_140000_MSNBC_Live_With_Stephanie_Ruhle/start/2220	CLINTON: \"I HAVE HIGH REGARD FOR THE CAMPAIGN THAT WE PUT TOGETHER\"\nCLINTON BLAMES CAMPAIGN \"ENVIRONMENT\". FOR HAMPERING HER ABILITY TO \"BREAK THROUGH\"\nUBER: HACKERS STOLE PERSONAL INFO ON 57 MILLION...
2017-11-22 14:38:00	CNNW	11	CNNW_20171122_140000_CNN_Newsroom_With_John_Berman_and_Poppy_Harlow/start/2280	8OO-591-O722 Quickenloanscom
2017-11-22 14:38:00	FOXNEWSW	14	FOXNEWSW_20171122_140000_Americas_Newsroom_With_Bill_Hemmer_and_Sandra_Smith/start/2280	> RON DESANTIS R | FLORIDA CONGRESSMAN\n> RON DESANTIS R-FL | HOUSE JUDICIARY COMMITTEE
2017-11-22 14:38:00	MSNBCW	18	MSNBCW_20171122_140000_MSNBC_Live_With_Stephanie_Ruhle/start/2280	MILLIONS HITTING THE ROAD AHEAD OF THANKSGIVING\nTRESIB. . \\nsuhndeq'udenirix\ufb01mtm u'\nUBER: HACKERS STOLE PERSONAL INFO ON 57 MILLION RIDERS AND DRIVERS
2017-11-22 14:39:00	FOXNEWSW	39	FOXNEWSW_20171122_140000_Americas_Newsroom_With_Bill_Hemmer_and_Sandra_Smith/start/2340	RTRIDGE FAMILY'S DAVID CASSIDY DEAD AT 67
2017-11-22 14:39:00	MSNBCW	3	MSNBCW_20171122_140000_MSNBC_Live_With_Stephanie_Ruhle/start/2340	TRESIB. . msuhndeq'udeniriedmtm u'. . . . .u. L_.
2017-11-22 14:40:00	MSNBCW	4	MSNBCW_20171122_140000_MSNBC_Live_With_Stephanie_Ruhle/start/2400	I1. l IH'UY \u201c
2017-11-22 14:41:00	BBCNEWS	7	BBCNEWS_20171122_113000_The_Budget/start/11460	SIMON GOMPERTZ. Personal Finance Correspondent
2017-11-22 14:41:00	FOXNEWSW	5	FOXNEWSW_20171122_140000_Americas_Newsroom_With_Bill_Hemmer_and_Sandra_Smith/start/2460	Heart Failure symptoms increase the risk
2017-11-22 14:42:00	CNNW	22	CNNW_20171122_140000_CNN_Newsroom_With_John_Berman_and_Poppy_Harlow/start/2520	UBER PAID HACKERS $1OOK TO HIDE MASSIVE DATA BREACH. . Personal info stolen on 57 million customers, drivers\nUBER CONCEALED HACK AFI'ER INFO ON 57M PEOPLE STOLEN. . Paid hackers $1OOk after they stole personal information in 2O16\nUBER...
2017-11-22 14:42:00	MSNBCW	26	MSNBCW_20171122_140000_MSNBC_Live_With_Stephanie_Ruhle/start/2520	UBER ACKNOWLEDGES KEEPING DATA BREACH UNDER WRAPS FOR A YEAR\nUBER: HACKERS STOLE PERSONAL INFO ON 57 MILLION RIDERS & DRIVERS
2017-11-22 14:43:00	MSNBCW	21	MSNBCW_20171122_140000_MSNBC_Live_With_Stephanie_Ruhle/start/2580	UBER ACKNOWLEDGES KEEPING DATA BREACH UNDER WRAPS FOR A YEAR\nUBER: WE PAID TWO HACKERS $1OO,OOO, DATA HAS SINCE BEEN \"DESTROYED\
2017-11-22 14:44:00	BBCNEWS	10	BBCNEWS_20171122_113000_The_Budget/start/11640	PAUL NOWAK. Deputy Director General, TUC
2017-11-22 14:44:00	CNNW	22	CNNW_20171122_140000_CNN_Newsroom_With_John_Berman_and_Poppy_Harlow/start/2640	@ HomeLight.com The Smarter Way to Find a Real Estate Agent\nRAND PAUL'S WIFE: IT WAS A \"BLINDSIDE A'ITACK\
2017-11-22 14:44:00	FOXNEWSW	13	FOXNEWSW_20171122_140000_Americas_Newsroom_With_Bill_Hemmer_and_Sandra_Smith/start/2640	. AA: POSSIBLE THANKSGIVING TRAFFIC RECORDS
2017-11-22 14:44:00	MSNBCW	26	MSNBCW_20171122_140000_MSNBC_Live_With_Stephanie_Ruhle/start/2640	UBER CEO: \"WE ARE CHANGING THE WAY WE DO BUSINESS\"\nUBER CEO: \"NONE OF THIS SHOULD HAVE. HAPPENED AND I WILL NOT MAKE EXCUSES FOR IT\"\nUBER: HACKERS STOLE PERSONAL INFO ON 57 MILLION...
2017-11-22 14:45:00	BBCNEWS	9	BBCNEWS_20171122_113000_The_Budget/start/11700	STEPHEN MARTIN. Director General, Institute of Directors
2017-11-22 14:45:00	FOXNEWSW	24	FOXNEWSW_20171122_140000_Americas_Newsroom_With_Bill_Hemmer_and_Sandra_Smith/start/2700	I_I \u2014 I. {ES TRUMP BREAKS SILENCE ON ROY MOORE\nFFIC TURNS LA. FREEWAY INTO PARKING LOT\n'ES TRUMP BREAKS SILENCE ON ROY MOORE
2017-11-22 14:45:00	MSNBCW	28	MSNBCW_20171122_140000_MSNBC_Live_With_Stephanie_Ruhle/start/2700	UBER ACKNOWLEDGES KEEPING DATA BREACH UNDER WRAPS FOR A YEAR\nTRUMP RIPS INTO UCLA PLAYER'S DAD AS \"UNGRATEFUL FOOL!\"\nUBER: HACKERS STOLE PERSONAL INFO ON 57 MILLION RIDERS & DRIVERS
2017-11-22 14:46:00	FOXNEWSW	55	FOXNEWSW_20171122_140000_Americas_Newsroom_With_Bill_Hemmer_and_Sandra_Smith/start/2760	{ES TRUMP BREAKS SILENCE ON ROY MOORE-. . \"HINDI!!!\
2017-11-22 14:46:00	MSNBCW	3	MSNBCW_20171122_140000_MSNBC_Live_With_Stephanie_Ruhle/start/2760	TRUMP RIPS INTO UCLA PLAYER'S DAD AS \"UNGRATEFUL FOOL!\
2017-11-22 14:48:00	CNNW	27	CNNW_20171122_140000_CNN_Newsroom_With_John_Berman_and_Poppy_Harlow/start/2880	RAND PAUL'S WIFE SPEAKS OUT ON \"BLINDSIDE ATTACK\
2017-11-22 14:48:00	FOXNEWSW	14	FOXNEWSW_20171122_140000_Americas_Newsroom_With_Bill_Hemmer_and_Sandra_Smith/start/2880	> CAPRI CAFARO D | FMR OHIO SENATE MINORITY LEADER\n> CAPRI CAFARO | AMERICAN UNIV SCH OF PUBLIC AFFAIRS
2017-11-22 14:49:00	FOXNEWSW	49	FOXNEWSW_20171122_140000_Americas_Newsroom_With_Bill_Hemmer_and_Sandra_Smith/start/2940	'ES TRUMP BREAKS SILENCE ON ROY MOORE
2017-11-22 14:50:00	CNNW	21	CNNW_20171122_140000_CNN_Newsroom_With_John_Berman_and_Poppy_Harlow/start/3000	RAND PAUL'S WIFE SPEAKS OUT ON \"BLINDSIDE A'ITACK\". . Sunlen Serfaty OW Correspondent\nRAND PAUL'S WIFE SPEAKS OUT ON \"BLINDSIDE ATTACK\"\nRAND PAUL'S WIFE SPEAKS OUT ON \"BLINDSIDE A'ITACK\". . Sunlen Serfaty CJ\\N...
2017-11-22 14:50:00	MSNBCW	20	MSNBCW_20171122_140000_MSNBC_Live_With_Stephanie_Ruhle/start/3000	TRUMP: \"IT WAS ME\" THAT GOT UCLA PLAYERS OUT OF CHINA\nTRUMP RIPS INTO UCLA PLAYER'S DAD AS \"UNGRATEFUL FOOL!\
2017-11-22 14:51:00	CNNW	11	CNNW_20171122_140000_CNN_Newsroom_With_John_Berman_and_Poppy_Harlow/start/3060	TEEN IDOL DAVID CASSIDY DIES AT 67\nRAND PAUL'S WIFE SPEAKS OUT ON \"BLINDSIDE ATTACK\
2017-11-22 14:51:00	FOXNEWSW	3	FOXNEWSW_20171122_140000_Americas_Newsroom_With_Bill_Hemmer_and_Sandra_Smith/start/3060	RAMTRUCKSJIOM
