2017-11-22 18:13:00	FOXNEWSW	6	FOXNEWSW_20171122_180000_Outnumbered_Overtime_With_Harris_Faulkner/start/780	OUSE ETHICS COMMITTEE LAUNCHES INVESTIGATION INTO. A I A I A AA I A I A A A ' ' I A '\n| \u2014 - ' \u2014 V. IOUSE ETHICS COMMITTEE LAUNCHES INVESTIGATION INTO. . IFGATInMC n: (FYI IAI Mle'nMnl lf'T ACAIMCT DID rnmvznc
2017-11-22 18:13:00	MSNBCW	24	MSNBCW_20171122_180000_MSNBC_Live_With_Craig_Melvin/start/780	TRUMP BACKS MOORE IN ALABAMA SENATE RACE, POINTS TO DENIALS\nTRUMP: MOORE \"TOTALLY DENIES IT\" AND \"YOU HAVE TO LISTEN TO HIM\"\nBRIAN MCGUIRE | FMR.CH|EFOFSTAFF,SEN.MITCHMCCONNELL\nTRUMP: \"WE DON'T...
2017-11-22 18:14:00	BBCNEWS	4	BBCNEWS_20171122_180000_BBC_News_at_Six/start/840	PETER NORMAN. Say No to Sandleford campaigner
2017-11-22 18:14:00	FOXNEWSW	4	FOXNEWSW_20171122_180000_Outnumbered_Overtime_With_Harris_Faulkner/start/840	WHAT TO EXPECT FROM ETHICS INVESTIGATION. L I A A I A A A A ' ' I A ' I A A
2017-11-22 18:14:00	MSNBCW	27	MSNBCW_20171122_180000_MSNBC_Live_With_Craig_Melvin/start/840	TRUMP: ROY MOORE \"DENIES IT, THAT'S ALL I CAN SAY\"\nTRUMP: \"WE DON'T NEED A LIBERAL\" IN ALABAMA SENATE SEAT\nCBS: THREE CBS EMPLOYEES COME FORWARD. WITH ALLEGATIONS AGAINST CHARLIE ROSE
2017-11-22 18:15:00	BBCNEWS	4	BBCNEWS_20171122_180000_BBC_News_at_Six/start/900	SARAH-JANE MARSH. Birmingham Women's and Children's NHS Trust
2017-11-22 18:15:00	CNNW	17	CNNW_20171122_180000_Wolf/start/900	1.8OO.551.8963 preventcruelty.org
2017-11-22 18:15:00	FOXNEWSW	13	FOXNEWSW_20171122_180000_Outnumbered_Overtime_With_Harris_Faulkner/start/900	III '. WAITING VERDICT IN KATE STEINLE MURDER TRIAL\nPRECISION CRAFTED PERFORMANCE
2017-11-22 18:15:00	MSNBCW	15	MSNBCW_20171122_180000_MSNBC_Live_With_Craig_Melvin/start/900	UBER: HACKERS STOLE PERSONAL INFO ON 57M RIDERS & DRIVERS\nCBS: THREE CBS EMPLOYEES COME FORWARD. WITH ALLEGATIONS AGAINST CHARLIE ROSE
2017-11-22 18:16:00	BBCNEWS	5	BBCNEWS_20171122_180000_BBC_News_at_Six/start/960	SAFFRON CORDERY. NHS Providers\nMARK HARVEY. Nurse
2017-11-22 18:17:00	CNNW	30	CNNW_20171122_180000_Wolf/start/1020	DARING DEFECTION FROM NORTH KOREA CAUGHT ON CAMERA\negglandsbest.com
2017-11-22 18:18:00	BBCNEWS	10	BBCNEWS_20171122_180000_BBC_News_at_Six/start/1080	NBBCNewsSix
2017-11-22 18:18:00	CNNW	31	CNNW_20171122_180000_Wolf/start/1080	DARING DEFECTION FROM NORTH KOREA CAUGHT ON CAMERA\nVIDEO SHOWS NORTH KOREAN DEFECTOR'S ESCAPE, UNDER FIRE
2017-11-22 18:18:00	MSNBCW	21	MSNBCW_20171122_180000_MSNBC_Live_With_Craig_Melvin/start/1080	CBS, PBS, BLOOMBERG CUT TIES WITH CHARLIE ROSE\nCBS: THREE CBS EMPLOYEES COME FORWARD. WITH ALLEGATIONS AGAINST CHARLIE ROSE
2017-11-22 18:20:00	CNNW	62	CNNW_20171122_180000_Wolf/start/1200	DARING DEFECTION FROM NORTH KOREA CAUGHT ON CAMERA
2017-11-22 18:20:00	FOXNEWSW	7	FOXNEWSW_20171122_180000_Outnumbered_Overtime_With_Harris_Faulkner/start/1200	AITING VERDICT IN KATE STEINLE MURDER TRIAL
2017-11-22 18:20:00	MSNBCW	34	MSNBCW_20171122_180000_MSNBC_Live_With_Craig_Melvin/start/1200	FORMER INTERN: CHARLIE ROSE SHOWED ME GRAPHIC. SEX SCENE FROM A MOVIE. BUT DID NOT TOUCH ME\nCBS: THREE CBS EMPLOYEES COME FORWARD. WITH ALLEGATIONS AGAINST CHARLIE ROSE\nCBS, PBS, BLOOMBERG CUT TIES WITH CHARLIE ROSE
2017-11-22 18:21:00	CNNW	39	CNNW_20171122_180000_Wolf/start/1260	DARING DEFECTION FROM NORTH KOREA CAUGHT ON CAMERA\nDARING DEFECTION FROM NORTH KOREA CAUGHT ON CAMERA. . Balbina Hwang Former Senior Adviser, State Department
2017-11-22 18:21:00	MSNBCW	26	MSNBCW_20171122_180000_MSNBC_Live_With_Craig_Melvin/start/1260	CHARLIE ROSE: \"I DO NOT BELIEVE THAT. ALL OF THESE ALLEGATIONS ARE ACCURATE\"\nWASH POST REPORTER: MORE THAN A DOZEN NEW ACCUSERS. HAVE COME FORWARD WITH ALLEGATIONS AGAINST CHARLIE ROSE\nACCUSERS FROM \"CHARLIE...
2017-11-22 18:22:00	CNNW	32	CNNW_20171122_180000_Wolf/start/1320	DARING DEFECTION FROM NORTH KOREA CAUGHT ON CAMERA\nDOCTOR: NORTH KOREAN DEFECTOR'S BODY FULL OF PARASITES. . . . Balbina Hwang Former Senior Adviser, State Department\nDOCTOR: NORTH...
2017-11-22 18:22:00	FOXNEWSW	24	FOXNEWSW_20171122_180000_Outnumbered_Overtime_With_Harris_Faulkner/start/1320	WSJ: MLIJELLER'S TEAM NOW LOOKING INTO
2017-11-22 18:22:00	MSNBCW	28	MSNBCW_20171122_180000_MSNBC_Live_With_Craig_Melvin/start/1320	WASH POST REPORTER: MORE THAN A DOZEN NEW ACCUSERS. HAVE COME FORWARD WITH ALLEGATIONS AGAINST CHARLIE ROSE\nCBS, PBS, BLOOMBERG CUT TIES WITH CHARLIE ROSE\nUBER: HACKERS STOLE PERSONAL INFO ON 57M RIDERS & DRIVERS
2017-11-22 18:23:00	CNNW	15	CNNW_20171122_180000_Wolf/start/1380	DARING DEFECTION FROM NORTH KOREA CAUGHT ON CAMERA. . Balbina Hwang Former Senior Adviser, State Department\nTRUMP CALLS BALL \"UNGRATEFUL FOOL\", COMPARES TO DON KING\nDID GOP SENATOR TIP HER HAND ON FATE OF TAX BILL?\nDARING DEFECTION FROM NORTH...
2017-11-22 18:23:00	MSNBCW	11	MSNBCW_20171122_180000_MSNBC_Live_With_Craig_Melvin/start/1380	DRAMATIC VIDEO SHOWS N. KOREAN SOLDIERS SHOOTING DEFECT OR
2017-11-22 18:24:00	FOXNEWSW	6	FOXNEWSW_20171122_180000_Outnumbered_Overtime_With_Harris_Faulkner/start/1440	\ufb02. NEW QUESTIONS ON MUELLER'S. :nrl R IN 11.\": DI Iccm Donn:
2017-11-22 18:25:00	BBCNEWS	5	BBCNEWS_20171122_180000_BBC_News_at_Six/start/1500	EMMERSON MNANGAGWA. Former Vice-President of Zimbabwe
2017-11-22 18:26:00	BBCNEWS	8	BBCNEWS_20171122_180000_BBC_News_at_Six/start/1560	KAMAL AHMED. Economics Editor
2017-11-22 18:26:00	CNNW	6	CNNW_20171122_180000_Wolf/start/1560	Symptoms may include pain in the right or middle upper stomach area, fever,. mmm nausea and vomiting, or your skin or the white part of your eyes turn yellow.
2017-11-22 18:26:00	MSNBCW	4	MSNBCW_20171122_180000_MSNBC_Live_With_Craig_Melvin/start/1560	UBER: HACKERS STOLE PERSONAL INFO ON 57M RIDERS & DRIVERS
2017-11-22 18:27:00	CNNW	18	CNNW_20171122_180000_Wolf/start/1620	1 -8OO-NEW-BMWS\nI SATURDAY 7P
2017-11-22 18:27:00	MSNBCW	34	MSNBCW_20171122_180000_MSNBC_Live_With_Craig_Melvin/start/1620	UBER: HACKERS STOLE PERSONAL INFO ON 57M RIDERS & DRIVERS\nUBER: WE KEPT DATA BREACH UNDER WRAPS FOR A YEAR
2017-11-22 18:28:00	CNNW	39	CNNW_20171122_180000_Wolf/start/1680	TRUMP BACKS ACCUSED SEX ASSAULTER, CITING HIS DENIAL
2017-11-22 18:28:00	MSNBCW	19	MSNBCW_20171122_180000_MSNBC_Live_With_Craig_Melvin/start/1680	UBER CEO: \"NONE OF THIS SHOULD HAVE. HAPPENED AND I WILL NOT MAKE EXCUSES FOR IT\"\nUBER: PAID 2 HACKERS $1OO,OOO, DATA HAS SINCE BEEN \"DESTROYED\"\nUBER CEO: \"WE ARE CHANGING THE WAY WE DO BUSINESS\"\nUBER: HACKERS STOLE...
2017-11-22 18:29:00	CNNW	30	CNNW_20171122_180000_Wolf/start/1740	TRUMP ENDORSES DESPITE IVANKA'S \"SPECIAL PLACE IN HELLII DIG. . AB. Stoddard Associate Editor and Columnist, RealClearPolitics\nTRUMP BACKS ACCUSED SEX ASSAULTER, CITING HIS DENIAL\nTRUMP ENDORSES DESPITE IVANKA'S \"SPECIAL PLACE IN HELL\" DIG
2017-11-22 18:29:00	MSNBCW	22	MSNBCW_20171122_180000_MSNBC_Live_With_Craig_Melvin/start/1740	UBER: PAID 2 HACKERS $1OO,OOO, DATA HAS SINCE BEEN \"DESTROYED\"\nUBER: WE KEPT DATA BREACH UNDER WRAPS FOR A YEAR\nUBER: HACKERS STOLE PERSONAL INFO ON 57M RIDERS & DRIVERS
2017-11-22 18:30:00	FOXNEWSW	13	FOXNEWSW_20171122_180000_Outnumbered_Overtime_With_Harris_Faulkner/start/1800	Give the GIFT or HEALTH! K
2017-11-22 18:30:00	MSNBCW	47	MSNBCW_20171122_180000_MSNBC_Live_With_Craig_Melvin/start/1800	UBER: HACKERS STOLE PERSONAL INFO ON 57M RIDERS & DRIVERS\nGOP SEN. MURKOWSKI BACKING OBAMACARE MANDATE. REPEAL IN APPARENT BOOST FOR GOP TAX BILL
2017-11-22 18:31:00	BBCNEWS	37	BBCNEWS_20171122_183000_Sportsday/start/60	KEVIN SPACEY ALLEGATONS\nYOUR BUDGET QUESTIONS
2017-11-22 18:31:00	CNNW	45	CNNW_20171122_180000_Wolf/start/1860	TRUMP'S JUSTIFICATION FOR BACKING MOORE: \"HE DENIES IT\". . Sunlen Serfaty CJ\\I\\I CongressionalCorrespondent\nGOP SOURCE: TRUMP'S DOUBT OF ACCUSERS LED TO DECISION\nTRUMP'S JUSTIFICATION FOR BACKING MOORE: \"HE DENIES IT\
2017-11-22 18:31:00	MSNBCW	29	MSNBCW_20171122_180000_MSNBC_Live_With_Craig_Melvin/start/1860	WH MILITARY PERSONNEL \"REASSIGNED\" OVER ALLEGED. CONTACT WITH WOMEN DURING TRUMP\u2019S ASIA TRIP\nGOP SEN. MURKOWSKI BACKING OBAMACARE MANDATE. REPEAL IN APPARENT BOOST FOR GOP TAX BILL
2017-11-22 18:32:00	BBCNEWS	55	BBCNEWS_20171122_183000_Sportsday/start/120	YOUR BUDGET QUESTIONS\nTHE PAPERS
2017-11-22 18:32:00	CNNW	44	CNNW_20171122_180000_Wolf/start/1920	GOP SOURCE: TRUMP'S DOUBT OF ACCUSERS LED TO DECISION. . Juana Summers OW Politics Senior Writer\nGOP SOURCE: TRUMP'S DOUBT OF ACCUSERS LED TO DECISION
2017-11-22 18:32:00	MSNBCW	33	MSNBCW_20171122_180000_MSNBC_Live_With_Craig_Melvin/start/1920	EX-TEAM USA GYMNASTICS DOCTOR. PLEADS GUILTY IN SEXUAL ASSAULT CASE\nTILLERSON DECLARES VIOLENCE AGAINST. ROHINGYA IN MYANMAR AS \"ETHNIC CLEANSING\
2017-11-22 18:33:00	CNNW	26	CNNW_20171122_180000_Wolf/start/1980	TRUMP: FREED PLAYER'S DAD AN \"UNGRATEFUL FOOL\"\nGOP SOURCE: TRUMP'S DOUBT OF ACCUSERS LED TO DECISION. . Juana Summers OW Politics Senior Writer\nGOP SOURCE: TRUMP'S DOUBT OF ACCUSERS...
2017-11-22 18:33:00	FOXNEWSW	7	FOXNEWSW_20171122_180000_Outnumbered_Overtime_With_Harris_Faulkner/start/1980	r)_\u2014. . PRESIDENT TRUMP SPENDS 9O MINUTES ON. 11.\": DI-lan: wn'u m IcelAM DDFCIDFMT DI ITIM\nr)_\u2014. . PRESIDENT TRUMP SPENDS 9O MINUTES ON. 11.\": DI-lan: \\AIITI-l DI KQIAM DDFCIDFMT DI ITIM\nPRESIDENT TRUMP SPENDS 9O MINUTES ON
2017-11-22 18:33:00	MSNBCW	45	MSNBCW_20171122_180000_MSNBC_Live_With_Craig_Melvin/start/1980	DRAMATIC VIDEO SHOWS N. KOREAN SOLDIERS SHOOTING DEFECT OR\nTILLERSON DECLARES VIOLENCE AGAINST. ROHINGYA IN MYANMAR AS \"ETHNIC CLEANSING\
2017-11-22 18:34:00	CNNW	34	CNNW_20171122_180000_Wolf/start/2040	TRUMP: UCLA PLAYER'S DAD A \"POOR MAN'S DON KING\". . . . Juana Summers OW Politics Senior Writer\nTRUMP: FREED PLAYER'S DAD AN \"UNGRATEFUL FOOL\"\nTRUMP: FREED PLAYER'S DAD AN \"UNGRATEFUL FOOL\". . . . AB. Stoddard Host, No Labels...
2017-11-22 18:34:00	MSNBCW	28	MSNBCW_20171122_180000_MSNBC_Live_With_Craig_Melvin/start/2040	DRAMATIC VIDEO SHOWS N. KOREAN SOLDIERS SHOOTING DEFECT OR\nU.N.: N. KOREA VIOLATED WAR ARMISTICE IN FIRING AT DEFECT OR
2017-11-22 18:35:00	BBCNEWS	29	BBCNEWS_20171122_183000_Sportsday/start/300	SPORTSDAV\nSTEVE SMITH. Austvalia Captain\n. . SPORTSDAV
2017-11-22 18:35:00	CNNW	47	CNNW_20171122_180000_Wolf/start/2100	TRUMP: FREED PLAYER'S DAD AN \"UNGRATEFUL FOOL\". . . . AB. Stoddard Host, No Labels Radio on SiriusXM\nTRUMP: FREED PLAYER'S DAD AN \"UNGRATEFUL FOOL\
2017-11-22 18:35:00	MSNBCW	12	MSNBCW_20171122_180000_MSNBC_Live_With_Craig_Melvin/start/2100	HOUSE ETHICS PANEL LAUNCHING PROBE INTO REP. CONYERS\nESCAPED N. KOREAN DEFECTOR RECOVERING AFI'ER SURGERY\nU.N.: N. KOREA VIOLATED WAR ARMISTICE IN FIRING AT DEFECT OR
2017-11-22 18:36:00	BBCNEWS	13	BBCNEWS_20171122_183000_Sportsday/start/360	GRAEME SWANN. England 2OO8-2O13\nSPONTSDAV
2017-11-22 18:36:00	CNNW	20	CNNW_20171122_180000_Wolf/start/2160	TRUMP: FREED PLAYER'S DAD AN \"UNGRATEFUL FOOL\"\nTRUMP: FREED PLAYER'S DAD AN \"UNGRATEFUL FOOL\". . . . Sunlen Serfaty CJ\\N CongressionalCorrespondent\nTRUMP DEFENDS MOORE, QUESTIONS...
2017-11-22 18:36:00	MSNBCW	11	MSNBCW_20171122_180000_MSNBC_Live_With_Craig_Melvin/start/2160	TTV. 711. . 1' 8OO\" 3O1 .6397 IJJ UnitedHealth\nHow much do I need to retire?
2017-11-22 18:37:00	MSNBCW	14	MSNBCW_20171122_180000_MSNBC_Live_With_Craig_Melvin/start/2220	\"\"\" TTV. 111. . 1 8OO- 3O1- 6397 wUnitedHealth\nTTV. 711. . 1' 8OO\" 3O1 .6397 l\ufb02 UnitedHealth\n\"\"\" TTV. 111. . 1- 8OO 3O1- 6397 WumtedHealm\nTTV. 711. . 1~ 8OO\" 3O1 .6397 l\ufb02...
2017-11-22 18:38:00	BBCNEWS	6	BBCNEWS_20171122_183000_Sportsday/start/480	SPORTSDAV
2017-11-22 18:38:00	CNNW	7	CNNW_20171122_180000_Wolf/start/2280	Plan availability vanes by region and state\nUse as dlrected. Read each label.. Keep out O1 leach of mildlen.. VICKSSOM \u00a9 Procter & Gamble, Inc. 2O17
2017-11-22 18:38:00	MSNBCW	14	MSNBCW_20171122_180000_MSNBC_Live_With_Craig_Melvin/start/2280	\"\"\" TTV. 111. . 1- 8OO- 3O1- 6397 lJJUrutedHealth\nTTV. 711. . 1' 8OO\" 3O1 .6397 w UnitedHealth
2017-11-22 18:40:00	MSNBCW	20	MSNBCW_20171122_180000_MSNBC_Live_With_Craig_Melvin/start/2400	HOUSE ETHICS PANEL LAUNCHING PROBE INTO REP. CONYERS\nREPORT: NEW ACCUSER ALLEGED SHE WAS SEXUALLY. HARASSED BY REP. CONYERS IN COURT FILINGS THIS YEAR\nREPORT: NEW ACCUSER ALLEGED IN...
2017-11-22 18:41:00	FOXNEWSW	25	FOXNEWSW_20171122_180000_Outnumbered_Overtime_With_Harris_Faulkner/start/2460	RAMTRUCKSJDOM
2017-11-22 18:41:00	MSNBCW	35	MSNBCW_20171122_180000_MSNBC_Live_With_Craig_Melvin/start/2460	REPORT: NEW ACCUSER ALLEGED IN LAWSUIT SHE \"REPEATEDLY. AND DAILY\" DEALT WITH UNWANTED TOUCHING BY REP. CONYERS\nREP. CONYERS SPOKESMAN: NEW ACCUSER. \"VOLUNTARILY DECIDED TO DROP HER CASE\"\nREPORT: NEW ACCUSER DROPPED HER LAWSUIT AGAINST. REP....
2017-11-22 18:42:00	BBCNEWS	15	BBCNEWS_20171122_183000_Sportsday/start/720	CRAIG GORDON. Celtic\nBRENDAN RODGERS. Celtic Manage!
2017-11-22 18:42:00	MSNBCW	16	MSNBCW_20171122_180000_MSNBC_Live_With_Craig_Melvin/start/2520	DETROIT FREE PRESS: REP. CONYERS MUST RESIGN\nHOUSE ETHICS PANEL LAUNCHING PROBE INTO REP. CONYERS\nREP. CONYERS: \"I EXPRESSLY AND VEHEMENTLY DENIED. THE ALLEGATIONS MADE AGAINST...
2017-11-22 18:43:00	CNNW	24	CNNW_20171122_180000_Wolf/start/2580	TRUMP'S JUSTIFICATION FOR BACKING MOORE: \"HE DENIES IT\"\nTRUMP'S JUSTIFICATION FOR BACKING MOORE: \"HE DENIES IT\". . Rep Frances Rooney (R) Florida\nTRUMP BACKS ACCUSED CHILD MOLESTER OVER...
2017-11-22 18:43:00	FOXNEWSW	7	FOXNEWSW_20171122_180000_Outnumbered_Overtime_With_Harris_Faulkner/start/2580	TRUMP LEAVES DOOR OPEN TO CAMPAIGNING
2017-11-22 18:43:00	MSNBCW	36	MSNBCW_20171122_180000_MSNBC_Live_With_Craig_Melvin/start/2580	HOUSE ETHICS PANEL LAUNCHING PROBE INTO REP. CONYERS\nJENBC NEWS. KASIE HUNT CAPITOL HILL CORRESPONDENT\nPOWERFUL MEN IN SPOTLIGHT AS HARASSMENT SCANDALS GROW
2017-11-22 18:44:00	CNNW	30	CNNW_20171122_180000_Wolf/start/2640	TRUMP BACKS ACCUSED SEX ASSAULTER, CITING HIS DENIAL\nTRUMP BACKS ACCUSED SEX ASSAULTER CITING HIS DENIAL. . Rep Frances Rooney (R) Foreign Affairs Committee\nTRUMP BACKS ACCUSED SEX...
2017-11-22 18:44:00	MSNBCW	41	MSNBCW_20171122_180000_MSNBC_Live_With_Craig_Melvin/start/2640	POWERFUL MEN IN SPOTLIGHT AS HARASSMENT SCANDALS GROW
2017-11-22 18:45:00	BBCNEWS	16	BBCNEWS_20171122_183000_Sportsday/start/900	TOM DECENT. Sydney Morning Herald\nGREGOR TOWNSEND. Scotland Head Coach
2017-11-22 18:45:00	CNNW	22	CNNW_20171122_180000_Wolf/start/2700	TRUMP ENDORSES DESPITE IVANKA'S \"SPECIAL PLACE IN HELL\" DIG\nTRUMP ENDORSES DESPITE IVANKA'S \"SPECIAL PLACE IN HELLII DIG. . Rep Frances Rooney (R) Florida\nTRUMP BACKS ACCUSED SEX ASSAULTER,...
2017-11-22 18:45:00	FOXNEWSW	15	FOXNEWSW_20171122_180000_Outnumbered_Overtime_With_Harris_Faulkner/start/2700	TRUMP LEAVES DOOR OPEN TO CAMPAIGNING\n\ufb02 \u2014. GUY BENSON. . [AV kIE\\AIC I'nkl'l'nlnl I'I'\ufb01D
2017-11-22 18:46:00	BBCNEWS	31	BBCNEWS_20171122_183000_Sportsday/start/960	SEAN MAITLAND. Scotland
2017-11-22 18:46:00	FOXNEWSW	12	FOXNEWSW_20171122_180000_Outnumbered_Overtime_With_Harris_Faulkner/start/2760	TRUMP LEAVES DOOR OPEN TO CAMPAIGNING\nTRUMP LEAVES DOOR OPEN TO CAMPAIGNING. A _ u I . ' A _ I L I _ H\nTRUMP LEAVES DOOR OPEN TO CAMPAIGNING. \\AIITI-l MnnDl: AC I-ll:...
2017-11-22 18:47:00	CNNW	36	CNNW_20171122_180000_Wolf/start/2820	TRUMP TO END PROTECTED STATUS FOR HAITIANS. . Rep Frances Rooney (R) Foreign Affairs Committee\nTRUMP TO END PROTECTED STATUS FOR HAITIANS\nTRUMP TO END PROTECTED STATUS FOR HAITIANS. . Rep Frances Rooney (R) Florida
2017-11-22 18:48:00	CNNW	23	CNNW_20171122_180000_Wolf/start/2880	TRUMP TO END PROTECTED STATUS FOR HAITIANS. . Rep Frances Rooney (R) Florida\nU.S. MAKES DECLARATION ON MASSACRE UNFOLDING IN MYANMAR\nTRUMP TO END PROTECTED STATUS FOR HAITIANS
2017-11-22 18:49:00	MSNBCW	15	MSNBCW_20171122_180000_MSNBC_Live_With_Craig_Melvin/start/2940	POWERFUL MEN IN SPOTLIGHT AS HARASSMENT SCANDALS GROW\nFBI: DEATH OF BORDER PATROL AGENT IN TEXAS. BEING INVESTIGATED AS POSSIBLE ATI'ACK
2017-11-22 18:50:00	MSNBCW	10	MSNBCW_20171122_180000_MSNBC_Live_With_Craig_Melvin/start/3000	1\u00bb877\u00bb8HUM|RA. HI IMInA\u00ae HI \u201dmm m\nRu nrocr'rintinn nnlu HI IMIRA {'\ufb02
2017-11-22 18:52:00	MSNBCW	10	MSNBCW_20171122_180000_MSNBC_Live_With_Craig_Melvin/start/3120	\"II I_. III-
2017-11-22 18:53:00	BBCNEWS	9	BBCNEWS_20171122_185000_BBC_News/start/180	BUDGET 2O17. Chancellor has delivered tax and spending plans\nCHARLES READ. The Economist\nBUDGET 2O17. OBR: Debt to peak this year then fall as share O1 GDP\nBUDGET 2O17. Growth {orecasts...
2017-11-22 18:53:00	CNNW	55	CNNW_20171122_180000_Wolf/start/3180	TILLERSON: CLEARLY \"ETHNIC CLEANSING\" IN MYANMAR
2017-11-22 18:53:00	FOXNEWSW	5	FOXNEWSW_20171122_180000_Outnumbered_Overtime_With_Harris_Faulkner/start/3180	EMBER SHAPING UP TO BE A BUSY MONTH FOR LAWMAKERS
2017-11-22 18:53:00	MSNBCW	9	MSNBCW_20171122_180000_MSNBC_Live_With_Craig_Melvin/start/3180	FBI: WE'RE INVESTIGATING \"A NUMBER OF POSSIBLE. SCENARIOS\" IN DEATH OF BORDER PATROL AGENT\nFBI: DEATH OF BORDER PATROL AGENT IN TEXAS. BEING INVESTIGATED AS POSSIBLE ATTACK
2017-11-22 18:54:00	BBCNEWS	11	BBCNEWS_20171122_185000_BBC_News/start/240	BUDGET 2O17. Chancellor announces tunher \u00a33bn for Brexit preparations\nBUDGET 2O11. OER delivers assessment of Chancellor's Budget\nBUDGET 2O17. Productivity Investment fund rises to to over \u00a331 bn\nBUDGET...
2017-11-22 18:54:00	CNNW	35	CNNW_20171122_180000_Wolf/start/3240	TILLERSON: CLEARLY \"ETHNIC CLEANSING\" IN MYANMAR\nTILLERSON: CLEARLY \"ETHNIC CLEANSING\" IN MYANMAR. . Michelle Kosinski CJ\\N Senior Diplomatic Correspondent
2017-11-22 18:54:00	FOXNEWSW	10	FOXNEWSW_20171122_180000_Outnumbered_Overtime_With_Harris_Faulkner/start/3240	\ufb02 \u2014. GUY BENSON. . Tn'AIkILIAII rnu Dnl I'I'II'C :nl'rnn\nEMBER SHAPING UP TO BE A BUSY MONTH FOR LAWMAKERS\nl. ZAC PETKANAS I. . [I'D nklf' CEKIInD An'lICED
2017-11-22 18:54:00	MSNBCW	27	MSNBCW_20171122_180000_MSNBC_Live_With_Craig_Melvin/start/3240	FBI \"AGGRESSIVELY INVESTIGATING ALL LEADS\". IN DEATH OF BORDER PATROL AGENT\nBORDER PATROL AGENT KILLED, SECOND SERIOUSLY. HURT IN POSSIBLE ATI'ACK ALONG TEXAS BORDER\nFBI: WE'RE INVESTIGATING \"A NUMBER OF...
2017-11-22 18:55:00	BBCNEWS	13	BBCNEWS_20171122_185000_BBC_News/start/300	BUDGET 2O17. Chancellor has delivered tax and spending plans\nBUDGET 2O17. Growth lorecasts downgraded for next four years\nBUDGET 2O17. OER: Debt to peak this yeav then fall as share O! GDP\nBUDGET...
2017-11-22 18:55:00	CNNW	62	CNNW_20171122_180000_Wolf/start/3300	TILLERSON: CLEARLY \"ETHNIC CLEANSING\" IN MYANMAR. . Michelle Kosinski CJ\\N Senior Diplomatic Correspondent
2017-11-22 18:55:00	FOXNEWSW	19	FOXNEWSW_20171122_180000_Outnumbered_Overtime_With_Harris_Faulkner/start/3300	WHETHER CONGRESS WILL GET THE ITEMS ON
2017-11-22 18:55:00	MSNBCW	15	MSNBCW_20171122_180000_MSNBC_Live_With_Craig_Melvin/start/3300	JUDGE SLAMS TRUMP'S TWEETS, BLOCKS TRANSGENDER TROOP BAN
2017-11-22 18:56:00	BBCNEWS	19	BBCNEWS_20171122_185000_BBC_News/start/360	BUDGET 2O17. OER delivers assessment of Chancellor's Budget\nBUDGET 2O17. Productivity Investment fund rises to to over \u00a331bn\nBUDGET 2O17. Chancellor: Public borrowing to 1a|| every year to...
2017-11-22 18:56:00	CNNW	10	CNNW_20171122_180000_Wolf/start/3360	3 MISSING AFI'ER U.S. NAW PLANE CRASHES OFF JAPAN\nTILLERSON: CLEARLY \"ETHNIC CLEANSING\" IN MYANMAR. . Michelle Kosinski CJ\\N Senior Diplomatic Correspondent\nTILLERSON: CLEARLY \"ETHNIC...
2017-11-22 18:56:00	MSNBCW	7	MSNBCW_20171122_180000_MSNBC_Live_With_Craig_Melvin/start/3360	Taken wnh evening meal.
2017-11-22 18:57:00	BBCNEWS	10	BBCNEWS_20171122_185000_BBC_News/start/420	BUDGET 2O17. Living Wage to rise to 27,83 an hour fvom April
2017-11-22 18:57:00	CNNW	15	CNNW_20171122_180000_Wolf/start/3420	BIRCHBOX.COM
2017-11-22 18:57:00	FOXNEWSW	3	FOXNEWSW_20171122_180000_Outnumbered_Overtime_With_Harris_Faulkner/start/3420	I'E. . nllAl'lA (Tull/c OMAHAQTFAKQ COM/HO] IDAY
2017-11-22 18:57:00	MSNBCW	13	MSNBCW_20171122_180000_MSNBC_Live_With_Craig_Melvin/start/3420	W Xare. . \u00a7 Hvaroxaba\nAvailable by prescription only. See our ad in Popular Etience.
2017-11-22 18:58:00	BBCNEWS	9	BBCNEWS_20171122_185000_BBC_News/start/480	DARREN BETI\u2019
2017-11-22 18:58:00	CNNW	8	CNNW_20171122_180000_Wolf/start/3480	888.391.PALM SouthBeachDiet.c<
2017-11-22 18:59:00	FOXNEWSW	18	FOXNEWSW_20171122_180000_Outnumbered_Overtime_With_Harris_Faulkner/start/3540	Preventive care
2017-11-22 18:59:00	MSNBCW	7	MSNBCW_20171122_180000_MSNBC_Live_With_Craig_Melvin/start/3540	TRUMP BACKS MOORE IN ALABAMA SENATE RACE, POINTS TO DENIALS
2017-11-22 19:00:00	BBCNEWS	22	BBCNEWS_20171122_185000_BBC_News/start/600	MLADIC SENTENCED TO LIFE\nBUDGETING FOR BREXIT\nTRUMP ON MOORE
2017-11-22 19:00:00	CNNW	18	CNNW_20171122_180000_Wolf/start/3600	TRUMP BACKS ACCUSED SEX ASSAULTER, CITING HIS DENIAL\nBrooke Baldwin. @BrookeBCNN
2017-11-22 19:00:00	FOXNEWSW	10	FOXNEWSW_20171122_180000_Outnumbered_Overtime_With_Harris_Faulkner/start/3600	ISSING AFTER NAW PLANE CRASHES IN PACIFIC\nb LUCAS TOMLINSON
2017-11-22 19:01:00	BBCNEWS	7	BBCNEWS_20171122_190000_Beyond_100_Days/start/60	ZIMBABWE'S NEXT PRESIDENT
2017-11-22 19:01:00	CNNW	61	CNNW_20171122_190000_CNN_Newsroom_With_Brooke_Baldwin/start/60	TRUMP BACKS ACCUSED SEX ASSAULTER, CITING HIS DENIAL
2017-11-22 19:01:00	FOXNEWSW	24	FOXNEWSW_20171122_190000_The_Daily_Briefing_With_Dana_Perino/start/60	SEARCH FOR 3 MISSING SERVICE MEMBERS. . -I.A.--. -._ n\nSEARCH FOR 3 MISSING SERVICE MEMBERS
2017-11-22 19:01:00	MSNBCW	34	MSNBCW_20171122_190000_MSNBC_Live_With_Katy_Tur/start/60	TRUMP BACKS MOORE IN ALABAMA SENATE RACE, POINTS TO DENIALS\nMOORE CONSIDERING LEGAL ACTION AGAINST HIS ACCUSERS
2017-11-22 19:02:00	CNNW	34	CNNW_20171122_190000_CNN_Newsroom_With_Brooke_Baldwin/start/120	TRUMP BACKS ACCUSED SEX ASSAULTER, CITING HIS DENIAL\nTHE LOOMING SHOWDOWN IF MOORE WINS SENATE RACE
2017-11-22 19:02:00	FOXNEWSW	32	FOXNEWSW_20171122_190000_The_Daily_Briefing_With_Dana_Perino/start/120	MISSING AFTER NAW PLANE CRASHES IN PACIFIC\nNAW TRANSPORT PLANE CRASHES WHILE. TAKING DADT IM InIMTII c -IADAM :vcnrlccc
2017-11-22 19:02:00	MSNBCW	21	MSNBCW_20171122_190000_MSNBC_Live_With_Katy_Tur/start/120	TRUMP BACKS MOORE IN ALABAMA SENATE RACE, POINTS TO DENIALS\nBeverly Young Nelson
2017-11-22 19:03:00	CNNW	62	CNNW_20171122_190000_CNN_Newsroom_With_Brooke_Baldwin/start/180	THE LOOMING SHOWDOWN IF MOORE WINS SENATE RACE
2017-11-22 19:03:00	FOXNEWSW	18	FOXNEWSW_20171122_190000_The_Daily_Briefing_With_Dana_Perino/start/180	OORE CAMPAIGN CHALLENGES ACCUSERS' CLAIMS
2017-11-22 19:03:00	MSNBCW	53	MSNBCW_20171122_190000_MSNBC_Live_With_Katy_Tur/start/180	TRUMP BACKS MOORE IN ALABAMA SENATE RACE, POINTS TO DENIALS
2017-11-22 19:04:00	CNNW	47	CNNW_20171122_190000_CNN_Newsroom_With_Brooke_Baldwin/start/240	THE LOOMING SHOWDOWN IF MOORE WINS SENATE RACE\nTHINGS TRUMP HAS TWEETED ABOUT INSTEAD OF ROY MOORE
2017-11-22 19:04:00	MSNBCW	24	MSNBCW_20171122_190000_MSNBC_Live_With_Katy_Tur/start/240	TRUMP RIPS INTO UCLA PLAYER'S DAD AS \"UNGRATEFUL FOOL!\"\nTRUMP: MOORE \"TOTALLY DENIES IT\" AND \"YOU HAVE TO LISTEN TO HIM\"\nMOORE: \"DON'T KNOW\" ACCUSERS, \"CERTAINLY I DIDN'T DO ANYTHING TO THEM\
2017-11-22 19:05:00	BBCNEWS	11	BBCNEWS_20171122_190000_Beyond_100_Days/start/300	BEYOND 1OO DAYS\nRATKO MLADIC GUILTY. UN tribunal deliver guilty verdict in the Hague\nRATKO MLADIC GUILTY. Guilty verdict in 1O of the 11 charges\nRATKO...
2017-11-22 19:05:00	CNNW	62	CNNW_20171122_190000_CNN_Newsroom_With_Brooke_Baldwin/start/300	THINGS TRUMP HAS TWEETED ABOUT INSTEAD OF ROY MOORE
2017-11-22 19:05:00	FOXNEWSW	13	FOXNEWSW_20171122_190000_The_Daily_Briefing_With_Dana_Perino/start/300	. REPORT: ROY MOORE'S COMMUNICATIONS. . nIDFf'TnD AMMnI IMFFC I-IIC DFCIGMATIOM\n. REPORT: ROY MOORE'S COMMUNICATIONS. . nlnlzr'rnn AMMnI IMFFC I-IIC DFCICMATIOM\nREPORT: ROY MOORE' 5 COMMUNICATIONS
2017-11-22 19:05:00	MSNBCW	15	MSNBCW_20171122_190000_MSNBC_Live_With_Katy_Tur/start/300	TRUMP: LAVAR BALL \"JUST A POOR MAN'S. VERSION OF DON KING. BUT WITHOUT THE HAIR\
2017-11-22 19:06:00	BBCNEWS	11	BBCNEWS_20171122_190000_Beyond_100_Days/start/360	RATKO MLADIC GUILTY. Mladic was Bosnian Serb army commander in 199O5\nRATKO MLADIC GUILTV. Mladic on trial at the Hague since 2O12\nRATKO MLADIC GUILTY. Mladic guilty of genocide, crimes against...
2017-11-22 19:06:00	CNNW	29	CNNW_20171122_190000_CNN_Newsroom_With_Brooke_Baldwin/start/360	THINGS TRUMP HAS TWEETED ABOUT INSTEAD OF ROY MOORE\nTRUMP BACKS ACCUSED SEX ASSAULTER, CITING HIS DENIAL\nTRUMP BACKS ACCUSED SEX ASSAULTER, CITING HIS DENIAL. Sheila Gilbert Chairwoman,...
2017-11-22 19:06:00	FOXNEWSW	36	FOXNEWSW_20171122_190000_The_Daily_Briefing_With_Dana_Perino/start/360	. WEEKS UNTIL ALABAMA SENATE ELECTION\n> JASON JOHNSON | REPUBLICAN STRATEGIST\nWEEKS UNTIL ALABAMA SENATE ELECTION
2017-11-22 19:07:00	BBCNEWS	11	BBCNEWS_20171122_190000_Beyond_100_Days/start/420	RATKO MLADIC GUILTV \u2019. Over 8,OOO Muslim men and boys died in Srebrenica\nRATKO MLADIC GUILTY. Darko Mladic: Justice replaced by war propaganda\nRATKO MLADIC GUILTY. UN tribunal deliver guilty verdict in the...
2017-11-22 19:07:00	CNNW	42	CNNW_20171122_190000_CNN_Newsroom_With_Brooke_Baldwin/start/420	TRUMP BACKS ACCUSED SEX ASSAULTER, CITING HIS DENIAL. Sheila Gilbert Chairwoman, Calhoun County Democratic Party\nALABAMA DEM: MORE GOP WOMEN COMING TO OUR SIDE\nTRUMP BACKS ACCUSED SEX ASSAULTER, CITING HIS DENIAL
2017-11-22 19:07:00	FOXNEWSW	16	FOXNEWSW_20171122_190000_The_Daily_Briefing_With_Dana_Perino/start/420	> JASON JOHNSON | REPUBLICAN STRATEGIST
2017-11-22 19:07:00	MSNBCW	37	MSNBCW_20171122_190000_MSNBC_Live_With_Katy_Tur/start/420	TRUMP BACKS MOORE IN ALABAMA SENATE RACE, POINTS TO DENIALS\nTRUMP: MOORE \"TOTALLY DENIES IT\" AND \"YOU HAVE TO LISTEN TO HIM\
