2017-12-03 00:00:00	BBCNEWS	15	BBCNEWS_20171202_234500_The_Film_Review/start/900	TRUMP ON FLYNN\nTIRED MOUNTAIN SYNDROME
2017-12-03 08:28:00	MSNBCW	8	MSNBCW_20171203_070000_Dateline/start/5280	TRUMP: \"I HAD TO FIRE GENERAL FLYNN BECAUSE. HE LIED TO THE VICE PRESIDENT AND THE FBI.\"\nABC NEWS SUSPENDS BRIAN ROSS AFTER. \"SERIOUS ERROR\" REPORTING ON FLYNN'S GUILTY PLEA
2017-12-03 08:31:00	CNNW	10	CNNW_20171203_080000_This_Is_Life_With_Lisa_Ling/start/1860	i GetLifeLockNow.com 1-8OO-664-O962 Eggggi\ufb01gee
2017-12-03 08:31:00	FOXNEWSW	41	FOXNEWSW_20171203_080000_Justice_With_Judge_Jeanine/start/1860	JudgeJeaninePirro @JudgeJeanine @JudgeJeanine I
2017-12-03 08:34:00	FOXNEWSW	7	FOXNEWSW_20171203_080000_Justice_With_Judge_Jeanine/start/2040	I> DAN BONGINO | FORMER SECRET SERVICE AGENT. . RESIDENT TRUMP TWEETING ABOUT MICHAEL FLYNN,. H\" I ADV n IMTnM AND AN\u201d NFWQ' RDIAN an\u201c
2017-12-03 08:36:00	MSNBCW	26	MSNBCW_20171203_070000_Dateline/start/5760	1-8OO 785-521O. . niuneh nth:
2017-12-03 08:37:00	FOXNEWSW	10	FOXNEWSW_20171203_080000_Justice_With_Judge_Jeanine/start/2220	RESIDENT TRUMP MEETING ABOUT MICHAEL FLYNN,. 7 HEARYSLINTON AND ABC NEWS' BRIAN Loss
2017-12-03 08:37:00	MSNBCW	28	MSNBCW_20171203_070000_Dateline/start/5820	rrmlir\ufb01aczmn ram \u2014
2017-12-03 08:38:00	BBCNEWS	4	BBCNEWS_20171203_080000_Breakfast/start/2280	JOSE MOUHINHO. Manchester United manager
2017-12-03 08:41:00	CNNW	15	CNNW_20171203_080000_This_Is_Life_With_Lisa_Ling/start/2460	#THISISLIFE
2017-12-03 08:41:00	FOXNEWSW	20	FOXNEWSW_20171203_080000_Justice_With_Judge_Jeanine/start/2460	UMLULAIM. COM. . \u201c$8OO 61O 243O
2017-12-03 08:41:00	MSNBCW	26	MSNBCW_20171203_070000_Dateline/start/6060	he only took whatever
2017-12-03 08:43:00	CNNW	3	CNNW_20171203_080000_This_Is_Life_With_Lisa_Ling/start/2580	therealreamom. . All Items are prerowned and consigned to The Rea/Real. Trademarks are owned by their respect/Ve brand owners
2017-12-03 08:43:00	FOXNEWSW	31	FOXNEWSW_20171203_080000_Justice_With_Judge_Jeanine/start/2580	SENATE REPUBLICANS PASS TAX BILL I\nSENATE REPUBLICANS PASS TAX BILL
2017-12-03 08:44:00	CNNW	9	CNNW_20171203_080000_This_Is_Life_With_Lisa_Ling/start/2640	g H. EXCLUSIVE TV'OFFER Z'TEETER.
2017-12-03 08:45:00	CNNW	23	CNNW_20171203_080000_This_Is_Life_With_Lisa_Ling/start/2700	g I V. EXCLUSIVE va OFFER ATEETER.
2017-12-03 08:45:00	FOXNEWSW	28	FOXNEWSW_20171203_080000_Justice_With_Judge_Jeanine/start/2700	SENATE REPUBLICANS PASS TAX BILL I\nJudgeJeaninePirro @JudgeJeanine .Judge_Jeanine I\nABC NEWS SUSPENDS BRIAN ROSS OVER. \"SERIOUS ERROR\" IN TRUMP/FLYNN REPORT I
2017-12-03 08:46:00	CNNW	5	CNNW_20171203_080000_This_Is_Life_With_Lisa_Ling/start/2760	LIFE. . WITH LISA LING
2017-12-03 08:46:00	FOXNEWSW	39	FOXNEWSW_20171203_080000_Justice_With_Judge_Jeanine/start/2760	ABC NEWS SUSPENDS BRIAN ROSS OVER. \"SERIOUS ERROR\" IN TRUMP/FLYNN REPORT\nJudgeJeaninePirro @JudgeJeanine .JudgeJeanine I
2017-12-03 08:48:00	BBCNEWS	10	BBCNEWS_20171203_080000_Breakfast/start/2880	\"=-. O' _ MONDAY\n\"=-. O' . MONDAY
2017-12-03 08:50:00	FOXNEWSW	12	FOXNEWSW_20171203_080000_Justice_With_Judge_Jeanine/start/3000	'UTRAGEOUS COMMENTS OF THE WEEK\n(1mm. \\usa
2017-12-03 08:51:00	FOXNEWSW	31	FOXNEWSW_20171203_080000_Justice_With_Judge_Jeanine/start/3060	'UTRAGEOUS COMMENTS or THE WEEK F\n>Y BEHAR CHEERS OVER FLYNN GUILTY PLEA NEWS F
2017-12-03 08:52:00	FOXNEWSW	42	FOXNEWSW_20171203_080000_Justice_With_Judge_Jeanine/start/3120	'UTRAGEOUS COMMENTS or THE WEEK F\nMSNBC'S JOE SCARBOROUGH GOES ON. WILD RANT ABOUT PRESIDENT TRUMP
2017-12-03 08:53:00	FOXNEWSW	23	FOXNEWSW_20171203_080000_Justice_With_Judge_Jeanine/start/3180	MSNBC'S JOE SCARBOROUGH GOES ON F. WILD RANT ABOUT PRESIDENT TRUMP\n> MICHAEL TAMMERO | \"IN THE FOXLIGHT\" HOST I. . MSNBC'S JOE SCARBOROUGH GOES ON. wu n RANT Annl IT DDFCIDFNT TDI IMD
2017-12-03 08:54:00	FOXNEWSW	22	FOXNEWSW_20171203_080000_Justice_With_Judge_Jeanine/start/3240	ABC NEWS SUSPENDS BRIAN ROSS OVER F. \"SERIOUS ERROR\" IN TRUMP/FLYNN REPORT\nMSNBC'S JOE SCARBOROUGH GOES ON F. WILD RANT ABOUT PRESIDENT TRUMP\n'UTRAGEOUS COMMENTS or THE WEEK F\n> MICHAEL TAMMERO | \"IN THE...
2017-12-03 08:55:00	FOXNEWSW	41	FOXNEWSW_20171203_080000_Justice_With_Judge_Jeanine/start/3300	ABC NEWS SUSPENDS BRIAN ROSS OVER F. \"SERIOUS ERROR\" IN TRUMP/FLYNN REPORT
2017-12-03 08:58:00	CNNW	3	CNNW_20171203_080000_This_Is_Life_With_Lisa_Ling/start/3480	Let us always stand with the unconformed.
2017-12-03 08:59:00	CNNW	27	CNNW_20171203_080000_This_Is_Life_With_Lisa_Ling/start/3540	#THISISLIFE
2017-12-03 08:59:00	FOXNEWSW	14	FOXNEWSW_20171203_080000_Justice_With_Judge_Jeanine/start/3540	WiseFoodStorage.com. . 8OO-88O-393O\nJudgeJeaninePirro @JudgeJeanine @JudgeJeanine I
2017-12-03 09:01:00	CNNW	12	CNNW_20171203_090000_CNN_Newsroom_Live/start/60	TRUMP TWEET SAYS HE FIRED FLYNN FOR LYING TO FBI\n1714UTC-2Dec2O17\nTRUMP: THERE'S BEEN ABSOLUTELY NO COLLUSION\nTRUMP TWEET SAYS HE FIRED FLYNN FOR LYING TO FBI. . Donald Trump U.S....
2017-12-03 09:02:00	CNNW	42	CNNW_20171203_090000_CNN_Newsroom_Live/start/120	TRUMP TWEET SAYS HE FIRED FLYNN FOR LYING TO FBI\nTRUMP: THERE'S BEEN ABSOLUTELY NO COLLUSION\nTRUMP TWEET SAYS HE FIRED FLYNN FOR LYING TO FBI. . Boris Sanchez U\\N Correspondent
2017-12-03 09:03:00	BBCNEWS	12	BBCNEWS_20171203_090000_BBC_News/start/180	SOCIAL MOBILITY BOARD QUIT. All four board members of the commission resign\nSOCIAL MOBILITY BOARD QUIT. Chair Alan Milburn: PM unable to commit to future\nSOCIAL MOBILITY BOARD QUIT. Resignations blamed on 'Iack...
2017-12-03 09:03:00	CNNW	62	CNNW_20171203_090000_CNN_Newsroom_Live/start/180	TRUMP TWEET SAYS HE FIRED FLYNN FOR LYING TO FBI
2017-12-03 09:04:00	CNNW	30	CNNW_20171203_090000_CNN_Newsroom_Live/start/240	NYT: TRUMP OFFICIALS WERE BRIEFED ON FLYNN'S MEETINGS\nTRUMP TWEET SAYS HE FIRED FLYNN FOR LYING TO FBI
2017-12-03 09:05:00	BBCNEWS	11	BBCNEWS_20171203_090000_BBC_News/start/300	SOCIAL MOBILITY BOARD QUIT. Chair Alan Milburn: PM unable to commit to future\nSOCIAL MOBILITY BOARD QUIT. Milbum: PM failing over pledge to build a fairer Britain
2017-12-03 09:05:00	CNNW	30	CNNW_20171203_090000_CNN_Newsroom_Live/start/300	TRUMP TWEET SAYS HE FIRED FLYNN FOR LYING TO FBI\nTRUMP TWEET SAYS HE FIRED FLYNN FOR LYING TO FBI. . Areva Martin gm Legal Analyst\nTRUMP LAWYER: TWEET PARAPHRASED WHITE HOUSE ATI'ORNEY
2017-12-03 09:06:00	BBCNEWS	25	BBCNEWS_20171203_090000_BBC_News/start/360	BREXIT NEGOTIATIONS. Leading Braxit supporters urge PM to walk away trom talks
2017-12-03 09:06:00	FOXNEWSW	28	FOXNEWSW_20171203_090000_The_Greg_Gutfeld_Show/start/360	\u00abTONIGHT.. The Greg Gurfeld Show\n\u00abTONIGHT-
2017-12-03 09:07:00	CNNW	54	CNNW_20171203_090000_CNN_Newsroom_Live/start/420	WHITE HOUSE SUGGESTS RUSSIA PROBE IS ALMOST OVER. . Areva Martin Attorney & Legal Affairs Commentator\nWHITE HOUSE SUGGESTS RUSSIA PROBE IS ALMOST OVER
2017-12-03 09:07:00	FOXNEWSW	11	FOXNEWSW_20171203_090000_The_Greg_Gutfeld_Show/start/420	E. \u201cN TO BOYCOTT WHITE HOUSE CHRISTMAS PARTY T\nJN TO BOYCOTT WHITE HOUSE CHRISTMAS PARTY
2017-12-03 09:08:00	CNNW	24	CNNW_20171203_090000_CNN_Newsroom_Live/start/480	TRUMP TWEET SAYS HE FIRED FLYNN FOR LYING TO FBI. . Areva Martin gm Legal Analyst\nTRUMP TWEET SAYS HE FIRED FLYNN FOR LYING TO FBI\nWHITE HOUSE SUGGESTS RUSSIA PROBE IS ALMOST OVER
2017-12-03 09:09:00	CNNW	30	CNNW_20171203_090000_CNN_Newsroom_Live/start/540	MICHAEL FLYNN'S RELATIONSHIP WITH TRUMP\nTRUMP TWEET SAYS HE FIRED FLYNN FOR LYING TO FBI. . Areva Martin gm Legal Analyst\nMICHAEL FLYNN'S RELATIONSHIP WITH TRUMP. . Donald...
2017-12-03 09:10:00	CNNW	38	CNNW_20171203_090000_CNN_Newsroom_Live/start/600	FLYNN FIRED BY OBAMA WHITE HOUSE, JOINED TRUMP TEAM\nMICHAEL FLYNN'S RELATIONSHIP WITH TRUMP\nMICHAEL FLYNN'S RELATIONSHIP WITH TRUMP. . Michael Flvnn Former Dir., U.S. Defense...
2017-12-03 09:10:00	FOXNEWSW	14	FOXNEWSW_20171203_090000_The_Greg_Gutfeld_Show/start/600	'. \\JN TO BOYCOTT WHITE HOUSE CHRISTMAS PARTY i\nTRUMP'S WEEK
2017-12-03 09:11:00	CNNW	20	CNNW_20171203_090000_CNN_Newsroom_Live/start/660	SOURCES: US. TO RECOGNIZE JERUSALEM AS CAPITAL OF ISRAEL\nMICHAEL FLYNN'S RELATIONSHIP WITH TRUMP\nTRUMP DEFENDED FLYNN DESPITE FIRING HIM IN FEBRUARY\nTRUMP DEFENDED FLYNN DESPITE FIRING HIM IN...
2017-12-03 09:11:00	FOXNEWSW	29	FOXNEWSW_20171203_090000_The_Greg_Gutfeld_Show/start/660	El The Greg Gul'feld Show\nTRUMP'S WEEK
2017-12-03 09:12:00	CNNW	24	CNNW_20171203_090000_CNN_Newsroom_Live/start/720	SOURCES: US. TO RECOGNIZE JERUSALEM AS CAPITAL OF ISRAEL\nSYRIAN STATE MEDIA: ISRAEL STRIKES SITE NEAR DAMASCUS\nISRAELI PM WARNS IRAN OVER ITS PRESENCE IN SYRIA. . Beniamin Netanvahu Israeli...
2017-12-03 09:12:00	FOXNEWSW	10	FOXNEWSW_20171203_090000_The_Greg_Gutfeld_Show/start/720	HARRY'S GETTING MARRIED
2017-12-03 09:13:00	CNNW	32	CNNW_20171203_090000_CNN_Newsroom_Live/start/780	YEMEN'S EX-PRESIDENT OFFERS TALKS TO SAUDI COALITION\nHONDURAS CURFEW AMID PRESIDENTIAL VOTE DISPUTE\nISRAELI PM WARNS IRAN OVER ITS PRESENCE IN SYRIA\nISRAELI PM WARNS IRAN OVER ITS...
2017-12-03 09:14:00	CNNW	6	CNNW_20171203_090000_CNN_Newsroom_Live/start/840	1-8OO-835-9O9O Call now for free guide. . TTY:711
2017-12-03 09:15:00	BBCNEWS	22	BBCNEWS_20171203_090000_BBC_News/start/900	US RUSSIA PROBE
2017-12-03 09:16:00	CNNW	19	CNNW_20171203_090000_CNN_Newsroom_Live/start/960	FREE 1-8OO-554-1O63. . INFORMATION AHS.com\nVVV UV I Ivvv. . AHS.com
2017-12-03 09:17:00	CNNW	7	CNNW_20171203_090000_CNN_Newsroom_Live/start/1020	OPPOSITION DECRIES HONDURAS CURFEW AMID VOTE DISPUTE
2017-12-03 09:17:00	FOXNEWSW	5	FOXNEWSW_20171203_090000_The_Greg_Gutfeld_Show/start/1020	7|.\u201c each film-mun ounul
2017-12-03 09:18:00	CNNW	26	CNNW_20171203_090000_CNN_Newsroom_Live/start/1080	OPPOSITION DECRIES HONDURAS CURFEW AMID VOTE DISPUTE\nGERMAN FAR-RIGHT PARTY AFD ELECTS LEADERS AMID PROTESTS\nGERMAN FAR-RIGHT PARTY ELECTS NATIONALIST AS CO-LEADER
2017-12-03 09:19:00	CNNW	20	CNNW_20171203_090000_CNN_Newsroom_Live/start/1140	U.S. OFFICIAL: MISSILE LIKELY FAILED RE-ENTRY\nPYONGYANG: TRUMP \"BEGGING FOR NUCLEAR WAR\"\nGERMAN FAR-RIGHT PARTY ELECTS NATIONALIST AS CO-LEADER\nHAWAII RESTARTS TESTS OF NUCLEAR...
2017-12-03 09:19:00	FOXNEWSW	20	FOXNEWSW_20171203_090000_The_Greg_Gutfeld_Show/start/1140	PRINCE HARRY AND MEGHAN MARKLE. ANNOUNCE ENGAGEMENT
2017-12-03 09:20:00	CNNW	53	CNNW_20171203_090000_CNN_Newsroom_Live/start/1200	HAWAII RESTARTS TESTS OF NUCLEAR WARNING SIRENS\nHAWAII RESTARTS TESTS OF NUCLEAR WARNING SIRENS. Lt. Col. Charles Anthony Hawaii Defense Dept.\nHAWAII RESTARTS TESTS OF NUCLEAR...
2017-12-03 09:21:00	CNNW	54	CNNW_20171203_090000_CNN_Newsroom_Live/start/1260	HAWAII PREPARES FOR POSSIBLE NUCLEAR STRIKE\nHAWAII PREPARES FOR POSSIBLE NUCLEAR STRIKE. . Lt. Col. Charles Anthony Hawaii Defense Dept.
2017-12-03 09:21:00	FOXNEWSW	9	FOXNEWSW_20171203_090000_The_Greg_Gutfeld_Show/start/1260	D JAMIE LISSOW | ACTOR/WRITER/COMEDIAN '. . PRINCE HARRY AND MEGHAN MARKLE. [mum nun: FNGAGFMFNT
2017-12-03 09:22:00	CNNW	45	CNNW_20171203_090000_CNN_Newsroom_Live/start/1320	HAWAII PREPARES FOR POSSIBLE NUCLEAR STRIKE\nHAWAII PREPARES FOR POSSIBLE NUCLEAR STRIKE. . Mitsuko Heidtke Hiroshima Survivor\nHAWAII PREPARES FOR POSSIBLE NUCLEAR STRIKE. . Matt...
2017-12-03 09:22:00	FOXNEWSW	4	FOXNEWSW_20171203_090000_The_Greg_Gutfeld_Show/start/1320	PRINCE HARRY AND MEGHAN MARKLE. ANNOUNCE ENGAGEMENT. . 75.\\ 113mg: 3' war-wt: mam
2017-12-03 09:23:00	CNNW	24	CNNW_20171203_090000_CNN_Newsroom_Live/start/1380	ITALIAN PRES. REACTS TO CNN EXCLUSIVE ON SLAVE AUCTIONS\nCNN TEAM RECOUNTS UNCOVERING MIGRANT SLAVE AUCTIONS\nCNN TEAM RECOUNTS UNCOVERING MIGRANT SLAVE AUCTIONS. . Voice of Nima Elbaqir (J\\N...
2017-12-03 09:24:00	CNNW	43	CNNW_20171203_090000_CNN_Newsroom_Live/start/1440	CNN TEAM RECOUNTS UNCOVERING MIGRANT SLAVE AUCTIONS\nCNN TEAM RECOUNTS UNCOVERING MIGRANT SLAVE AUCTIONS. . Nima Elbaqir OW Seniorlnternational Correspondent
2017-12-03 09:25:00	CNNW	62	CNNW_20171203_090000_CNN_Newsroom_Live/start/1500	CNN TEAM RECOUNTS UNCOVERING MIGRANT SLAVE AUCTIONS
2017-12-03 09:26:00	CNNW	51	CNNW_20171203_090000_CNN_Newsroom_Live/start/1560	CNN TEAM RECOUNTS UNCOVERING MIGRANT SLAVE AUCTIONS\nCNN TEAM RECOUNTS UNCOVERING MIGRANT SLAVE AUCTIONS. . Alex Platt OW Senior Photoiournalist
2017-12-03 09:26:00	FOXNEWSW	12	FOXNEWSW_20171203_090000_The_Greg_Gutfeld_Show/start/1560	stamns.com/tv
2017-12-03 09:27:00	CNNW	39	CNNW_20171203_090000_CNN_Newsroom_Live/start/1620	CNN TEAM RECOUNTS UNCOVERING MIGRANT SLAVE AUCTIONS\nHOW AFRICAN MIGRANTS GET TRAPPED IN WEB OF HUMAN TRAFFICKING\nCNN TEAM RECOUNTS UNCOVERING MIGRANT SLAVE AUCTIONS. . Nima Elbaqir OW...
2017-12-03 09:27:00	FOXNEWSW	7	FOXNEWSW_20171203_090000_The_Greg_Gutfeld_Show/start/1620	H. R. MCMASTER I. PRESIDENT 5 NATIONAL SECURITY ADVISOR. . m MIMIC LIN\nm. TEST NORTH KOREAN ICBM LAUNCH ENDS IN FAILURE I\nm. 'TEST NORTH KOREAN ICBM LAUNCH ENDS IN FAILURE I
2017-12-03 09:28:00	CNNW	48	CNNW_20171203_090000_CNN_Newsroom_Live/start/1680	HOW AFRICAN MIGRANTS GET TRAPPED IN WEB OF HUMAN TRAFFICKING
2017-12-03 09:28:00	FOXNEWSW	10	FOXNEWSW_20171203_090000_The_Greg_Gutfeld_Show/start/1680	m. 'TEST NORTH KORJEANIWCQM LAUNCH ENDS IN FAILURE I
2017-12-03 09:29:00	CNNW	14	CNNW_20171203_090000_CNN_Newsroom_Live/start/1740	FLYNN FALLOUT
2017-12-03 09:29:00	MSNBCW	8	MSNBCW_20171203_090000_Dateline/start/1740	hafhfi\ufb02'nr rnm 1-888-723-5O
2017-12-03 09:30:00	CNNW	32	CNNW_20171203_090000_CNN_Newsroom_Live/start/1800	,\ufb02f'\ufb02w 1-8OO-764-7O79. . mypillow.com
2017-12-03 09:30:00	FOXNEWSW	8	FOXNEWSW_20171203_090000_The_Greg_Gutfeld_Show/start/1800	b TYRUS I FOX NEWS CONTRIBUTOR '. . BROWN UNIVERSITY ALLOWING STUDENTS. Tn \"(Fl F.lnFNTIFY\" Ac DFDCONQ m: ml no
2017-12-03 09:31:00	FOXNEWSW	8	FOXNEWSW_20171203_090000_The_Greg_Gutfeld_Show/start/1860	> JAMIE LISSOW I ACTOR/WRITER/COMEDIAN r. . VICTORIA'S SECRET FASHION SHOW. Ar'\ufb02 mm m: ('l n11 IDAI ApppnpmATInN
2017-12-03 09:32:00	CNNW	12	CNNW_20171203_090000_CNN_Newsroom_Live/start/1920	TRUMP TWEET SAYS HE FIRED FLYNN FOR LYING TO FBI\nGeorge Howell. @GeorgeHowellCNN
2017-12-03 09:32:00	MSNBCW	12	MSNBCW_20171203_090000_Dateline/start/1920	TRUMP TWEET: FIRED MIKE FLYNN AS NATIONAL SECURITY. ADVISER BECAUSE HE LIED TO THE FBI AND VP PENCE
2017-12-03 09:33:00	CNNW	19	CNNW_20171203_090000_CNN_Newsroom_Live/start/1980	SYRIAN STATE MEDIA: ISRAEL STRIKES SITE NEAR DAMASCUS\nTRUMP HAILS SENATE PASSAGE OF TAX BILL\nTRUMP TWEET SAYS HE FIRED FLYNN FOR LYING TO FBI\nMOSCOW'S REAL INTENTIONS IN DEALING WITH FLYNN
2017-12-03 09:33:00	FOXNEWSW	5	FOXNEWSW_20171203_090000_The_Greg_Gutfeld_Show/start/1980	VICTORIA' S SECRET FASHION SHOW. iACCUSED OF CULTURAL APPROPRIATION. . .;. 2:11\u201c. LII H am\u201c: 12'
2017-12-03 09:33:00	MSNBCW	10	MSNBCW_20171203_090000_Dateline/start/1980	MCMASTER: NORTH KOREA'S ATI'EMPTS TO \"DEVELOP LONG RANGE. NUCLEAR CAPABILITY\" IS \"GREATEST IMMEDIATE THREAT\" TO THE US.\nTRUMP TWEET: FIRED MIKE FLYNN AS NATIONAL SECURITY. ADVISER BECAUSE HE LIED TO THE FBI AND VP PENCE
2017-12-03 09:34:00	CNNW	25	CNNW_20171203_090000_CNN_Newsroom_Live/start/2040	KISLYAK MOCKS MUELLER INVESTIGATION ON RUSSIAN TV\nSOURCE: FLYNN TALKED SANCTIONS WITH THE RUSSIANS\nMOSCOW'S REAL INTENTIONS IN DEALING WITH FLYNN\nKISLYAK MOCKS MUELLER INVESTIGATION ON...
2017-12-03 09:34:00	FOXNEWSW	9	FOXNEWSW_20171203_090000_The_Greg_Gutfeld_Show/start/2040	SHOCK AT 3O ROCK
2017-12-03 09:35:00	CNNW	26	CNNW_20171203_090000_CNN_Newsroom_Live/start/2100	TRUMP COMPLIMENTED PUTIN FOR NOT RETALIATING\nTRUMP COMPLIMENTED PUTIN FOR NOT RETALIATING. . Sarah Mendelson Former Senior U.S. State Department Official\nSOURCE: FLYNN TALKED...
2017-12-03 09:36:00	CNNW	26	CNNW_20171203_090000_CNN_Newsroom_Live/start/2160	U.S. LAW SANCTIONS RUSSIANS CLOSE TO PUTIN\nFLYNN SAT WITH PUTIN AT A GALA DINNER\nTRUMP COMPLIMENTED PUTIN FOR NOT RETALIATING. . Sarah Mendelson Former Senior U.S. State...
2017-12-03 09:37:00	CNNW	32	CNNW_20171203_090000_CNN_Newsroom_Live/start/2220	TRUMP TWEET SAYS HE FIRED FLYNN FOR LYING TO FBI\nU.S. TROUBLES ARE VICTORIES FOR VLADIMIR PUTIN\nFLYNN SAT WITH PUTIN AT A GALA DINNER
2017-12-03 09:37:00	FOXNEWSW	8	FOXNEWSW_20171203_090000_The_Greg_Gutfeld_Show/start/2220	ian. Actual Quell' User\n46O-5138 quelltv.com -\n6O-5138 quelltv.com
2017-12-03 09:37:00	MSNBCW	4	MSNBCW_20171203_090000_Dateline/start/2220	It's all right. You are doing the right thing.
2017-12-03 09:38:00	CNNW	27	CNNW_20171203_090000_CNN_Newsroom_Live/start/2280	TRUMP TWEET SAYS HE FIRED FLYNN FOR LYING TO FBI. . Scott Lucas Professor of Intl. Politics, University of Birmingham\nTRUMP TWEET SAYS HE FIRED FLYNN FOR LYING TO FBI. . Scott Lucas Founder & Editor, EA WorIdView\nTRUMP TWEET SAYS HE FIRED FLYNN FOR...
2017-12-03 09:38:00	FOXNEWSW	30	FOXNEWSW_20171203_090000_The_Greg_Gutfeld_Show/start/2280	8OO-46O-5138 quelltv.com\n6O-5138 quelltv.com
2017-12-03 09:39:00	CNNW	29	CNNW_20171203_090000_CNN_Newsroom_Live/start/2340	TRUMP TWEET SAYS HE FIRED FLYNN FOR LYING TO FBI\nREPORT: FLYNN WORKED WITH TRANSITION TEAM ON RUSSIA. . Scott Lucas Professor of Intl. Politics, University of Birmingham\nREPORT: FLYNN...
2017-12-03 09:40:00	CNNW	47	CNNW_20171203_090000_CNN_Newsroom_Live/start/2400	NYT: MCFARLAND EMAIL SAID RUSSIA \u201cTHREW\u201d ELECTION\nREPORT: FLYNN WORKED WITH TRANSITION TEAM ON RUSSIA. . Scott Lucas Professor of Intl. Politics, University of Birmingham
2017-12-03 09:41:00	CNNW	34	CNNW_20171203_090000_CNN_Newsroom_Live/start/2460	NYT: MCFARLAND EMAIL SAID RUSSIA \"THREW\" ELECTION. . Scott Lucas Professor of Intl. Politics, University of Birmingham\nNYT: MCFARLAND EMAIL SAID RUSSIA \u201cTHREW\u201d ELECTION
2017-12-03 09:42:00	CNNW	12	CNNW_20171203_090000_CNN_Newsroom_Live/start/2520	NYT: MCFARLAND EMAIL SAID RUSSIA \u201cTHREW\u201d ELECTION\nU.S.-CHINA REVERSE TECH MIGRATION
2017-12-03 09:42:00	FOXNEWSW	8	FOXNEWSW_20171203_090000_The_Greg_Gutfeld_Show/start/2520	y @GregGuffeldShow\n> BRE PAYTON I THE FEDERALIST STAFF WRITER '. . DX MEDIA REMOVES OPEN BAR FROM HOLIDAY PARTY. nvpp an\" IAI HApAchFNT FFApc
2017-12-03 09:42:00	MSNBCW	13	MSNBCW_20171203_090000_Dateline/start/2520	1-8OO 785-521O. . niuneh nth:
2017-12-03 09:43:00	FOXNEWSW	11	FOXNEWSW_20171203_090000_The_Greg_Gutfeld_Show/start/2580	u curl-tn n
2017-12-03 09:45:00	CNNW	26	CNNW_20171203_090000_CNN_Newsroom_Live/start/2700	U.S. STEPPING AWAY FROM GLOBAL COMPACT ON MIGRATION
2017-12-03 09:46:00	CNNW	28	CNNW_20171203_090000_CNN_Newsroom_Live/start/2760	JUDGE: TRUMP ADMIN. CANNOT DELAY FOREIGN ENTREPRENEURS RULE\nU.S. STEPPING AWAY FROM GLOBAL COMPACT ON MIGRATION\nLEGAL UNCERTAINTY LEADS TO REVERSE TECH MIGRATION\nUNHCR: WORLD IS SEEING AN...
2017-12-03 09:46:00	FOXNEWSW	13	FOXNEWSW_20171203_090000_The_Greg_Gutfeld_Show/start/2760	m sundav 9P et M\nI NBCSPORTSBAYAREACOM
2017-12-03 09:47:00	CNNW	62	CNNW_20171203_090000_CNN_Newsroom_Live/start/2820	LEGAL UNCERTAINTY LEADS TO REVERSE TECH MIGRATION
2017-12-03 09:48:00	CNNW	54	CNNW_20171203_090000_CNN_Newsroom_Live/start/2880	LEGAL UNCERTAINTY LEADS TO REVERSE TECH MIGRATION\nLEGAL UNCERTAINTY LEADS TO REVERSE TECH MIGRATION. . Michael Solomon 1Ox Management
2017-12-03 09:49:00	BBCNEWS	25	BBCNEWS_20171203_093000_The_Papers/start/1140	thECpapers\n1m mum ummmnm ._....__::. . \u201dBBCpapers
2017-12-03 09:49:00	CNNW	58	CNNW_20171203_090000_CNN_Newsroom_Live/start/2940	LEGAL UNCERTAINTY LEADS TO REVERSE TECH MIGRATION
2017-12-03 09:49:00	FOXNEWSW	7	FOXNEWSW_20171203_090000_The_Greg_Gutfeld_Show/start/2940	> JAMIE LISSOW | ACTOR/WRITER/COMEDIAN L. . SCIENTISTS: GLITTER SHOULD BE BANNED. nvpp FNVIDONMFNTAI IMPACT
2017-12-03 09:50:00	BBCNEWS	37	BBCNEWS_20171203_093000_The_Papers/start/1200	an mum ummmnm ._-__::. . #BBCpapers
2017-12-03 09:50:00	CNNW	28	CNNW_20171203_090000_CNN_Newsroom_Live/start/3000	BUYCORAVIN.COM
2017-12-03 09:50:00	FOXNEWSW	8	FOXNEWSW_20171203_090000_The_Greg_Gutfeld_Show/start/3000	SCIENTISTS: GLI'ITER SHOULD BE BANNED. OVER ENVIRONMENTAL IMPACT
2017-12-03 09:51:00	CNNW	8	CNNW_20171203_090000_CNN_Newsroom_Live/start/3060	. GetLifeLockNow.com 1-8OO-664-O962 Eggggf\u00e9'g\u00e9ee
2017-12-03 09:51:00	FOXNEWSW	7	FOXNEWSW_20171203_090000_The_Greg_Gutfeld_Show/start/3060	D BRE PAYTON I THE FEDERALIST STAFF WRITER F. . SCIENTISTS: GLITTER SHOULD BE BANNED. nvpp FNVIDONMFNTAI IMDAt'T\n> KATHERINE TIMPF | FOX NEWS CONTRIBUTOR. . SCIENTISTS: GLI'ITER SHOULD BE BANNED. nvpp FNVIDONMFNTAI IMDAr'T
2017-12-03 09:52:00	BBCNEWS	12	BBCNEWS_20171203_093000_The_Papers/start/1320	\u00abBECpapevs
2017-12-03 09:53:00	BBCNEWS	18	BBCNEWS_20171203_093000_The_Papers/start/1380	#BBCpapevs
2017-12-03 09:53:00	CNNW	13	CNNW_20171203_090000_CNN_Newsroom_Live/start/3180	MOUNT AGUNG VOLCANO THREATENING MAJOR ERUPTION IN BALI
2017-12-03 09:53:00	FOXNEWSW	19	FOXNEWSW_20171203_090000_The_Greg_Gutfeld_Show/start/3180	PROJECT \"KAT-ITAS\
2017-12-03 09:57:00	CNNW	32	CNNW_20171203_090000_CNN_Newsroom_Live/start/3420	1-8OO-684-36O1
2017-12-03 09:57:00	FOXNEWSW	25	FOXNEWSW_20171203_090000_The_Greg_Gutfeld_Show/start/3420	'ASHINGTON POST EXPOSES FAKE MOORE ACCUSER
2017-12-03 09:59:00	MSNBCW	6	MSNBCW_20171203_090000_Dateline/start/3540	was haonv.
2017-12-03 10:00:00	BBCNEWS	43	BBCNEWS_20171203_093000_The_Papers/start/1800	SOCIAL MOBILITY BOARD QUIT\nASHES SERIES
2017-12-03 10:00:00	CNNW	17	CNNW_20171203_090000_CNN_Newsroom_Live/start/3600	SLIGHT LEAD FOR DEMOCRAT IN ALABAMA SENATE RACE\nWHO KNEW WHAT AT THE WHITE HOUSE?\nIRISH BORDER ISSUES CAUSE BREXIT TALKS LOGJAM
2017-12-03 10:00:00	FOXNEWSW	4	FOXNEWSW_20171203_090000_The_Greg_Gutfeld_Show/start/3600	MOLLY LINE
2017-12-03 10:01:00	BBCNEWS	14	BBCNEWS_20171203_100000_BBC_News/start/60	1O:3O 1OO WOMEN
2017-12-03 10:01:00	CNNW	27	CNNW_20171203_100000_CNN_Newsroom_Live/start/60	TRUMP TWEET SAYS HE FIRED FLYNN FOR LYING TO FBI
2017-12-03 10:02:00	CNNW	18	CNNW_20171203_100000_CNN_Newsroom_Live/start/120	TRUMP: THERE'S BEEN ABSOLUTELY NO COLLUSION\nTRUMP TWEET SAYS HE FIRED FLYNN FOR LYING TO FBI\nTRUMP TWEET SAYS HE FIRED FLYNN FOR LYING TO FBI. . Boris Sanchez LRN Correspondent
2017-12-03 10:03:00	BBCNEWS	12	BBCNEWS_20171203_100000_BBC_News/start/180	SOCIAL MOBILITY BOARD QUIT. All four board members of the commission resign\nSOCIAL MOBILITY BOARD QUIT. Resignat'rons blamed on \u2019Iack of progress to fairer Britain'\nSOCIAL MOBILITY BOARD QUIT. Chair Alan...
2017-12-03 10:03:00	CNNW	62	CNNW_20171203_100000_CNN_Newsroom_Live/start/180	TRUMP TWEET SAYS HE FIRED FLYNN FOR LYING TO FBI
2017-12-03 10:04:00	BBCNEWS	11	BBCNEWS_20171203_100000_BBC_News/start/240	SOCIAL MOBILITY BOARD QUIT. Milburn: PM {ailing over pledge to build a fairer Britain\nSOCIAL MOBILITY BOARD QUIT. Govt: Making good progress on social mobility\nSOCIAL MOBILITY BOARD QUIT. All four board members of the...
2017-12-03 10:04:00	CNNW	31	CNNW_20171203_100000_CNN_Newsroom_Live/start/240	NYT: TRUMP OFFICIALS WERE BRIEFED ON FLYNN'S MEETINGS\nTRUMP TWEET SAYS HE FIRED FLYNN FOR LYING TO FBI\nTRUMP LAWYER: TWEET PARAPHRASED WHITE HOUSE ATI'ORNEY
2017-12-03 10:04:00	FOXNEWSW	7	FOXNEWSW_20171203_100000_Fox_Report_Saturday/start/240	TRUMP PRAISES GOP LAWMAKERS. AFTER SENATE PASSES TAX BILL. . rm
2017-12-03 10:05:00	BBCNEWS	10	BBCNEWS_20171203_100000_BBC_News/start/300	SOCIAL MOBILITY BOARD QUIT. Resignamns blamed on \u2019Iack oI progress to fairer BrIIain'\nSOCIAL MOBILITY BOARD QUIT. Chair Alan Milburn: Govt focussing on Brexit\nSOCIAL MOBILITY BOARD QUIT. Milburn: PM tailing over pledge...
2017-12-03 10:05:00	CNNW	27	CNNW_20171203_100000_CNN_Newsroom_Live/start/300	TRUMP TWEET SAYS HE FIRED FLYNN FOR LYING TO FBI\nTRUMP LAWYER: TWEET PARAPHRASED WHITE HOUSE ATI'ORNEY\nTRUMP TWEET SAYS HE FIRED FLYNN FOR LYING TO FBI. . Areva Martin gm Legal Analyst
2017-12-03 10:05:00	FOXNEWSW	7	FOXNEWSW_20171203_100000_Fox_Report_Saturday/start/300	TRUMP PRAISES GOP LAWMAKERS. AFTER SENATE PASSES TAX BILL. . ma\nTRUMP SAYS HE'S NOT WORRIED ABOUT. WHAT FLYNN WILL TELL MUELLER. . m
2017-12-03 10:06:00	BBCNEWS	11	BBCNEWS_20171203_100000_BBC_News/start/360	SOCIAL MOBILITV BOARD QUIT. Chair Alan Milburn: Govt focussing on Brexit\nSOCIAL MOBILITY BOARD QUIT. Milburn: May doing nothing to heal social division\nSOCIAL MOBILITY BOARD QUIT. Milbum: PM Iailing over...
2017-12-03 10:06:00	CNNW	28	CNNW_20171203_100000_CNN_Newsroom_Live/start/360	TRUMP TWEET SAYS HE FIRED FLYNN FOR LYING TO FBI. . Areva Martin gm Legal Analyst\nTRUMP TWEET SAYS HE FIRED FLYNN FOR LYING TO FBI\nWHITE HOUSE SUGGESTS RUSSIA PROBE IS ALMOST OVER
2017-12-03 10:06:00	FOXNEWSW	19	FOXNEWSW_20171203_100000_Fox_Report_Saturday/start/360	TRUMP SAYS HE'S NOT WORRIED ABOUT. WHAT FLYNN WILL TELL MUELLER. . m\nTY COBB. YESTERDAY. ATTORNEY FOR PRESIDENT TRUMP
2017-12-03 10:07:00	BBCNEWS	11	BBCNEWS_20171203_100000_BBC_News/start/420	SOCIAL MOBILITY BOARD QUIT. Education Sec: Time for Iresh blood In the Commission\nSOCIAL MOBILITY BOARD QUIT. Education Sec delends gov1 record on social mobility\nSOCIAL MOBILITY BOARD QUIT. All four board members of...
2017-12-03 10:07:00	CNNW	47	CNNW_20171203_100000_CNN_Newsroom_Live/start/420	WHITE HOUSE SUGGESTS RUSSIA PROBE IS ALMOST OVER. . Areva Martin Attorney & Legal Affairs Commentator\nWHITE HOUSE SUGGESTS RUSSIA PROBE IS ALMOST OVER
2017-12-03 10:08:00	BBCNEWS	27	BBCNEWS_20171203_100000_BBC_News/start/480	SOCIAL MOBILITY BOARD QUIT. . Labouv: Social mobility has totally stalled undev Conservatives\nSOCIAL MOBILITY BOARD QUIT. Milbum: PM 1ailing over pledge to build a fairer Britain\nSOCIAL MOBILITY BOARD QUIT. Milbum: May doing...
2017-12-03 10:08:00	CNNW	26	CNNW_20171203_100000_CNN_Newsroom_Live/start/480	TRUMP TWEET SAYS HE FIRED FLYNN FOR LYING TO FBI. . Areva Martin gm Legal Analyst\nTRUMP TWEET SAYS HE FIRED FLYNN FOR LYING TO FBI\nWHITE HOUSE SUGGESTS RUSSIA PROBE IS ALMOST OVER
2017-12-03 10:08:00	FOXNEWSW	7	FOXNEWSW_20171203_100000_Fox_Report_Saturday/start/480	5C NEWS SUSPENDS REPORTER BRIAN ROSS. )VER ERRONEOUS MICHAEL FLYNN REPORT. . m
