2017-11-26 10:38:00	CNNW	5	CNNW_20171126_100000_CNN_Newsroom_Live/start/2280	Visit STELARAtv.com or call 1.866.8OO.116O
2017-11-26 10:38:00	FOXNEWSW	26	FOXNEWSW_20171126_100000_Fox_Report_Saturday/start/2280	SPORTS WORLD BRACES FOR POSSIBLE O. IMPACT OF REPUBLICAN TAX REFORM ,. . m\nSPORTS WORLD BRACES FOR POSSIBLE. IMPACT OF REPUBLICAN TAX REFORM. . \u2014u- \u2014a\u2014._ \u2014-
2017-11-26 10:39:00	CNNW	5	CNNW_20171126_100000_CNN_Newsroom_Live/start/2340	Individual results mav varv. Bv orescrintion onlv.
2017-11-26 10:40:00	CNNW	21	CNNW_20171126_100000_CNN_Newsroom_Live/start/2400	FUNERAL HELD FOR U.S. BORDER AGENT WHO DIED MYSTERIOUSLY
2017-11-26 10:41:00	BBCNEWS	9	BBCNEWS_20171126_103000_100_Women_Challenge/start/660	sh\u00e9 wanted me to do hbusehold work
2017-11-26 10:41:00	FOXNEWSW	10	FOXNEWSW_20171126_100000_Fox_Report_Saturday/start/2460	monday 8P et
2017-11-26 10:42:00	CNNW	41	CNNW_20171126_100000_CNN_Newsroom_Live/start/2520	FUNERAL HELD FOR U.S. BORDER AGENT WHO DIED MYSTERIOUSLY\nSEARCH FOR MISSING SUBMARINE IN ELEVENTH DAY
2017-11-26 10:43:00	BBCNEWS	5	BBCNEWS_20171126_103000_100_Women_Challenge/start/780	she will get'into trouble
2017-11-26 10:43:00	CNNW	26	CNNW_20171126_100000_CNN_Newsroom_Live/start/2580	FAMILIES OF MISSING CREW THANKFUL FOR SEARCH HELP\nSEARCH FOR MISSING SUBMARINE IN ELEVENTH DAY
2017-11-26 10:44:00	CNNW	8	CNNW_20171126_100000_CNN_Newsroom_Live/start/2640	NORTH KOREA DIGS DMZ TRENCH AFI'ER SOLDIER'S ESCAPE\nFORMER SOLDIER PRAISES NK DEFECTOR FOR HIS \"BRAVERY\". . Kanq Ri-hvuk North Korean Defector\nFORMER SOLDIER PRAISES NK DEFECTOR FOR HIS...
2017-11-26 10:44:00	FOXNEWSW	14	FOXNEWSW_20171126_100000_Fox_Report_Saturday/start/2640	CopperFit Back.com. . \" 1-8OO-44O-77O1
2017-11-26 10:45:00	CNNW	29	CNNW_20171126_100000_CNN_Newsroom_Live/start/2700	FORMER SOLDIER RECOUNTS \"BRUTAL\" CONDITIONS IN N KOREA\nFORMER SOLDIER PRAISES NK DEFECTOR FOR HIS \"BRAVERY\"\nFORMER SOLDIER RECOUNTS \"BRUTAL\" CONDITIONS IN N KOREA. . Kanq Ri-hvuk North...
2017-11-26 10:45:00	FOXNEWSW	19	FOXNEWSW_20171126_100000_Fox_Report_Saturday/start/2700	{OTESTS IN PAKISTAN PROMPT MEDIA BLACKOUT I. . m\nPRESIDENT TRUMP NAMES OMB DIRECTOR. MULVANEY AS INTERIM DIRECTOR OF CFPB. . M\ufb01\nPRESIDENT TRUMP NAMES OMB DIRECTOR. VIULVANEY AS...
2017-11-26 10:45:00	MSNBCW	21	MSNBCW_20171126_100000_Dateline/start/2700	ROO-ERR-17OR
2017-11-26 10:46:00	CNNW	26	CNNW_20171126_100000_CNN_Newsroom_Live/start/2760	FORMER SOLDIER RECOUNTS \"BRUTAL\" CONDITIONS IN N KOREA\nFORMER SOLDIER RECOUNTS \"BRUTAL\" CONDITIONS IN N KOREA. . Anna Coren CJ\\N Correspondent\nUNDERCOVER VIDEO SHOWS DIRE CONDITIONS IN N...
2017-11-26 10:46:00	FOXNEWSW	11	FOXNEWSW_20171126_100000_Fox_Report_Saturday/start/2760	PRESIDENT TRUMP NAMES OMB DIRECTOR h. MULVANEY AS INTERIM DIRECTOR OF CFPB ,,. . m
2017-11-26 10:47:00	CNNW	21	CNNW_20171126_100000_CNN_Newsroom_Live/start/2820	ZIMBABWE'S HIGH COURT: MILITARY TAKEOVER WAS CONSTITUTIONAL\nUNDERCOVER VIDEO SHOWS DIRE CONDITIONS IN N KOREA\nUNDERCOVER VIDEO SHOWS DIRE CONDITIONS IN N KOREA. . Rev Kim Sung-eun Caleb...
2017-11-26 10:47:00	FOXNEWSW	14	FOXNEWSW_20171126_100000_Fox_Report_Saturday/start/2820	LA LAUNCHING 'GR_AND DEPRESSION CHALLENGE' \ufb01'\ufb01'l\nPRESIDENT TRUMP NAMES OMB DIRECTOR h. MULVANEY AS INTERIM DIRECTOR OF CFPB V =. . m\nPRESIDENT TRUMP NAMES OMB DIRECTOR O. MULVANEY AS...
2017-11-26 10:48:00	CNNW	39	CNNW_20171126_100000_CNN_Newsroom_Live/start/2880	WITNESSING THE BIRTH OF ZIMBABWE'S NEW POLITICAL ERA\nZIMBABWE'S HIGH COURT: MILITARY TAKEOVER WAS CONSTITUTIONAL\nWITNESSING THE BIRTH OF ZIMBABWE'S NEW POLITICAL ERA. . Farai Sevenzo aw...
2017-11-26 10:48:00	FOXNEWSW	22	FOXNEWSW_20171126_100000_Fox_Report_Saturday/start/2880	SEARCHERS PLAN TO SCREEN THOUSANDS IN HOPES O. )F FINDING A BIOLOGICAL BASIS FOR DEPRESSION ,. . I'm _I\nUCLA/World Health Organization
2017-11-26 10:49:00	CNNW	58	CNNW_20171126_100000_CNN_Newsroom_Live/start/2940	WITNESSING THE BIRTH OF ZIMBABWE'S NEW POLITICAL ERA
2017-11-26 10:49:00	FOXNEWSW	10	FOXNEWSW_20171126_100000_Fox_Report_Saturday/start/2940	SEARCHERS PLAN TO SCREEN THOUSANDS IN HOPES C I?\" '. )F FINDING A BIOLOGICAL BASIS FOR DEPRESSION '\nSEARCHERS PLAN TO SCREEN THOUSANDS IN HOPES. )F FINDING A BIOLOGICAL BASIS FOR DEPRESSION
2017-11-26 10:51:00	CNNW	4	CNNW_20171126_100000_CNN_Newsroom_Live/start/3060	Visit STELARAtv.com or call 1.866.8OO.116O
2017-11-26 10:51:00	FOXNEWSW	3	FOXNEWSW_20171126_100000_Fox_Report_Saturday/start/3060	W. carlv fiorina
2017-11-26 10:53:00	CNNW	3	CNNW_20171126_100000_CNN_Newsroom_Live/start/3180	Taken with evening meal,
2017-11-26 10:53:00	FOXNEWSW	13	FOXNEWSW_20171126_100000_Fox_Report_Saturday/start/3180	SHOPPERS HIT NEIGHBORHOOD STORES. FOR SMALL BUSINESS SATURDAY. . M\ufb01\nSMALL BUSINESS SATURDAY EXPECTED TO. GENERATE BIG REVENUES IN ITS EIGHTH YEAR. . m\ufb01\u2014
2017-11-26 10:54:00	CNNW	16	CNNW_20171126_100000_CNN_Newsroom_Live/start/3240	NETFLIX'S \"THE CROWN\" RETURNING FOR SEASON 2
2017-11-26 10:54:00	FOXNEWSW	47	FOXNEWSW_20171126_100000_Fox_Report_Saturday/start/3240	SMALL BUSINESS SATURDAY EXPECTED TO. GENERATE BIG REVENUES IN ITS EIGHTH YEAR. . M\ufb01
2017-11-26 10:55:00	FOXNEWSW	33	FOXNEWSW_20171126_100000_Fox_Report_Saturday/start/3300	SMALL BUSINESS SATURDAY EXPECTED TO. GENERATE BIG REVENUES IN ITS EIGHTH YEAR. . W\ufb01\nAMERICAN EXPRESS. S NFIB
2017-11-26 10:56:00	CNNW	46	CNNW_20171126_100000_CNN_Newsroom_Live/start/3360	NETFLIX'S \"THE CROWN\" RETURNING FOR SEASON 2\nNatalie Allen George Howell. @AllenCNN @GeorgeHowellCNN
2017-11-26 10:58:00	FOXNEWSW	11	FOXNEWSW_20171126_100000_Fox_Report_Saturday/start/3480	NATIONWIDE CHRISTMAS TREE SHORTAGE. PANICS BUSINESS OWNERS, RAISES PRICES. . M\ufb01
2017-11-26 10:59:00	CNNW	6	CNNW_20171126_100000_CNN_Newsroom_Live/start/3540	girlsinc.org
2017-11-26 11:00:00	BBCNEWS	35	BBCNEWS_20171126_103000_100_Women_Challenge/start/1800	CHANGING OF THE GUARD\nLEEDS CAR CRASH\nDRONE SAFETY
2017-11-26 11:00:00	FOXNEWSW	36	FOXNEWSW_20171126_100000_Fox_Report_Saturday/start/3600	November 26, 2O17
2017-11-26 11:01:00	BBCNEWS	15	BBCNEWS_20171126_110000_BBC_News/start/60	LEEDS CAR CRASH. Five people die after car collides with a tree
2017-11-26 11:02:00	BBCNEWS	11	BBCNEWS_20171126_110000_BBC_News/start/120	LEEDS CAR CRASH. Stolen Renault Clio collided with atree\nLEEDS CAR CRASH. A twelve year old and we \ufb01fteen year olds among dead\nLEEDS CAR CRASH. Five people die after car collides with a tree
2017-11-26 11:02:00	CNNW	20	CNNW_20171126_110000_New_Day_Sunday/start/120	W. Abby Phillip OW White House Correspondent\nIHUMP |V|I:l:|b WIIH UUI\u201d Al'ltAU UI' IM HtI'UHIVI VUII:. . RIGHT NOW INDIANAPOLIS( 3O\u00b0 MEMPHIS r 4O\" NEWORLEANS
2017-11-26 11:02:00	FOXNEWSW	14	FOXNEWSW_20171126_110000_Fox_and_Friends_Sunday/start/120	{UMP TAPS BUDGET DIRECTOR TO CLEAN UP CFPB \\
2017-11-26 11:03:00	BBCNEWS	6	BBCNEWS_20171126_110000_BBC_News/start/180	Baroness SUGG. Aviation Minister
2017-11-26 11:03:00	CNNW	28	CNNW_20171126_110000_New_Day_Sunday/start/180	W. Abby Phillip OW White House Correspondent\nAbby Phillip <I\\N White House Correspondent
2017-11-26 11:04:00	BBCNEWS	12	BBCNEWS_20171126_110000_BBC_News/start/240	DRONE SAFETY LEGISLATION. Government publishes draft Drone Bill\nDRONE SAFETY LEGISLATION. Police could have power to ground & seize drones\nDr STEVE WRIGHT. University of the West of England
2017-11-26 11:05:00	BBCNEWS	11	BBCNEWS_20171126_110000_BBC_News/start/300	DRONE SAFETY LEGISLATION. Drone owners to sit safety awareness tests\nDRONE SAFETY LEGISLATION. Owners required to register drones with authorities\nDRONE SAFETY LEGISLATION. Drones to be banned from...
2017-11-26 11:05:00	FOXNEWSW	20	FOXNEWSW_20171126_110000_Fox_and_Friends_Sunday/start/300	{UMP TAPS BUDGET DIRECTOR TO CLEAN UP CFPB. . \u2014_\\\n{UMP TAPS BUDGET DIRECTOR TO CLEAN UP CFPB k\n)14: MULVANEY BLASTED CFPB AS \"A JOKE\" .
2017-11-26 11:06:00	BBCNEWS	10	BBCNEWS_20171126_110000_BBC_News/start/360	DRONE SAFETY LEGISLATION. Police could have power to ground & seize drones\nDRONE SAFETY LEGISLATION. Owners required to register drones with authorities\nDRONE SAFETV LEGISLATION. Drone owners to sit safety...
2017-11-26 11:06:00	CNNW	26	CNNW_20171126_110000_New_Day_Sunday/start/360	Errol Louis OW Political Commentator\nHtl'UHlbl JAHtU KUDHNtH'b DHHINKINU Wl'll | t HUUDI: HULI:. . RIGHT NOW DENVER ( 43\" SACRAMENTO ( 56\u00b0 SALT LAKE CITY
2017-11-26 11:06:00	FOXNEWSW	15	FOXNEWSW_20171126_110000_Fox_and_Friends_Sunday/start/360	{UMP VOWS TO BRING CFPB \"BACK TO LIFE\". . \\\n)14: MULVANEY BLASTED CFPB AS \"A JOKE\". . \\\n)14: MULVANEY BLASTED CFPB AS \"A JOKE\" '\nU|.VANEY IN 2O14: CFPB HAS NO ACCOUNTABILITY E
2017-11-26 11:07:00	BBCNEWS	11	BBCNEWS_20171126_110000_BBC_News/start/420	DRONE SAFETV LEGISLATION. Government publishes draft Drone Bill\nDRONE SAFETY LEGISLATION. Govt to encourage research into drone technology\nDRONE SAFETY LEGISLATION. Police could have power to ground...
2017-11-26 11:07:00	CNNW	17	CNNW_20171126_110000_New_Day_Sunday/start/420	W. NYT: Trump's son- in- -law sidelined, \"focusing on his own projects\"\nJulian Zelizer OW Political Analyst\nKUDHNtH IU HAND UVtH HUbblH HtLAI |:U UUUD IU thAII: IUMUHHUW. . RIGHT NOW MIAMI ' ,66\u00b0 ORLANDO ....
2017-11-26 11:07:00	FOXNEWSW	33	FOXNEWSW_20171126_110000_Fox_and_Friends_Sunday/start/420	{UMP VOWS TO BRING CFPB \"BACK TO LIFE\". . \\\nDJ: TRUMP HAS POWER TO NAME CFPB ACTING DIR. . \\\nDJ: TRUMP HAS POWER TO NAME CFPB ACTING DIR I
2017-11-26 11:08:00	CNNW	36	CNNW_20171126_110000_New_Day_Sunday/start/480	NYT: Trump's son-in-Iaw sidelined, \"focusing on his own projects\"\nW. NYT: Trump's son- in- -law sidelined, \"focusing on his own projects\"_
2017-11-26 11:08:00	FOXNEWSW	50	FOXNEWSW_20171126_110000_Fox_and_Friends_Sunday/start/480	DJ: TRUMP HAS POWER TO NAME CFPB ACTING DIR. . \\
2017-11-26 11:09:00	CNNW	25	CNNW_20171126_110000_New_Day_Sunday/start/540	W. NYT: Trump' 3 son- in- -|aw sidelined, \"focusing on his own projects\u201d\nNYT: Trump's son-in-Iaw sidelined, \"focusing on his own projects\"\nW. NYT: Trump's son- in- -law sidelined, \"focusing on his own...
2017-11-26 11:09:00	FOXNEWSW	53	FOXNEWSW_20171126_110000_Fox_and_Friends_Sunday/start/540	CRUNCH TIME FOR TAX REFORM. . \\
2017-11-26 11:09:00	MSNBCW	27	MSNBCW_20171126_110000_Dateline/start/540	W1 -8OO- 785- 521O. . niune\ufb01 u \"in
2017-11-26 11:10:00	BBCNEWS	11	BBCNEWS_20171126_110000_BBC_News/start/600	IRELAND BREXIT TALKS. Hogan: Some in British govt have and fadh in trade deal\nIRELAND BREXIT TALKS. . Hogan: Staying in customs union best way In avowd bolder controls\nIRELAND BREXIT TALKS. . Irish Repubh\u2019c's...
2017-11-26 11:10:00	FOXNEWSW	49	FOXNEWSW_20171126_110000_Fox_and_Friends_Sunday/start/600	DNGRESS STILL DIVIDED ON TAX REFORM I
2017-11-26 11:11:00	BBCNEWS	10	BBCNEWS_20171126_110000_BBC_News/start/660	IRELAND BREXIT TALKS W. Hogan: Some in British govt have b'ind faith in trade deal m\nIRELAND BREXIT TALKS. . Irish Repub\ufb01c's EU Commissionev: UK shamdn't leave single market\nJOHN McDONNELL MP. Labour Shadow Chancellor
2017-11-26 11:11:00	CNNW	31	CNNW_20171126_110000_New_Day_Sunday/start/660	WashPo: Kushner near center of power, yet also increasingly marginalized\nW. NYT: Trump' 5 son- in- -|aw sidelined, \"focusing on his own projects\u201d
2017-11-26 11:11:00	FOXNEWSW	53	FOXNEWSW_20171126_110000_Fox_and_Friends_Sunday/start/660	'T: GOP FLEEING MCCONNELL IN 2O18 PRIMARIES
2017-11-26 11:12:00	CNNW	22	CNNW_20171126_110000_New_Day_Sunday/start/720	W. Julian Zelizer OW Political Analyst\nII'IUIVII'I UUNDUMtH AutNUI \"I'll-ID I:II:I:N I-I IUII-IL UlebltH\". . RIGHT NOW KANSAS CITY . 39\u00b0 MINNEAPOLIS . 28\u00b0 SAINT LOUIS
2017-11-26 11:12:00	FOXNEWSW	26	FOXNEWSW_20171126_110000_Fox_and_Friends_Sunday/start/720	NAL GOODBYES TO KILLED TX BORDER AGENT i\nAN TRIES TO CUT OFF TRUMP MOTORCADE I. . . a\nEN. FRANKEN TO ADDRESS MEDIA TODAY i\n'T: GOP FLEEING MCCONNELL IN 2O18 PRIMARIES
2017-11-26 11:13:00	BBCNEWS	5	BBCNEWS_20171126_110000_BBC_News/start/780	watan Gunung Mung
2017-11-26 11:13:00	CNNW	6	CNNW_20171126_110000_New_Day_Sunday/start/780	W. Julian Zelizer Historian & Professor, Princeton University\n|-/ -. . RIGHT NOW MIAMI ( 66\u00b0 ORLANDO ( 58\u00b0 TAMPA
2017-11-26 11:13:00	FOXNEWSW	20	FOXNEWSW_20171126_110000_Fox_and_Friends_Sunday/start/780	LOOK WHO'S COMING TO LUNCH I\nEN. FRANKEN TO ADDRESS MEDIA TODAY i
2017-11-26 11:17:00	FOXNEWSW	43	FOXNEWSW_20171126_110000_Fox_and_Friends_Sunday/start/1020	OP TAX BILL FACES MAKE-OR-BREAK WEEK I\nLearn more at greatcallcom
2017-11-26 11:18:00	CNNW	7	CNNW_20171126_110000_New_Day_Sunday/start/1080	U|:W| bLAWID WIUUHtI Ht'b \"I'IIUINU I'HUIVI l'llb HtUUHU\". . RIGHT NOW NASHVILLE( 36\u00b0 PITTSBURGH ( 36\u00b0 RALEIGH
2017-11-26 11:18:00	FOXNEWSW	20	FOXNEWSW_20171126_110000_Fox_and_Friends_Sunday/start/1080	OP TAX BILL FACES MAKE-OR-BREAK WEEK i\nOP TAX BILL FACES MAKE-OR-BREAK WEEK I\nOP TAX BILL FACES MAKE-OR-BREAK WEEK
2017-11-26 11:19:00	CNNW	37	CNNW_20171126_110000_New_Day_Sunday/start/1140	Charles Barkley Retired NBA Player
2017-11-26 11:19:00	FOXNEWSW	28	FOXNEWSW_20171126_110000_Fox_and_Friends_Sunday/start/1140	INS CORKER & FLAKE WORRY ABOUT TAX PLAN COST i\nURDLES REMAIN FOR GOP TAX REFORM BILL i\nURDLES REMAIN FOR GOP TAX REFORM BILL I\nOP TAX BILL FACES MAKE-OR-BREAK WEEK i\nURDLES REMAIN...
2017-11-26 11:20:00	CNNW	10	CNNW_20171126_110000_New_Day_Sunday/start/1200	, , I I I l_\" I \"I 1: I'm,\"-. Errol Louis Political Anchor, Spectrum News
2017-11-26 11:20:00	FOXNEWSW	29	FOXNEWSW_20171126_110000_Fox_and_Friends_Sunday/start/1200	URDLES REMAIN FOR GOP TAX REFORM BILL i\nURDLES REMAIN FOR GOP TAX REFORM BILL
2017-11-26 11:22:00	CNNW	34	CNNW_20171126_110000_New_Day_Sunday/start/1320	I\" 'II mum\"... I , 7 , ,. Julian Zelizer Historian & Professor, Princeton University\nm 1: mum\"... I 7 , ,. Julian Zelizer OW Political Analyst
2017-11-26 11:23:00	CNNW	17	CNNW_20171126_110000_New_Day_Sunday/start/1380	W. President last Tuesday. \"|' ll be letting you know next week\"\nW. President last Tuesday: \"I'll be letting you know next week\
2017-11-26 11:23:00	FOXNEWSW	4	FOXNEWSW_20171126_110000_Fox_and_Friends_Sunday/start/1380	W. carlv fiorina
2017-11-26 11:24:00	CNNW	55	CNNW_20171126_110000_New_Day_Sunday/start/1440	W. First daughter said there was \"a special place in hell for people who prey on children\"\nW. President last Tuesday: \"|' ll be letting you know next week\
2017-11-26 11:24:00	FOXNEWSW	17	FOXNEWSW_20171126_110000_Fox_and_Friends_Sunday/start/1440	ELIBERATIONS TO RESUME IN STEINLE TRIAL I
2017-11-26 11:25:00	CNNW	14	CNNW_20171126_110000_New_Day_Sunday/start/1500	W. Errol Louis Political Anchor, Spectrum News\nW. First daughter said there was \"a special place in hell for people who prey on children\
2017-11-26 11:25:00	FOXNEWSW	21	FOXNEWSW_20171126_110000_Fox_and_Friends_Sunday/start/1500	JRVEY: BERNIE SANDERS IS DEMS #1 2O2O PICK i
2017-11-26 11:26:00	FOXNEWSW	27	FOXNEWSW_20171126_110000_Fox_and_Friends_Sunday/start/1560	LON MAGAZINE: HILLARY SHOULD RUN IN 2O2O\nJRVEY: BERNIE SANDERS IS DEMS #1 2O2O PICK
2017-11-26 11:27:00	FOXNEWSW	57	FOXNEWSW_20171126_110000_Fox_and_Friends_Sunday/start/1620	DEMOCRATS DIVIDED?
2017-11-26 11:28:00	CNNW	15	CNNW_20171126_110000_New_Day_Sunday/start/1680	BIRCHBOX.COM
2017-11-26 11:28:00	MSNBCW	12	MSNBCW_20171126_110000_Dateline/start/1680	. . ThnRarnngFirm nnm (mm-anon
2017-11-26 11:29:00	MSNBCW	13	MSNBCW_20171126_110000_Dateline/start/1740	ELIZABETH WARREN: LAW CALLS FOR CFPB DEPUTY DIRECTOR. TO RUN AGENCY IF DIRECT OR'S JOB IS VACANT. NOT TRUMP\u2019S PICK\nEGYPT'S PRESIDENT VOWS DEADLY ATTACK. ON MOSQUE \"WILL NOT GO UNPUNISHED\
2017-11-26 11:31:00	CNNW	7	CNNW_20171126_110000_New_Day_Sunday/start/1860	W. Sen. Roy Blunt (R) Missouri
2017-11-26 11:32:00	CNNW	7	CNNW_20171126_110000_New_Day_Sunday/start/1920	, ,. Mick Mulvaney | White House Budget Director\nSen. Bernie Sanders (I) Vermont\nMAN: UH thAK WI:I:I\\ I'UH LIUP IAK HtI'UHWI PLAN. . . . RIGHT NOW ATLANTA ( 45\u00b0 CHARLOTTE ( 43\u00b0...
2017-11-26 11:32:00	FOXNEWSW	3	FOXNEWSW_20171126_110000_Fox_and_Friends_Sunday/start/1920	\u00a92O17 FCA US LLC All Flights Reserved.
2017-11-26 11:33:00	CNNW	15	CNNW_20171126_110000_New_Day_Sunday/start/1980	RIGHT NOW KANSAS CITY - 39\u00b0 MINNEAPOLIS . 28\u00b0 SAINT LOUIS\n, ,. Mick Mulvaney White House Budget Director
2017-11-26 11:34:00	FOXNEWSW	12	FOXNEWSW_20171126_110000_Fox_and_Friends_Sunday/start/2040	BLUE LINE BEARS\nEARS CREATED FROM FALLEN OFFICERS' UNIFORMS
2017-11-26 11:35:00	CNNW	5	CNNW_20171126_110000_New_Day_Sunday/start/2100	centurylink.com/yourlink
2017-11-26 11:36:00	FOXNEWSW	21	FOXNEWSW_20171126_110000_Fox_and_Friends_Sunday/start/2160	EARS CREATED FROM FALLEN OFFICERS' UNIFORMS I\nEDDY BEARS HONOR FALLEN HEROES i
2017-11-26 11:37:00	CNNW	23	CNNW_20171126_110000_New_Day_Sunday/start/2220	. TheBarnesFirm.com (8OO)-8OO-OOOO
2017-11-26 11:37:00	FOXNEWSW	14	FOXNEWSW_20171126_110000_Fox_and_Friends_Sunday/start/2220	EDDY BEARS HONOR FALLEN HEROES i\nEDDY BEARS HONOR FALLEN HEROES I
2017-11-26 11:37:00	MSNBCW	17	MSNBCW_20171126_110000_Dateline/start/2220	' I almonm. . .-mm 1 -888- 994- 7666 ASP\n' I almomn. . u-mm 1 -888- 994- 7666 ASP\n' I Ulmonm. . u-mm 1 -888- 994- 7666 ASP
2017-11-26 11:38:00	CNNW	3	CNNW_20171126_110000_New_Day_Sunday/start/2280	#MySholAtEpllepsy
2017-11-26 11:39:00	CNNW	5	CNNW_20171126_110000_New_Day_Sunday/start/2340	AHutNIINA NUI uIVINU Ul' btAHUI'I Utbl\u2019llt \"HPLUDIUN\" HtPUHI. . RIGHT NOW BOSTON L 49\u201c NEWYORK ( 46\u00b0 PHILADELPHIA
2017-11-26 11:39:00	FOXNEWSW	33	FOXNEWSW_20171126_110000_Fox_and_Friends_Sunday/start/2340	EARS CREATED FROM FALLEN OFFICERS' UNIFORMS L\nEDDY BEARS HONOR FALLEN HEROES L
2017-11-26 11:40:00	CNNW	11	CNNW_20171126_110000_New_Day_Sunday/start/2400	W. Father Edward Beck OW Religion Commentator
2017-11-26 11:40:00	FOXNEWSW	27	FOXNEWSW_20171126_110000_Fox_and_Friends_Sunday/start/2400	BLUE LINE BEARS\nEARS CREATED FROM FALLEN OFFICERS' UNIFORMS 1
2017-11-26 11:41:00	CNNW	4	CNNW_20171126_110000_New_Day_Sunday/start/2460	v. \u2014 v v' ..... _..'.. .\u2014 ..v.. .v .u...-.-.-.. \"-. . Father Edward Beck | cm Religion Commentator. . TODAY CINCINNATI 5O\u00b0 CLEVELAND i 42\" COLUMBUS
2017-11-26 11:42:00	CNNW	10	CNNW_20171126_110000_New_Day_Sunday/start/2520	W. Father Edward Beck CAN Religion Commentator
2017-11-26 11:42:00	FOXNEWSW	19	FOXNEWSW_20171126_110000_Fox_and_Friends_Sunday/start/2520	CHICAGO POLICE DEPT.\nCEBOOK REMOVES ADS PROMOTING GUNS\nEADLY THANKSGIVING WEEKEND IN CHICAGO i\nECRET SANTA' PAYS OVER 1OK FOR LAYAWAY TOYS
2017-11-26 11:43:00	FOXNEWSW	16	FOXNEWSW_20171126_110000_Fox_and_Friends_Sunday/start/2580	ECRET SANTA' PAYS OVER 1OK FOR LAYAWAY TOYS\nMESSAGE TO THE ESTABLISHMENT I\nCHARLIE K.. SECRET SANTA WHO PAID FOR LAYAWAY ITEMS
2017-11-26 11:44:00	CNNW	6	CNNW_20171126_110000_New_Day_Sunday/start/2640	Father Edward Beck OW Religion Commentator\nv. \u2014 v vv ..... _..'.. .\u2014 ..v.. .v .u...-.-.-.. \"-. . Father Edward Beck | on Religion Commentator. . RIGHT NOW CINCINNATI l 27\u00b0...
2017-11-26 11:44:00	FOXNEWSW	10	FOXNEWSW_20171126_110000_Fox_and_Friends_Sunday/start/2640	Get cash back for our holida sho- --in.
2017-11-26 11:46:00	CNNW	11	CNNW_20171126_110000_New_Day_Sunday/start/2760	Jesse R.
2017-11-26 11:47:00	FOXNEWSW	35	FOXNEWSW_20171126_110000_Fox_and_Friends_Sunday/start/2820	RASSLEY: NOMINEES DESERVE CONSIDERATION I\nRASSLEY: NOMINEES DESERVE CONSIDERATION i
2017-11-26 11:48:00	FOXNEWSW	26	FOXNEWSW_20171126_110000_Fox_and_Friends_Sunday/start/2880	I TRUMP NOMINEES CONFIRMED TO COURTS i\nRASSLEY: NOMINEES DESERVE CONSIDERATION\nRASSLEY: NOMINEES DESERVE CONSIDERATION i
2017-11-26 11:49:00	FOXNEWSW	29	FOXNEWSW_20171126_110000_Fox_and_Friends_Sunday/start/2940	EMS vs REPUBLICANS ON NOMINATIONS h\nRASSLEY SCHEDULED HEARINGS FOR 2 NOMINEES i\nN:ATORS GIVE VIEWS ON NOMINEES BY BLUE SLIPS i
2017-11-26 11:49:00	MSNBCW	4	MSNBCW_20171126_110000_Dateline/start/2940	Results may vary.\nDoctor dramatization.
2017-11-26 11:50:00	FOXNEWSW	37	FOXNEWSW_20171126_110000_Fox_and_Friends_Sunday/start/3000	I TRUMP NOMINEES CONFIRMED TO COURTS i
2017-11-26 11:50:00	MSNBCW	4	MSNBCW_20171126_110000_Dateline/start/3000	BREO Is not for children and adolescents. . um Inna\u00bb Olm- 1O :Anpn a! any.\nFor commercially insured patients Restrictions apply
2017-11-26 11:52:00	FOXNEWSW	3	FOXNEWSW_20171126_110000_Fox_and_Friends_Sunday/start/3120	SUNDAYS 8P ET @
2017-11-26 11:54:00	CNNW	6	CNNW_20171126_110000_New_Day_Sunday/start/3240	'M'. BOMBAS
2017-11-26 11:54:00	FOXNEWSW	19	FOXNEWSW_20171126_110000_Fox_and_Friends_Sunday/start/3240	CYBER SAVINGS\nCYBER SAVINGS. . . . V
2017-11-26 11:55:00	FOXNEWSW	49	FOXNEWSW_20171126_110000_Fox_and_Friends_Sunday/start/3300	CYBER SAVINGS\nEST SHOPPING APPS FOR CYBER MONDAY i
2017-11-26 11:56:00	FOXNEWSW	57	FOXNEWSW_20171126_110000_Fox_and_Friends_Sunday/start/3360	MUST SEE DEALS BEFORE YOU SHOP I
2017-11-26 11:57:00	CNNW	4	CNNW_20171126_110000_New_Day_Sunday/start/3420	This infunnnlion is no! a (omplele description of benefits. Contact m plan to: more infnnnntiun. Limitations,. (opnymenis and vesuiclinns may npp|y. aenems, premium and member cast shale may change on January 1 of. Each year.. . voot.a_GH_1 31.75] Accepkzd
2017-11-26 11:59:00	CNNW	9	CNNW_20171126_110000_New_Day_Sunday/start/3540	Ivan Cabrera ans Meteorologist\nIHUUDANUD tVAUUI-H I:U Ab til-\\LI VULUANU tHUFIb. . RIGHT NOW NASHVILLE( 36\u00b0 PITTSBURGH ( 36\u00b0 RALEIGH
2017-11-26 12:00:00	CNNW	10	CNNW_20171126_110000_New_Day_Sunday/start/3600	Nine airlines have canceled flights after \"red warning\"\n. .v\".u'\u2014- \u2014-..vv...\u2014\u2014 .uv \u2014. .\u2014. '\u2014 v...'v _. .v. .v. . Nine airlines have canceled flights after \"red warning\". ....
2017-11-26 12:00:00	FOXNEWSW	43	FOXNEWSW_20171126_110000_Fox_and_Friends_Sunday/start/3600	November 26, 2O17
2017-11-26 12:00:00	MSNBCW	34	MSNBCW_20171126_110000_Dateline/start/3600	ALABAMA BA1TLE
2017-11-26 12:01:00	BBCNEWS	9	BBCNEWS_20171126_120000_BBC_News/start/60	LEEDS CAR CRASH. Five people die after car collides with a tree\nTHE ASHES\nALISON FREEMAN. News Correspondent
2017-11-26 12:01:00	MSNBCW	24	MSNBCW_20171126_120000_MSNBC_Live/start/60	KELLY: \"THERE WAS HONESTLY NEVER A TIME WHEN. I CONTEMPLATED GETI'ING RID OF JARED 8. IVANKA\"\nALABAMA BATTLE
2017-11-26 12:02:00	BBCNEWS	11	BBCNEWS_20171126_120000_BBC_News/start/120	LEEDS CAR CRASH. Stolen Renault Clio collided with a tree\nLEEDS CAR CRASH. A twelve year old and 'wo \ufb01fteen year olds among dead\nLEEDS CAR CRASH. Two fifteen year olds are in police...
2017-11-26 12:02:00	CNNW	5	CNNW_20171126_120000_New_Day_Sunday/start/120	'Ii\u00e9\ufb01l\u201c s\u00e9iii'ci\u00e9e. . TODAY DALLAS - 72\u00b0 LOS ANGELES O.- 84\u00b0 PHOENIX
2017-11-26 12:02:00	MSNBCW	47	MSNBCW_20171126_120000_MSNBC_Live/start/120	DOJ: TRUMP HAS LEGAL AUTHORITY TO NAME. ACTING HEAD OF CONSUMER PROTECTION BOARD\nWAPO: THE SHRINKING PROFILE OF JARED KUSHNER\nKELLY: \"THERE WAS HONESTLY NEVER A TIME WHEN. I CONTEMPLATED GE'I'I'ING RID OF JARED &...
2017-11-26 12:03:00	CNNW	36	CNNW_20171126_120000_New_Day_Sunday/start/180	W. Abby Phillip OW White House Correspondent
2017-11-26 12:03:00	FOXNEWSW	21	FOXNEWSW_20171126_110000_Fox_and_Friends_Sunday/start/3780	{UMP TAPS BUDGET DIRECTOR TO CLEAN UP CFPB :
2017-11-26 12:03:00	MSNBCW	42	MSNBCW_20171126_120000_MSNBC_Live/start/180	DOJ: TRUMP HAS LEGAL AUTHORITY TO NAME. ACTING HEAD OF CONSUMER PROTECTION BOARD
2017-11-26 12:04:00	BBCNEWS	9	BBCNEWS_20171126_120000_BBC_News/start/240	Baroness SUGG. Aviation Minister\nDRONE SAFETY LEGISLATION. Government publishes draft Drone Bill\nDr STEVE WRIGHT. University of the West of England
2017-11-26 12:04:00	FOXNEWSW	20	FOXNEWSW_20171126_110000_Fox_and_Friends_Sunday/start/3840	.UMP NAMES MULVANEY AS ACTING CFPB DIRECTOR I\nlUMP BLAMES OBAMA ADMIN FOR CFPB \"DISASTER\". . . . \\
2017-11-26 12:04:00	MSNBCW	32	MSNBCW_20171126_120000_MSNBC_Live/start/240	POLL: MOORE: 47%, JONES: 45%\nLATEST POLL SHOWS MOORE LEADING IN SENATE RACE\nMOORE CAMPAIGN \"CONFIDENT\" AFI'ER TRUMP BACKS GOP CANDIDATE
2017-11-26 12:05:00	BBCNEWS	62	BBCNEWS_20171126_120000_BBC_News/start/300	DRONE SAFETY LEGISLATION. Government publishes draft Drone Bill
2017-11-26 12:05:00	CNNW	30	CNNW_20171126_120000_New_Day_Sunday/start/300	W. Departing director names successor; Trump. appoints own pick hours later\nW. Abby Phillip OW White House Correspondent
2017-11-26 12:05:00	FOXNEWSW	45	FOXNEWSW_20171126_110000_Fox_and_Friends_Sunday/start/3900	lUMP BLAMES OBAMA ADMIN FOR CFPB \"DISASTER\". . . . \\\nlUMP BLAMES OBAMA ADMIN FOR CFPB \"DISASTER\" I
2017-11-26 12:05:00	MSNBCW	49	MSNBCW_20171126_120000_MSNBC_Live/start/300	TRUMP: MOORE \"TOTALLY DENIES IT\" AND \"YOU HAVE TO LISTEN TO HIM\"\nMOORE CAMPAIGN \"CONFIDENT\" AFI'ER TRUMP BACKS GOP CANDIDATE
2017-11-26 12:06:00	CNNW	9	CNNW_20171126_120000_New_Day_Sunday/start/360	, ,. Departing director names successor; Trump appoints own pick hours later\nHtl\u2019UHlbl JAHtU KUDHNtH'b DHHINKINU WHI | t I'IUUDI: HULI:. . RIGHT NOW KANSASCITY( 39\u00b0 MINNEAPOLIS ( 28\u00b0 SAINTLOUIS\nHtl\u2019UHlbl...
2017-11-26 12:06:00	FOXNEWSW	26	FOXNEWSW_20171126_110000_Fox_and_Friends_Sunday/start/3960	:PB MEANT TO END ABUSIVE LENDING PRACTICES. . . . \\\n:PB MEANT TO END ABUSIVE LENDING PRACTICES .\nMICK MULVANEY '. DIRECTOR OF THE OFFICE MANAGEMENT & BUDGET |
2017-11-26 12:06:00	MSNBCW	40	MSNBCW_20171126_120000_MSNBC_Live/start/360	NY TIMES: WHY TRUMP STANDS BY MOORE,. EVEN AS IT FRACTURES HIS PARTY\nMELANIE ZANONA ' ETAEFIKk/RITER\nPOLLS SHOW TIGHT ALABAMA SENATE RACE
2017-11-26 12:07:00	CNNW	17	CNNW_20171126_120000_New_Day_Sunday/start/420	NYT: Trump's son-1n-Iaw sidelined, \"focusing on his own projects\"\nNYT: Trump's son-1n-law sidelined, \"focusing on his own projects\"\nW. Kelly Jane Torrance Deputy Managing Editor The Weekly Standard
