2017-11-28 07:33:00	CNNW	32	CNNW_20171128_070000_CNN_Tonight_With_Don_Lemon/start/1980	NYT: TRUMP NOW SAYS 'ACCESS HOLLYWOOD' TAPE A FAKE\nNYT: TRUMP NOW SAYS 'ACCESS HOLLYWOOD' TAPE A FAKE. . Frank Bruni New York Times Op\u2014Ed Columnist\nNYT: TRUMP NOW SAYS 'ACCESS...
2017-11-28 07:33:00	FOXNEWSW	27	FOXNEWSW_20171128_070000_The_Ingraham_Angle/start/1980	{UMP'S HOSTILE RELATIONSHIP WITH THE PRESS P. . _I'rs. . . . c
2017-11-28 07:33:00	MSNBCW	34	MSNBCW_20171128_070000_The_11th_Hour_With_Brian_Williams/start/1980	SENATE GOP HOPES TO VOTE ON TAX BILL LATER THIS WEEK\nWH, CONGRESS MAKE FINAL PUSH FOR TAX OVERHAUL\nTRUMP WHITE HOUSE FACING CRUCIAL TESTS BEFORE YEAR\u2019S END\nTHE WEEKLY STANDARD. BILL...
2017-11-28 07:34:00	CNNW	62	CNNW_20171128_070000_CNN_Tonight_With_Don_Lemon/start/2040	NYT: TRUMP NOW SAYS 'ACCESS HOLLYWOOD' TAPE A FAKE
2017-11-28 07:34:00	FOXNEWSW	35	FOXNEWSW_20171128_070000_The_Ingraham_Angle/start/2040	UMP REFERS TO WARREN AGAIN AS \"POCAHONTAS\"\nUMP REFERS TO WARREN AGAIN AS \"POCAHONTAS\". . . . In\nBRIT HUME. . FOX NEWS SENIOR POLITICAL ANALYST. _ITLAIIMP_DAL1AKAI AMIZI : _
2017-11-28 07:34:00	MSNBCW	29	MSNBCW_20171128_070000_The_11th_Hour_With_Brian_Williams/start/2040	TRUMP & SENATE GOP TO MEET TMRW OVER TAX BILL\nWH, CONGRESS MAKE FINAL PUSH FOR TAX OVERHAUL
2017-11-28 07:35:00	CNNW	42	CNNW_20171128_070000_CNN_Tonight_With_Don_Lemon/start/2100	NYT: TRUMP NOW SAYS 'ACCESS HOLLYWOOD' TAPE A FAKE\nNYT: TRUMP NOW SAYS 'ACCESS HOLLYWOOD' TAPE A FAKE. . April Ryan White House Correspondent, American Urban Radio Networks\nNYT: TRUMP...
2017-11-28 07:35:00	FOXNEWSW	39	FOXNEWSW_20171128_070000_The_Ingraham_Angle/start/2100	UMP REFERS TO WARREN AGAIN AS \"POCAHONTAS\". . . . In
2017-11-28 07:35:00	MSNBCW	22	MSNBCW_20171128_070000_The_11th_Hour_With_Brian_Williams/start/2100	TRUMP & SENATE GOP TO MEET TMRW OVER TAX BILL\nPOLITICO: TRUMP DOESN\u2019T KNOW WHAT\u2019S NEXT AFI'ER TAXES
2017-11-28 07:36:00	MSNBCW	52	MSNBCW_20171128_070000_The_11th_Hour_With_Brian_Williams/start/2160	POLITICO: TRUMP DOESN\u2019T KNOW WHAT\u2019S NEXT AFI'ER TAXES\nTHE WEEKLY STANDARD. BILL KRISTOL FDITOP ATI APGF
2017-11-28 07:37:00	MSNBCW	34	MSNBCW_20171128_070000_The_11th_Hour_With_Brian_Williams/start/2220	CONGRESS FACES CRITICAL TO-DO LIST BEFORE 2O18\nJEREMY PETERS l :gmsgfggm\nPOLITICO: TRUMP DOESN\u2019T KNOW WHAT\u2019S NEXT AFI'ER TAXES\nFacebook.com/11thHOUI' I
2017-11-28 07:38:00	CNNW	34	CNNW_20171128_070000_CNN_Tonight_With_Don_Lemon/start/2280	TRUMP ON MOORE: 'HE SAYS |T DIDN'T HAPPEN'\nNYT: TRUMP NOW SAYS 'ACCESS HOLLYWOOD' TAPE A FAKE\nTRUMP ON MOORE: 'HE SAYS IT DIDN'T HAPPEN'. . Frank Bruni @FrankBruni
2017-11-28 07:38:00	MSNBCW	38	MSNBCW_20171128_070000_The_11th_Hour_With_Brian_Williams/start/2280	WHITE HOUSE FACING CHAOTIC, PACKED DECEMBER\nCONGRESS FACES CRITICAL TO-DO LIST BEFORE 2O18
2017-11-28 07:39:00	BBCNEWS	21	BBCNEWS_20171128_060000_Breakfast/start/5940	COMING UP on Victoria Derbysh'rre. \u201c. BBC Two' BBC News Channel & Onhne\nCOMING UP on Victoria Derbyshire. \u00bb BBC Two' BBC News Channel & Onhne\nCOMING UP on Victoria Derbyshire. BBC Two, BBC News Channel &...
2017-11-28 07:39:00	CNNW	40	CNNW_20171128_070000_CNN_Tonight_With_Don_Lemon/start/2340	TRUMP ON MOORE: 'HE SAYS |T DIDN'T HAPPEN'\nTRUMP ON MOORE: 'HE SAYS IT DIDN'T HAPPEN'. . Frank Bruni @FrankBruni\nTRUMP ON MOORE: 'HE SAYS IT DIDN'T HAPPEN'. . Frank Bruni New...
2017-11-28 07:39:00	MSNBCW	20	MSNBCW_20171128_070000_The_11th_Hour_With_Brian_Williams/start/2340	WHITE HOUSE FACING CHAOTIC, PACKED DECEMBER
2017-11-28 07:40:00	BBCNEWS	12	BBCNEWS_20171128_060000_Breakfast/start/6000	COMING UP on Victoria Derbyshire. BBC Two BBC News Channel & Oniine
2017-11-28 07:40:00	CNNW	21	CNNW_20171128_070000_CNN_Tonight_With_Don_Lemon/start/2400	TRUMP ON MOORE: 'HE SAYS |T DIDN'T HAPPEN'\nPOLITICS AND PRESSURE INSIDE THE TRUMP FAMILY
2017-11-28 07:40:00	FOXNEWSW	25	FOXNEWSW_20171128_070000_The_Ingraham_Angle/start/2400	SARAH ELLISON. HOLIDAY ISSUE 2O17\nSARAH ELLISON. HOLIDAY ISSUE 2O17 /
2017-11-28 07:40:00	MSNBCW	12	MSNBCW_20171128_070000_The_11th_Hour_With_Brian_Williams/start/2400	1 844 FNTYVIO
2017-11-28 07:41:00	CNNW	13	CNNW_20171128_070000_CNN_Tonight_With_Don_Lemon/start/2460	cancercenter.com/outsmart
2017-11-28 07:42:00	MSNBCW	25	MSNBCW_20171128_070000_The_11th_Hour_With_Brian_Williams/start/2520	TRUMP CALLS SEN. WARREN \"POCAHONTAS\". AT FVFNT HONODING NATIVF AMFDICANS\n8-OO84921731
2017-11-28 07:43:00	FOXNEWSW	22	FOXNEWSW_20171128_070000_The_Ingraham_Angle/start/2580	(D) MASSACHUSETTS
2017-11-28 07:43:00	MSNBCW	26	MSNBCW_20171128_070000_The_11th_Hour_With_Brian_Williams/start/2580	WH: TRUMP CALLING WARREN POCAHONTAS \"NOT A RACIAL SLUR\"\nTRUMP CALLS SEN. WARREN \"POCAHONTAS\". AT FVFNT HONODING NATIVF AMFDICANS
2017-11-28 07:44:00	CNNW	8	CNNW_20171128_070000_CNN_Tonight_With_Don_Lemon/start/2640	MELANIA TRUMP UNVEILS WH CHRISTMAS DECORATIONS
2017-11-28 07:44:00	FOXNEWSW	20	FOXNEWSW_20171128_070000_The_Ingraham_Angle/start/2640	IAOS AT CONSUMER FINANCIAL PROTECTION BUREAU\nSHOWDOWN AT THE CFPB. . In
2017-11-28 07:44:00	MSNBCW	36	MSNBCW_20171128_070000_The_11th_Hour_With_Brian_Williams/start/2640	TRUMP MOCKS WARREN DURING. MFI\u2014'I'ING WITH NAVAJO com: TAI KFps\nTRUMP CALLS SEN. WARREN \"POCAHONTAS\". AT FVFNT HONODING NATIVF AMFDICANS
2017-11-28 07:45:00	CNNW	23	CNNW_20171128_070000_CNN_Tonight_With_Don_Lemon/start/2700	POLITICS AND PRESSURE INSIDE THE TRUMP FAMILY\nVANITY FAIR: MELANIA DIDN'T WANT TO BE FIRST LADY. . Sarah Ellison Contributing Editor, Vanity Fair\nVANITY FAIR: MELANIA DIDN'T WANT...
2017-11-28 07:45:00	FOXNEWSW	16	FOXNEWSW_20171128_070000_The_Ingraham_Angle/start/2700	iAOS AT CONSUMER FINANCIAL PROTECTION BUREAU\nROBERT WEISSMAN. . PRESIDENT OF PUBLIC CITIZEN. \u2014nm I \"mm\u201c. um :\u2014\nIAOS AT CONSUMER FINANCIAL PROTECTION BUREAU I. . \u2014I...
2017-11-28 07:45:00	MSNBCW	16	MSNBCW_20171128_070000_The_11th_Hour_With_Brian_Williams/start/2700	TRUMP AGAIN ESCALATES ATI'ACKS ON PRESS\nSTEVE SCHMIDT | EEEFM\u00e9\ufb01'X\ufb01\u00e9mF\u2019A'G\u201d\nTRUMP CALLS SEN. WARREN \"POCAHONTAS\". AT FVFNT HONODING NATIVF AMFDICANS\nWH: TRUMP...
2017-11-28 07:46:00	CNNW	47	CNNW_20171128_070000_CNN_Tonight_With_Don_Lemon/start/2760	VANITY FAIR: MELANIA DIDN'T WANT TO BE FIRST LADY\nVANITY FAIR: MELANIA DIDN'T WANT TO BE FIRST LADY. . Sarah Ellison @Sarahlellison\nVANITY FAIR: MELANIA DIDN'T WANT TO BE FIRST LADY. ....
2017-11-28 07:46:00	FOXNEWSW	21	FOXNEWSW_20171128_070000_The_Ingraham_Angle/start/2760	IAOS AT CONSUMER FINANCIAL PROTECTION BUREAU. . \u2014 AAAAAAAAAAAAAAAAAA _\niAOS AT CONSUMER FINANCIAL PROTECTION BUREAU\n{AOS AT CONSUMER FINANCIAL PROTECTION BUREAU
2017-11-28 07:46:00	MSNBCW	55	MSNBCW_20171128_070000_The_11th_Hour_With_Brian_Williams/start/2760	TRUMP GOES AFI'ER PRESS WITH HIS AGENDA STALLED\nTRUMP SUGGESTS CONTEST FOR. \"MOST DISHONFST\u201d NFWS NFI'WODK
2017-11-28 07:47:00	FOXNEWSW	40	FOXNEWSW_20171128_070000_The_Ingraham_Angle/start/2820	IAOS AT CONSUMER FINANCIAL PROTECTION BUREAU
2017-11-28 07:47:00	MSNBCW	8	MSNBCW_20171128_070000_The_11th_Hour_With_Brian_Williams/start/2820	TRUMP SUGGESTS CONTEST FOR. \"MOST DISHONFST\u201d NFWS NFI'WODK
2017-11-28 07:48:00	CNNW	26	CNNW_20171128_070000_CNN_Tonight_With_Don_Lemon/start/2880	KUSHNER'S ROLE AS SENIOR WH ADVISOR DIMINISHED. . Emily Jane Fox cm Contributor\nKUSHNER'S ROLE AS SENIOR WH ADVISOR DIMINISHED\nKUSHNER'S ROLE AS SENIOR WH ADVISOR DIMINISHED. . Emily Jane FOX @emilyjanefox
2017-11-28 07:48:00	FOXNEWSW	38	FOXNEWSW_20171128_070000_The_Ingraham_Angle/start/2880	iAOS AT CONSUMER FINANCIAL PROTECTION BUREAU\nROBERT WEISSMAN. . PRESIDENT OF PUBLIC CITIZEN. \u20141nm I mum\u201c. \u201ca. :\u2014\nIAOS AT CONSUMER FINANCIAL PROTECTION BUREAU. . \u2014...
2017-11-28 07:49:00	CNNW	21	CNNW_20171128_070000_CNN_Tonight_With_Don_Lemon/start/2940	KUSHNER'S ROLE AS SENIOR WH ADVISOR DIMINISHED\nKUSHNER'S ROLE AS SENIOR WH ADVISOR DIMINISHED. . Emily Jane FOX @emilyjanefox
2017-11-28 07:49:00	FOXNEWSW	8	FOXNEWSW_20171128_070000_The_Ingraham_Angle/start/2940	iAOS AT CONSUMER FINANCIAL PROTECTION BUREAU
2017-11-28 07:50:00	MSNBCW	16	MSNBCW_20171128_070000_The_11th_Hour_With_Brian_Williams/start/3000	RUSSIA PROBE HANGS OVER TRUMP ADMINISTRATION\nDAVID WILLMANI zessyTiiEESMMES\nLA TIMES: MUELLER\u2019S RECORD SHOWS SURPRISING FLAWS
2017-11-28 07:51:00	CNNW	10	CNNW_20171128_070000_CNN_Tonight_With_Don_Lemon/start/3060	POLITICS AND PRESSURE INSIDE THE TRUMP FAMILY
2017-11-28 07:51:00	MSNBCW	25	MSNBCW_20171128_070000_The_11th_Hour_With_Brian_Williams/start/3060	LA TIMES: MUELLER'S RECORD SHOWS SURPRISING FLAWS\nMUELLER LARGELY RESPECTED BY BOTH GOP & DEMS\nDAVID WILLMANI zessyTiEEESMMES\nDAVID WILLMANI zessyTiEEEEEEME
2017-11-28 07:52:00	CNNW	19	CNNW_20171128_070000_CNN_Tonight_With_Don_Lemon/start/3120	KUSHNER'S ROLE AS SENIOR WH ADVISOR DIMINISHED. . Michael D'Antonio Author, 'The Truth About Trump'\nKUSHNER'S ROLE AS SENIOR WH ADVISOR DIMINISHED\nKUSHNER'S ROLE AS SENIOR WH ADVISOR DIMINISHED. . Michael D'Antonio OW...
2017-11-28 07:52:00	MSNBCW	16	MSNBCW_20171128_070000_The_11th_Hour_With_Brian_Williams/start/3120	LA TIMES: MUELLER\u2019S RECORD SHOWS A MAN OF FALLIBLE JUDGMENT\nMUELLER LARGELY RESPECTED BY BOTH GOP & DEMS\nDAVID WILLMANI zessyTiEEESMMES\nDAVID WILLMANI zessyTiiEESEMES\nLA TIMES: MUELLER\u2019S FBI...
2017-11-28 07:53:00	CNNW	29	CNNW_20171128_070000_CNN_Tonight_With_Don_Lemon/start/3180	NYT: TRUMP WAS IN DISBELIEF OVER IVANKA'S. CONDEMNATION OF ROY MOORE\nKUSHNER'S ROLE AS SENIOR WH ADVISOR DIMINISHED\nALABAMA DEM USES IVANKA QUOTE IN SENATE AD
2017-11-28 07:53:00	MSNBCW	33	MSNBCW_20171128_070000_The_11th_Hour_With_Brian_Williams/start/3180	LA TIMES: MUELLER'S RECORD SHOWS SURPRISING FLAWS\nLA TIMES: MUELLER\u2019S FBI STRUGGLED TO FIND. DFDSON DFSDONSIRI F FOR 9OO1 ANTHRAX ATTACKS\nDAVID WILLMANI zessyTiiEESMMES
2017-11-28 07:54:00	CNNW	20	CNNW_20171128_070000_CNN_Tonight_With_Don_Lemon/start/3240	ALABAMA DEM USES IVANKA QUOTE IN SENATE AD\nALABAMA DEM USES IVANKA QUOTE IN SENATE AD. . Sarah Ellison Contributing Editor, Vanity Fair\nALABAMA DEM USES IVANKA QUOTE IN SENATE...
2017-11-28 07:54:00	MSNBCW	40	MSNBCW_20171128_070000_The_11th_Hour_With_Brian_Williams/start/3240	LA TIMES: MUELLER\u2019S RECORD SHOWS A MAN OF FALLIBLE JUDGMENT\nLA TIMES: MUELLER\u2019S RECORD SHOWS SURPRISING FLAWS
2017-11-28 07:55:00	CNNW	47	CNNW_20171128_070000_CNN_Tonight_With_Don_Lemon/start/3300	NYT: TRUMP WAS IN DISBELIEF OVER IVANKA'S. CONDEMNATION OF ROY MOORE\nALABAMA DEM USES IVANKA QUOTE IN SENATE AD
2017-11-28 07:55:00	FOXNEWSW	27	FOXNEWSW_20171128_070000_The_Ingraham_Angle/start/3300	HINA CENSORING FREE SPEECH IN THE USA? '
2017-11-28 07:55:00	MSNBCW	14	MSNBCW_20171128_070000_The_11th_Hour_With_Brian_Williams/start/3300	CEO AND FOUNDER
2017-11-28 07:56:00	CNNW	11	CNNW_20171128_070000_CNN_Tonight_With_Don_Lemon/start/3360	NYT: TRUMP WAS IN DISBELIEF OVER IVANKA'S. CONDEMNATION OF ROY MOORE\nTRUMP A'ITACKS PRESS, ENDORSES CONSPIRACY BLOG
2017-11-28 07:56:00	FOXNEWSW	22	FOXNEWSW_20171128_070000_The_Ingraham_Angle/start/3360	HINA CENSORING FREE SPEECH IN THE USA? I\nHINA CENSORINIG FREE SPEECH IN THE USA? I. . \u2014 nnnnnnnnnnnnnnnnnn _
2017-11-28 07:56:00	MSNBCW	11	MSNBCW_20171128_070000_The_11th_Hour_With_Brian_Williams/start/3360	I [Inn-I1 an-Mnl l-n'/\nValid November let through November 27th
2017-11-28 07:57:00	FOXNEWSW	34	FOXNEWSW_20171128_070000_The_Ingraham_Angle/start/3420	HINA CENSORING FREE SPEECH IN THE USA? \"\nHINA CENSORING FREE SPEECH IN THE USA?. . _ AAAAAAAAAAAAAAAAAA _
2017-11-28 07:58:00	CNNW	19	CNNW_20171128_070000_CNN_Tonight_With_Don_Lemon/start/3480	stamps.con
2017-11-28 07:58:00	FOXNEWSW	28	FOXNEWSW_20171128_070000_The_Ingraham_Angle/start/3480	HINA CENSORING FREE SPEECH IN THE USA? I\nSTEVEN MOSHER. . AUTHOR OF \"BULLY OF ASIA\". \u20141TLA' IMnDALuuA I AMIZI : _
2017-11-28 07:58:00	MSNBCW	25	MSNBCW_20171128_070000_The_11th_Hour_With_Brian_Williams/start/3480	PRINCE HARRY & ACTRESS MEGHAN MARKLE ENGAGED
2017-11-28 07:59:00	FOXNEWSW	22	FOXNEWSW_20171128_070000_The_Ingraham_Angle/start/3540	IWII VETERAN HONORED AT NFL GAME .
2017-11-28 08:00:00	CNNW	27	CNNW_20171128_070000_CNN_Tonight_With_Don_Lemon/start/3600	PRESIDENT TRUMP'S ATI'ACKS ON THE PRESS
2017-11-28 08:00:00	MSNBCW	4	MSNBCW_20171128_070000_The_11th_Hour_With_Brian_Williams/start/3600	THE RUSSIANS
2017-11-28 08:01:00	FOXNEWSW	17	FOXNEWSW_20171128_080000_Fox_News__Night/start/60	WHO'S IN CHARGE OF THE CFPB?. . mm\u201c \u201d2er \u2014\nBUREAUCRATIC BATTLE. THE FIGHT OVER WHO WILL LEAD AGENCY. . _ maul/2m\nSHANNON BREAM
2017-11-28 08:02:00	FOXNEWSW	31	FOXNEWSW_20171128_080000_Fox_News__Night/start/120	BUREAUCRATIC BATTLE. THE FIGHT OVER WHO WILL LEAD AGENCY. . _ mama/2m\nBUREAUCRATIC BATTLE. THE FIGHT OVER WHO WILL LEAD AGENCY. . _ Wanton-r
2017-11-28 08:02:00	MSNBCW	11	MSNBCW_20171128_080000_All_In_With_Chris_Hayes/start/120	MICHAEL FLYNN | FMR.NATIONALSECURITYADVISOR
2017-11-28 08:03:00	MSNBCW	12	MSNBCW_20171128_080000_All_In_With_Chris_Hayes/start/180	JAMES COMEY | FMR. FBI DIRECTOR
2017-11-28 08:05:00	CNNW	45	CNNW_20171128_080000_CNN_Tonight_With_Don_Lemon/start/300	PRESIDENT TRUMP'S ATI'ACKS ON THE PRESS\nPRESIDENT TRUMP'S ATTACKS ON THE PRESS. . Dan Rather Host, AXS TV's \"The Big Interview\u201c\nPRESIDENT TRUMP'S ATTACKS ON THE PRESS. ....
2017-11-28 08:05:00	FOXNEWSW	50	FOXNEWSW_20171128_080000_Fox_News__Night/start/300	CFPB CONTROVERSY. TRUMP- APPOINTED JUDGE WILL HEAR CASE. . _ auteur _
2017-11-28 08:05:00	MSNBCW	3	MSNBCW_20171128_080000_All_In_With_Chris_Hayes/start/300	. m d n - prepanng lo negouaxe wuh moseculovs over. a deal that could Include ms testimony. aaalnsl me oresvdenl or semor Whvle House
2017-11-28 08:06:00	CNNW	26	CNNW_20171128_080000_CNN_Tonight_With_Don_Lemon/start/360	PRESIDENT TRUMP'S ATTACKS ON THE PRESS. . Dan Rather Host, AXS TV's \"The Big Interview\u201c\nPRESIDENT TRUMP'S ATTACKS ON THE PRESS. . Dan Rather @DanRather\nPRESIDENT TRUMP'S ATI'ACKS ON THE PRESS
2017-11-28 08:06:00	FOXNEWSW	29	FOXNEWSW_20171128_080000_Fox_News__Night/start/360	CFPB CONTROVERSY. TRUMP- APPOINTED JUDGE WILL HEAR CASE. . _ rumour _\nI. CFPB CONTROVERSY. . TDI IAAI'LADDAIKITEI'I II In\ufb01ll \\AIII I LIEAD ('ACE l\nI\u2014]. CFPB CONTROVERSY. . TDI IAAILADDAIKITEI'I II...
2017-11-28 08:06:00	MSNBCW	37	MSNBCW_20171128_080000_All_In_With_Chris_Hayes/start/360	IKUMI\" 6:\nElm New \ufb02urk Eimcs. MICHAEL SCHMIDT I WASHINGTON COPPFSDONDFNT
2017-11-28 08:07:00	CNNW	34	CNNW_20171128_080000_CNN_Tonight_With_Don_Lemon/start/420	IS THE PRESIDENT PU'ITING REPORTERS AT RISK?\nIS THE PRESIDENT PUTTING REPORTERS AT RISK?. . Kimberly Dozier OW Global Affairs Analyst\nPRESIDENT TRUMP'S ATI'ACKS ON THE PRESS\nIS...
2017-11-28 08:07:00	FOXNEWSW	23	FOXNEWSW_20171128_080000_Fox_News__Night/start/420	DEMS MOCK MULVANEY. SCHUMER CALLS MULVANEY \"TROJAN HORSE\" CANDIDATE. . rumour \u2014\nCFPB CONTROVERSY I. TRUMP- APPOINTED JUDGE WILL HEAR CASE. . _ mun/2m _
2017-11-28 08:08:00	FOXNEWSW	13	FOXNEWSW_20171128_080000_Fox_News__Night/start/480	DEMS MOCK MULVANEY. SCHUMER CALLS MULVANEY \"TROJAN HORSE\" CANDIDATE. . mun/2m \u2014\nDEMS MOCK MULVANEY. SCHUMER CALLS MULVANEY \"TROJAN HORSE\" CANDIDATE. . mun/2m _\nDEMS MOCK MULVANEY I. . (fl\u2014ll IAAED f'AI I C All...
2017-11-28 08:08:00	MSNBCW	10	MSNBCW_20171128_080000_All_In_With_Chris_Hayes/start/480	FMR. ASSISTANT SPECIAL. NICK AKERMAN WATFPGATF DPOSFCUTOP\nFMR. ASSISTANT SPECIAL. NICK AKERMAN WATFPGATF ppnspcump
2017-11-28 08:09:00	CNNW	39	CNNW_20171128_080000_CNN_Tonight_With_Don_Lemon/start/540	PRESIDENT TRUMP'S ATTACKS ON THE PRESS. . Carl Bernstein @carlbernstein\nIS THE PRESIDENT PU'ITING REPORTERS AT RISK?\nPRESIDENT TRUMP'S ATI'ACKS ON THE PRESS
2017-11-28 08:09:00	FOXNEWSW	21	FOXNEWSW_20171128_080000_Fox_News__Night/start/540	SEXUAL HARASSMENT ACCUSATIONS E. ZONGRESSIONAL DEMOCRATS SCRAMBLE TO DEAL WITH REPORTS. . \ufb01hkllI'LIT\nI\u2014l. DEMS MOCK MULVANEY. . (fl\u2014ll IAAED f'AI I C All II\\IAkII:V \"TDnIAkI unoccu I'AklhlhAT: I
2017-11-28 08:09:00	MSNBCW	15	MSNBCW_20171128_080000_All_In_With_Chris_Hayes/start/540	h 'f-. . IKUMI\" 6:\nL:. . h\u2014 'r-. . IKUMI\" 6:\nFMR. ASSISTANT SPECIAL. NICK AKERMAN WATFPGATF ppnspcump
2017-11-28 08:10:00	CNNW	55	CNNW_20171128_080000_CNN_Tonight_With_Don_Lemon/start/600	PRESIDENT TRUMP'S ATI'ACKS ON THE PRESS\nPRESIDENT TRUMP'S ATTACKS ON THE PRESS. . Carl Bernstein @carlbernstein
2017-11-28 08:10:00	FOXNEWSW	30	FOXNEWSW_20171128_080000_Fox_News__Night/start/600	SEXUAL HARASSMENT ACCUSATIONS I. ZONGRESSIONAL DEMOCRATS SCRAMBLE TO DEAL WITH REPORTS. . \ufb01hklll'LlT\nSEXUAL HARASSMENT ACCUSATIONS I. . 'nurzncccnnum ncnnrn ATC CPDAAAIII I Tn n\ufb02Al \\AIITLI ncnnn'rc
2017-11-28 08:10:00	MSNBCW	15	MSNBCW_20171128_080000_All_In_With_Chris_Hayes/start/600	L\u2014'r- '. . IKUMI\" 6:\nh- 'r-. . IKUMI\" 6:\nL\u2014 '1-. . IKUMI\" 6:\nFMR. ASSISTANT SPECIAL. NICK AKERMAN WATFPGATF ppnspcumn
2017-11-28 08:11:00	CNNW	62	CNNW_20171128_080000_CNN_Tonight_With_Don_Lemon/start/660	PRESIDENT TRUMP'S ATI'ACKS ON THE PRESS
2017-11-28 08:11:00	FOXNEWSW	49	FOXNEWSW_20171128_080000_Fox_News__Night/start/660	SEXUAL HARASSMENT ACCUSATIONS I. ZONGRESSIONAL DEMOCRATS SCRAMBLE To DEAL WITH REPORTS. . mkllf'u'l\u2019\nSEXUAL HARASSMENT ACCUSATIONS I. ZONGRESSIONAL DEMOCRATS SCRAMBLE TO DEAL WITH REPORTS. . mun/2m
2017-11-28 08:11:00	MSNBCW	23	MSNBCW_20171128_080000_All_In_With_Chris_Hayes/start/660	L\u2014'r- '. . IKUNII\" 6':
2017-11-28 08:12:00	CNNW	49	CNNW_20171128_080000_CNN_Tonight_With_Don_Lemon/start/720	CONSERVATIVE GROUP TARGETS WASHINGTON POST\nPRESIDENT TRUMP'S ATI'ACKS ON THE PRESS\nCONSERVATIVE GROUP TARGETS WASHINGTON POST. . James O'Keefe Founder of Project Veritas
2017-11-28 08:12:00	FOXNEWSW	62	FOXNEWSW_20171128_080000_Fox_News__Night/start/720	SEXUAL HARASSMENT ACCUSATIONS I. ZONGRESSIONAL DEMOCRATS SCRAMBLE TO DEAL WITH REPORTS. . n'\ufb02KIII'LIT
2017-11-28 08:12:00	MSNBCW	20	MSNBCW_20171128_080000_All_In_With_Chris_Hayes/start/720	L:. . L\u2014'r.\u2019. . IKUMI\" 6:\nFMR. ASSISTANT SPECIAL. NICK AKERMAN WATFPGATF ppnspcump
2017-11-28 08:13:00	CNNW	26	CNNW_20171128_080000_CNN_Tonight_With_Don_Lemon/start/780	CONSERVATIVE GROUP TARGETS WASHINGTON POST. . Dan Rather Host, AXS TV's \"The Big Interview\u201c\nCONSERVATIVE GROUP TARGETS WASHINGTON POST\nCONSERVATIVE GROUP TARGETS WASHINGTON POST. . Dan Rather @DanRather
2017-11-28 08:13:00	MSNBCW	12	MSNBCW_20171128_080000_All_In_With_Chris_Hayes/start/780	Eur musllingtnn 11O51. ASHLEY PARKER WHITF HOIISF DFDOPTFP
2017-11-28 08:14:00	CNNW	25	CNNW_20171128_080000_CNN_Tonight_With_Don_Lemon/start/840	PRESIDENT TRUMP'S ATTACKS ON THE PRESS. . Carl Bernstein @carlbernstein\nCONSERVATIVE GROUP TARGETS WASHINGTON POST\nPRESIDENT TRUMP'S ATI'ACKS ON THE PRESS\nPRESIDENT TRUMP'S ATTACKS ON THE PRESS. . Carl...
2017-11-28 08:14:00	FOXNEWSW	10	FOXNEWSW_20171128_080000_Fox_News__Night/start/840	ALTERCATION AT ROY MOORE RALLY I. FOX CREWS CONFRONTED BY CAMPAIGN STAFF
2017-11-28 08:15:00	CNNW	54	CNNW_20171128_080000_CNN_Tonight_With_Don_Lemon/start/900	PRESIDENT TRUMP'S ATTACKS ON THE PRESS. . Carl Bernstein @carlbernstein\nPRESIDENT TRUMP'S ATTACKS ON THE PRESS. . Carl Bernstein :m' Political Analyst
2017-11-28 08:15:00	FOXNEWSW	8	FOXNEWSW_20171128_080000_Fox_News__Night/start/900	SEXUAL HARASSMENT ACCUSATIONS I. TRUMP WILL NOT CAMPAIGN Pon ROY MOORE IN ALABAMA. . \ufb01hkllf'u'l'\nSEXUAL HARASSMENT ACCUSATIONS. TRUMP WILL NOT CAMPAIGN FOR ROY MOORE IN ALABAMA. . \ufb01hkllI'LIT
2017-11-28 08:15:00	MSNBCW	24	MSNBCW_20171128_080000_All_In_With_Chris_Hayes/start/900	THIS IS THE PRESIDENT\n1-8O9-844-196O m1 1
2017-11-28 08:16:00	CNNW	53	CNNW_20171128_080000_CNN_Tonight_With_Don_Lemon/start/960	PRESIDENT TRUMP'S ATI'ACKS ON THE PRESS\nPRESIDENT TRUMP'S ATTACKS ON THE PRESS. . Kimberly Dozier CJ\\N Global Affairs Analyst
2017-11-28 08:16:00	FOXNEWSW	15	FOXNEWSW_20171128_080000_Fox_News__Night/start/960	SEXUAL HARASSMENT ACCUSATIONS \\. TRUMP WILL NOT CAMPAIGN FOR ROY MOORE IN ALABAMA. . \ufb01hkllI'LIT\nSEXUAL HARASSMENT ACCUSATIONS I. TRUMP WILL NOT CAMPAIGN POR ROY MOORE IN ALABAMA. . \ufb01hklll'LlT
2017-11-28 08:16:00	MSNBCW	37	MSNBCW_20171128_080000_All_In_With_Chris_Hayes/start/960	1-8O9-844-196O m1 1
2017-11-28 08:17:00	CNNW	23	CNNW_20171128_080000_CNN_Tonight_With_Don_Lemon/start/1020	PRESIDENT TRUMP'S ATTACKS ON THE PRESS. . Kimberly Dozier @KimDozier\nPRESIDENT TRUMP'S ATTACKS ON THE PRESS. . Kimberly Dozier Senior National Security Correspondent, The Daily Beast\nPRESIDENT TRUMP'S...
2017-11-28 08:17:00	FOXNEWSW	17	FOXNEWSW_20171128_080000_Fox_News__Night/start/1020	SEXUAL HARASSMENT ACCUSATIONS. TRUMP WILL NOT CAMPAIGN FOR ROY MOORE IN ALABAMA. . \ufb01hklll'u'l\u2019\nSEXUAL HARASSMENT ACCUSATIONS '. ZONGRESSIONAL DEMOCRATS SCRAMBLE TO DEAL WITH REPORTS 1. . mkllI'LlT
2017-11-28 08:18:00	FOXNEWSW	27	FOXNEWSW_20171128_080000_Fox_News__Night/start/1080	SEXUAL HARASSMENT ACCUSATIONS \\. ZONGRESSIONAL DEMOCRATS SCRAMBLE TO DEAL WITH REPORTS I. . \ufb01hklll'u'f\nSEXUAL HARASSMENT ACCUSATIONS I. ZONGRESSIONAL DEMOCRATS SCRAMBLE TO DEAL WITH REPORTS. . mun/N.\u201d
2017-11-28 08:19:00	CNNW	30	CNNW_20171128_080000_CNN_Tonight_With_Don_Lemon/start/1140	PRESIDENT TRUMP'S ATTACKS ON THE PRESS. . Dan Rather @DanRather\nPRESIDENT TRUMP'S ATTACKS ON THE PRESS. . Dan Rather Host, AXS TV's \"The Big Interview\u201c\nPRESIDENT TRUMP'S ATI'ACKS ON THE PRESS
2017-11-28 08:19:00	FOXNEWSW	34	FOXNEWSW_20171128_080000_Fox_News__Night/start/1140	SEXUAL HARASSMENT ACCUSATIONS. ZONGRESSIONAL DEMOCRATS SCRAMBLE TO DEAL WITH REPORTS. . mklll'u'l\u2019\nSEXUAL HARASSMENT ACCUSATIONS. ZONGRESSIONAL DEMOCRATS SCRAMBLE TO DEAL WITH REPORTS. . \ufb01hklll'u'l'
2017-11-28 08:19:00	MSNBCW	10	MSNBCW_20171128_080000_All_In_With_Chris_Hayes/start/1140	SEN. ELIZABETH WARREN ' (D) MASSACHUSETTS\nSEN. ELIZABEI'H WARREN ' (D) MASSACHUSETTS
2017-11-28 08:20:00	FOXNEWSW	8	FOXNEWSW_20171128_080000_Fox_News__Night/start/1200	SEXUAL HARASSMENT ACCUSATIONS. ZONGRESSIONAL DEMOCRATS SCRAMBLE TO DEAL WITH REPORTS. . \ufb01hkllI'LIT
2017-11-28 08:20:00	MSNBCW	20	MSNBCW_20171128_080000_All_In_With_Chris_Hayes/start/1200	ATTORNEY. GYASI Ross MFMRFP OF THF RI ACKFFFT NATION\nf \\ THIS IS THE PRESIDENT I\nSARAH HUCKABEE SANDERS I WHITE HOUSE PRESS SECRETARY
2017-11-28 08:21:00	CNNW	8	CNNW_20171128_080000_CNN_Tonight_With_Don_Lemon/start/1260	Call 24/7: (8OO) 88 :'. . . . massAmon com \\ Inlormanon ProKecuon
2017-11-28 08:21:00	FOXNEWSW	11	FOXNEWSW_20171128_080000_Fox_News__Night/start/1260	THE HUMANI
2017-11-28 08:21:00	MSNBCW	5	MSNBCW_20171128_080000_All_In_With_Chris_Hayes/start/1260	ATTORN EY. GYASI Ross MFMRFP OF THF RI ACKFFFT NATION
2017-11-28 08:22:00	CNNW	14	CNNW_20171128_080000_CNN_Tonight_With_Don_Lemon/start/1320	1-8OO-754-9595 ~AARP' \u201cWWW. . AARPMedicareSupplement.com mm\u201c cm?\u201d\n1 -8OO-754-9595 Call now for Free Guide. . TTY:711\n1 -8OO-754-9595 Mum \u201cm\u201cummm. . Toll-free 1mm\u201c camp\u201c,
2017-11-28 08:22:00	MSNBCW	24	MSNBCW_20171128_080000_All_In_With_Chris_Hayes/start/1320	ATTORNEY. GYASI Ross MFMRFP OF THF RI ACKFFFT NATION\n5 \\ THIS IS THE PRESIDENT
2017-11-28 08:24:00	CNNW	17	CNNW_20171128_080000_CNN_Tonight_With_Don_Lemon/start/1440	PRESIDENT TRUMP'S ATI'ACKS ON THE PRESS
2017-11-28 08:24:00	MSNBCW	20	MSNBCW_20171128_080000_All_In_With_Chris_Hayes/start/1440	THE SWAMP\nATTORNEY. GYASI Ross MFMRFP OF THF RI ACKFFFT NATION
2017-11-28 08:25:00	CNNW	27	CNNW_20171128_080000_CNN_Tonight_With_Don_Lemon/start/1500	PRESIDENT TRUMP'S ATTACKS ON THE PRESS. . James Clapper OW National Security Analyst\nPRESIDENT TRUMP'S ATTACKS ON THE PRESS. . James Clapper Former Director of National Intelligence\nPRESIDENT TRUMP'S ATI'ACKS ON THE...
2017-11-28 08:25:00	FOXNEWSW	22	FOXNEWSW_20171128_080000_Fox_News__Night/start/1500	THE HILL. \u2019-' NOVEMBER 27\nTHE HILL. \" NOVEMBER 27
2017-11-28 08:25:00	MSNBCW	16	MSNBCW_20171128_080000_All_In_With_Chris_Hayes/start/1500	TOUCHOFMO
2017-11-28 08:26:00	CNNW	21	CNNW_20171128_080000_CNN_Tonight_With_Don_Lemon/start/1560	IN RETALIATORY MOVE, PUTIN SIGNS MEDIA 'FOREIGN AGENTS' LAW\nIN RETALIATORY MOVE, PUTIN SIGNS MEDIA 'FOREIGN AGENTS' LAW. . James Clapper OW National Security Analyst\nPRESIDENT TRUMP'S ATTACKS ON...
2017-11-28 08:26:00	FOXNEWSW	27	FOXNEWSW_20171128_080000_Fox_News__Night/start/1560	A DAUNTING DECEMBER. AUST- PASS FUNDING, IMMIGRATION ON CONGRESSIONAL AGENDA I. . _ mnunu'r\nA DAUNTING DECEMBER I. AUST- PASS FUNDING, IMMIGRATION ON CONGRESSIONAL AGENDA. . mmuru'r
2017-11-28 08:27:00	FOXNEWSW	20	FOXNEWSW_20171128_080000_Fox_News__Night/start/1620	TAX REFORM TALLY. SENATE REPUBLICANIS CAUTIOUSLY OPTIMISTIC I. . nkllfiLlT\nA DAUNTING DECEMBER F. . Al ICT.DAC\u20ac III mnmn IAAAAIIZD ATInM AM rnmnncccmmu APJIMDA
2017-11-28 08:27:00	MSNBCW	12	MSNBCW_20171128_080000_All_In_With_Chris_Hayes/start/1620	REP. MICK MULVANEY I (R) SOUTH CAROLINA
2017-11-28 08:28:00	CNNW	29	CNNW_20171128_080000_CNN_Tonight_With_Don_Lemon/start/1680	HAYDEN: TRUMP'S COMMENTS AN 'OUTRAGEOUS ASSAULT ON TRUTH'. . James Clapper OW National Security Analyst\nPRESIDENT TRUMP'S ATI'ACKS ON THE PRESS\nHAYDEN: TRUMP'S COMMENTS AN 'OUTRAGEOUS ASSAULT ON TRUTH'\nHAYDEN: TRUMP'S COMMENTS AN...
2017-11-28 08:28:00	FOXNEWSW	21	FOXNEWSW_20171128_080000_Fox_News__Night/start/1680	\"THEY CALL HER POCAHONTAS\" I. RUMP HITS WARREN s CLAIM OF NATIVE AMERICAN HERITAGE. . \ufb01hkllf'LIT\n. TAX REFORM TALLY '. . CERIATI: DEDI IDI II'AKIC ('AI ITInI ICI V nDTIAAICTI!'
2017-11-28 08:29:00	CNNW	28	CNNW_20171128_080000_CNN_Tonight_With_Don_Lemon/start/1740	HAYDEN: TRUMP'S COMMENTS AN 'OUTRAGEOUS ASSAULT ON TRUTH'\nHAYDEN: TRUMP'S COMMENTS AN 'OUTRAGEOUS ASSAULT ON TRUTH'. . James Clapper Former Director of National Intelligence\nHAYDEN: TRUMP'S...
2017-11-28 08:30:00	CNNW	19	CNNW_20171128_080000_CNN_Tonight_With_Don_Lemon/start/1800	GETCORAVIN.COM\nSPECULATION GROWS THAT FLYNN IS COOPERATING WITH MUELLER
